,Date / Time,City,State,Shape,Duration,Summary,Link to Event
268,2019-06-24 14:23:00,Santa Fe,NM,Diamond,10 minutes,"Bright clear sky and very little breeze, I noticed something flashing, it was even sparkling, flitting erratically.",https://nuforc.org/webreports/reports/147/S147038.html
269,2019-06-22 22:30:00,Belen,NM,Changing,2 minutes,"I was the passenger in a car, in the back seat on the passengers side. We were driving south on I-25. Our destination was Belen. My unc",https://nuforc.org/webreports/reports/146/S146990.html
270,2019-06-22 22:30:00,Belen,NM,Unknown,2 minutes,4 bright white lights.,https://nuforc.org/webreports/reports/147/S147079.html
271,2019-06-18 21:35:00,Ruidoso,NM,Formation,15 seconds,"We saw two bright yellowish orange lights, then as soon as we noticed them they spread out in a perfect line two in the center.",https://nuforc.org/webreports/reports/146/S146893.html
272,2019-06-12 21:45:00,Socorro,NM,Circle,3-5 minutes,On June 13th I was coming home from the grocery store with my daughter. I was driving down a local Street when I looked to my right (ea,https://nuforc.org/webreports/reports/146/S146857.html
273,2019-06-11 22:00:00,Carrizozo,NM,Changing,Few minutes,"I was driving and saw three glowing orbs is the best I can describe it. I was driving trying to keep an eye on it and as I watched it,",https://nuforc.org/webreports/reports/146/S146759.html
274,2019-06-07 16:00:00,Ruidoso,NM,Circle,2 minutes,"Outside of Ruidoso, N.M. there were 4 round objects in my camera lens. The object were moving in twos near each other.",https://nuforc.org/webreports/reports/146/S146931.html
275,2019-06-07 16:00:00,Ruidoso,NM,Circle,3 minutes,"There were four, they were spaced exactly the same distance vertically , the top two were orangish yellow the bottom two weer blueish",https://nuforc.org/webreports/reports/146/S146897.html
276,2019-06-05 21:26:00,Artesia,NM,Light,17 seconds,"Five orange, and yellowish circular lights appeared in the night sky.",https://nuforc.org/webreports/reports/146/S146664.html
277,2019-05-26 21:41:00,Los alamos,NM,Formation,45 seconds,3 lights connected by red string. ((NUFORC Note: Space Link satellites. PD)),https://nuforc.org/webreports/reports/146/S146404.html
278,2019-05-26 21:40:00,Taos,NM,Light,3 minutes,3 stars in a straight line calmly moving in a linear path! ((NUFORC Note: Space Link satellites. PD))((anonymous source)),https://nuforc.org/webreports/reports/146/S146400.html
279,2019-05-15 21:00:00,Cochiti Lake,NM,Unknown,ongoing,"Color shifting of several craft in night sky. ((NUFORC Note: Possibly ""twinkling"" stars?? PD))",https://nuforc.org/webreports/reports/146/S146756.html
280,2019-05-08 22:00:00,La Mesa,NM,Fireball,15 minutes,5 separate large fireballs with bright white light in the middle of them each. At one time it looked as if it left a smoke like trail.,https://nuforc.org/webreports/reports/146/S146101.html
281,2019-04-25 20:30:00,Fairacres,NM,Light,30 seconds,"3 Orange/Red/Yellow fireball gently pulsating lights that separately lit up and disappeared in front of Organ Mtns in Las Cruces, NM",https://nuforc.org/webreports/reports/145/S145946.html
282,2019-04-09 19:30:00,Espanola,NM,Circle,10,Very bright large round object nw of moon and farther away than moon.,https://nuforc.org/webreports/reports/145/S145567.html
283,2019-04-09 19:00:00,Santa Fe,NM,Oval,Ongoing,Two oval-shaped stationary orbs brightly reflecting light. ((anonymous report)),https://nuforc.org/webreports/reports/145/S145565.html
284,2019-03-22 20:00:00,Taos,NM,Cigar,3 minutes,In the northern sky just west of the Big Dipper constellation over Taos Mountain on Taos Pueblo. I noticed it because it looked star li,https://nuforc.org/webreports/reports/145/S145345.html
285,2019-02-19 00:00:00,Albuquerque,NM,Light,2 hours,"Strange matrix-like lights traveled in front of the local Mountains, base to base, Smell of rotting flesh the closer I got.",https://nuforc.org/webreports/reports/144/S144939.html
286,2019-02-16 14:00:00,Moriarty,NM,Disk,5 minutes,UFO seen in broad daylight near Golden,https://nuforc.org/webreports/reports/144/S144905.html
287,2019-01-29 19:02:00,Alamogordo,NM,Orb,1 minute,I was driving near the hospital in Alamogordo New Mexico and noticed about 10 orange to red orb type ufo's. All 6 people in the car saw,https://nuforc.org/webreports/reports/144/S144727.html
288,2019-01-08 18:45:00,Bosque Farma,NM,Rectangle,20 minutes,"It looked to be two objects following each other, but it was one air craft the lights. ((anonymous report))",https://nuforc.org/webreports/reports/144/S144364.html
289,2019-01-06 16:40:00,Santa Fe,NM,Light,15 minutes,"Bright, flickering white light seen drifting through the sunless fog in mountains above Santa Fe.",https://nuforc.org/webreports/reports/144/S144346.html
290,2018-12-17 21:00:00,Albuquerque,NM,Other,1 hour,Observation of huge bubble like orbs things around neighbor's house across the way by the Rio grande. ((anonymous report)),https://nuforc.org/webreports/reports/144/S144153.html
291,2018-12-16 18:22:00,Albuquerque,NM,Orb,3+ hours,((HOAX??))Me and kid saw huge bubble like orbs around us and was moving and glowing. ((anonymous report)),https://nuforc.org/webreports/reports/144/S144154.html
292,2018-12-15 20:00:00,Albuquerque,NM,Orb,All night,A bunch of orbs and someone glowing. ((anonymous report)),https://nuforc.org/webreports/reports/144/S144156.html
293,2018-12-14 23:30:00,Albuquerque,NM,Light,10 seconds,Silent fast accelerating object above Albuquerque Sunport.,https://nuforc.org/webreports/reports/144/S144551.html
294,2018-12-14 13:30:00,Albuquerque,NM,Other,30 minutes,"Around 1-2pm a jet black Angled object about 2500ft altitude, est. 200ft to 400ft long point to tip to point, drifted along West to Eas",https://nuforc.org/webreports/reports/144/S144187.html
295,2018-12-13 19:00:00,Ruidoso,NM,Light,5 minutes,Same object seen two consecutive nights.,https://nuforc.org/webreports/reports/144/S144188.html
296,2018-12-08 23:00:00,Santa Fe,NM,Light,,There was a flashing sequence of blinking lights from W to E. ((NUFORC Note: Possible military exercise?? PD)),https://nuforc.org/webreports/reports/144/S144005.html
297,2018-12-08 22:30:00,Santa Fe,NM,Flash,2 minutes,15 flashing lights in a vertical formation traveling in northern sky east to west with two fighter jets flying at them.,https://nuforc.org/webreports/reports/144/S144004.html
298,2018-12-08 20:30:00,Santa Fe,NM,Formation,10-15 minutes,"Straight-line formation, 20-25 lights going on and off periodically in night sky, accompanied by droning sound, steadily moving west.",https://nuforc.org/webreports/reports/144/S144006.html
299,2018-12-01 22:00:00,Espanola,NM,Other,2 hours+,"I'm the person reporting about the taos,dulce,& Santa Clara back in NO. Keep seeing it. Was to the E. ((NUFORC Note: Sirius? PD))",https://nuforc.org/webreports/reports/144/S144012.html
300,2018-11-29 04:15:00,Las Cruces,NM,Light,~15 minutes,Bright light over Organ Mountain. ((NUFORC Note: Possible sighting of Venus?? PD)),https://nuforc.org/webreports/reports/143/S143926.html
301,2018-11-25 17:17:00,Deming,NM,Rectangle,20 minutes,UFO in Deming NM 11/25/18,https://nuforc.org/webreports/reports/143/S143947.html
302,2018-11-21 21:15:00,Taos/Dulce/Santa Clara,NM,Other,30 minutes,"Weird object of lights in Northern New Mexico that move. ((NUFORC Note: Possibly the star, Capella?? PD))((anonymous report))",https://nuforc.org/webreports/reports/143/S143852.html
303,2018-11-19 17:55:00,Roswell,NM,Triangle,2 minutes,"I was on road 40 miles into Roswell, NM, Driving a triangle shape no sound a dime light then a briate about 30 yard from my c",https://nuforc.org/webreports/reports/143/S143830.html
304,2018-11-14 06:00:00,Raton,NM,Circle,1:30,Saw this bright star floating. Realized I was way too close. Thought it might be a helicopter hovering with its search light.,https://nuforc.org/webreports/reports/143/S143757.html
305,2018-11-05 21:30:00,Roswell,NM,Light,1.5 minutes,"Three lights spotted over west Roswell, New Mexico, flashing in sync.",https://nuforc.org/webreports/reports/143/S143670.html
306,2018-11-01 18:00:00,Albuquerque,NM,Unknown,~4 minutes,"Large blue/green flame/light over Albuquerque, NM.",https://nuforc.org/webreports/reports/143/S143849.html
307,2018-10-07 20:30:00,Hobbs,NM,Light,10 minutes,Just seen a slow bright light moving in the southeast N.M. Sky. ((NUFORC Note: Launch of Falcon 9 rocket. PD)),https://nuforc.org/webreports/reports/143/S143412.html
308,2018-09-30 21:15:00,Ghost Ranch,NM,Changing,1 minute,"Large, circular, gauzy light moved in unison with our vehicle, changed shape into an oval, moved obliquely and, finally, straight down",https://nuforc.org/webreports/reports/143/S143505.html
309,2018-09-23 21:00:00,Albuquerque,NM,,1 minute,((NUFORC Note: Witness provides no information. PD)),https://nuforc.org/webreports/reports/143/S143245.html
310,2018-09-18 05:10:00,Albuquerque,NM,Light,4 seconds,"What appeared at first to be a shooting star, kept on going straight across the morning sky without a sound or change in brightness.",https://nuforc.org/webreports/reports/143/S143182.html
311,2018-09-09 07:50:00,Hobbs,NM,Orb,20 minutes,Bright orange orb hovered high in sky then disappeared.,https://nuforc.org/webreports/reports/143/S143049.html
312,2018-09-04 19:20:00,Deming,NM,Light,3-4 minutes,"One black craft, one large white light, and two smaller orange lights west of Deming, NM.",https://nuforc.org/webreports/reports/143/S143115.html
313,2018-09-04 18:50:00,Deming,NM,Diamond,35 minutes,"Bright white diamond shaped object, not moving, during daylight, high altitude,other small lights approached it,Deming,New Mexico.",https://nuforc.org/webreports/reports/143/S143006.html
314,2018-09-04 18:30:00,Deming,NM,Teardrop,40 minutes,Caught floating guitar shaped light and 3 others appeared move toward earth and disappeared.,https://nuforc.org/webreports/reports/142/S142997.html
315,2018-08-27 21:00:00,Albuquerque,NM,Circle,1 hour,"planes don't zig-zag, it was not a plane.",https://nuforc.org/webreports/reports/142/S142872.html
316,2018-08-25 14:00:00,Albuquerque,NM,Circle,>20 minutes,"Round reflective object in the sky over Albuquerque, NM. ((anonymous report))",https://nuforc.org/webreports/reports/142/S142900.html
317,2018-08-22 21:45:00,Las Cruces,NM,Oval,60 seconds,I saw a strange oval lighted object in the sky when I was flying from Austin to San Diego.,https://nuforc.org/webreports/reports/145/S145970.html
318,2018-08-19 15:00:00,Taos,NM,Disk,1/4 second,"A photographer took three photos of a tree, and an anomalous, disc-shaped object shows up in photos. ((NUFORC Note: Cicada?? PD))",https://nuforc.org/webreports/reports/142/S142806.html
319,2018-08-18 16:00:00,Belen,NM,Triangle,5 seconds,"I was at the Belen Airport in the parking lot, I had gotten out of my car and was hoping to catch some take offs and landings, but ther",https://nuforc.org/webreports/reports/150/S150473.html
320,2018-08-18 11:35:00,Los Lunas,NM,Circle,20 minutes,"A Silver circular object was observed at a very high altitude over Los Lunas, New Mexico. Until obstructed by clouds.",https://nuforc.org/webreports/reports/142/S142826.html
321,2018-08-14 23:30:00,Edgewood,NM,Other,30,"I have worked in aviation for 20 yrs and it was not a meteor, rocket launch, weather balloon, or aircraft",https://nuforc.org/webreports/reports/142/S142744.html
322,2018-08-01 19:00:00,Cleveland,NM,Other,1 minute,Drone with green lights.,https://nuforc.org/webreports/reports/144/S144857.html
323,2018-07-22 11:30:00,Deming,NM,Oval,20,Oblong disk hovering over Deming New Mexico 7/22/18,https://nuforc.org/webreports/reports/142/S142671.html
324,2018-07-18 20:45:00,Albuquerque,NM,Other,2 minutes,"I was on the roof when my son looked up and said "" what is that "", pointing to a black spot, very high moving very fast west",https://nuforc.org/webreports/reports/142/S142312.html
325,2018-07-18 02:30:00,Santa Fe,NM,Light,10 minutes,"Formation of large bright spherical lights over open land near Santa Fe, NM",https://nuforc.org/webreports/reports/142/S142302.html
326,2018-07-17 23:27:00,Elephant Butte,NM,Unknown,<1 second,Bright light in the stars with a jagged tail,https://nuforc.org/webreports/reports/142/S142613.html
327,2018-06-29 23:00:00,"unsure, possibly Des Moines or Grenville",NM,Orb,30-60 seconds,Single bright red orb close to top of car then suspended in the sky,https://nuforc.org/webreports/reports/145/S145496.html
328,2018-06-29 09:10:00,Santa Fe,NM,Circle,5 seconds,"Huge bright green lights converge into three smaller bright green lights in Santa Fe, NM.",https://nuforc.org/webreports/reports/141/S141988.html
329,2018-06-18 21:30:00,Ruidoso,NM,Circle,2.30 minutes,"1 Bright object split into 5, while moving together.",https://nuforc.org/webreports/reports/146/S146927.html
330,2018-06-14 22:00:00,Albuquerque,NM,Triangle,2 hours,"Stationary object hovering beyond the cloud cover, noticed it was faint when clouds moved by. ((anonymous report))",https://nuforc.org/webreports/reports/141/S141826.html
331,2018-06-14 16:00:00,Roswell,NM,Other,2 minutes,Horseshoe shape moving eastward at a constant rapid speed with no sound underneath the clouds. ((anonymous report)),https://nuforc.org/webreports/reports/146/S146836.html
332,2018-06-02 23:15:00,Albuquerque,NM,Light,5 seconds,Large flash of light in the sky. ((NUFORC Note: Possible flare from an Iridium satellite? PD)),https://nuforc.org/webreports/reports/141/S141894.html
333,2018-04-04 07:08:00,Albuquerque,NM,Disk,1.5 minutes,"7:08 AM Albuquerque, NM. April 4, 2018. Large, rust-colored saucer vanishes after geometrical shape surrounds the object.",https://nuforc.org/webreports/reports/139/S139354.html
334,2018-03-21 22:50:00,Sandia Park,NM,Flash,4 minutes,"A non-metered flashing light of oscillating intensity and varied trajectory, with inconstant speed.",https://nuforc.org/webreports/reports/139/S139227.html
335,2018-03-17 21:00:00,Nowhere,NM,Other,1 hour,Shooting star that came back.,https://nuforc.org/webreports/reports/154/S154668.html
336,2018-03-17 18:42:00,Rowe,NM,Orb,4 minutes,"On 17 March 2018, I was taking sunset photos on top of Glorieta Mesa on State Hwy 34. ((NUFORC Note: Lens flares. PD))",https://nuforc.org/webreports/reports/139/S139220.html
337,2018-03-13 06:30:00,Taos,NM,Triangle,10 minutes,"Extremely bright single light changed into three lights in a triangle moving from West to East, very high in the sky.",https://nuforc.org/webreports/reports/139/S139160.html
338,2018-03-12 21:30:00,Tijeras,NM,Teardrop,3 seconds,Extremely bright about 1/10th of a solar diameter. No craft was observed,https://nuforc.org/webreports/reports/139/S139180.html
339,2018-03-01 22:35:00,San Yisidro,NM,Cigar,30 seconds,"Cigar-shaped, about 100' long one dim light in the front and one in the back was black",https://nuforc.org/webreports/reports/139/S139258.html
340,2018-02-17 13:45:00,Albuquerque,NM,Changing,20 minutes,I noticed a strange metal shape hovering south east. ((anonymous report)),https://nuforc.org/webreports/reports/138/S138836.html
341,2018-02-15 23:00:00,Albuquerque,NM,Flash,3 seconds,Bright blue/green circle flash flying fast horizonatally in sky and went away in 3 seconds.,https://nuforc.org/webreports/reports/138/S138715.html
342,2018-02-06 21:00:00,Cliff,NM,Light,5 minutes,Massive illuminated bubble. ((NUFORC Note: Space X booster rocket venting fuel?? PD)) ((anonymous report)),https://nuforc.org/webreports/reports/138/S138669.html
343,2018-02-06 19:25:00,San Lorenzo,NM,,10-15 minutes,Large bright a/c with 2 distinct beams of light separated into large bifurcated gaseous cloud over S NM. ((space debris??)),https://nuforc.org/webreports/reports/138/S138767.html
344,2018-02-06 19:21:00,Santa Fe,NM,Light,5 minutes,Light moving slowly south of Santa Fe with strange haze around it which expanded.,https://nuforc.org/webreports/reports/138/S138668.html
345,2018-02-06 19:00:00,Clayton,NM,Light,20 minutes,Flashing foggy light then saw like a trail fog of a triangle shape glowing bright in the night sky then the light was gone.,https://nuforc.org/webreports/reports/138/S138667.html
346,2018-01-19 21:00:00,Tijeras (south of),NM,Other,While driving,Line of red lights very far off on horizon blinking in unison. It covered the whole horizon.,https://nuforc.org/webreports/reports/138/S138482.html
347,2018-01-16 06:10:00,Aztec,NM,Light,3 seconds,Large flaming object falling from the sky. ((anonymous report)),https://nuforc.org/webreports/reports/138/S138406.html
348,2018-01-09 20:25:00,Albuquerque,NM,Light,1 hour,"Flashing red light over Albuquerque, New Mexico no sound coming from craft. Been blinking on and off for roughly an hour as of now (20:",https://nuforc.org/webreports/reports/138/S138329.html
349,2018-01-01 00:00:00,Albuquerque,NM,Orb,10 minutes,"Several orange lights moving slowly, which faded out, one by one.",https://nuforc.org/webreports/reports/138/S138159.html
350,2017-12-28 04:37:00,Albuquerque,NM,Circle,1 minute,Two circular objects giving off extremely bright yellow and green light before dissapating,https://nuforc.org/webreports/reports/138/S138072.html
351,2017-12-25 15:30:00,Taos,NM,Fireball,Seconds,"I just flipped through a few photos I took on Christmas Day at Luna Mystica, an Airstream hotel near Taos,NM. I noticed strange object",https://nuforc.org/webreports/reports/138/S138084.html
352,2017-12-22 18:00:00,Moriarty area,NM,Other,30 minutes,Massive spotlight type light coming from on or behind the Sandia mountains. ((NUFORC Note: Sighting of missile launch?? PD)),https://nuforc.org/webreports/reports/138/S138146.html
353,2017-12-14 19:00:00,Santa Fe,NM,Triangle,10 seconds,"Triangular object with bright green lights near Santa Fe, NM.",https://nuforc.org/webreports/reports/137/S137810.html
354,2017-12-09 20:50:00,Ohkay Owingeh (San Juan),NM,Light,5-10 minutes,Flashing Fleet of Fifteen Flying Objects.,https://nuforc.org/webreports/reports/137/S137683.html
355,2017-12-08 08:45:00,Placitas,NM,,25,Sequence of blinking lights; northward. Lights were seen towards the Jemez landscape. ((anonymous report)),https://nuforc.org/webreports/reports/137/S137662.html
356,2017-11-30 18:25:00,Stanley,NM,Light,10-30 seconds,"Blinking red light over Stanley, NM.",https://nuforc.org/webreports/reports/137/S137522.html
357,2017-11-14 21:00:00,Soccorro,NM,Light,1 minutes,"Orange lights near Socorro, NM.",https://nuforc.org/webreports/reports/138/S138455.html
358,2017-11-13 19:00:00,Roswell,NM,Circle,20 minutes,Lights blinking in sequence across the dark Nothern sky.,https://nuforc.org/webreports/reports/137/S137407.html
359,2017-11-12 07:34:00,Waterflow,NM,Triangle,15,"A triangle shaped object above morgan lake area, could see the sky through it, with bright spear lights, in a large perfect triangle sh",https://nuforc.org/webreports/reports/137/S137235.html
360,2017-11-12 01:00:00,Albuquerque,NM,Light,30 minutes,High altitude point of light SE of Albuquerque II. ((NUFORC Note: Sighting of Sirius?? PD)),https://nuforc.org/webreports/reports/137/S137222.html
361,2017-11-04 19:00:00,Albuquerque,NM,Light,,((HOAX??)) A single purple light hovered over University of New Mexico's campus. ((anonymous report)),https://nuforc.org/webreports/reports/137/S137122.html
362,2017-10-24 23:00:00,Albuquerque,NM,Light,unknown,"High altitude point of light SE of Albuquerque. ((NUFORC Note: Possible ""twinkling"" star?? PD))",https://nuforc.org/webreports/reports/136/S136990.html
363,2017-10-22 20:42:00,Artesia,NM,Fireball,2 minutes,"Stepped outside for a chore, looked up and saw a rather huge, fiery ball of something moving at a high rate of speed. At first I though",https://nuforc.org/webreports/reports/136/S136925.html
364,2017-10-21 11:12:00,Ruidoso,NM,Triangle,1 minute,"Gf and I where outside, stargazing, when we saw a low flying obj. with lights on each end in the shape of a triangle. ((anon. report)",https://nuforc.org/webreports/reports/136/S136915.html
365,2017-10-16 19:40:00,Las Cruces,NM,Light,5 minutes,Very bright light low in the northern sky,https://nuforc.org/webreports/reports/136/S136781.html
366,2017-10-09 20:30:00,Farmington,NM,Sphere,20 minutes,Sphere with multicolor lights traveling west by NE. ((NUFORC Note: Star? Confirmed by witness to have been Arcturus. PD)),https://nuforc.org/webreports/reports/136/S136669.html
367,2017-10-07 21:50:00,Pojoque,NM,Changing,20 minutes,Blue and Red blinking lights on a first egg type flying object above pojoque mountains overlooking Las alamos,https://nuforc.org/webreports/reports/136/S136623.html
368,2017-10-06 19:40:00,Jemez Springs,NM,Circle,40 seconds,Video shows something flying past moon.,https://nuforc.org/webreports/reports/136/S136598.html
369,2017-10-01 20:15:00,Taos,NM,Light,5 minutes,UFO Near Andromeda constellation.,https://nuforc.org/webreports/reports/136/S136889.html
370,2017-09-08 18:25:00,Albuquerque,NM,Egg,split second,Metallic object fell from sky in front of me while I was driving north a few miles south of Albuquerque Airport.,https://nuforc.org/webreports/reports/136/S136089.html
371,2017-09-01 21:00:00,Rio Rancho,NM,Other,25 minutes,We were returning entering the gate to our farm. There was a shoe shaped craft hovering low. We are researching ufo and alien life for,https://nuforc.org/webreports/reports/136/S136953.html
372,2017-08-25 20:30:00,Nageezi,NM,Other,4 seconds,My wife and I do not want be public with our names and who we are. It seems since you already have my phone number. I would like to ask,https://nuforc.org/webreports/reports/136/S136721.html
373,2017-08-25 20:30:00,Nageezi,NM,Circle,2 minutes,I saw a big white light with two strangers sitting in a bubble type craft in the side of the hill on Hwy 550 N.M.,https://nuforc.org/webreports/reports/136/S136728.html
374,2017-08-24 21:20:00,Las Cruces,NM,Circle,9 minutes,Slowly flashing lights above Las Cruces.,https://nuforc.org/webreports/reports/135/S135892.html
375,2017-08-04 07:48:00,Las Cruces,NM,Sphere,,Possible Craft Photographed.,https://nuforc.org/webreports/reports/148/S148358.html
376,2017-08-01 23:30:00,Silver City,NM,Other,5 minutes,"Lights in high sky, moving too slow for airliner, also inconsistent pattern, illuminated large craft, in clear desert night sky.",https://nuforc.org/webreports/reports/138/S138359.html
377,2017-07-29 21:30:00,Santa Fe,NM,Cylinder,10,"Looked like a small aircraft,with blue and green changing circular lights inside it. Flying slow and low. ((anonymous report))",https://nuforc.org/webreports/reports/135/S135432.html
378,2017-07-27 23:30:00,Raton,NM,Cylinder,15 seconds,Thought I was looking at a revolving lighthouse as I drove through a construction zone S of Raton through some mountainous terrain.,https://nuforc.org/webreports/reports/136/S136465.html
379,2017-07-26 21:30:00,Las Cruces,NM,Fireball,20-30 minutes,"Faced Organ mts. From my home in LA Mesa. Noticed orangish burning fireball type ufo, ((anonymous report))",https://nuforc.org/webreports/reports/135/S135383.html
380,2017-07-25 20:30:00,Rock Springs,NM,Triangle,2-4 minutes,I watched a aircraft following glowing orb. The aircraft had blinking lights the prb did not. ((anonymous report)),https://nuforc.org/webreports/reports/135/S135370.html
381,2017-07-19 23:30:00,Roswell,NM,Unknown,5 minutes,Weird lights in Roswell.,https://nuforc.org/webreports/reports/135/S135293.html
382,2017-07-19 12:05:00,,NM,Other,30 minutes,Dark thing,https://nuforc.org/webreports/reports/171/S171836.html
383,2017-07-12 10:15:00,Las Cruces,NM,,10 minutes,4 fireballs illuminating consecutively in a horizontal pattern over Organ Mountains. Also over NASA. ((anonymous report)),https://nuforc.org/webreports/reports/135/S135129.html
384,2017-07-12 03:50:00,Gallup,NM,Cone,05:30,We observed and recorded the objects with mobile phones as it followed us into the city. ((NUFORC Note: Venus? Anonymous report. PD)),https://nuforc.org/webreports/reports/135/S135122.html
385,2017-07-12 00:45:00,Artesia,NM,Fireball,3 seconds,"Brantley Lake. To the S, we saw a bright green flash the size of a small plane.",https://nuforc.org/webreports/reports/136/S136132.html
386,2017-07-11 22:30:00,Artesia,NM,Light,.43,As me and my brother talked about flying I just happened to notice a broth star in the south west of were I was sitting. I began to see,https://nuforc.org/webreports/reports/135/S135107.html
387,2017-07-07 01:00:00,Dzilth-na-o-dithle,NM,Other,5 minutes,Going to sleep around 1:00 a.m. With 4 of my nephew and nieces. Turned off generator. As going back into our home. Heard a blowing s,https://nuforc.org/webreports/reports/150/S150867.html
388,2017-07-06 21:00:00,Alto,NM,Light,2-3 minutes,"Unexplained trio of bright lights, night of July 6, 2017.",https://nuforc.org/webreports/reports/135/S135101.html
389,2017-07-06 01:00:00,Nageezi,NM,Disk,3 minutes,Huge Neon green horseshoe light pass over us at night.,https://nuforc.org/webreports/reports/166/S166141.html
390,2017-07-04 21:45:00,Jal,NM,Light,10 minutes,"July 4th 2017 my family and I were waiting for fireworks to start in Jal, New Mexico. We witnessed a small red dot hovering in one spot",https://nuforc.org/webreports/reports/135/S135280.html
391,2017-06-30 14:00:00,Roswell,NM,Cylinder,10-15 minutes,The object was very long cylinder shaped with many rectangular windows.,https://nuforc.org/webreports/reports/149/S149237.html
392,2017-06-27 12:00:00,Taos,NM,Circle,7 hours +,"Daytime white disc sighting In Taos, New Mexico, with video link. ((anonymous report))",https://nuforc.org/webreports/reports/135/S135032.html
393,2017-05-22 17:30:00,Lovington,NM,Other,10 minutes,"V shaped objects over Lovington, New Mexico.",https://nuforc.org/webreports/reports/134/S134393.html
