,Date / Time,City,State,Shape,Duration,Summary,Link to Event
1472,2015-02-25 18:15:00,Round Rock,TX,Fireball,5 minutes,"Orange fireball with two, distinct ""wings"" reaching back behind it.",https://nuforc.org/webreports/reports/117/S117495.html
1473,2015-02-19 23:30:00,Big Wells,TX,Cigar,30 seconds,Bright lights.,https://nuforc.org/webreports/reports/117/S117416.html
1474,2015-02-19 09:40:00,Walburg,TX,Cigar,1 minute,Two bright shiny white cylindrical cigar-shaped objects rounded nose and tails.,https://nuforc.org/webreports/reports/117/S117388.html
1475,2015-02-18 23:45:00,Helotes,TX,Chevron,4-5 seconds,Translucent white in color and bird shape.,https://nuforc.org/webreports/reports/117/S117380.html
1476,2015-02-18 01:30:00,Frost,TX,Light,3 hours,"Assom ((sic. ""Awesome"")) i want 2 drive.",https://nuforc.org/webreports/reports/117/S117384.html
1477,2015-02-14 22:00:00,Stafford,TX,Circle,3 minutes,Orange/reddish circular object flying across the sky.,https://nuforc.org/webreports/reports/117/S117493.html
1478,2015-02-10 16:30:00,Midland,TX,Disk,~5 seconds,"UFO over Midland, Texas.",https://nuforc.org/webreports/reports/117/S117259.html
1479,2015-02-01 18:25:00,Frisco,TX,Light,3:00,"Large and unusual light observed in the evening sky just southwest of Frisco, Texas...",https://nuforc.org/webreports/reports/117/S117101.html
1480,2015-02-01 18:00:00,Webster,TX,Other,15 seconds,A Vertical Phenomena Vector.,https://nuforc.org/webreports/reports/117/S117723.html
1481,2015-01-29 19:00:00,Salado/Jarrell,TX,Light,5 minutes,2 blue lights traveling low below cloud cover along I-35.,https://nuforc.org/webreports/reports/117/S117141.html
1482,2015-01-29 10:30:00,Houston,TX,Disk,~30 seconds,White disc with shiny top moving west from 77095 zip code.,https://nuforc.org/webreports/reports/117/S117070.html
1483,2015-01-24 23:15:00,Spring,TX,Fireball,8-10 minutes,7 fireballs take exact path in sky at intervals.,https://nuforc.org/webreports/reports/116/S116935.html
1484,2015-01-24 21:14:00,Austin,TX,Fireball,8 minutes,"5 silent odd shaped fireballs on precise path, evenly spaced from south turning east to horizon.",https://nuforc.org/webreports/reports/116/S116940.html
1485,2015-01-24 20:27:00,Irving,TX,Light,Minutes,Driving down Rochelle Rd. towards N. Story Rd. and saw 3 lights 1 leading like 3:00p while other two were 12:00p & 6p. they appear to,https://nuforc.org/webreports/reports/125/S125437.html
1486,2015-01-23 22:10:00,San Antonio,TX,Diamond,2 minutes,4 amber color diamond shape flying objects observed.,https://nuforc.org/webreports/reports/116/S116916.html
1487,2015-01-23 21:34:00,Buda,TX,Oval,5 seconds,"Looking up in our computer room out the widow, a bright blue/white object streaked across the sky.",https://nuforc.org/webreports/reports/116/S116913.html
1488,2015-01-23 09:00:00,San Antonio,TX,Triangle,unknown,"Was driving west on I-10 toward 1604 and saw 2 white lights that looked like wingtip lights, but they weren't flashing.",https://nuforc.org/webreports/reports/116/S116919.html
1489,2015-01-20 20:30:00,Austin,TX,Unknown,4 minutes,"Red lights over Austin, TX.",https://nuforc.org/webreports/reports/116/S116857.html
1490,2015-01-20 20:00:00,Henderson,TX,Triangle,5 minutes,"We heard loud humming. Went outside and saw large, red, pulsating triangle in the sky. It hovered, then disappeared",https://nuforc.org/webreports/reports/116/S116868.html
1491,2015-01-17 20:00:00,Houston,TX,Formation,5 minutes,Cluster formation of glowing orange balls in the sky.,https://nuforc.org/webreports/reports/116/S116771.html
1492,2015-01-16 23:20:00,Converse,TX,Oval,1 minute,Orange glowing ball flight low over converse park near Judson High School.,https://nuforc.org/webreports/reports/116/S116767.html
1493,2015-01-16 17:15:00,Victoria,TX,Unknown,45 seconds,"The movement of the light source appearing in different places in the sky was interesting, since I had never seen anything like this.",https://nuforc.org/webreports/reports/116/S116810.html
1494,2015-01-16 07:15:00,(Unspecified location),TX,Light,2 minutes,Strange light emitting different colors. ((NUFORC Note: Witness does not indicate location in Texas. PD)),https://nuforc.org/webreports/reports/116/S116812.html
1495,2015-01-15 03:05:00,Desoto,TX,Orb,15 seconds,I was driving heading south to my home around 3:05 am and up to my right in the sky a oval white blue orb shot passed me heading south,https://nuforc.org/webreports/reports/116/S116740.html
1496,2015-01-14 22:40:00,Sanger,TX,Other,4 minutes,"""U"" shaped orange glowing object.",https://nuforc.org/webreports/reports/125/S125277.html
1497,2015-01-08 19:40:00,Bandera,TX,Triangle,20 minutes,A hoard of UFOs flying with a triangle brings clouds in an instant.,https://nuforc.org/webreports/reports/116/S116574.html
1498,2015-01-07 05:45:00,College Station,TX,Oval,1 minute,Bright white light in illuminating cloud in southern sky,https://nuforc.org/webreports/reports/116/S116548.html
1499,2015-01-07 02:00:00,Lexington,TX,Unknown,~2 minutes,"Loud rumbling noise, 2 vertical white lights, smaller red ones, massive vehicle moving to northwest",https://nuforc.org/webreports/reports/117/S117499.html
1500,2015-01-04 18:20:00,Spring,TX,Fireball,8 minutes,3 red glowing lights fireball objects moving north to south in Houston area moving about 2 minutes apart in same flight path.,https://nuforc.org/webreports/reports/116/S116505.html
1501,2015-01-03 22:00:00,Austin,TX,Light,5 minutes,"Reddish lights or fireballs seen moving from west to east in Austin, Texas.",https://nuforc.org/webreports/reports/116/S116479.html
1502,2015-01-03 21:00:00,Hughes Springs,TX,Circle,10 minutes,Immediately saw red lights in the Southwest sky.,https://nuforc.org/webreports/reports/116/S116494.html
1503,2015-01-03 21:00:00,Hughes Springs,TX,Circle,10 minutes,Observed approximately twenty-five red/orange flying objects or balls of light in sky.,https://nuforc.org/webreports/reports/116/S116495.html
1504,2015-01-03 19:00:00,San Antonio,TX,Light,5 minutes,8 lights in the sky.,https://nuforc.org/webreports/reports/116/S116481.html
1505,2015-01-01 00:15:00,El Paso,TX,Light,6 minutes,One bright object with three flashing lights. Then it split into two. It happened right after midnight on new year's eve. I obtained,https://nuforc.org/webreports/reports/116/S116385.html
1506,2015-01-01 00:00:00,San Antonio,TX,Sphere,,Captured on video a UFO hovering over us as we watched the fireworks on New Years Eve.,https://nuforc.org/webreports/reports/116/S116434.html
1507,2014-12-28 11:55:00,Colleyville,TX,Other,12:00,"DFW airport area, round object sighted much faster, smaller, shinier and higher than commercial jets in vicinity.",https://nuforc.org/webreports/reports/116/S116241.html
1508,2014-12-27 19:45:00,Pearland,TX,Sphere,3 seconds,"An intensive white light flash on residential road, non UFO or trajectory.",https://nuforc.org/webreports/reports/116/S116213.html
1509,2014-12-25 20:14:00,Baytown,TX,Other,3 minutes,Speechless,https://nuforc.org/webreports/reports/116/S116300.html
1510,2014-12-24 22:30:00,San Antonio,TX,Circle,5 minutes,Two bright orange lights were moving straight across the sky with no engine sound.,https://nuforc.org/webreports/reports/116/S116343.html
1511,2014-12-22 19:50:00,Houston,TX,Sphere,15 minutes,"While walking subdivision park we saw 4 white light objects,1stayed stationary, 3moved in a > formation,then turn L,then back flat -",https://nuforc.org/webreports/reports/116/S116163.html
1512,2014-12-16 06:41:00,Spring,TX,Chevron,1-2 seconds,Falling object changing direction.,https://nuforc.org/webreports/reports/116/S116050.html
1513,2014-12-15 19:00:00,Harlingen,TX,Light,20 seconds,"Very large, low to the groung, bright green light shot across Harlingen, TX sky",https://nuforc.org/webreports/reports/116/S116059.html
1514,2014-12-13 23:00:00,San Antonio,TX,Triangle,30 minutes,yellowish orangeish triangular shape,https://nuforc.org/webreports/reports/116/S116016.html
1515,2014-12-12 07:00:00,Waco,TX,Light,1:00,"Light shooting across sky, change direction, then fade with other",https://nuforc.org/webreports/reports/115/S115947.html
1516,2014-12-07 19:40:00,Cedar Park,TX,Unknown,a few minutes,"Flashing lights (1 red 2 green) with whirring sound, stopped, then changed direction, then went down towards the earth.",https://nuforc.org/webreports/reports/115/S115868.html
1517,2014-12-07 02:15:00,Porter,TX,Light,2 minutes,Ball of light.,https://nuforc.org/webreports/reports/115/S115867.html
1518,2014-12-03 01:11:00,El Paso,TX,Unknown,1:32,Missing time episode and two experiences of sleep paralysis.,https://nuforc.org/webreports/reports/118/S118971.html
1519,2014-12-01 02:00:00,Arlington,TX,Unknown,45 minutes,Got up to turn heater on and could hear what sounded like the sound barrier had been broke like fighter jets.,https://nuforc.org/webreports/reports/115/S115757.html
1520,2014-11-30 01:00:00,Kemah,TX,Other,:30,"While sitting on an upper deck a little after midnight, I was looking up at the sky and saw an orange spider/bug looking object moving",https://nuforc.org/webreports/reports/115/S115723.html
1521,2014-11-26 19:00:00,Dallas,TX,Fireball,2 minutes,"Orange flickering light moving through sky, then the light went out; could see silver object moving away @ high speed. No noise.",https://nuforc.org/webreports/reports/115/S115654.html
1522,2014-11-26 05:30:00,Brenham,TX,Oval,15-20 seconds,"Oval, very dark with faint gold light, appeared to be spinning, gyrating, motion as it moved silently away.",https://nuforc.org/webreports/reports/115/S115684.html
1523,2014-11-25 21:00:00,Pearland,TX,Circle,20 minutes,UFO spotted.,https://nuforc.org/webreports/reports/115/S115626.html
1524,2014-11-24 08:00:00,Spring,TX,Egg,5 minutes,"There was a hovering silver egg shaped object above Spring, Texas.",https://nuforc.org/webreports/reports/115/S115606.html
1525,2014-11-18 18:45:00,Nacogdoches,TX,Light,30 seconds,"Two white lights slowly moved apart, and then faded away.",https://nuforc.org/webreports/reports/115/S115451.html
1526,2014-11-16 23:30:00,Houston,TX,Circle,3 seconds,Blue light in the sky appears and vanishes instantly.,https://nuforc.org/webreports/reports/115/S115420.html
1527,2014-11-15 21:30:00,Riverside,TX,Formation,10 minutes,"We witnessed 20 bright orange aircraft traveling from east to west, flying low, equally spaced apart, about the speed of airplane.",https://nuforc.org/webreports/reports/115/S115417.html
1528,2014-11-15 20:35:00,Newark,TX,Triangle,4 to 5 minutes,"3 Black Triangular Objects flying silently overhead. ((NUFORC Note: Witness is highly experienced, and credible. PD))",https://nuforc.org/webreports/reports/115/S115561.html
1529,2014-11-15 02:30:00,San Antonio,TX,Other,Seconds,Octagon shaped object flying at low altitude above San Antonio.,https://nuforc.org/webreports/reports/115/S115707.html
1530,2014-11-14 19:31:00,Dallas,TX,Rectangle,45-60 seconds,"A single, rectangle shaped object with red lights and alternating blinking white lights, like hazard lights flew over Dallas, Texas.",https://nuforc.org/webreports/reports/115/S115359.html
1531,2014-11-11 20:20:00,Allen,TX,Triangle,10 minutes,Drone or UFO.,https://nuforc.org/webreports/reports/115/S115302.html
1532,2014-11-09 19:50:00,Houston,TX,Fireball,2-3 minutes,Observed very bright orange lights moving at the same altitude across the sky at normal aircraft speeds till they quickly faded.,https://nuforc.org/webreports/reports/115/S115227.html
1533,2014-11-09 14:00:00,Woodlands,TX,Fireball,3 minutes,"Fireball traveling southwest very high moving very fast, moved directly overhead. Cleared horizon in under 3 min.",https://nuforc.org/webreports/reports/115/S115242.html
1534,2014-11-08 20:45:00,Edinburg,TX,Circle,5 seconds,Saw what appeared to be a green ball of fire fly west-northwest and disintegrate into white sparks or flames.,https://nuforc.org/webreports/reports/115/S115256.html
1535,2014-11-08 20:30:00,San Angelo,TX,Oval,8 seconds,Weird sighting.,https://nuforc.org/webreports/reports/115/S115246.html
1536,2014-11-08 01:25:00,Spring,TX,Circle,3 minutes,Multiple reddish circular objects from ground to sky vanish.,https://nuforc.org/webreports/reports/115/S115274.html
1537,2014-11-04 00:00:00,Humble,TX,Rectangle,1 minutes,"AMBER SQUARE OBJECT, HIGH IN ATMOSPHERE, MOVING NW TO SE (1-MIN)",https://nuforc.org/webreports/reports/115/S115534.html
1538,2014-11-01 06:45:00,Holland,TX,Circle,8 seconds,"On the morning of Sat., November 1st, 2014, between 6:40 am and 6:45 am, I was traveling south in Texas highway 95.",https://nuforc.org/webreports/reports/115/S115089.html
1539,2014-11-01 06:40:00,Sulphur Springs,TX,Oval,10-15 seconds,"Deer hunt spoiled by sudden appearance of 3 bright lights, surrounded by a dim amber ring of light.",https://nuforc.org/webreports/reports/115/S115175.html
1540,2014-11-01 01:20:00,San Marcos,TX,Chevron,~30 seconds,Chevron shaped object with rounded ends and internal glow flies over Texas City.,https://nuforc.org/webreports/reports/116/S116120.html
1541,2014-10-31 20:15:00,Allen,TX,Triangle,<15 seconds,Whitish Gray triangular object without lights flew silently above Highway 5 from North to South. The object was as big as a house.,https://nuforc.org/webreports/reports/115/S115096.html
1542,2014-10-29 20:00:00,Carrollton,TX,Other,4-5 seconds,"Craft with two rear propulsion engines accelerates and disappeared apx 600 yards as I turned around, and previous triangle craft",https://nuforc.org/webreports/reports/115/S115796.html
1543,2014-10-29 19:30:00,Nacogdoches,TX,Light,15 minutes,"Three separate ""lights"" witnessed within 15 minutes in East Texas.",https://nuforc.org/webreports/reports/114/S114679.html
1544,2014-10-29 19:20:00,Garland,TX,Unknown,1 minute,Multiple reddish colored objects moving in a single-file path from southeast to northwest while gaining altitude.,https://nuforc.org/webreports/reports/115/S115147.html
1545,2014-10-28 22:30:00,Mineola,TX,Other,5-10 minutes,Around 10:30p.m. as my wiife and I witnesses as we watched the sky to the west.From the northwest beyound the treeline we watched five,https://nuforc.org/webreports/reports/114/S114700.html
1546,2014-10-28 02:34:00,Rowlett,TX,Circle,4 minutes,Baseball size one white light points down on roof from at least twenty feet up.,https://nuforc.org/webreports/reports/114/S114837.html
1547,2014-10-27 03:00:00,Houston,TX,Triangle,3 minutes,"Large transparent delta wing ufo; no lights, noise, condensation trail. Speed slow enough to stall.",https://nuforc.org/webreports/reports/125/S125080.html
1548,2014-10-27 03:00:00,San Marcos,TX,Triangle,6 seconds,"Black Triangle glides through San Marcos, Texas.",https://nuforc.org/webreports/reports/114/S114734.html
1549,2014-10-26 21:30:00,Cross Plains,TX,Flash,4-5 seconds,"3 flashing, exploding ""STARS.""",https://nuforc.org/webreports/reports/115/S115280.html
1550,2014-10-25 12:00:00,San Antonio,TX,Cylinder,10 minutes,White cylinder shape. Seen by 4 police officers in San Antonio Tx,https://nuforc.org/webreports/reports/114/S114783.html
1551,2014-10-24 08:50:00,Humble,TX,Orb,10 minutes,Blue orb circle high above sky bright flash of blue light like a led light and rose quickly and hovered. A plane passed over it and you,https://nuforc.org/webreports/reports/114/S114821.html
1552,2014-10-23 23:00:00,Valley View,TX,Light,40 seconds,The ufo was a stationary light blending in with the stars that began moving as if they were being manned from a stationary stand still.,https://nuforc.org/webreports/reports/114/S114798.html
1553,2014-10-22 20:00:00,Cypress,TX,Other,15-20 seconds,"Sighting in Cypress, Texas.",https://nuforc.org/webreports/reports/114/S114882.html
1554,2014-10-19 00:00:00,Carrolltom,TX,Triangle,1 minutes,I was outside tonight and I seen a UFO it was in a triangular shape with very bright lights and it fastly and disappeared and I was wit,https://nuforc.org/webreports/reports/114/S114671.html
1555,2014-10-18 21:45:00,Bryan,TX,Light,2 seconds,"Bright white light streaked across Bryan, Tx, in a lateral line.",https://nuforc.org/webreports/reports/114/S114652.html
1556,2014-10-17 22:00:00,Rio Hondo,TX,Light,2-5 mintues,"Light in sky seen in Rio Hondo, Texas, came towards vehicle, stopped in the air, then turned around and disappeared.",https://nuforc.org/webreports/reports/117/S117921.html
1557,2014-10-17 01:15:00,Celina,TX,Circle,20 minutes,Two Strange Amber/Golden Spheres that Flared up into Starlike Shaped Objects.,https://nuforc.org/webreports/reports/115/S115355.html
1558,2014-10-15 21:45:00,Alvin,TX,Unknown,15 minutes,Craft with color changing lights.,https://nuforc.org/webreports/reports/114/S114563.html
1559,2014-10-15 09:00:00,Galveston,TX,Circle,3 hours,"I was in my patio, and suddenly a lot!! of light with a tail like web spider came across the sky!!. I did took a video and pictures. I",https://nuforc.org/webreports/reports/114/S114886.html
1560,2014-10-14 15:15:00,Euless,TX,Other,5 minutes,Me and three others witnessed a very large amount of floating white orbs moving through the sky.,https://nuforc.org/webreports/reports/114/S114532.html
1561,2014-10-13 04:00:00,Schulenburg,TX,Circle,15 minutes,Stationary yellow object in sky.,https://nuforc.org/webreports/reports/114/S114492.html
1562,2014-10-12 21:30:00,San Antonio,TX,Light,5 minutes,Strange moving light.,https://nuforc.org/webreports/reports/114/S114477.html
1563,2014-10-10 20:54:00,League City,TX,Other,2 minutes,2 red/2 green octagon shaped object in sky.,https://nuforc.org/webreports/reports/114/S114446.html
1564,2014-10-10 20:00:00,Woodville,TX,Sphere,15 minutes,Bright white greenish object zig-zagged across sky.,https://nuforc.org/webreports/reports/114/S114475.html
1565,2014-10-08 22:30:00,Richmond,TX,Light,10 minutes,Bright solid light.,https://nuforc.org/webreports/reports/114/S114348.html
1566,2014-10-08 05:50:00,Austin,TX,Disk,15 minutes,"10/08/14, 5:55 AM, Pictures of a ship around the moon as it was in Eclipse.  I was visiting in Austin, TX. The night of the lunar e",https://nuforc.org/webreports/reports/115/S115290.html
1567,2014-10-07 23:50:00,Gainesville,TX,Triangle,3-4 minutes,"We witnessed a triangular shaped object with a light at each corner, stop and fly silently during a blackout.",https://nuforc.org/webreports/reports/114/S114314.html
1568,2014-10-06 15:20:00,Bryan,TX,Triangle,15 minutes,"Bright white tube mega ship hovering, later similar turns into triangle saucer.",https://nuforc.org/webreports/reports/114/S114308.html
1569,2014-10-05 20:45:00,Galveston,TX,Circle,5 minutes,My husband was outside looking at our Halloween lights and asked me to come out and look at light in the sky. At first I thought it was,https://nuforc.org/webreports/reports/114/S114268.html
1570,2014-10-05 16:45:00,Lubbock,TX,Chevron,20 minutes,White shaped chevron turning in the sky.,https://nuforc.org/webreports/reports/114/S114249.html
1571,2014-10-04 21:30:00,Garland,TX,Formation,1+ minute,"3 pulsating lights in a triangle formation, moving fast with a fourth, identical light to the bottom-right of the three.  I stopped",https://nuforc.org/webreports/reports/114/S114216.html
1572,2014-10-04 18:28:00,Keller,TX,Oval,1 minute,This was not a aircraft or helicopter.,https://nuforc.org/webreports/reports/114/S114220.html
1573,2014-10-03 22:16:00,Houston,TX,Light,30 seconds,Object flies strait down and turns is lights off.,https://nuforc.org/webreports/reports/114/S114187.html
1574,2014-10-03 22:00:00,Austin,TX,Changing,20 minutes,Several UFOs moving towards me slowly then turned into one humungous mother ship with smaller ships flying beside it.,https://nuforc.org/webreports/reports/166/S166981.html
1575,2014-10-03 20:00:00,Copperas Cove,TX,Cone,,I was hunting up 8:00 pm with my friend Bob I told it dark lets go up hill when get up the hill lets check wild game invation camera,https://nuforc.org/webreports/reports/114/S114311.html
1576,2014-10-03 08:00:00,Ferris,TX,Fireball,5 minutes,Fire in the sky.,https://nuforc.org/webreports/reports/114/S114195.html
1577,2014-10-02 23:58:00,Spring,TX,Light,1.3 minutes,Two lights moving slowly changing colors from white to purple to red near Spring Tx on 10/2/14 apprx 2358 hrs.,https://nuforc.org/webreports/reports/114/S114168.html
1578,2014-10-01 22:00:00,Granbury,TX,Triangle,5 minutes,2 triangle shaped UFO's. One was close and flew over head the other was distant and hovered in place.,https://nuforc.org/webreports/reports/114/S114917.html
1579,2014-10-01 16:30:00,Port Neches,TX,Other,30 seconds,((HOAX??)) 3 black military helicopters (Apache or Black Hawk) seen flying at low altitude from SSW to NNE.,https://nuforc.org/webreports/reports/114/S114125.html
1580,2014-09-30 20:00:00,Plano,TX,Triangle,,I was driving on the freeway and saw a bright blue light flying fast in the sky.. I pulled my phone out and started to record.. It was,https://nuforc.org/webreports/reports/114/S114114.html
1581,2014-09-27 20:15:00,Houston,TX,Formation,4,Orange lights in the night sky in a formation.,https://nuforc.org/webreports/reports/114/S114023.html
1582,2014-09-27 04:00:00,Mansfield,TX,Disk,45 minutes,Two multi colored objects moving erratically with changing colors flashing near dallas/ft.wotrh.,https://nuforc.org/webreports/reports/113/S113963.html
1583,2014-09-26 20:26:00,Lubbock,TX,Unknown,Still accuring,A craft seen to the northwest of lubbock. ((NUFORC Note: Reported by local news to be a balloon. PD)),https://nuforc.org/webreports/reports/113/S113939.html
1584,2014-09-26 20:02:00,Lubbock,TX,Light,10 minutes,Bright light over Lubbock TX ((NUFORC Note: Reported by local news to be a balloon. PD)),https://nuforc.org/webreports/reports/113/S113938.html
1585,2014-09-25 05:45:00,Grand Prairie,TX,Triangle,half hour..still there,Blinking formation hovering over my house.,https://nuforc.org/webreports/reports/113/S113903.html
1586,2014-09-25 00:30:00,Amarillo,TX,Circle,1 minute,Red light surrounded by a green light spinning around red. 2 side by side.,https://nuforc.org/webreports/reports/113/S113891.html
1587,2014-09-23 23:15:00,Austin,TX,Other,3 minutes,((HOAX??)) Y-shaped low flying orange glowing object.,https://nuforc.org/webreports/reports/113/S113844.html
1588,2014-09-23 23:00:00,Pinehurst,TX,Light,1 second,"A craft, to low to be a satellite, too fast to be a plane, completely silent, flew across the night sky for a second, only to vanish.",https://nuforc.org/webreports/reports/113/S113863.html
1589,2014-09-21 18:00:00,Galveston,TX,Circle,8 minutes,Strange shape was hovering over near Galveston near the sea wall . Was moving slowly till it faded away.,https://nuforc.org/webreports/reports/113/S113793.html
1590,2014-09-21 13:00:00,Huntsville,TX,Rectangle,several seconds,Rectangle shaped UFO observed traveling at an extremely high rate of speed and sending out bright white propulsion as it traveled.,https://nuforc.org/webreports/reports/114/S114864.html
1591,2014-09-21 03:45:00,Kingwood,TX,Light,Minute,"Single light with two beams of light, flashed colors very fast.",https://nuforc.org/webreports/reports/113/S113902.html
1592,2014-09-21 01:00:00,Euless,TX,Chevron,30-60 seconds,"List the date and time of the sighting; Sept 21, 2014, around 1 am.",https://nuforc.org/webreports/reports/113/S113736.html
1593,2014-09-21 00:45:00,Hillsboro,TX,Other,15+ minutes,Flashing star split into to separate stationary objects.,https://nuforc.org/webreports/reports/113/S113742.html
1594,2014-09-20 13:00:00,Monaville,TX,Changing,20 minutes,"At an airshow could see craft in distant sky drifting very slowly. Photos taken, showing a craft in the shape of the number 3, shini",https://nuforc.org/webreports/reports/113/S113724.html
1595,2014-09-19 16:30:00,Dallas,TX,Other,10 seconds,((HOAX??)) Dallas UFO near airport.,https://nuforc.org/webreports/reports/113/S113710.html
1596,2014-09-15 03:00:00,Amarillo (near),TX,Disk,unknown,Only seen on the photo I have.,https://nuforc.org/webreports/reports/113/S113827.html
1597,2014-09-14 20:40:00,Katy,TX,Changing,I witnessed it for over t,"UFO near Detention Pond in Katy, Texas, Emanates Threatening Gunfire Sounds.",https://nuforc.org/webreports/reports/113/S113584.html
1598,2014-09-13 23:00:00,Haltom,TX,Circle,,Me and my friend went out on the balcony to smoke a cigarette and i looked up seen 4 lights but they were not moving at all stayed in 1,https://nuforc.org/webreports/reports/113/S113524.html
1599,2014-09-10 06:58:00,Kemah,TX,Cigar,5 minutes,2 stationary cigar-shaped objects clearly visible in morning sunlight.,https://nuforc.org/webreports/reports/113/S113455.html
1600,2014-09-06 21:45:00,Austin,TX,Triangle,?,HUGE Triangle Craft hovering near I-35 North Austin,https://nuforc.org/webreports/reports/113/S113329.html
1601,2014-09-06 00:30:00,Lago Vista,TX,Diamond,2 minutes,The craft had 4 peach colored lights on each tip with a canister looking cockpit jutting from the bottom with white lights circling it.,https://nuforc.org/webreports/reports/113/S113309.html
1602,2014-09-05 23:00:00,Cedar Hill,TX,Circle,between 5 to 10 minutes,green see through bubble,https://nuforc.org/webreports/reports/113/S113368.html
1603,2014-09-04 22:30:00,Burleson,TX,Light,20 seconds,"Looking to the northeast, I noticed a light moving across the sky. The light moving across the sky was purely white, appeared to be at",https://nuforc.org/webreports/reports/113/S113278.html
1604,2014-09-02 16:05:00,Fort Worth,TX,Other,100-120 seconds,Star after sundown before stars out; instantly became brighter; white cloud like explosion; an object shot out.,https://nuforc.org/webreports/reports/113/S113186.html
1605,2014-09-01 21:00:00,Austin,TX,Triangle,10 minutes,Massive triangle shaped craft flew directly over me with out a sound.,https://nuforc.org/webreports/reports/117/S117759.html
1606,2014-09-01 07:00:00,Sulphur Springs,TX,Rectangle,1 minute,Seems like they want me to see them.,https://nuforc.org/webreports/reports/120/S120484.html
