,Date / Time,City,State,Country,Shape,Duration,Summary,Posted,Images
3647,2/13/04 07:40,Maricopa,AZ,USA,Light,,lights similar to phoenix lights only turn on faster,3/2/04,
3648,2/12/04 22:30,Phoenix,AZ,USA,Sphere,hours,"Large luminous object appearing easterly from Phoenix, appears stationary.",3/2/04,
3649,2/5/04 08:50,Mesa,AZ,USA,Disk,30 min,Gold hub cap-like shape that bobbed along rather unsteadily.,2/12/04,
3650,2/3/04 23:00,Scottsdale,AZ,USA,Disk,30min.,5 ships move from n.east to the south. All ships of disk shape.,2/12/04,
3651,2/1/04 20:30,Tucson,AZ,USA,Circle,Taking pics,"We were taking pictures of the moon as there was a large white circle around it, and we tried to get that on film. We had never seen a",3/2/04,
3652,1/31/04 09:00,Saint Johns (15 miles NE of),AZ,USA,Sphere,5 min,Refractive mirror like Sphere observed in isolated NE Arizona :Via Jeff Rense,1/31/04,
3653,1/29/04 10:40,Flagstaff,AZ,USA,Light,1-2 minuets,Red and Blue lights moving across they sky in the shape of a crecent moon,1/31/04,
3654,1/28/04 21:00,Phoenix,AZ,USA,Fireball,30+mins,single large fireball hovered,1/31/04,
3655,1/28/04 20:30,Mesa,AZ,USA,Oval,10 min.,Lights over Phoenix again& again.,2/12/04,
3656,1/27/04 19:30,Mesa,AZ,USA,Formation,10 minutes,3-4 UFO's forming a pyramid formation in a Mesa Arizona Desert.,1/31/04,
3657,1/26/04 20:50,Phoenix,AZ,USA,Light,6 minutes,"The light continued to pulsate very slowly, completely disappearing, and then turning back on.",1/31/04,
3658,1/17/04 20:30,Lake Havasu City,AZ,USA,Light,About an Hour,Weird Light fading out then brilliantly bright again.,1/22/04,
3659,1/17/04 18:00,Mesa,AZ,USA,Cigar,5minutes,I WAS SITTING ON THE STEPS OF MY APARTMENT WHEN I OBSERVED A BLACK CIGAR SHAPED OBJECT TRAVLING,1/22/04,
3660,1/16/04 19:30,Quartzite,AZ,USA,Light,5 minutes,"Off-white light moving in the sky, then stopped, a smaller light fell to the ground from the main object and the main object left.",1/22/04,
3661,1/13/04 22:00,Scottsdale,AZ,USA,Light,3-5 seconds,Erractic pinpoint of light observed in the night skies of greater Phoenix.,1/17/04,
3662,1/6/04 18:40,Phoenix,AZ,USA,Light,15 min.,Large bright white light over downtown Phoenix,1/17/04,
3663,1/5/04 21:00,Arivaca,AZ,USA,Disk,1 hour,"high traffic area in Arivaca, S.E. Arizona numerous sightings of up to six objects at a time and low altitude chase",1/19/05,
3664,1/5/04 19:00,Seligman (40 mi east of),AZ,USA,Light,35 min,Mysterious red lights hover at great speeds and preform unheardof manuvers over mt. range in northern Arizona.,1/17/04,
3665,1/5/04 17:30,Seligman (near),AZ,USA,Cigar,10 minutes,"Cigar Shaped objects east of Seligman, AZ on I40 East",1/17/04,
3666,12/23/03 03:00,Pinetop,AZ,USA,Unknown,20 minutes,"low bright red light, with periodic white beems oflight to ground",1/17/04,
3667,12/19/03 03:00,Amado,AZ,USA,Triangle,1 hour,Sighted 10 UFO's who appeared to be mining.,1/17/04,
3668,12/10/03 19:25,Prescott,AZ,USA,Fireball,10 seconds,"Three orange-yellow lights flashed in a straight line in the sky, blinking on and off once before blinking out of view entirely.",12/19/03,
3669,12/10/03 07:00,Sanders,AZ,USA,Cigar,5 minutes,Cigar shaped black object spotted over Northern Arizona town,12/19/03,
3670,12/5/03 18:30,Sedona,AZ,USA,Disk,Approx. 6 minutes,Elongated sphere with red/white strobing lights seen hovering over Airport Mesa in Sedona,12/9/03,
3671,12/4/03 21:15,Scottsdale,AZ,USA,Cigar,2 hours,The object was first observed in the southern sky at 23:15 hours. It then moved to the south eastern sky where it remained static for a,12/9/03,
3672,12/1/03 19:30,Mesa,AZ,USA,Fireball,5 secs,Bright red light east of Mesa.,12/9/03,
3673,12/1/03 07:30,Gilbert,AZ,USA,Circle,15 minutes,bright red circle almost like a flare but can stop and turn opposite direction can travel for miles then dissapears.,12/9/03,
3674,11/26/03 18:55,Gilbert,AZ,USA,Triangle,90 sec,Nov 26th 6:55pm I saw three red lights,12/9/03,
3675,11/26/03 03:00,Bellemont,AZ,USA,Fireball,5 minutes,A large glowing green fireball.,1/31/04,
3676,11/21/03 20:15,Mesa,AZ,USA,Egg,2 seconds,Bright Green Light above Mesa,11/26/03,
3677,11/20/03 18:30,Mesa,AZ,USA,Light,8 minutes,Flashing red light moving slowly,11/26/03,
3678,11/20/03 18:30,Tempe,AZ,USA,Other,45 minutes,Brilliant Red Starlike object in east sky on 11-20-03 in Tempe AZ,11/26/03,
3679,11/19/03 09:00,Naco (Mexico),AZ,USA,Light,09:30,white floating light,11/26/03,
3680,11/18/03 22:30,Huachuca City,AZ,USA,Oval,Ongoing,Four circular lights in the eastern sky.,11/26/03,
3681,11/17/03 14:10,Yuma,AZ,USA,Formation,ongoing,"Straightline formation of numerous white ""lego-type"" objects in flight above Yuma Az,as viewed online from the local satellite of www.w",11/26/03,
3682,11/15/03 19:30,Sierra Vista,AZ,USA,Unknown,1 hour +,The pulsating light kept moving over our area for over an hour with no sound emitting from it and the light pulsating the whole time.,11/26/03,
3683,11/15/03 18:15,Gilbert,AZ,USA,Fireball,25,"Nov 20 Bright Red light low in sky moving northeast across Gilbert, Arizona.",11/26/03,
3684,11/15/03 18:00,Strawberry,AZ,USA,Disk,45 min,Landed Object viewed with High Power Scope at Length,5/24/05,
3685,11/15/03 14:00,Superior,AZ,USA,Sphere,at least 1 hr,Silver Sphere Hindreds of Witnesses Superior AZ,11/26/03,
3686,11/10/03 02:30,Tucson,AZ,USA,Light,10 minutes,"3 starlike lights moving together in unison very bright and low, then disappearing together.",11/11/03,
3687,11/8/03 18:30,Phoenix,AZ,USA,Flash,seconds,"""Shooting star"" below cloud layer",4/9/04,
3688,11/7/03 01:00,Glendale,AZ,USA,Triangle,10 sec,Sitting outside with wife and witnessed a large triangular shaped object had no sound or lights. I got my wifes attention and she witne,6/4/04,
3689,11/1/03 01:00,Gold Canyon,AZ,USA,Circle,Several Minutes,Circle of Red Lights,1/31/11,
3690,10/31/03 23:00,Tucson,AZ,USA,Triangle,8 Hours,"Visible by the naked eye, appear to be several bright, triangular objects in the East and West sky.",11/8/03,
3691,10/24/03 20:15,Wickiup,AZ,USA,Triangle,10 min,The triangular craft reminded me of the one seen over phoenix a few years ago.,10/31/03,
3692,10/22/03 21:00,Bouse,AZ,USA,Light,"3 minutes, twice",Multiple rows of bright yellowish lights seen against night sky,10/31/03,
3693,10/22/03 20:55,Wikieup,AZ,USA,Formation,HOUR AND HALF,UFO ENCOUNTER IN ARIZONA,10/31/03,
3694,10/22/03 08:06,New River,AZ,USA,Other,1 minute,I looked out of the bus window and saw a horseshoe-shaped thing flying away like it had just taken off.,12/19/03,
3695,10/17/03 17:00,Payson,AZ,USA,Oval,about 10 min,Am not sure of the day. We were traveling by car from Tonto Basin. Wesaw a brilliant golden star NE of Payson. There was no other s,4/27/04,
3696,10/15/03 21:15,Mesa,AZ,USA,Circle,10 minutes,Coming Home,11/11/03,
3697,10/15/03 04:00,Flagstaff,AZ,USA,Oval,15 min,"i was traveling at this time in my life and called a VW van home...camping out was what i did to save money on rent, flagstaff, arizon",4/14/09,
3698,10/13/03 19:12,Phoenix,AZ,USA,Sphere,10 seconds,Please tell me that its no big deal because my nine year old son is scared stiff after seeing this!,10/15/03,
3699,10/5/03 21:15,Kingman,AZ,USA,Disk,20 minutes,Kingman Gold saucer Sighting,10/15/03,
3700,10/5/03 18:15,Phoenix,AZ,USA,Formation,15 to 20 minutes,"There was a constellation of ""stars"" in the sky, except it was broad daylight and no clouds, some moved, then they faded away.",10/7/03,
3701,9/30/03 00:00,Tucson,AZ,USA,Oval,home,"It looked like it was hovering, around us the green light was getting brigter for about 1 minute and then left faster than light.",10/7/03,
3702,9/29/03 00:17,San Carlos,AZ,USA,Triangle,45 sec.,3 lights spoted over Apache Reservation,10/7/03,
3703,9/22/03 21:30,Phoenix,AZ,USA,Orb,30-45 minutes,Stationary amber orbs of light fade out then reappear in the exact same spot.,9/24/03,
3704,9/20/03 18:15,Sedona,AZ,USA,Cylinder,5 seconds,Silver cylinder in vertical configuration moving rapidly Westward faster than an airplane for 5 seconds before it disappeared.,7/25/04,
3705,9/18/03 16:00,Tucson,AZ,USA,Circle,1 hour,I was outside with my husband and friend's when I looked up and saw something in the sky. one of the craft's looked closer than the,9/24/03,
3706,9/15/03 20:00,Marana,AZ,USA,Orb,30 minutes,More Orbs in Pinal AZ,9/17/03,
3707,9/15/03 19:00,Tacna,AZ,USA,Light,1 Hour and 25 minutes,I am a TRUCK DRIVER ( HAY HAULER ) .. I had just got loaded with hay in Tacna and ingressed onto the freeway ( INTERSTATE 8 ) and inst,9/24/03,
3708,9/14/03 02:00,Mesa,AZ,USA,Triangle,2 hrs.,"Tripod shaped object with red, blue, and yellow/white flashing lights hovering and or moving over the east valley.",9/17/03,
3709,9/11/03 21:30,Sonoran Desert,AZ,USA,Light,2-4 min. & 4-6 min.,"Large bright lights in the Sonoran Desert sighted on Sept. 11, 2003.",9/28/03,
3710,9/10/03 20:10,Marana,AZ,USA,Orb,2 minutes,3 Orange Orbs Over S Pinal County,9/17/03,
3711,9/9/03 22:00,Prescott,AZ,USA,,45 minutes,"Bright ""stars"" flying in sky in Prescott, AZ. Followed by USAF observation/intervention.",8/7/07,
3712,9/7/03 03:00,Maricopa,AZ,USA,Light,15-30 min.,Bright light moving irregularly.,9/9/03,
3713,9/5/03 21:30,Chandler,AZ,USA,Triangle,1 minute,"THE OBJECT SWOOPED DOWN AND DECENDED EASTWARD, TOTALLY SILENT",9/12/03,
3714,9/5/03 08:48,Phoenix,AZ,USA,Other,1 minute,"Square shaped craft flying over downtown Phoenix, AZ.",9/9/03,
3715,8/30/03 23:30,Maricopa,AZ,USA,Unknown,2 hours,17 stationary and slow moving starlike objects emitting brilliant rainbow lights,9/4/03,
3716,8/30/03 19:00,Heber,AZ,USA,Cigar,5 minutes,Bright large cigar shaped UFO in plain view for several minutes.,9/9/03,
3717,8/30/03 04:30,Apache Junction,AZ,USA,Light,ongoing,Red and blue over Superstition Mountain,9/4/03,
3718,8/28/03 23:00,Kingman,AZ,USA,Triangle,5 minutes,Triangular shape craft with diamond shape lights,9/4/03,
3719,8/28/03 19:30,Surprise,AZ,USA,Other,?,motionless night time-exposure photo of unexplained object,9/4/03,
3720,8/28/03 06:10,Apache Junction,AZ,USA,Disk,1 minute,"08/28/03 Apache Junction,AZ photo of circular object",9/4/03,
3721,8/28/03 06:00,Sanders,AZ,USA,Light,2-3 minutes,Bright Light Seen at Dawn,9/17/03,
3722,8/27/03 21:45,Maricopa,AZ,USA,Diamond,approx. 2 hours,Bright orange lights south of Phoenix,8/28/03,
3723,8/27/03 20:45,Mesa,AZ,USA,Fireball,15 min,2 glowing orange fireballs in the sky,8/28/03,
3724,8/25/03 21:45,Phoenix,AZ,USA,Unknown,16min,i was flying near pheonix when a craft flew right in front of my airplane for 16 min,5/24/05,
3725,8/23/03 15:00,Sedona,AZ,USA,Oval,5 Minutes,Dark stationary craft - hovering at about 1000 feet,11/28/07,
3726,8/19/03 21:00,Chandler,AZ,USA,Cone,several minutes,Ice cream cone shaped craft seen for several minutes in neighborhood. 3 lights in triangle shape on bottom. Spotlight beam. No sound,8/28/03,
3727,8/16/03 15:55,Chandler,AZ,USA,Other,20 minutes,They looked like tiny satellites with thier solar panels extended.,8/28/03,
3728,8/15/03 11:00,Gilbert,AZ,USA,Cross,10 seconds,"aircraft shadow, but no aircraft.",1/17/04,
3729,8/12/03 06:30,Tucson,AZ,USA,Other,35 40 SECONDS,BLUE JELLY LIKE SUBSTANCE IN THE MIDDLE. A GOLD BAND ALL AROUND IT.,10/8/07,
3730,8/11/03 18:00,Grand Canyon (100 miles from),AZ,USA,Light,15 sec,object flashed and vanished,8/28/03,
3731,8/11/03 02:00,Tucson,AZ,USA,Light,10 min,4 lights hung in the sky,9/17/03,
3732,8/8/03 23:03,Scottsdale,AZ,USA,Disk,15 min,3 objects moving south towards Tucson. Were stationary 2 just vanished 3rd remained moving slowly towards the south,8/28/03,
3733,8/8/03 22:30,Tempe,AZ,USA,Flash,10-15 minutes,FLASHING LIGHT/ NO MOVEMENT/VERY BRIGHT AND HIGH IN THE SKY,8/28/03,
3734,8/8/03 21:00,Phoenix,AZ,USA,Oval,15 minutes,glowing large object spotted over phoenix,8/28/03,
3735,8/4/03 19:00,Hereford,AZ,USA,Other,1.5 seconds,I was stading on my front porch looking easterly when I first spotted a large closed horseshoe shaped object heading east from about on,6/4/04,
3736,8/3/03 03:00,Tucson,AZ,USA,Chevron,5 minutes,Chevron craft - 2 bright white/blue lights,5/13/12,
3737,7/25/03 14:30,Meteor Crater,AZ,USA,Unknown,Showed up on a snapshot,It looked like a brown upside down spoon.,8/28/03,
3738,7/21/03 22:00,Tucson,AZ,USA,Triangle,15 min,very large and slow moving,8/1/03,
3739,7/21/03 01:00,Mormon Lake,AZ,USA,Triangle,2-5 min,A large triangle flying at high altitude,4/27/04,
3740,7/16/03 23:00,Phoenix (area),AZ,USA,Fireball,few seconds,Orange fireball over Phoenix area,8/4/03,
3741,7/16/03,Arizona (rural),AZ,USA,,,UFO on the ground in the Southwest US. ((NUFORC Note: Turns out to be a bizarre structure on ground. PD)),8/4/03,
3742,7/11/03 12:00,Zion National Park,AZ,USA,Triangle,photo,A friend while on vacation shot some photos of scenery when the film was developed there was a craft on the film. I took it home and l,8/1/03,
3743,7/8/03,Arizona (rural),AZ,USA,Disk,10 seconds or less,Saw a saucer after a plan spining w/ lights and other events followed.,7/16/03,
3744,7/5/03 23:15,Sedona,AZ,USA,Triangle,2 minutes,"A black triangle was seen flying over Sedona, AZ the evening of July 5, 2003 by six eyewitnesses",7/16/03,
3745,6/30/03 05:30,Phoenix,AZ,USA,Unknown,2 minutes,I was driving west on Broadway Rd. When I noticed a shiny small dot in the sky. It was in the direction towards Sky Harbor Airport. The,7/16/03,
3746,6/24/03 21:45,Prescott,AZ,USA,Sphere,2min,"It moved about a mile or less out into the desert and stoped, then I could see the ground light up beneath it for a moment and then it",7/16/03,
3747,6/24/03 03:32,Kingman,AZ,USA,Light,22 min,the object moved at speed from one place to enother,7/16/03,
3748,6/22/03 21:45,Sun City West,AZ,USA,Light,3 minutes,White light moves erratically through Arizona night sky,7/16/03,
3749,6/22/03 03:00,Mesa,AZ,USA,Cigar,1min,slow low white flying cigar shaped ufo over east mesa.,7/16/03,
3750,6/9/03 22:47,Phoenix,AZ,USA,Light,10 min,"Three lit objects moving about on I-10 in Phoenix, AZ",6/18/03,
3751,6/9/03 19:30,Avondale,AZ,USA,Orb,3 minutes,Strange zig-zagging object traveling from S.W. to N.E.,6/18/03,
3752,6/4/03 23:00,Phoenix,AZ,USA,Light,30 minutes,"I am a security officer assigned to a sensitive area which I will not disclose. The sighting was from this location, but not at this lo",6/10/03,
3753,6/4/03 20:15,Yuma (outside of),AZ,USA,Light,2.5 hrs.,"Several hovering globes of yellow/orange light in the sky outside of Yuma, AZ",6/10/03,
3754,5/31/03 13:00,Phoenix,AZ,USA,Cigar,5-10 seconds,Close encounter of the third kind,11/19/12,
3755,5/31/03 01:00,Pichacho Peak,AZ,USA,Formation,10 minutes,"We were driving south on I-10 when we noticed an object flying at a high speed, close to the ground in irregular patterns.",6/3/03,
3756,5/27/03 22:10,Phoenix,AZ,USA,Cigar,10 minutes,What was that cigar shaped object ?,6/18/03,
3757,5/25/03 23:20,Payson,AZ,USA,Sphere,over 1 hr.,"object low in west sky from Payson, AZ, oval shape w/3 bright spots, moving slowly lower toward horizen",5/27/03,
3758,5/21/03 05:30,Tempe,AZ,USA,Cylinder,120 SECOUNDS,STRAGE ROD-LIKE UFO SEEN OVER TEMPE ARIZONA,6/3/03,
3759,5/20/03 02:35,Tucson,AZ,USA,Oval,30 minutes,"Whitish Grey somewhat Egg/Oval in shaped slowly hovering way up in sky, folding in half/quarter and back to Oval/Egg again.",5/27/03,
3760,5/19/03 23:45,Surprise,AZ,USA,Circle,6 minutes,Flash of light out of which two objects diverged,5/27/03,
3761,5/18/03 21:30,Phoenix,AZ,USA,Disk,3 minutes,four round bright discs with black roating circles in them flying in formation going east,7/16/03,
3762,5/15/03 19:00,Highway 64,AZ,USA,Flash,4 minutes,I was driving a couple of friends back from the Grand Canyon on highway 64 at about 7 pm in the evening. This was May of 2003.  My p,3/4/08,
3763,5/15/03 17:35,Sacaton,AZ,USA,Teardrop,2-3 minutes,"Tearshape - flying with the bulb end first, smooth grey/white in color about 3 feet long.",5/27/03,
3764,5/3/03 22:30,Kayenta,AZ,USA,Light,At Home,Seeing a light over Black Mesa.,1/27/05,
3765,5/1/03 23:02,Arizona City,AZ,USA,Egg,1min,"On May 1, 2003 at approximately 2303 hours, in the northwest sky, I noticed what appeared to be a slow moving egg shaped star. It was m",5/9/03,
3766,5/1/03 12:00,Quartzsite,AZ,USA,Sphere,.5 hour,Grey basketball tracking me from the front!,4/3/11,
3767,4/27/03 16:30,Mesa,AZ,USA,Diamond,5 - 10 MINUTES,"6 BRIGHT LIGHT SEEN OVER MESA AZ. IN BROAD DAYLIGHT BY 6-10 ADULT WITNESSES, OBJECTS WERE MOVING VERY RAPIDLY ACROSS THE SKY",5/2/03,
3768,4/25/03 01:04,Glendale/Phoenix,AZ,USA,Flash,minute,"Bright bluish lights follow my wife car early in the morning, no sounds, lit entire area.",4/27/03,
3769,4/21/03 22:56,Phoenix,AZ,USA,Fireball,6 seconds,SUDDENLY A BRIGHT ELECTRIC BLUE FIREBALL WITH A BIG FIREY RED SPARKLING TAIL APPEARED,4/27/03,
3770,4/21/03 21:45,Phoenix,AZ,USA,Other,2-5 seconds,bright diamond object over south Phoenix,4/22/03,
3771,4/20/03 15:00,Phoenix,AZ,USA,Disk,a few minutes,UFO or not??,7/16/03,
3772,4/16/03 21:00,Wikieup/Wickenburg (enroute),AZ,USA,Other,45 min,golden orange lights seen on and off for about 45 min in arizona on wed. 14 april 2003 1 to 7 lights seen at a time,4/27/03,
3773,4/8/03 12:05,Tempe,AZ,USA,Cylinder,1 minute or so,"Noontime sighting on a sunny, cloudless day of a long, brightly glaring craft that disappears from view.",4/22/03,
3774,4/6/03 16:50,Phoenix,AZ,USA,Sphere,35 mins,"object moved at various speeds, stopping at times and then changed direction almost at a 90 degree angle the appeared to go up and dis",4/22/03,
3775,4/1/03 19:00,Phoenix,AZ,USA,Triangle,1 minute,"Two massive triangular-shaped objects in a wing to wing formation, hovering over a casino parking lot.",5/15/06,
3776,3/31/03 14:00,Tucson,AZ,USA,Circle,4 minutes,"Two spherical ufos seen in Tucson skies from 2:00 to 2:04 in the afternoon, approximately 45 degrees altitude, above the mountains, nor",4/22/03,
3777,3/31/03 14:00,Tucson,AZ,USA,Circle,4 minutes,"Two white spheres suddenly appear in clear , NE Tucson skies in daylight , moving eastward, disappearing after 4 min.",4/22/03,
3778,3/14/03 20:20,Phoenix,AZ,USA,Unknown,10 MINUTES,"Strobing blue light, LONG BRIGHT white tail, dropping ""midair bombs"" and released a single orange sphere.",3/21/03,
3779,3/10/03 02:00,Leupp/Flagstaff (between),AZ,USA,Circle,five minutes,Shiny object in sky disappears with no trace left behind.,3/21/03,
3780,3/5/03 21:10,Chino Valley,AZ,USA,Unknown,2 minutes,There was a black object sitting on the dirt road (or hovering just above it) at the top of the hill in front of us. It was at least as,3/21/03,
3781,2/22/03 22:00,Camp Verde,AZ,USA,Unknown,1 hour,as a crop circle in the sky,2/14/06,
3782,2/20/03 22:00,Phoenix,AZ,USA,,1-2 sec.,"Bright green ""fireball"" seen streaking from east to west over Phoenix, AZ.",3/21/03,
3783,2/20/03 18:30,Glendale,AZ,USA,Fireball,2 sec.,"i saw what appeared to be a meteor traveling east to west. it seemed extremely large, and frightfully close",8/28/03,
3784,2/15/03 19:00,Safford,AZ,USA,Sphere,0:05,"A brightly glowing, luminous [craft] was chased by military jets from a location NE of Phoenix and E of Superstition Mountains.",12/12/11,
3785,2/12/03 22:00,Apache Junction,AZ,USA,Oval,UFO,IT WAS ODD,3/21/03,
3786,2/9/03 10:45,Gilbert,AZ,USA,Orb,10 minutes,"High altitude oval traveling from SW to the NE, stopped then ascended upward until it vanished",3/21/03,
3787,2/5/03 19:40,Tucson,AZ,USA,Light,2-3 seconds,"The sighting resembled a shooting star, but the band of light was much thicker and extremely defined.",3/21/03,
3788,1/24/03 10:00,Prescot,AZ,USA,Circle,20min,small white ball that would go for a short period of time and then disapear and re-apear in different locations,7/16/03,
3789,1/23/03 20:00,Gilbert,AZ,USA,Light,11 minutes,I saw an orange halogen colored light hovering in the southwest horizon over the Chandler area.,3/21/03,
3790,1/22/03 21:30,Maricopa,AZ,USA,Light,15 minutes,Amber/Orange Lights,3/21/03,
3791,1/17/03 23:05,Tucson,AZ,USA,Unknown,,"Have you ever wondered why so many of your ""reporters"" lack spelling skills? A great many make very elemental spelling and grammatical",3/21/03,
3792,1/1/03 09:20,Yuma,AZ,USA,Oval,50 minutes,Large white sphere observed East of Yuma for about 50 minutes. Disapeared when military craft aproached.,3/21/03,
3793,12/31/02 16:40,Phoenix,AZ,USA,Other,10 minutes,"A silent, silver bell-shaped metallic object which emitted an orange glow was observed in the afternoon by 3 persons in Phoenix, AZ.",3/21/03,
3794,12/27/02 20:25,Phoenix,AZ,USA,Chevron,1 minute,Nine bright white lights forming a chevron,3/21/03,
3795,12/25/02 23:30,Phoenix,AZ,USA,Light,15mins,"Lights above the Estrella Mountains (Phoenix, AZ)",3/21/03,
3796,12/25/02 21:00,Oro Valley,AZ,USA,Light,2 minutes 30 seconds,It was Christmas at about 9:00am and my mom and dad were taking me to go visit my grandparents when I noticed a row of about 6 lights I,12/19/03,
3797,12/25/02 17:23,Sedona,AZ,USA,Formation,Not sure,"Formation of black objects in the sky above Sedona, AZ.",8/2/16,
3798,12/3/02 23:30,San Carlos Apache Reservation,AZ,USA,Unknown,5 SEC,Saw a huge bright red/orange object flying south and low at a high rate of speed over San Carlos Apache Reservation. Disappared in a,3/21/03,
3799,12/3/02 20:30,Phoenix,AZ,USA,Triangle,about 5 sec.,"at aprox.2030hrs i saw what appered to be a triangular shaped object,that appeared to be red orange moving at a very high rate of speed",12/23/02,
3800,11/29/02 19:40,Flagstaff,AZ,USA,Light,3 minutes,smal amber light to the north north east part of flagstaff,12/23/02,
3801,11/17/02 19:00,Wittmann,AZ,USA,Other,10 minuts,"A sudden flash of fire light came out of the clear sky, then the object came closer befor disapearing.",12/23/02,
3802,11/15/02 18:30,Surprise,AZ,USA,Flash,5 SECONDS,Flash in the sky,11/20/02,
3803,11/9/02 21:33,Tempe,AZ,USA,Sphere,4 SEC,"VERY BRIGHT BLUE/WHITE SPHERE SIGHTED TEMPE,AZ, HEADING 260 9NOV2002 2133 HRS.",11/16/02,
3804,11/9/02 20:00,Tucson,AZ,USA,Light,seconds,"Flash of blue lights, then fast movement out of sight",11/16/02,
3805,11/7/02 17:15,Nogales,AZ,USA,Triangle,5 minutes,Red glowing triangle shaped object flying away from the sun.,11/9/02,
3806,11/6/02 05:50,Tucson,AZ,USA,Oval,10 SECONDS OR LESS,Bright glowing lights flying in the clouds in Tucson,10/31/08,
3807,11/6/02 05:50,Tucson,AZ,USA,Light,10 seconds or less,Two large bright glowing lights flying in the clouds in Tucson.,3/19/09,
3808,11/1/02 21:40,Tucson,AZ,USA,Formation,split second,5 Crafts in unity for about .5 seconds move incredibly fast and disappeared immediately.,11/4/02,
3809,11/1/02 20:30,Scottsdale,AZ,USA,Fireball,15 seconds,Two Orbs Seen Over Scottsdale,11/4/02,
3810,11/1/02 01:00,Phoenix,AZ,USA,Triangle,5 min to 10,"November 1, 2002 I seen a Triangle shaped craft.",3/9/04,
3811,10/30/02 21:30,Crossing California into Arizona,AZ,USA,Fireball,20 Min,Huge round fireball heading straight toward the ground at great speed with orange yellow streak trial stopping before it hit the ground,11/9/02,
3812,10/29/02 21:38,Chandler,AZ,USA,Diamond,10 to 15 secs,The object appeared to be a dimmly illuminated flying wing approximately diamond shaped with squared off wing tips.,11/4/02,
3813,10/28/02 21:30,Wittmann,AZ,USA,Flash,60 SECONDS,Bright light falls from sky,11/4/02,
3814,10/26/02 10:30,Phoenix,AZ,USA,Cigar,seconds,"Photo of UFO in Phoenix Arizona,",12/19/03,
3815,10/12/02 18:00,Prescott,AZ,USA,Formation,10 minutes,Large cluster of black baloons tehered together at 1500 ft heading SW,10/15/02,
3816,10/6/02 11:00,none,AZ,USA,Other,unknown,Unknown object appears in background of photo.,10/15/02,
3817,10/5/02 22:00,Arizona??,AZ,USA,,,TV photos of cigar shaped craft sighted on 10/5/2002. Note data on photos.,1/23/16,
3818,10/4/02 00:00,Quartzite,AZ,USA,Triangle,3 min,driving home on I-10 west from Phoenix notice this strange triangular shape of lights gently take off from desert floor it had big ligh,12/3/04,
3819,10/1/02 14:00,Winslow,AZ,USA,Other,15-30 mins,"Silent average-looking airplane hovers over Leupp exit butte on I-40 for 15-30 mins, hundreds of witnesses.",7/6/10,
3820,9/28/02 17:30,Mesa,AZ,USA,Other,2 minutes,"Observed a dark, oblong craft fly over Mesa, AZ approx. 5 minutes after watching Air Force One pass by.",10/15/02,
3821,9/27/02 18:55,Scottsdale,AZ,USA,,5 min.,"Three witnesses observe peculiar, maneuvering object, which emits sparks below it.",9/29/02,
3822,9/27/02 12:00,Lake Havasu City,AZ,USA,Light,,Have you seen this?,9/28/02,
3823,9/19/02 19:36,Scottsdale,AZ,USA,Light,2 minutes,"Bubble with stationary beam shining into it, lightning bolt coming out of the bottom.",9/28/02,
3824,9/19/02 19:30,Flagstaff,AZ,USA,,10 minutes,First a beacon of light like Venus then fading as if through clouds and then a cone of light remaining for many minutes,9/28/02,
3825,9/19/02 19:30,Kingman,AZ,USA,Fireball,20 minutes,light trail continued to glow 15 minutes after the object disappeared,9/28/02,
3826,9/15/02 22:00,Lake Pleasent State Park,AZ,USA,Light,About an Hour,"Blue, star sized, lights that zigzag across the sky from horizon to horizon their jerky motions could not be natural.",7/8/04,
3827,9/14/02 00:05,Glendale,AZ,USA,Triangle,1:30 min,PHOENIX TRIANGLE U.F.O SPOTTED AGAIN- SEP/ 14/ 2002 AT 12:05 AM,9/19/02,
3828,9/10/02 07:45,Sedona,AZ,USA,Sphere,10 minutes,I was driving into Sedona to work on route 179 at approximately 7:45am. Shortly before the Villlage of Oak Creek my 10 year old son wh,9/19/02,
3829,9/6/02 22:10,Mesa,AZ,USA,Circle,several minutes,"At about 10 PM I witnessed several small circles of light moving around in the sky, (South West.) I immdediatly got some friends who li",9/13/02,
3830,9/1/02 19:30,Oracle,AZ,USA,Disk,10 minuttes,Disc (100 ft diameter) came out of cloud-hovered at altitude of 200 feet for 10 minutes. -15 people witness siting.,12/7/06,
