,Date / Time,City,State,Country,Shape,Duration,Summary,Posted,Images
1074,1/21/17 20:30,Gilbert,AZ,USA,Light,3 seconds,I went for ice cream with my son who is 12. We were in the car heading back home about 1 minute away from the house. I was facing w at,1/26/17,
1075,1/15/17 20:53,Phoenix,AZ,USA,Flash,2 minutes,Flash of light in the sky.,1/19/17,
1076,1/10/17 03:45,Sahaurita,AZ,USA,Light,20 minutes,"Bright light formation moving erratically near Tucson, AZ",2/17/17,
1077,1/9/17 19:15,Chandler,AZ,USA,Sphere,2 minutes,One round ball of fire.,1/12/17,
1078,1/1/17 00:20,San Tan Valley,AZ,USA,Fireball,5 minutes,Red ball of hovering light.,1/6/17,
1079,12/31/16 23:56,Phoenix,AZ,USA,Triangle,2 minutes,The pyramid shaped like craft flew from the west to east.it was very cloudy weather. The craft was huge and bright with a amber color.,1/6/17,
1080,12/31/16 17:00,Mesa,AZ,USA,Egg,20 minutes,Metallic object flashing in sky.,1/6/17,
1081,12/31/16 02:45,Phoenix,AZ,USA,Flash,5-10 seconds,"A dark round object, then a bright flash of light trailing the sky.",1/6/17,
1082,12/30/16 20:00,New River,AZ,USA,Fireball,3 minutes,"I just saw 2-3 looked like stars, not a plane, in the west sky. The one top left ""joined"" the one bottom right.",1/6/17,
1083,12/27/16 18:00,Tucson,AZ,USA,Unknown,2 hours,Bright white orb over Mt Lemmon Tucson AZ,12/30/16,
1084,12/24/16 21:00,Anthem,AZ,USA,Sphere,5,7 orange lights/sphere's seen by 3 ppl on Christmas Eve.,12/30/16,
1085,12/23/16 17:30,Tucson,AZ,USA,Formation,2 minutes,"Ten large round solid, non-blinking, reddish-orange ""orb-like"" lights flying in formation over Tucson, AZ.",3/17/17,
1086,12/20/16 20:30,Sun City West,AZ,USA,Fireball,5 minutes,"Hovering silent flaming object, after a few minutes rapidly ascended to the SW and disappeared.",3/10/17,
1087,12/19/16 21:53,Florence Jct./Reymart,AZ,USA,Circle,60 seconds,"While camping in the Cottonwood canyon Rd., along the gas line rd., I awoke to my dog growling and staring north. I looked to see what",12/21/16,
1088,12/19/16 20:02,Gilbert,AZ,USA,Light,15 minutes,Undulating swarm cloud of thousands of multi-colored blinking lights in the sky for 10-15 minutes. ((NUFORC Note: LED balloons. PD)),12/21/16,
1089,12/19/16 19:02,Phoenix,AZ,USA,Circle,3 days,Bright light in the night sky. Disappears within about every 30 min returns in intervals. ((NUFORC Note: Venus?? PD)),12/21/16,
1090,12/16/16 11:30,Tucson,AZ,USA,Other,35 minutes,"Shape-shifting pod with moving appendages gave many different looks in 35 minutes. NW Tucson, AZ.",8/16/21,
1091,12/15/16 07:12,Chandler,AZ,USA,,1 minute,Dropping off my son at school and we saw a black line going north to south across the moon,12/15/16,
1092,12/14/16 05:35,Prescott Valley,AZ,USA,Unknown,8 minutes,Three blinking lights (in order) hovering w/ a metal pinging sounds in the dark morning sky for 8-10 minutes before disappearing.,12/21/16,
1093,12/12/16 16:30,Green Valley,AZ,USA,Cone,unk,"Small round object hovering over Green Valley, AZ. ((NUFORC Note: We suspect Venus, or a lens flare. PD))",12/30/16,
1094,12/12/16 16:30,Green Valley,AZ,USA,Disk,unknown,The clear distinct shape and symmetry of this object seem to suggest a UFO.,12/30/16,
1095,12/10/16 18:52,Kayenta,AZ,USA,Disk,10 minutes,"Gigantict Disc with rotating side lights headed northeast over Kayenta into Monument Valley, UT.",12/15/16,
1096,12/9/16 22:00,Phoenix,AZ,USA,Unknown,30 minutes,We were looking towards east and seen in the sky a object that was spinning or lights were spinning. ((NUFORC Note: Star? PD)),12/15/16,
1097,12/9/16 21:30,Kingman,AZ,USA,Triangle,15 seconds,Aircraft w/3 large bright white lights. Lights were shaped like > . It was too high to be a commercial airline but as big. Became as,12/15/16,
1098,12/4/16 14:16,Marana,AZ,USA,,4 seconds,Black nose aircraft near sun. ((anonymous report)),12/5/16,
1099,12/1/16 23:00,Sahuarita,AZ,USA,Formation,20 minutes,Lights in Southern Arizona,9/6/19,
1100,12/1/16 18:52,Glendale,AZ,USA,Light,8 seconds,Fastest light I've ever seen move in the sky with no trail behind it.,12/5/16,
1101,11/22/16 21:30,Mesa,AZ,USA,Light,20 minutes,"Bright red light,waning until disappearing, moving in small, erratic, directional changes.",12/5/16,
1102,11/16/16 22:37,Benson (north of),AZ,USA,Light,2 minutes,Large amber light turns into 5 and slowly disappears,12/5/16,
1103,11/16/16 20:00,Maricopa,AZ,USA,Circle,15 minutes,3 lights in a line that would randomly go dark and return to color. Stayed in formation the while time.,12/5/16,
1104,11/16/16 20:00,Lake Havasu City,AZ,USA,Cross,20 minutes,8 Flashing lights seen flying in formation with multiple other planes flying in close proximity for long periods of time circling over,12/5/16,
1105,11/15/16 20:00,Phoenix,AZ,USA,Egg,30 seconds,2 fast low flying planes follow point of light in sky over east valley in Phoenix,12/5/16,
1106,11/15/16 08:00,Glendale,AZ,USA,Changing,3 minutes,((HOAX??)) Mother ship released four lights.,12/5/16,
1107,11/14/16 00:00,Glendale,AZ,USA,Circle,5 minutes,"I walked out of my friends house toward my car looking west and spotted two orange lights coasting downward toward earth, the lights s",12/5/16,
1108,11/13/16 19:30,Gila Bend (west of; on I-8),AZ,USA,Light,10-12 minutes,Lights from sky following car near Gila Bend I-8.,12/5/16,
1109,11/12/16 19:00,Glendale,AZ,USA,Orb,40 minutes,Ospreys USMC trainings.,12/5/16,
1110,11/11/16 18:45,Phoenix,AZ,USA,Light,60,Light follows Southwest Airlines flight for 60 minutes.,12/5/16,
1111,11/10/16 19:17,Glendale,AZ,USA,Light,12 minutes,3 lights.,11/11/16,
1112,11/10/16 19:15,Glendale,AZ,USA,Light,15 minutes,"3 lights over Phoenix, AZ.",11/11/16,
1113,11/10/16 19:15,Phoenix,AZ,USA,Formation,5 minutes,"White/orange circular lights in rectangle formation Phoenix, Arizona.",11/11/16,
1114,11/10/16 19:00,Glendale,AZ,USA,Formation,20 minutes,3 lights spotted in line over Phoenix.,11/11/16,
1115,11/10/16 19:00,Phoenix,AZ,USA,Circle,15 minutes,3 lights in formation turning off and on in sequence.,11/11/16,
1116,11/10/16 15:30,Glendale,AZ,USA,Other,15 minutes,Three lights in a line a cross the sky. ((anonymous report)),11/11/16,
1117,11/6/16 00:30,Avondale,AZ,USA,Light,10 minutes,"3 bright orange lights in the Avondale, AZ, area.",11/11/16,
1118,11/5/16 22:35,Scottsdale,AZ,USA,Fireball,5 minutes,"Upon stepping out to the back yard this evening, I noticed 3 large, orange fireball type objects low in the north sky.",11/11/16,
1119,11/5/16 19:00,Kingman,AZ,USA,Unknown,30-35 minutes,Wintessed what appeared to be 2 satellites in tandem--then later--odd grouping of flickering lights,11/11/16,
1120,11/5/16 06:45,Sweetwater,AZ,USA,Other,3 minutes,"On Nov. 5th, 2016, at approx. 0645 hours. We were out doing our morning walk, and we observed a metallic chrome like helmet sh",12/5/16,
1121,11/4/16 13:00,The Grand Canyon,AZ,USA,Diamond,2 seconds,UFO top left of video,9/9/22,
1122,11/4/16 01:00,Tempe,AZ,USA,Orb,90 seconds,Three orange/amber orbs silently floating above Tempe neighborhood around Baseline and Kyrene,11/11/16,
1123,11/2/16 20:42,Congress,AZ,USA,Light,20 minutes,"Orange glowing lights in the sky, 3 sets of 3 and then 2 sets of 3 in two different locations in Congress, Arizona.",11/4/16,
1124,10/31/16 01:16,Tempe,AZ,USA,Fireball,5 minutes,Three fire balls appear in the nights sky. Do there little dance and then disappear into the night.,11/4/16,
1125,10/29/16 10:30,Rock Point,AZ,USA,Disk,10 seconds,"Dark-grayish flat like object, in the skies for approximately 10 seconds.",12/5/16,
1126,10/28/16 04:30,Florence,AZ,USA,Circle,05:30,"Giant lighted circle towards the E over the mountains, looks like a full moon but the moon sets in the W. ((anonymous report))",11/4/16,
1127,10/27/16 20:00,Tucson,AZ,USA,Other,6 seconds,"Fast moving straight line from E to W, no sound, completely covered underneath with dim white light.",11/4/16,
1128,10/26/16 22:15,Apache Junction,AZ,USA,Orb,~7 minutes,I received a phone call stating that I needed to go outside and look at the lights over South Mountain.,10/27/16,
1129,10/25/16 19:00,Chandler,AZ,USA,Unknown,1 minute,The UFO had amber lights circulating around it. It was dark so I could not see any shape. The event only lasted 1 minute.,10/27/16,
1130,10/25/16 18:45,Globe,AZ,USA,Formation,4 minutes,Amber string of lights.,10/27/16,
1131,10/25/16 18:42,San Tan Valley,AZ,USA,Oval,,A straight line of four to five lights that appeared to be rotating in a circular motion,10/27/16,
1132,10/25/16 18:40,Chandler,AZ,USA,Formation,30 seconds,"We were driving east on the Loop 202 San Tan freeway, and I saw what appeared to be balls of amber light appearing in the sky due east.",10/27/16,
1133,10/25/16 18:40,Florence,AZ,USA,Light,10 minutes,"Oct. 25, 2016, between 6:30pm and 7:30pm, numerous people from different towns in Arizona are seeing lights in the sky.",10/27/16,
1134,10/25/16 18:40,Globe,AZ,USA,Other,1-2 minutes,"My sons and I were leaving the College when we saw 5 lights in the sky, they faded in and out then disappeared. The 5 lights were in th",10/27/16,
1135,10/25/16 18:35,San Tan Valley,AZ,USA,Formation,3 minutes,String of lights appearing to change postition with each other.,11/4/16,
1136,10/25/16 18:30,Gilbert,AZ,USA,Circle,2 minutes,"Four red lights. Appeared, went into formation and then disappeared.",10/27/16,
1137,10/25/16 18:30,Mesa,AZ,USA,Unknown,~2 minutes,I only saw 4 or 5 oscillating lights while travelling down the 202 eastbound. Amber or white in color. Slowly moving through the sky,10/27/16,
1138,10/25/16 18:30,Queen Creek,AZ,USA,Light,2 minutes,Saw lights appear and dissapear then reappear in a straight line...north to south,10/27/16,
1139,10/21/16 23:50,Phoenix,AZ,USA,Other,8 minutes,Mysterious object in the Phoenix sky.,11/4/16,
1140,10/18/16 23:00,Tucson,AZ,USA,Light,10 minutes,"Bright light that seemed to be hovering, jumped twice, then disapeared.",10/21/16,
1141,10/16/16 19:50,Golden Valley,AZ,USA,Circle,5 minutes,Large Circular Bright Pulsating Light Changed Color from Red to Green to Yellow,10/21/16,
1142,10/16/16 12:45,Tucson,AZ,USA,Rectangle,4 minutes,Object flew across the sky and then straight up until no longer visible. Fast.,10/21/16,
1143,10/15/16 22:00,Yuma,AZ,USA,Orb,1 seconds,Blue light incident and circular ufos,1/4/19,
1144,10/15/16 18:03,Prescott,AZ,USA,Unknown,2 minutes,"Odd erratic, bright light over Prescott area.",10/21/16,
1145,10/13/16 22:00,Parker,AZ,USA,Orb,10 minutes,"Once again above the desert here where I live red orb like lights appeared, traveled the same exact path and vanished.",10/21/16,
1146,10/8/16 18:13,Prescott,AZ,USA,Other,16 minutes,"On October 8, 2016 from 1813 to 1829 I observed a stationary hovering object above Prescott, AZ that had six tumbling ""lobes.&quot",4/20/17,
1147,10/8/16 00:00,Cochise County,AZ,USA,Flash,seconds,"Flashes lighting up portions of the sky. Also, last year witnessed 4 lights hovering in diamond shape in St. David for >1 hr.",10/11/16,
1148,10/1/16 19:30,Phoenix,AZ,USA,Other,12 minutes,7 objects appearing to be fire going over phoenix az sky at around 730 pm on oct.1 2016,10/11/16,
1149,9/25/16 23:46,El Mirage,AZ,USA,Circle,10 minutes,Around 11:46 PM when I was staring up in the sky and noticed 2 circle li ((anonymous report)),9/30/16,
1150,9/15/16 23:20,Benson,AZ,USA,Rectangle,1 second,Rectangular light bar shaped object swooped down the hills in a flash.,10/21/16,
1151,9/10/16 01:50,Tucson,AZ,USA,Light,,"Three lights with one being green, if connected, one can form a triangle; also stood in place while the lights flashed in a pattern.",9/15/16,
1152,9/6/16 14:45,Tucson,AZ,USA,Triangle,1.5 minutes,"Unidentifiable craft moving at extreme speed over Tucson, AZ SEPT 6, 16",9/9/16,
1153,8/30/16 21:45,Tempe,AZ,USA,Light,16 minutes,My girlfriend and I saw two lights hovering over the Tempe area. We were looking south to southwest.,9/9/16,
1154,8/30/16 21:40,Tempe,AZ,USA,Fireball,5-10 minutes,At around 9:40 pm went outside and saw two bright orange fireballs side by side heading towards south mountain. ((anonymous report)),9/2/16,
1155,8/23/16 19:00,Gila Bend,AZ,USA,Light,20 minutes,Lights in the sky.,9/2/16,
1156,8/22/16 22:15,Prescott Valley,AZ,USA,Other,8 seconds,"I saw two bright orange lights in the night that slowly glowed on , then slowly glowed off.",8/25/16,
1157,8/22/16 20:00,Sedona,AZ,USA,Unknown,2-3 hours,Lights and entities in Northern Arizona.,8/29/16,
1158,8/18/16 21:00,Mesa,AZ,USA,Fireball,2 seconds,"Green, bright, ball falling from sky, Mesa, AZ.",8/19/16,
1159,8/18/16 20:37,Maricopa,AZ,USA,Circle,4 minutes,Bright flashing light zig zagging across the sky. ((anonymous report)),8/19/16,
1160,8/17/16 20:00,Gilbert,AZ,USA,Light,60 seconds,"Constant bright star-like white light, heading away with no nav or landing lights. ((NUFORC Note: Sighting of ISS. PD))",8/19/16,
1161,8/15/16 20:05,Gilbert,AZ,USA,Circle,5 minutes,"Round shaped object with no blinking lights, just white, first high in air, then lower instantly, moving across the sky, disappears.",8/16/16,
1162,8/12/16 04:00,Interstate 8,AZ,USA,Triangle,10 minutes,"W on I-8, in AZ, E of Yuma at 4am. On my left, near an overpass, was a craft that looked to be size of car. ((anonymous report))",8/16/16,
1163,8/12/16 02:04,Phoenix,AZ,USA,Light,4 seconds,"Went out to smoke a cigarette and saw a flash of blue light in the sky, it was like something just warped out. The blue light was compo",8/16/16,
1164,8/6/16 20:30,Sedonna,AZ,USA,Other,90 minutes,How anyone can see a UFO.,5/4/18,
1165,8/2/16 19:25,Phoenix,AZ,USA,Light,4-5 minutes,This was not a plane or helecopter.,8/29/16,
1166,7/31/16 20:00,Phoenix,AZ,USA,Rectangle,2 seconds,Looks like square lightning. ((NUFORC Note: Looks like a normal lightning bolt to us. PD)),8/16/16,
1167,7/28/16 09:00,Phoenix,AZ,USA,Other,1 minute,"Faster than Mach 9.6 or almost 7,000 mph. WAY FASTER!",8/16/16,
1168,7/28/16 01:35,Buckeye,AZ,USA,Changing,5 minutes,"We saw a fuzzy orb of yellow/cream light that divided into two and back to one, giving the appearance of growing brighter and then disa",8/2/16,
1169,7/27/16 23:00,Kingman,AZ,USA,Orb,2 minutes,Slow moving orbs of light.,8/2/16,
1170,7/27/16 21:30,Kingman,AZ,USA,Other,60 seconds,"Huge low flying craft over Kingman, AZ, possible crash landing. ((NUFORC Note: Space debris? PD))",8/2/16,
1171,7/27/16 21:30,Prescott Valley,AZ,USA,Formation,10 minutes,"Round headlight appearing to be two crafts side by side, then veered toward the E. ((NUFORC Note: Space debris. PD))",8/2/16,
1172,7/27/16 20:30,Grand Canyon,AZ,USA,Circle,30 seconds,Grand Canyon sighting.,8/16/16,
1173,7/27/16 02:30,Surprise/Glendale,AZ,USA,Unknown,3 seconds,"Bright flash of green light, streaked through the sky and left behind a faint purple glow that faded quickly",8/2/16,
1174,7/26/16 21:45,Kingman,AZ,USA,Circle,,"2 large balls of light in the southern sky, lasted for only a few seconds.",8/2/16,
1175,7/22/16 01:30,Sedona,AZ,USA,Light,1 second,Flash of white ball of light.,7/22/16,
1176,7/21/16 22:00,Phoenix,AZ,USA,Circle,Seconds,"OBJECT CROSSED THE SKY SO FAST, LIKE IT WAS HURLING TOWARD THE GROUND, BUT DISAPPEARED INSTEAD.",8/2/16,
1177,7/21/16 20:50,Buckeye,AZ,USA,Light,5 seconds,"Fast moving light in Buckeye, AZ.",7/22/16,
1178,7/21/16 20:00,Camp Verde,AZ,USA,Light,8-15 minutes,"Multiple lights, moving horizontally and vertically with no sound.",7/22/16,
1179,7/19/16 05:20,Yuma,AZ,USA,Disk,30 minutes,Orange saucer vanished and left a black trail leading down to the surface of the Earth.,7/22/16,
1180,7/19/16 00:10,Phoenix,AZ,USA,Cylinder,45 seconds,"Strange red lights in Phoenix Sky, just now.",7/22/16,
1181,7/17/16 16:00,Quartzsite,AZ,USA,Unknown,Unknown,"I did not witness anything while I was shooting my photos,I took them blindly of the bright sky. ((NUFORC Note: Lens flares. PD))",7/22/16,
1182,7/14/16 20:40,Gold Canyon,AZ,USA,Other,15 seconds,Round craft with bright emerald lights flashed and disappeared the second time the lights flashed.,9/9/16,
1183,7/12/16 21:45,Kingman,AZ,USA,Flash,1 second,My girlfriend and I we're sitting on my back patio stargazing in Clacks Canyon. All of a sudden a spotlight appeared high in sky.,7/15/16,
1184,7/11/16 19:00,Tucson,AZ,USA,Other,~2 seconds,Took pic 3 lights in picture u can see ufo have pic's.,8/2/16,
1185,7/7/16 21:30,Tucson,AZ,USA,Other,4 minutes,Star-like objects pass over Tucson.,7/8/16,
1186,7/7/16 21:30,Tucson,AZ,USA,Teardrop,4 minutes,Hundreds of small flickering white lighted objects floating quickly across the sky.,7/15/16,
1187,7/7/16 21:30,Tucson,AZ,USA,Light,1 minute,"Constellation of 14-30 dim lights, 3 bright blue lights performing maneuvers.",7/15/16,
1188,7/4/16 21:00,El Mirage,AZ,USA,Orb,1 minutes,"Round orb purple haze around it with red in the middle , moved vary quickly down and to the left and hovered there ,seen it for maybe 1",7/8/16,
1189,7/2/16 21:03,Phoenix,AZ,USA,Light,~3 minutes,3 Moving Lights with Large Trails in Phoenix form a Triangle in the Night Sky,7/8/16,
1190,6/29/16 01:01,Phoenix,AZ,USA,Light,~5 seconds,"Please review the show of ""American Monster"" S1 / E5 ""Shooting Phoenix."" This show has absolutely nothing to do w/ UFOs.",7/8/16,
1191,6/27/16 20:25,San Tan Valley,AZ,USA,Oval,5 minutes,3 iridescent orbs flyin North to South with no noise,7/8/16,
1192,6/27/16 17:50,Phoenix,AZ,USA,Oval,30+ seconds,Oval shaped disk w/15 degree increase towards center top; bright light w/thin beams extended to its side; shot up & disappeared.,7/8/16,
1193,6/19/16 23:32,Sun City West,AZ,USA,Sphere,20 seconds,Bright luminous green UFO.,6/24/16,
1194,6/19/16 12:20,Green Valley,AZ,USA,Cylinder,10 seconds,"UFO over Green Valley, Arizona.",6/24/16,
1195,6/17/16 20:05,Oro Valley,AZ,USA,Sphere,2 minutes,Bright white sphere traveling east to west.,6/24/16,
1196,6/15/16 20:00,Gilbert,AZ,USA,Formation,20 minutes,Orbs in the sky.,3/23/18,
1197,6/13/16 22:30,Phoenix,AZ,USA,Circle,20 seconds,"Bright circular light over North Phoenix, then disappears.",6/16/16,
1198,6/13/16 02:00,Phoenix,AZ,USA,Circle,3 minutes,Bright white/blue halo over Phoenix.,6/16/16,
1199,6/12/16 23:30,Phoenix,AZ,USA,Light,2 seconds,"Late night, on a mountain relatively close to my home, I encountered this green light streak across the sky. Heading in the north-west",6/16/16,
1200,6/11/16 23:20,Peoria,AZ,USA,Unknown,10 minutes,Weird maneuvers by bright lights.,6/16/16,
1201,6/11/16 11:10,Laveen,AZ,USA,Diamond,10-15 minutes,Weird shaped object towards South Mountain by Laveen 6-11-16.,6/16/16,
1202,6/11/16 07:00,Buckeye,AZ,USA,Sphere,30-45 seconds,"((HOAX??)) Was standing outside at a cemetery, my whole family was there. I was looking up at planes (like I do often).",6/16/16,
1203,6/9/16 21:00,Chandler,AZ,USA,Fireball,20 minutes,I noticed something strange flying in the sky. It was a red circular orb. It flew around. ((anonymous report)),6/15/17,
1204,6/6/16 04:30,Mohave Valley,AZ,USA,Orb,20-30 minutes,"Early this morning while I was on my back porch waiting for my dogs to go number one and too,I Witnessed an orange colored orb to the w",6/10/16,
1205,6/3/16 14:05,Wittmann,AZ,USA,Cylinder,6 minutes,"Tumbling red cylinder moving very slowly, then disappeared.",6/10/16,
1206,6/2/16 23:00,Sun City,AZ,USA,Formation,10 minutes,"Bluish, to red/orange, formation of circle or oval, swormed and traveled",6/3/16,
1207,6/2/16 04:00,Glendale,AZ,USA,Other,5 minutes,"There was a bright light, multiple bass booms and then crazy trails left in the sky. ((NUFORC Note: Reported as meteor. PD))",6/3/16,
1208,6/2/16 04:00,Phoenix,AZ,USA,Unknown,20 seconds,It turned the Phoenix area in to full daylight....,6/3/16,
1209,6/2/16 04:00,Tucson,AZ,USA,Circle,2 seconds,"Bright yellow pulsating light, 3 sec. And exploded into a white light.",6/3/16,
1210,6/2/16 04:00,Phoenix,AZ,USA,Fireball,3 seconds,"Gigantic fireball lit up the night sky just like it was daylight. E sky, N Phoenix. Huge contrail was left in the sky. ((meteor??))",6/3/16,
1211,6/2/16 03:56,Kingman,AZ,USA,Unknown,10 seconds,Driving into work I saw a sudden bright blue light almost like lighting over the mountains behind the airport. At first I thought it wa,6/3/16,
1212,6/2/16 03:56,Scottsdale,AZ,USA,Flash,1 second,"Flash of light in the sky followed by a boom, followed by smoke trails that appear in uneven circles. ((NUFORC Note: Meteor? PD))",6/3/16,
1213,6/2/16 03:55,Lakeside,AZ,USA,Flash,3-4 seconds,Bright flash in sky followed by loud distant boom. ((NUFORC Note: Reported to have been a meteor. PD)),6/3/16,
1214,6/2/16 03:55,Phoenix,AZ,USA,Unknown,1 second,"Bright light swell, north of Phoenix.",6/3/16,
1215,6/2/16 03:45,Tempe,AZ,USA,Fireball,30 minutes,Bright flash followed by fireball falling from sky seen over PHX INT airport restricted air space. ((NUFORC Note: Meteor?? PD)),6/3/16,
1216,6/1/16 04:00,Avondale,AZ,USA,Flash,4 seconds,Orange firework flare west to east that was silent. ((NUFORC Note: Probable meteor?? PD)),6/3/16,
1217,5/30/16 21:00,Phoenix,AZ,USA,Changing,30 minutes,"Monday May 30th NE Phoenix, 7th Street and Paradise LN.",6/10/16,
1218,5/30/16 20:35,Avondale,AZ,USA,Oval,2 minutes,"2 separate oval orange lights, not blinking, no sounds, were flying low should have heard engines, moving very slowly then disappears.",6/1/16,
1219,5/29/16 23:30,Buckeye,AZ,USA,Light,30 minutes+,3 of us were in my back yard and seen a bright blue light slightly blinking and sometimes red lights in center. ((anonymous report)),6/1/16,
1220,5/29/16 11:43,Scottsdale,AZ,USA,Other,2-4 seconds,A shadow moving across mountain peaks which cause could not be determined.,6/1/16,
1221,5/28/16 09:00,Sun City,AZ,USA,Circle,1 hour,Orangish-red circular object seen north of Sun City AZ,6/1/16,
1222,5/27/16 22:00,Phoenix,AZ,USA,Changing,30 minutes,Friday the 27th of May at 10pm noticed a light flashing in the sky NE of Phoenix,6/1/16,
1223,5/22/16 23:05,Gilbert,AZ,USA,Sphere,5 minutes,Formation of lights.,5/26/16,
1224,5/19/16 21:11,Tucson,AZ,USA,Light,15 seconds,To the N of Tucson saw a still light suspended in the sky. It appeared to be moving ever so slowly. ((anonymous report)),5/20/16,
1225,5/16/16 23:30,Laveen,AZ,USA,Disk,30 seconds,"Yellow lights on Saucer spotted over the Estrella Mountains in Laveen, AZ",5/20/16,
1226,5/14/16 20:10,Maricopa,AZ,USA,Fireball,4 seconds,Orange orbs without noise & vanished quickly.,5/20/16,
1227,5/11/16 19:40,Tucson,AZ,USA,Light,>20 minutes,A bright green light surrounded by red lights hovered over NW Tucson.,5/20/16,
1228,5/11/16 04:00,Payson,AZ,USA,Formation,5 seconds,"6 objects in formation flying North at very high rate of speed, visible with night vision only",5/20/16,
1229,5/11/16 02:30,Phoenix,AZ,USA,Unknown,<2 minutes,"Intermittent light in one place, no speed.",5/14/19,
1230,5/10/16 22:00,Prescott,AZ,USA,Circle,6 minutes,Strange light makes 90 degree turn.,5/20/16,
1231,5/4/16 21:00,Tucson,AZ,USA,Light,5 minutes,High altitude South to North soundless white lighted object.,5/6/16,
1232,5/4/16 05:30,Mesa,AZ,USA,Fireball,5 minutes,I saw what looked like the only cloud in the sky. It was a small smudge. The sun was rising from behind the mountains so that little sp,5/6/16,
1233,5/3/16 12:00,Phoenix/Tempe,AZ,USA,Disk,15 minutes,05/03/2016 UFOS OVER PHOENIX SKYHABOR AIRPORT 1.	BRIGHT LIGHTS Small bright lights dancing all over skyhabor airport 12pm A.	Disk shap,5/6/16,
1234,5/1/16 22:08,Tucson,AZ,USA,Changing,15 minutes,"Seen lights in the sky, There were about 6 lights. They blinked in and out.",10/8/22,
1235,5/1/16 21:30,Chandler,AZ,USA,Oval,1 hour,Orange Oval near Chandler,5/6/16,
1236,4/28/16,Camp Verde,AZ,USA,Circle,2 minutes,"Round black object in the sky by Camp Verde, AZ with no sound, just hovering.",5/6/16,
1237,4/23/16 23:00,Phoenix,AZ,USA,Light,,I was going into my home i noticed a fire in the sky looked like a big shooting star i immediately started recording i told my boyfrien,4/29/16,
1238,4/23/16 21:20,Phoenix,AZ,USA,Light,~10 seconds,Bright light. ((NUFORC Note: Possible flare from an Iridium satellite? PD)),4/29/16,
1239,4/22/16 23:30,Green Valley,AZ,USA,Circle,10 seconds,Yellow circle object bright as a Christmas tree going warp speed as a plane was coming it just vanish,4/29/16,
1240,4/18/16 23:00,Peoria,AZ,USA,Triangle,2 minutes,Big triangle flew over my house!,4/29/16,
1241,4/16/16 02:17,Wickenburg,AZ,USA,Rectangle,2 seconds,"I live in an airpark a few miles northwest of the town of Wickenburg, AZ. I have a game camera set up to monitor traffic.",5/26/16,
1242,4/12/16 10:30,Nelson,AZ,USA,Cylinder,10 minutes,"UFO observed near Nelson, NV. ((NUFORC Note: Report from retired aerospace employee. PD))",4/15/16,
1243,4/3/16 12:20,Wickieup,AZ,USA,Formation,3 minutes,Cluster of small white/silver objects in the daytime sky.,4/15/16,
1244,4/2/16 21:00,Avondale,AZ,USA,Orb,1 hour,"Orangey-yellow ORBS at the Phoenix Raceway - April 2, 2016",4/15/16,
1245,4/1/16 20:00,Surprise,AZ,USA,Other,30 seconds,Burning plane falls from sky over LAFB in Az.,5/26/16,
1246,4/1/16 20:00,Sun City West,AZ,USA,Orb,5 minutes,((HOAX??)) Large falling orb breaks into 5 smaller orbs and possible explosion.,4/15/16,
1247,4/1/16 19:30,Goodyear,AZ,USA,Fireball,45 seconds,Fireball.,4/15/16,
1248,3/30/16 23:00,Phoenix,AZ,USA,Changing,5-10 minutes,Strange light or object in North Phoenix sky,4/15/16,
1249,3/30/16 05:00,Surprise,AZ,USA,Other,1 minute,Have video appeared middle of sky forming a cloud behind no aircraft no typical cloud... I zoomed in no aircraft in visible or flat was,4/29/16,
1250,3/29/16 17:00,Surprise,AZ,USA,Disk,2 minutes,Started in middle of sky...made a turn....when I closed up with camara yhe object seemed flat but invisible..I see a lit of military je,5/26/16,
1251,3/28/16 12:30,Tucson,AZ,USA,Light,60 seconds,Light sphere becomes hawk.,4/1/16,
1252,3/26/16 18:30,Globe,AZ,USA,Rectangle,30 minutes,Lights over globe as 3-26-16,4/15/16,
1253,3/23/16 20:18,Mesa,AZ,USA,Teardrop,1.30,A craft over a house in East Mesa..,4/29/16,
