,Date / Time,City,State,Country,Shape,Duration,Summary,Posted,Images
2350,1/6/12 09:05,Tucson,AZ,USA,Light,5 to 10 seconds,"In Tucson Az I saw a point of light moving over the Catalina Mountains. It appeared to be rotating or tumbling. It was about 9:05 Am,",1/12/12,
2351,1/3/12 22:45,Casa Grande,AZ,USA,Sphere,10 MINUTES,I was about 2 miles from the Casa Grande Airport. I was facing West and that's when I noticed these lights bouncing around in the dark.,1/12/12,
2352,1/1/12 00:00,Phoenix,AZ,USA,Oval,3 minites,Red orb.,1/24/12,
2353,12/31/11 23:58,Mesa,AZ,USA,Circle,2-5 min,"Mulitple lights seen over Mesa, Az New Years 2012",1/12/12,
2354,12/31/11 22:00,Prescott/Prescott Valley,AZ,USA,Light,5 seconds,Green light/sphere seen in Prescott/Prescott Valley,1/12/12,
2355,12/31/11 21:30,Queen Creek,AZ,USA,Oval,3-4 sec,"Oval object, fast moving with a light green tail. also radiating a white halo, came from the eastern sky and flew westward",1/12/12,
2356,12/31/11 20:30,Flagstaff (south of),AZ,USA,Sphere,5 secs,"New Year's Eve 2011 UFO sighting around 8:30 pm south of Flagstaff, Arizona",1/12/12,
2357,12/31/11 20:23,Sedona,AZ,USA,Triangle,30-45 seconds,I was facing N NE 34 5152.16N 111 4738.39W elevation 4436 ft The object came from the NE directly NW till it was gone,1/12/12,
2358,12/31/11 20:16,Cottonwood,AZ,USA,Fireball,a few seconds,"A large green ball of light with a yellow then white tail then nothing, appeared low in the sky.",1/12/12,
2359,12/31/11 20:15,Wellton,AZ,USA,Fireball,8 to 10 seconds,Blue Green Glow,1/12/12,
2360,12/31/11 20:00,Scottsdale,AZ,USA,Disk,45 seconds,Scottsdale,1/12/12,
2361,12/28/11 21:30,Maricopa,AZ,USA,Fireball,45 minutes,"I saw 3 objects that hung around for the full time, It affected my car gauges.",1/12/12,
2362,12/26/11 06:30,Phoenix,AZ,USA,Unknown,20,An object with blue lights over Phoenix,1/12/12,
2363,12/25/11 21:05,Sierra Vista,AZ,USA,Disk,continuing,There is an object in the sky that we have confirmed cannot be an aircraft because it is hovering.,1/12/12,
2364,12/24/11 23:00,Phoenix,AZ,USA,Other,15 mins.,Purple light dances around sky while disappearing and reappearing.,1/12/12,
2365,12/24/11 06:50,Phoenix,AZ,USA,Unknown,15 minutes,Bright Blue & Red Object in North Valley,1/12/12,
2366,12/18/11 22:30,Tucson,AZ,USA,Orb,20 min,Bright purple orb dancing in clouds in tucson,1/12/12,
2367,12/16/11 22:00,Lake Havasu City,AZ,USA,Light,30 seconds,Red and blue low flying lights speeding through sky.,1/12/12,
2368,12/15/11 02:00,North Yuma,AZ,USA,Circle,3 times,Instant burst of circular lights turning into straight laser beams to a center light burst.,1/12/12,
2369,12/14/11 20:00,Phoenix,AZ,USA,Disk,15-20 mins,Many amber colored spheres,12/17/11,
2370,11/29/11 20:00,Chandler,AZ,USA,Changing,,"Large bright ""star"" moving slowly then changing directions and making jumpy movements.",12/12/11,
2371,11/29/11 16:00,Payson,AZ,USA,Cigar,3-5 min,Long tubular shaped ufo over the desert of Arizona near Payson.,12/12/11,
2372,11/27/11 22:00,Mayer,AZ,USA,Formation,30 sec.,"Lights seen over the Bradshaw Mts, Az.",4/18/12,
2373,11/27/11 19:13,Kayenta,AZ,USA,Oval,5-7 seconds,"6-7 ovoids in formation at high speed. Kayenta, AZ.",12/12/11,
2374,11/24/11 17:30,Phoenix,AZ,USA,Triangle,,UFOs in clouds around South Mountian,12/12/11,
2375,11/23/11 21:35,Goodyear,AZ,USA,Fireball,5 Minutes,Large White Fireball disappears behind Estrella mountains,12/12/11,
2376,11/22/11 18:00,Lake Havasu City,AZ,USA,Changing,30min,Small silver u shaped craft with blue and red lights on top.,1/12/12,
2377,11/17/11 18:45,Lake Havasu City,AZ,USA,Changing,1 MINUTE,Shiny Object Morphs into M Shaped Lights then Vanishes,12/12/11,
2378,11/17/11 16:30,Phoenix,AZ,USA,Sphere,20 minute,Just look sphere color metal formation geometric,12/12/11,
2379,11/16/11 18:00,Greenehaven,AZ,USA,Other,40 minutes,Half mile long string of blinking lights that we observed for 40 minutes,12/12/11,
2380,11/16/11 17:40,Kayenta,AZ,USA,Unknown,40 minutes,"UFO lights near Kayenta, AZ",12/12/11,
2381,11/14/11 20:00,Fountain Hills,AZ,USA,Light,3 seconds,My daughter (47)just came back from walking her dog and told Me her dad (69) and Mom (68)that she just observed a blue light just like,12/12/11,
2382,11/12/11 11:50,Chandler,AZ,USA,Rectangle,10 Minutes,Observed a grey unidentified rectanular object in the sky that paused and then moved quickly.,12/12/11,
2383,11/11/11 11:20,Scottsdale,AZ,USA,Unknown,5 minutes,6 glowing objects in the sky that were moving in ways that we have never seen,12/12/11,
2384,11/9/11 17:00,Phoenix,AZ,USA,Light,10 minutes,"3 white lights in a row over phoenix,az 3 army jets passed 30 minutes before the lights showed up",12/12/11,
2385,11/8/11 19:00,Wickenburg,AZ,USA,Triangle,short,Triangle lights,12/12/11,
2386,11/8/11 18:30,Duncan,AZ,USA,Light,20 seconds,"We were traveling North West on Hwy 70 from Lordsburg, NM to Duncan, AZ when my boyfriend and I both noticed a bright orange light in t",12/12/11,
2387,11/2/11 20:20,Mesa,AZ,USA,Other,5 min,arrow shaped craft red and orange-white over arizona.,12/12/11,
2388,10/28/11 16:39,Scottsdale,AZ,USA,Unknown,5min or less,"Three to Five comet-like objects seen descending in the sky east of Scottsdale AZ, directional changes and reigniting flames.",12/12/11,
2389,10/24/11 22:15,Buckeye,AZ,USA,Light,<1 minute,"Orange-Red light over Buckeye, fades away.",12/12/11,
2390,10/23/11 12:15,Phoenix,AZ,USA,,,They moved through the sky and seemed to glimmer from the reflection of the sun as the made falling moves with quick pivot positions,10/25/11,
2391,10/21/11 22:00,Maricopa,AZ,USA,Triangle,5 seconds,Triangle formation of lights followed by single light,10/25/11,
2392,10/19/11 20:37,Maricopa,AZ,USA,Other,10 seconds,Boomerang aircraft 15-20 white lights on leading edge Maricopa Arizona,10/25/11,
2393,10/18/11 20:35,Glendale,AZ,USA,Triangle,15sec,"whoosh sound doppler the sound of plane propeller, prompted turn to north, object uncloaked, traveled east cloaked to dissapear",10/25/11,
2394,10/18/11 03:15,Queen Creek,AZ,USA,Cylinder,15 Minutes,Cylinder flashing object stationary for 15 minutes. Red and Blue lights close to object flashing. Video Taped,10/19/11,
2395,10/15/11 21:20,Buckeye,AZ,USA,Other,Approx. 7 sec.,Sitting in the back yard seen fire ball go south to north. After about two minutes as I was facing west a v shaped craft with about fo,10/19/11,
2396,10/14/11 22:30,Tempe,AZ,USA,Sphere,5 minutes,DARK YELLOW ORANGISH BALL,10/19/11,
2397,10/14/11 21:20,Holbrook,AZ,USA,Other,.10 seconds,This fast moving craft was low flying and not a sound and no lights detail drawings of the underside are avaliable,12/12/11,
2398,10/14/11 19:41,Golden Valley,AZ,USA,Oval,2 to 3 seconds,"I saw a cluster of lights glowing together with a trail, moving south to north, high rate of speed",10/19/11,
2399,10/14/11 19:41,Golden Valley,AZ,USA,Oval,3 or 4 seconds,A cluster of bright lights shot across the sky at high rate of speed,10/19/11,
2400,10/14/11 18:30,Strawberry,AZ,USA,Flash,1.5 seconds,White flash appears in Geosynchronous orbit lasting for 1.5 seconds.,12/12/11,
2401,10/14/11 17:00,Sierra Vista,AZ,USA,Other,5-10 MIN.,Daytime transparent U.F.O. with one light on end of craft.,12/12/11,
2402,10/14/11 05:30,Scottsdale,AZ,USA,Triangle,Hours,Objects in the skies of Scottsdale.,10/19/11,
2403,10/14/11,Cibecue (west of),AZ,USA,Light,5 minutes,Bright yellow light moving slowly thru skies of eastern arizona,10/25/11,
2404,10/10/11 02:00,Prescott Valley,AZ,USA,Other,hours,"Craft boomerang shape.2:00am duration hours. ((NUFORC Note: Probable sighting of a twinkling star, possibly Sirius. PD))",10/10/11,
2405,10/5/11 21:00,Ganado,AZ,USA,Other,4 mins,Boomerage shaped object flying low and quiet.,10/19/11,
2406,10/5/11 19:00,Globe,AZ,USA,Light,60 seconds,Bright light moves across the sky and disappeared.,10/10/11,
2407,9/30/11 22:45,Fort Mohave,AZ,USA,Triangle,30 sec,"Triangle shape with no lights, no sound, hovering behind a electrical storm following it.",10/10/11,
2408,9/30/11 00:00,Maricopa,AZ,USA,Unknown,Unsure,Not an aircraft a being,3/6/23,
2409,9/29/11 21:00,Sedona,AZ,USA,Oval,1 hour (still happening),Oval shaped craft with multi-colored revolving lights in sky and stayed in same area for 2 hrs. ((NUFORC Note: Star?? Sirius?? PD)),10/10/11,
2410,9/27/11 21:34,Tucson,AZ,USA,Orb,15 minutes,"Triangle of three light green orbs flying North over Tucson, AZ before shooting directly up and disappearing.",10/10/11,
2411,9/26/11 04:45,Glendale (Luke Airforce Base),AZ,USA,Sphere,15 min,"UFO over Luke AFB Glendale,AZ",10/10/11,
2412,9/25/11 23:45,Camp Verde,AZ,USA,Fireball,6 seconds,fireball shoots of in sky to the west near camp verde AZ,10/10/11,
2413,9/25/11 04:45,Glendale (Luke Airforce Base),AZ,USA,Sphere,7 Min,"UFO over Luke AFB Glendale,AZ",10/25/11,
2414,9/22/11 22:15,Tempe,AZ,USA,Disk,10 seconds,"Green Illuminated disc hovering over Tempe,AZ in front of Aircraft",10/10/11,
2415,9/20/11 20:40,Flagstaff,AZ,USA,Circle,55 minutes,"shining red and blue light in western sky, circular, ring, spinning",10/10/11,
2416,9/19/11 20:30,Tucson,AZ,USA,Circle,5 minutes,"UFO sighting Tucson, AZ, Sept 19, 2011 at 8:30 pm",10/10/11,
2417,9/18/11 06:00,Chandler,AZ,USA,Teardrop,~1hour,Tear Dropped Shaped Object and Orb Cluster Observed In Arizona,10/10/11,
2418,9/18/11 06:00,Queen Creek,AZ,USA,Light,40 min,We saw a stationary glowing ball in South Eastern sky. ((NUFORC Note: Possible star?? PD)),10/10/11,
2419,9/18/11 06:00,San Tan Valley,AZ,USA,Circle,ongoing,Looks like a small bright moon.,10/10/11,
2420,9/15/11 19:45,Chandler,AZ,USA,Light,15-30 Seconds,Bright Red Light in Sky in Southeast Phoenix Area,10/10/11,
2421,9/14/11 19:45,Phoenix,AZ,USA,Teardrop,45 seconds,I noticed a very bright Blue-Green (like an acetylene flame) Tear shaped light coming towards the raised highway,10/10/11,
2422,9/14/11 19:45,Gold Canyon,AZ,USA,Other,1-5 seconds,Green comet?,10/10/11,
2423,9/14/11 17:00,Cave Creek,AZ,USA,Circle,30 SEC,"Three amber/yellow lights in triangle formation seen in Arizona night sky, then disappeared.",10/10/11,
2424,9/10/11 19:45,Seligman (15 miles west of),AZ,USA,Disk,15 minutes,"UFO photos of 9-10-11 at approx. 8pm in the yavapai desert in arizona, usa.",6/2/13,
2425,9/4/11 21:02,Tucson,AZ,USA,Triangle,5 minutes,"2 pulsating orb like lights hovering, ascending straight up, then across and saw its triangular shape and lights",10/10/11,
2426,8/30/11 20:20,Golden Valley,AZ,USA,Light,10-15 sec's,small white dot. emitting two short burst's of white cone shaped light.,10/10/11,
2427,8/28/11 23:20,Prescott Valley,AZ,USA,Oval,20 minutes,During this time I felt like something was watching me when I was watching the object.,10/10/11,
2428,8/27/11 18:15,Phoenix,AZ,USA,Oval,25 minutes,"white object floating in sky deploys hoses which spray out clouds, they joins another cloud and flys away",9/4/20,
2429,8/20/11 22:27,Kingman,AZ,USA,Circle,4 Mins,Orange lights hover over Kingman Fairgrounds,8/21/11,
2430,8/20/11 19:35,Globe,AZ,USA,Sphere,90 minutes,"Saw 3-4 erratic white-yellow spheres moving vertical, horizontal, diagonal, stopping, spiraling at high speed",8/21/11,
2431,8/20/11 19:35,Globe/Miami (between),AZ,USA,Light,90 minutes,"heard and saw 2 presumed military jets(white with red lights) chasing 4 very fast, erractic in movement white-yellow lights",8/21/11,
2432,8/19/11 15:38,Tucson,AZ,USA,Unknown,4-5 minutes,Mothership? releasing several smaller ships. ((NUFORC Note: We wonder whether this is a serious report. PD)),10/10/11,
2433,8/16/11 23:00,Grand Canyon (North Rim),AZ,USA,Oval,1 hour,"Bright multi colored object seen at night,at our campsite near the Grand Canyon North Rim.",8/21/11,
2434,8/15/11 22:00,Phoenix,AZ,USA,Light,30mins +,"white, red and blue flashing light in western sky at night, no motion",8/21/11,
2435,8/13/11 21:15,Phoenix,AZ,USA,Disk,15-20 seconds,"Disk Shaped (Domed Saucer shape, with multicolored, animated lights around rim)",8/21/11,
2436,8/9/11 20:15,Tucson,AZ,USA,Rectangle,3 MIN,"Rectangular Grid over Catalina Mountains in Tucson, AZ",8/21/11,
2437,8/8/11 18:30,Amado,AZ,USA,Orb,,Spherical object seen at sunset,10/10/11,
2438,8/7/11 08:30,Kingman,AZ,USA,Other,under 1 minute,"Low flying object sighted outside of Kingman, AZ",8/21/11,
2439,8/6/11 00:00,Tucson,AZ,USA,Light,1 hr,star like object going straight up,8/21/11,
2440,8/4/11 22:30,Kingman,AZ,USA,Light,1.5 hours,"Witnessed four bright lights that were in standing formation, changing in brightness.",8/21/11,
2441,8/4/11 21:00,Kingman,AZ,USA,Changing,15 minutes,30 lights heading toward Vegas over the Kingman area.,8/7/11,
2442,8/4/11 20:45,Kingman,AZ,USA,Oval,10 minutes,"A UFO that was hovering outside the town of Kingman, Arizona for about 10 minutes total. ((NUFORC Note: Other reports. PD))",8/7/11,
2443,8/4/11 20:45,Kingman,AZ,USA,Oval,15-30 mins the first time,Possible UFO over kingman az,8/7/11,
2444,7/23/11 06:50,Mesa,AZ,USA,Circle,10-15 seconds,"Big Round Circle UFO Sighting, A.M.",8/7/11,
2445,7/11/11 22:00,Snowflake,AZ,USA,Light,0ne hour and plus,Different colored blinking lights making right angles under heavy cloud color.,10/10/11,
2446,7/7/11 14:00,Sedona,AZ,USA,Circle,I don't know,A circular orange object was observed to be flying through the mountains as a photo was being taken.,8/7/11,
2447,7/5/11 23:11,Phoenix,AZ,USA,Unknown,about three minutes,"((HOAX??)) A Shadow Ship, A Being, And Unexplained Beams Glassing The Sands In Arizona. Detailed Story's Of A Desert Boy.",7/6/11,
2448,7/4/11 20:30,Cottonwood,AZ,USA,Circle,2 or 3 min.,"Glowing Red & White Yellow Fireball, Light panned back and forth",7/6/11,
2449,7/3/11 03:40,Litchfield Park,AZ,USA,Flash,Seconds,A little light in the sky that zoomed by really fast. But definitely was not a shooting star.,7/4/11,
2450,6/30/11 00:00,Phoenix,AZ,USA,Other,0:00 - 23:00,Faint stars that move,7/14/13,
2451,6/21/11 23:30,Lake Havasu City,AZ,USA,Flash,1 second,"1 bright flash, followed by another 30 seconds later.",6/27/11,
2452,6/21/11 22:00,Lake Havasu City,AZ,USA,Orb,2 seconds,"1 orange orb, split in 2 then vanished.",6/27/11,
2453,6/16/11 01:00,Gila Bend (west of),AZ,USA,Triangle,10 minutes,V-shaped craft makes banked turns at a high rate of speed while buzzing rooftops of businesses and homes.,6/27/11,
2454,6/6/11 14:30,San Tan Valley,AZ,USA,Egg,20 minutes,"June 6th, 2011, egg or disk shaped object seen over Eastern Phoenix area",7/4/11,
2455,5/30/11 01:30,Yavapai (Bloody Basin Road),AZ,USA,Other,10 Mins,Two round white lights with dim trail observed while remote desert camping.,6/3/11,
2456,5/28/11 23:20,Tucson,AZ,USA,Flash,1 second,"White flash lighted up the sky over Tucson, Az 05/28/11.",5/29/11,
2457,5/15/11 20:00,Sun City,AZ,USA,Triangle,2-5 minutes,It was just before dark at dusk. I just moved in and was looking at the sky to my left. I saw an orange upside down triangle in the s,8/7/11,
2458,5/14/11 12:30,Tucson,AZ,USA,Cigar,about 2 minutes,"Cigar shaped UFO spotted in Tucson, AZ on May 14, 2011.",5/29/11,
2459,5/12/11 12:25,Phoenix,AZ,USA,Oval,5 minutes,flying golf ball like objects over Phoenix,5/29/11,
2460,5/7/11 23:45,Phoenix,AZ,USA,Changing,20 mins,Blue UFO Over ASU West,5/12/11,
2461,5/7/11 21:45,Phoenix,AZ,USA,Oval,30 seconds,illumnated object traveling at fast rate of speed phoenix az.,5/12/11,
2462,4/20/11 00:15,Mesa,AZ,USA,Egg,:20,Bluish white egg shaprd light falling from sky,5/2/11,
2463,4/17/11 19:00,Benson,AZ,USA,Light,7minutes,Light object,5/2/11,
2464,4/16/11 23:55,San Tan Valley,AZ,USA,Orb,5 min,"quiet jet and red orb flying low over San Tan Valley, Az at midnight. The orb wasn't attached to anything.",5/2/11,
2465,4/14/11 20:00,Lake Havasu City,AZ,USA,Other,1 minute,V Pattern Lights Fly Silently over Lake Havasu City AZ,5/29/11,
2466,4/14/11 04:50,Lake Havasu City,AZ,USA,Orb,1-2 minutes,Pre-dawn sighting of 3 blue orbs followed by a 4th,5/2/11,
2467,4/14/11 04:40,Goodyear,AZ,USA,Triangle,5 minutes,Triangle shaped lights flying over outskirts of Phoenix from SSW to NNE at 0440am.,5/12/11,
2468,4/3/11 22:30,Phoenix,AZ,USA,Formation,45+ mins,"Flickering lights in form of enormous triangle moved east to south to west, disappearing between appearances.",5/2/11,
2469,4/2/11 00:30,Sedona,AZ,USA,Light,1 hour,Circular multi-colored flashing light object flies erratically south to north near Sedona AZ,4/3/11,
2470,3/31/11 21:00,Sedona,AZ,USA,Circle,13minutes,There were three ufos all in a kind of slanted light and they would all go up and down all together and were flickering yellow and oran,4/3/11,
2471,3/31/11 19:30,Arizona City,AZ,USA,Changing,6 hrs,"3 strobing lights are back changed shape. east and west of arizona city, AZ. ((NUFORC Note: Possible sighting of stars? PD))",4/3/11,
2472,3/30/11 19:10,Benson,AZ,USA,Fireball,2-3 seconds,Received a phone call from a friend of 30 years. I stepped outside to take the call. I sat on the stacked bricks that delineated one si,4/3/11,
2473,3/28/11 03:45,Prescott,AZ,USA,Diamond,4 seconds,"A diamond shaped, black craft with two lights passed low over head heading southwest.",4/3/11,
2474,3/24/11 20:45,Marana,AZ,USA,Light,30 min,"A series of bright round orange lights appearing in 5-10 minute intervals high in the sky over Marana, AZ",4/3/11,
2475,3/22/11 21:40,Mesa,AZ,USA,Light,30 seconds,Bright bluish light seen over Mesa Arizona in the direction of Four Peaks Mountain.,3/23/11,
2476,3/18/11 19:40,Litchfield Park,AZ,USA,Orb,3 Minutes,"4 orange orbs hovering over Litchfield Park, AZ",3/23/11,
2477,3/18/11 19:40,Surprise,AZ,USA,Fireball,4 Minutes,Falling Star Turns Out To Be Something WAY Different,3/23/11,
2478,3/18/11 19:35,Glendale,AZ,USA,Fireball,4 minutes,"3/18/11 7:35 P.M Glendale, AZ Fireball falling from sky turns into 6 large glowing lights.",3/23/11,
2479,3/18/11 19:00,Arizona City,AZ,USA,Sphere,10 min,"3 strobbing lights over casa grande,arizona",4/3/11,
2480,3/14/11 19:30,Lake Havasu City,AZ,USA,Other,45 seconds,Orange Orbs on multiple nights and finally a large Mother ship also Orange.,3/23/11,
2481,3/11/11 20:30,Mesa,AZ,USA,Triangle,5-10 secs,"triangle shaped, 5 lights, silent, fast,",3/23/11,
2482,3/10/11 07:46,Lake Havasu City,AZ,USA,Disk,3 Minutes,Bright Amber Disk - Travels Across The Desert Sky,3/23/11,
2483,3/9/11 19:30,Apache Junction,AZ,USA,Orb,3 min.,"Helicopter chases white light at high speeds over Apache Junction, AZ near Mesa border.",3/23/11,
2484,3/8/11 22:00,Wickenburg,AZ,USA,Light,4 seconds,5 bright lights up in the atmosphere.,3/10/11,
2485,3/3/11 01:20,Sedona,AZ,USA,Triangle,20 MIN,"They where back on my Ranch Again, 3rd time, this time 3 of em, not 2, the hovered around my cow pastures, then flew west toward the mo",3/10/11,
2486,3/2/11 06:46,Globe,AZ,USA,Sphere,42 seconds,"Potential UFO turns 90 degrees, vapor trail follows and makes an L in the sky. UFO entry with splash",3/10/11,
2487,3/2/11 06:45,Phoenix,AZ,USA,Unknown,15 seconds,Unknown Object leaving contrail and possible explosion.,3/10/11,
2488,3/2/11 06:25,Tsaile,AZ,USA,Oval,20 seconds,"Contrail line of 10 or more distinct, straight, sharp Z's then a craft appeared a distance above, then vanished.",3/10/11,
2489,3/1/11 18:00,Arizona/Californa Border,AZ,USA,Formation,20 MIN,"Aboard United Flight 667, saw 5 Black Discs along the left wing, flying same speed, after 10 mins , objects flew away at high speed, s",3/10/11,
2490,3/1/11 18:00,Tucson,AZ,USA,Orb,5-10 minutes,"Softball size soft glowing green light 10-15 feet above ground, beckoning me towards something, very agile.",9/7/21,
2491,2/24/11 20:11,Ahwatukee/Phoenix/Gilbert/Chandler,AZ,USA,Light,14 minutes,Four lights non formation up high over desert,3/10/11,
2492,2/18/11,Quartzsite,AZ,USA,Formation,10 min,"((HOAX??)) Camping in desert,saw 3 lights in tri-angle formation,going from west to E, lights made 90 deg turn [left] headed N.",2/23/11,
2493,2/17/11 17:20,Franconia,AZ,USA,Formation,5 minutes,"Bright, twinkling, amber light cluster seen in northern Arizona two different nights.",2/23/11,
2494,2/15/11 20:00,Safford,AZ,USA,Flash,30 minutes,Bright orange flashes in the eastern and western Safford skies.,2/18/11,
2495,2/15/11 17:00,Vicksburg,AZ,USA,Formation,15 seconds,"Arc of 7 - 8 stationary red ""asterisks"" not very high up in the sky.",2/18/11,
2496,2/14/11 22:30,Lake Havasu City,AZ,USA,Unknown,10 Seconds,"Orange, Pulsating Lights Near Lake Havasu City",2/23/11,
2497,2/14/11 21:41,Prescott Valley,AZ,USA,Other,30 seconds,3 lights and another one came from the 3 lights went towards the left then came back to the 3 lights and they all dissapeared,2/18/11,
2498,2/11/11 19:00,Litchfield Park,AZ,USA,Circle,2-3 minutes,6-7 reddish orange lights in the sky that dimmed and went out after a couple of minutes.,2/18/11,
2499,2/8/11 21:00,Prescott Valley,AZ,USA,Circle,20 seconds,"8 circular, orange craft flying over Glassford Hill",2/18/11,
2500,2/3/11 20:40,Gilbert,AZ,USA,Disk,second,2/3/2011 Gilbert AZ shaped disc with glowing dim redish light few seconds,2/8/11,
2501,2/1/11 19:00,Tucson,AZ,USA,Other,15 -25 seconds,Chinook helicopters escort strange object over Tucson AZ,2/18/11,
2502,2/1/11 09:00,Lake Havasu City,AZ,USA,Orb,1-2 minuets,Orange and Blue orbs....regular visitors.,8/7/11,
2503,1/26/11 00:30,Gila Bend,AZ,USA,Formation,15 minutes,"Formation of Yellow Fireballs tracking location and perspective during 80mph interstate travel, possible fighter intercept at end.",2/18/11,
2504,1/25/11 21:00,Prescott Valley,AZ,USA,Formation,20 second,"UNUSUALLY BRIGHT, SEQUENTUALLY ILLUMINATING, YELLOW LIGHTS.",1/31/11,
2505,1/24/11 00:00,Peoria,AZ,USA,Formation,2 min,((NUFORC Note: No information provided by witness. PD)),1/31/11,
2506,1/23/11 03:11,Sedona,AZ,USA,Cone,10 M,"2nd Encounter. Two Cone Shapped Craft Spotted over Same Pasture and felid as last time. Again, one emitted beam over Felid. Then shot b",1/31/11,
2507,1/20/11 07:00,Scottsdale,AZ,USA,Light,~15 min,"Slow moving, red pulsing light in the sky",1/31/11,
2508,1/19/11 20:15,Queen Creek,AZ,USA,Sphere,1 second,"Blue streak moved east very fast, then darted other direction.",1/31/11,
2509,1/18/11 19:30,Glendale,AZ,USA,Light,4 to 5 seconds,Green light streaked across the sky at a low level and then disappeared,1/31/11,
2510,1/17/11 22:00,Tempe,AZ,USA,Unknown,1-2 minutes,"Loud pulsating ""woor...woor"" noise shook apartment complex walls and set off car alarms at night in Tempe AZ",1/31/11,
2511,1/15/11 20:49,Gilbert,AZ,USA,Circle,2 - 3 minutes,"Four orange objects move across the sky in Gilbert, Arizona, before disappearing one by one.",1/31/11,
2512,1/15/11 00:00,Scottsdale,AZ,USA,Circle,30 seconds,A glowing green circle gliding acoss the sky,1/31/11,
2513,1/14/11 22:05,Peoria,AZ,USA,Flash,1 second,Quick moving ball of light in NW Phoenix Valley,1/31/11,
2514,1/2/11 19:12,Phoenix,AZ,USA,Diamond,0ver 15 min,Many lights moving in close formation. then going in differnt directions. VERY bright red lights,1/5/11,
2515,1/1/11 14:00,Yuma,AZ,USA,Oval,45 Minutes,oval stationary object over Yuma Proving Grounds on New Years Day 2011.,1/5/11,
2516,1/1/11 00:02,Sierra Vita,AZ,USA,Circle,6-7 minutes,"Sierra Vista, Az 1/1/2011 12:02 8 slow moving hovering objects lasted about 8 minutes.",1/5/11,
2517,12/29/10 22:30,Tucson,AZ,USA,Light,1 or 2 minutes,"Three, then four lights moving unnaturally fast, stopping abruptly then going straight up unnaturally fast; all with no sound.",7/17/11,
2518,12/27/10 22:30,Tucson,AZ,USA,Other,2 min,Bright orange solid lights hanging stationary over city.,1/5/11,
2519,12/26/10 16:45,Mohawk,AZ,USA,Cylinder,50 minutes,"Bright stationary object in sky north of Mohawk, AZ",1/5/11,
2520,12/24/10 00:00,Mesa,AZ,USA,Changing,,"When i went out side i saw 10 very large craft. Me and my friends were really scared. I saw moving lights, and then all of a sudden the",1/31/11,
2521,12/21/10 03:13,Sedona,AZ,USA,Cone,5 mins,"Two Cone craft, 1 emitted beam, hovered over felid and pasture, then shoot back up",1/5/11,
2522,12/17/10 13:00,Rio Rico,AZ,USA,Circle,1:00 am - 1:12am,UFO spotted in Rio Rico AZ,1/5/11,
2523,12/14/10 05:00,Peoria/Phoenix/Tempe/Chandler,AZ,USA,Light,1 hour,extremely intense white light unmoving 30 minutes,1/5/11,
2524,12/13/10 19:15,San Tan Valley,AZ,USA,Sphere,2 minutes,"Sphere changing colors red, orange, green has numerous yellowish circles exit connected and then sperate to speed off extremely fast.",1/5/11,
2525,12/13/10 19:05,Tucson,AZ,USA,Light,6 to 10 sec.,12/13/10 tucson az. lites lasted 6 to 10 sec. 4 lites south of tucson on 12/13/10,1/5/11,
2526,12/4/10 21:00,Peoria,AZ,USA,Unknown,10-15 minutes,String of lights in Phoenix area,2/23/11,
2527,12/3/10 07:00,Wellton,AZ,USA,Sphere,15 seconds,neon blue sphere came by moving slow until two jets came over the mountain then slowed way down got behind it for a moment then the sph,1/5/11,
2528,11/30/10 18:09,Chandler,AZ,USA,Rectangle,10 min +,large object sillouted in sunset hovering over estrella mountain.,1/5/11,
2529,11/26/10 21:30,Tumacacori,AZ,USA,Formation,15',More Amber Lights and Lines of Amber Lights Seen In and Around Tumacacori & Rio Rico AZ,1/5/11,
2530,11/26/10 02:00,Tucson,AZ,USA,Triangle,10 minutes,Triangle aircraft with 3 lights above tucson,1/5/11,
2531,11/22/10 05:00,Bullhead City,AZ,USA,Triangle,20 min,spirattic triangular light bouncing about,1/5/11,
2532,11/21/10 11:00,Scottsdale,AZ,USA,Disk,15 seconds,"I was at home on the patio that was facing south, I looked up and saw a dark object in the sky. I thought it was a helicopter but it wa",1/5/11,
2533,11/20/10 02:00,Chandler,AZ,USA,Light,10 minutes,"Lights in the sky that look like stars or satelites, but do not move accordingly per the laws of physics.",11/21/10,
2534,11/18/10 18:45,Hwy 260/Hwy 277,AZ,USA,Unknown,1 hour,"V shaped lights coming out of massive cloud in Northern Arizona, red lights blinking inside large cloud.",1/5/11,
2535,11/12/10 17:35,Buckeye,AZ,USA,Other,15 seconds,"Helicopter like ufo out in broad daylight with no noise, propellers, and up close.",5/13/12,
