,Date / Time,City,State,Country,Shape,Duration,Summary,Posted,Images
360,7/17/99 00:00,North Bowers Beach,DE,USA,Unknown,20 Min,A bright light the shot up in the sky and dissipeared for 3-5 min then came down about 20-30 miles away and made a cloud on the way up,8/10/99,
361,6/5/99 15:00,Wilmington,DE,USA,Egg,5 minutes,"In June 1999 a shiny silver egg shaped craft was seen in North Wilmington, DE",11/26/03,
362,6/5/99 02:50,Interstate (I-295 ??),DE,USA,Unknown,,Very similar to Phoenix lights incident 1997,5/20/16,
363,6/1/99 22:00,Townsend,DE,USA,Unknown,2 mins,Object with 6-7 lights that flew slow and quiet about 40 feet above the ground,10/30/06,
364,6/1/99 22:00,Middletown,DE,USA,Triangle,20 seconds,"Triangular object, surrounded by very dim lights, moving fast and low. Very hot and silent.",1/19/05,
365,6/1/99 19:00,Milford,DE,USA,Fireball,15-30 seconds,"Me and my buddy were driving south from up north DE, we werw approximately in Milford almost to Lewes and as we were driving I being in",7/7/17,
366,4/14/99 20:25,Milford/Milton (between; heading parallel to Rout..),DE,USA,Circle,2 to 3 seconds,"As I was driving, I think I saw what appeared to be a fireball or bolide meteor with a long tail. I previously thought it landed close",4/26/99,
367,2/27/99 18:00,Dagsboro,DE,USA,Light,10 minutes,"light 30 degrees N. N.E. size of quarter at arms length. erratic brilliant, like aircraft landing lights . light appeared as intelligen",12/2/00,
368,1/10/99 19:00,Newark,DE,USA,Fireball,1.5 sec,Quickly moving bluish/green light w/ tail. Meteor?,4/2/99,
369,6/20/98 02:00,Dover,DE,USA,Rectangle,30 seconds,"In the Summer on 98 Myself and 2 friends were on our way to q shore house on the Indian River in Delaware, I was driving Interstate 95",6/23/04,
370,6/1/98 09:30,Wilmington,DE,USA,Oval,3/14/98,"2 whitnesses see flying oval blinking uncontrollably, fliping several times in the sky and then suddenly dissapearing in a bright orang",8/16/02,
371,1/15/97 18:00,Millsboro,DE,USA,Triangle,appx. 2 hours,4 lights in square formation in sky and small triangular craft seen at close range,3/21/03,
372,6/16/96 20:30,Dover,DE,USA,Disk,15 seconds,Saw a spinning disk shaped aircraft with bright white lights at the bottom.,6/22/22,
373,8/14/95 01:00,Dover,DE,USA,Triangle,1 minute,"Triangle aircraft, silent, 3 lights on the bottom, no flashing lights moved in directions no airplane could ever move and landed",6/27/19,
374,4/17/95 19:00,Milton,DE,USA,Disk,4 hours,over DE bay flickering lights moving over DE shore/ New Jersey shore .warm air temp. for April/sky colors,5/24/05,
375,7/15/94 14:00,Rehoboth Beach,DE,USA,Sphere,1 minute,"Sphear, white with concave and convex ""windows"" daylight with binoculars",8/16/02,
376,7/15/93 21:15,Magnolia,DE,USA,Circle,10-15 minutes,Saucer-like object seen just south of Dover AFB.,2/14/06,
377,6/21/93 00:00,Dover,DE,USA,Teardrop,1 hour,it had a neon pink bottom and lime green lights on the bottom.,1/21/08,
378,6/20/91 20:00,Dover (near),DE,USA,Triangle,3-4 hours,1991 dover delaware. triangular craft,9/2/05,
379,11/12/90 23:30,Stanton,DE,USA,Light,30 sec,"TWO FRIENDS AND I WERE IN OUR HOT TUB WHEN WE VIEWED WHAT SEEMED TO BE ONE VERY LARGE PLANE IN THE SKY.SUDDENLY, THE FOUR TO FIVE LIGHT",9/28/02,
380,9/7/90 22:00,Dover (south of Dover AFB),DE,USA,Triangle,1:00,Evening sighting of UFO at two different locations.,3/16/00,
381,9/1/90 06:30,Dover,DE,USA,Circle,15 MINUTES,"AS I WAS SITTING IN MY CAR WAITING FOR MY COWORKERS TO ARRIVE AT OUR CONSTRUCTION SITE, I NOTICED A LIGHT IN THE DISTANCE THAT SEEM TO",5/24/99,
382,6/1/90 12:00,Greenville,DE,USA,Disk,30 seconds,White disc makes sharp turns and then shoots up as fast as lightning.,1/10/14,
383,12/23/89 20:00,Hockessin,DE,USA,Sphere,5 mins,We all know we saw the same circular glowing object that night,9/2/05,
384,9/30/88 21:00,New Castle,DE,USA,Triangle,30 seconds,Silent and hovering.,7/22/13,
385,6/1/85 06:00,Wilmington,DE,USA,Other,3 min,"Transluent like figure walking, early morning.",7/31/21,
386,10/15/84 08:15,New Castle,DE,USA,Other,3-5 minutes,Oct 1984 at 8:15 am small translucent half dome shaped object,8/7/11,
387,6/30/84 20:00,Seaford,DE,USA,Sphere,10 minutes,Me and a friend were night fishing in a pond in Seaford del.First we heard a sound coming from somewhere on the other side of trees.,10/11/16,
388,7/4/82 01:00,Wilmington,DE,USA,Other,30 seconds,"I had almost instantly, as I looked up, noticed an odd shaped craft merge out of the clouds and be flying directly over my head.",1/5/16,
389,11/21/81 21:30,Delmar,DE,USA,Light,5 minutes,My sister and I witnessed six bright red lights shooting green lights up at six blue lights that were positioned directly above.e,9/9/03,
390,2/2/80 20:30,Georgetown,DE,USA,Triangle,20 minutes,UFO at Vo-Tech Center comes calling again,9/2/05,
391,11/1/76 21:30,Wilmington,DE,USA,Disk,2 minutes,Silent hovercraft 35-50 feet above ground with searchlights beaming down on houses makes a 90 degree turn and vanishes.,2/18/13,
392,7/21/74 21:00,Newark,DE,USA,Disk,15 minutes,This was not a far away light but a real flying sauser hovering directly above me.,1/10/09,
393,7/4/72 21:00,Rehobeth Beach (near),DE,USA,Disk,10 minutes,"Hovering 25' up, middle section rotating clockwise and containing red, yellow and (green?) lighted sections, shot away fast, no sound.",5/15/13,
394,5/30/72 17:00,Wilmington,DE,USA,Other,?,"1972 Gigantic incandescent object hovering over Concord Mall - stopped cars - deafening silence, lost time.",10/30/06,
395,5/1/72 18:30,Port Penn,DE,USA,Unknown,5 min,silver blue steaking object zips into center of starlight sky,3/16/01,
396,6/30/70 18:00,Elsmere,DE,USA,Circle,15-20 minutes,"Elsmere Delaware Linden ave Park Large round not helicopter blades many colored flashing lights all the way around it, black I beleive",6/7/19,
397,10/15/69 18:30,Wilmington,DE,USA,Circle,1 minute,"Moon sized object ""grew"" to fill entire sky, then disappeared",1/5/11,
398,8/15/68 13:00,Cannon,DE,USA,Oval,30 MINUTES,ONE OVAL DARK GRAY OBJECT THAT HOVERED ABOVE IN THE SKY.,11/21/10,
399,7/1/67 22:00,Greenville,DE,USA,Disk,12 minutes,"1967 16 year old boy and date see UFO close up in Greenville, Delaware.",7/27/17,
400,8/9/66 00:00,Newcastle,DE,USA,Unknown,,"((HOAX??)) I was in bed and i would hear something, then gone this went on for years.",8/7/07,
401,7/1/66 00:30,Dover,DE,USA,Disk,5 minutes,"In the region within an hour of Dover AFB, Delaware",12/23/02,
402,9/30/64 00:00,Wilmington,DE,USA,Unknown,5 to 10 sec.,I thought it was a star....until it MOVED....three times!,1/22/04,
403,6/15/54 11:45,Claymont,DE,USA,Disk,10 secs,"It was just before noon on a warm sunny June day, I was 16 yrs old. Riding in the car with my brother-inlaw driving, my sister riding",11/8/03,
404,8/15/49 20:00,Wilmington,DE,USA,Cylinder,1 minute,"I was ascending a external staircase from our basement. Suddenly above me in the evening dark sky a very large, wide cylinder appeared",1/4/19,
