,Date / Time,City,State,Country,Shape,Duration,Summary,Posted,Images
710,8/11/09 21:00,Des Moines,IA,USA,Unknown,30 to 45 min,"Flashing and strobing object, flashing and strobing military jets, and two white lights moving above the Des Moines Iowa area.",8/27/09,
711,7/25/09 23:00,Algona,IA,USA,Light,2 minutes,"bright white light traveling north west to south east. ((NUFORC Note: Possibly the ISS, but it was visible only at 21:30 hrs. PD))",8/5/09,
712,7/23/09 22:15,Clive,IA,USA,,,"Bright white light in the sky that got brighter, turned red and was gone.",8/5/09,
713,7/17/09 10:00,Waterloo,IA,USA,Fireball,7 minutes,"4 Fireball-like UFO Seen in Waterloo Iowa, July 2009",12/12/09,
714,7/14/09 04:30,Dow City,IA,USA,Unknown,1 second,green shooting star that led me to discover a light with blue and red strobes on it!,8/5/09,
715,7/11/09 21:18,Clinton,IA,USA,Light,5 minutes,"clinton, iowa ufo sigthing",8/5/09,
716,7/2/09 00:00,Spencer,IA,USA,Triangle,15 min,white large trianglar shape. Able to move fast to keep up with the car.,8/5/09,
717,6/20/09 20:30,Sioux City,IA,USA,Triangle,30 minutes,They made a triangular formation.,8/5/09,
718,6/18/09 18:30,Arlington,IA,USA,Light,4 minutes,just a glowing on and off light that suddenly darted.,1/31/11,
719,5/15/09 17:00,Dubuque,IA,USA,Circle,5 - 10 seconds,Red glowing ball taking off before thunderstorm arrived on location,2/14/10,
720,5/2/09 03:30,Ames,IA,USA,Light,1 hour,Craft making 90 degree jagged cuts.,5/12/09,
721,4/24/09 22:19,Dubuque,IA,USA,Unknown,30-35 Seconds,"((HOAX??)) All I could think was ""OH ((deleted))!!""",5/12/09,
722,4/20/09 04:55,Graettinger,IA,USA,Other,5 minutes,Palo Alto County Iowa 5 minute durating,5/12/09,
723,4/6/09 21:00,Clive,IA,USA,Sphere,3 seconds,veering shooting star?,4/14/09,
724,3/19/09 06:20,Waukee,IA,USA,Unknown,2-3 minutes,"pulsating, glowing orange object floating to the northwest of waukee, ia",4/14/09,
725,3/18/09 20:13,Webster City,IA,USA,Light,10 secs,Fast moving light over nightime Webster city.,4/14/09,
726,3/16/09 21:30,Dubuque,IA,USA,Formation,10 seconds,"Chain formation of objects at very high altitude and speed, changing to cluster formation as they moved.",3/19/09,
727,3/15/09 23:00,Muscatine,IA,USA,Triangle,20 seconds,Triangle object with 4 white lights silently flys through the sky very low to the ground.,12/12/09,
728,3/14/09 23:30,Indianola,IA,USA,Triangle,1or more hrs,"triangular flat shaped object,with lights blinking spantaneously. ((NUFORC Note: Possible sighting of Sirius?? PD))",3/19/09,
729,3/5/09 06:45,Cedar Rapids,IA,USA,Teardrop,pic,Two objects iin the sky above Cedar Rapids Iowa morning of 3/5/09,3/19/09,
730,2/10/09 18:55,Hiawatha,IA,USA,Other,3-5 seconds,"Silent, colorless, tranluscent and of very large size flying at a elevation of 5000 feet.",3/19/09,
731,2/2/09 09:00,Ottumwa,IA,USA,Sphere,20 min,Bright white sphere pulsing to a amber color,3/19/09,
732,1/23/09 19:00,Des Moines,IA,USA,Oval,three hours,object first appeared to be aircraft with search lights on. ((NUFORC Note: Venus?? PD)),3/19/09,
733,1/14/09 21:25,Perry,IA,USA,Sphere,2 minutes,Red-orange light above horizon that rose slowly and zigzagged before disappearing.,3/19/09,
734,1/2/09 19:45,Perry,IA,USA,Flash,very short,"Very fast moving light(green), south of Perry, IA",1/10/09,
735,12/28/08 23:30,Des Moines,IA,USA,Light,2 nights,"Sorry, this was a while ago but I just found this site tonight.  Over Christmas break 2008 I was up late one night and went outside",1/24/12,
736,12/28/08 18:00,Langdon,IA,USA,Triangle,12/28/08,Tringlar lights over Langdon,1/10/09,
737,12/20/08 17:00,Iowa City,IA,USA,Unknown,2 seconds,"Bright opal colored flash in the sky oround Iowa City, Iowa on Dec. 20th 2008.",3/19/09,
738,12/6/08 22:00,Ankeny,IA,USA,Triangle,,A bright light 10:25 faded out.,1/10/09,
739,11/28/08 23:15,Sioux City,IA,USA,Oval,2-3 Minute,Rounded UFO Near Grandview Park in Sioux City,1/10/09,
740,11/25/08 18:30,New Hampton,IA,USA,Light,15 minutes,2 HUGE BRIGHT STATIONARY LIGHTS IN THE SKY. ((NUFORC Note: Venus and Jupiter currently are prominent in the sw sky. PD)),1/10/09,
741,11/21/08 03:00,Red Oak,IA,USA,Teardrop,1-2 minutes,a teardrop,1/10/09,
742,10/28/08 17:55,Iowa City,IA,USA,Unknown,1.5 - 2.5 minutes,Late-Afternoon Object Not Depositing a Vapor Trail Unlike Several In-Vicinity Airliner Jets,10/31/08,
743,10/25/08 22:30,Cedar Rapids,IA,USA,Orb,2 minutes,Red light dimming in and out across the clear night sky.,10/31/08,
744,10/15/08 21:00,Hancock County,IA,USA,Chevron,1 minute,"About 7 lights in a V pattern moving across sky heading north, no sound, lots of other aircraft in the area after the lights left",3/19/09,
745,10/7/08 22:00,Des Moines,IA,USA,Triangle,10 MINUTED,WHILE I WAS DRIVING ON THE INTERSTATE I SAW 3 TRIANGLER UFOS OVER MY CAR.,10/31/08,
746,10/2/08 20:00,Marshalltown,IA,USA,Triangle,4-5 seconds,"October 2, 2008 just after 8 p.m. Marshalltown, Iowa, saw a black triangular shaped object, with round green lights in V pattern",10/31/08,
747,9/7/08 23:00,Council Bluffs,IA,USA,Triangle,two minutes,"Sighted black triangle with three white lights and one red. Hovers, moves slowly, turns. Little sound.",10/31/08,
748,8/31/08 01:20,Waterloo,IA,USA,Light,35 min,Over Waterloo viewed from Dewar and Oelwein,10/31/08,
749,8/23/08 21:40,Fort Dodge,IA,USA,Fireball,5 to 7 minutes,Strange pulsing fireball low on the horizon.,10/31/08,
750,8/15/08 00:00,Urbandale,IA,USA,Light,2 hours plus,Changing colors of lights above city.,10/31/08,
751,8/4/08 21:30,Des Moines,IA,USA,Fireball,15 seconds,"Red light over Des Moines, Iowa vewed from Mitchellville, Iowa.",8/12/08,
752,8/3/08 16:42,Sioux City,IA,USA,Disk,30 seconds,Object seen within 1 Mile East of Grandview park in Sioux City(NorthSide). It travelled at about 400 ft in elevation in a N.E. directio,8/12/08,
753,8/1/08 22:30,Des Moines,IA,USA,Sphere,30 seconds,My brother and my mom were with me as we saw a ball of light moving Northwest through the sky. It only lasted about 40 seconds.,8/12/08,
754,7/19/08 20:00,Solon,IA,USA,,,These lights were visible in the early night time sky and witnessed by several observers prior to an advancing storm on 07/20/08 near S,8/12/08,
755,7/18/08 21:50,Waterloo,IA,USA,Fireball,10 seconds,"Flamelike UFO seen in Waterloo, IA",1/10/09,
756,7/17/08 23:15,Urbandale,IA,USA,Unknown,30 seconds,Five Intense Beams of Light,8/12/08,
757,7/7/08 21:20,Eldridge,IA,USA,Triangle,30-60 seconds,Small triangle shaped lights moving through sky.,8/12/08,
758,7/4/08 13:30,Eldora,IA,USA,Disk,30 minutes,Very large disk shaped ufo stopped in mid air a number of times.,9/24/12,
759,7/3/08 19:00,Atlantic,IA,USA,Oval,10 min,07-03-2008 on a cloudless nite a star in sky above iowa moving in different patterns for 10 min,1/10/09,
760,5/29/08 21:57,Solon,IA,USA,Unknown,2 minutes,object hovering with two bright lights that made no noise and disappeared into a while puffy cloud type formation and glowed.,6/12/08,
761,5/20/08 21:30,Tama,IA,USA,Light,FEW MINUTES,BRIGHT WHITE LIGHT MOVING ACROSS SKY SEEN ON THREE OCASSIONS,7/5/08,
762,5/20/08 01:00,Country Side,IA,USA,Fireball,,Two Brothers See Red Orbs Flying in Sky at Back Road CampSite.,10/10/11,
763,4/25/08 23:51,Cedar Rapids,IA,USA,Light,8 minutes,Two bright lights with about four or five smaller lights scattered near it dissapeared after being seen for around 8 seconds,6/12/08,
764,4/15/08,Des Moines,IA,USA,Unknown,,A light came in my window and wake me up and after 3 min it went straight up and out of sight.,7/3/13,
765,4/7/08 22:30,Mediapolis,IA,USA,Triangle,10 seconds,An object flying from the south slowed down near our house and then quickly flew toward the NW,6/12/08,
766,3/16/08 02:30,Little Rock,IA,USA,Triangle,35 secs,blueish green triangular object 0230 little rock ia going north then suddenly south lasted 30+ secs,6/12/08,
767,3/6/08 18:30,Des Moines,IA,USA,Unknown,2.5 hours,4 Fighter Jets continuous pattern. 2 F16's elongated N-S oval grid and 2 F16's elongated E-W oval grid. 2 craft leave fast after 3 hrs,5/15/13,
768,3/6/08 18:00,Altoona,IA,USA,Orb,hour,Blood-red orb being chased by multiple jets.,3/31/08,
769,2/19/08 19:10,Smithland,IA,USA,Sphere,2 min,"bright blue sphere near Smithland, IA",3/4/08,
770,1/17/08,Altoona,IA,USA,Oval,2 min,strange oval mettalic ufo,1/21/08,
771,12/29/07 22:15,Altoona,IA,USA,Unknown,five minutes,strange pulsing light over Altoona Iowa,3/4/08,
772,11/23/07 22:03,Cedar Rapids,IA,USA,Triangle,3 Min,"Triangular craft, two horizontaly level beams of lights, ""Head Lights"" I-380, Cedar Rapids, Iowa, Near Eastern Iowa Airport",11/28/07,
773,11/4/07 10:00,Cedar Falls,IA,USA,Circle,5 seconds,I want to believe.....,4/17/08,
774,10/25/07 22:30,Marion,IA,USA,Light,10-15 Minutes,I was outside smoking a cigarette. I looked over to the field across the street. I saw the first object and thought maybe it's jus,1/21/08,
775,10/20/07 13:00,Lamoni,IA,USA,Unknown,0n video/football game,I captured a dark object moving quickly across the sky (to fast for a bird)!!,2/14/08,
776,10/20/07 00:24,Council Bluffs,IA,USA,Chevron,2,"Strange, Swift, 'Geese'.",11/28/07,
777,10/9/07 23:00,Pella,IA,USA,Flash,,"Light colored red flashing lights appeared in the sky in Pella, IA on 2 different days and times.",11/28/07,
778,9/19/07 22:00,Webb,IA,USA,Light,7min.,"Large orange lites in straight line formation coming on one at a time then going off simutaneously, no sound. Bt moving quickly.",10/8/07,
779,9/19/07 09:30,Webb,IA,USA,Unknown,unknown,five orange blinking lights,10/8/07,
780,9/17/07 23:00,Des Moines,IA,USA,Unknown,About a half hour,Green lit-up horizon with saucer like flying object.,8/12/08,
781,9/14/07 05:50,Bettendorf,IA,USA,Triangle,4 minutes,Tiangular 3 white lighted object hovering with no sound,10/8/07,
782,9/13/07 20:45,Keokuk,IA,USA,,1-2 minutes,A large red circle shaped object appeared out of no where and disappeared as quickly.,10/8/07,
783,9/5/07 21:00,Cedar Falls,IA,USA,Light,2 - 3 seconds,"Last Wednesday or Thursday, about 9 PM, I looked out my living room window and saw a ball of light streak across the sky. It was fairly",10/8/07,
784,8/30/07 20:30,Keokuk,IA,USA,Light,10 minutes,Sequential orange lights in night southeastern night sky Keokuk Iowa 8/30/2007,1/21/08,
785,8/25/07 05:45,Waterloo,IA,USA,Light,15 Minutes,"White light, moving in different directions/speeds and stopped in the night/morning sky.",10/8/07,
786,8/21/07 19:45,Des Moines,IA,USA,Triangle,15 MINUTES,WHILE I WAS GOING TO AN INDIAN RESTAURANT I SAW A TRIANGLER SHAPED OBJECT.,10/31/08,
787,8/18/07 12:00,Waterloo,IA,USA,Oval,5 Minutes,A shiny silver object floating stationary then made tight but short movements.,4/22/22,
788,7/31/07 22:00,Des Moines,IA,USA,Light,2 minuts,very bright white light that slowly dimd then moved slowly to the north across the sky at high altude. Brightend again then disapered.t,8/7/07,
789,7/25/07 22:30,Waukon,IA,USA,Changing,uncertain-15/20 minutes?,"Multiple UFO sitings cumulating in siting of an object that changed shape and ""zigzagged"" through the sky.",8/14/07,
790,7/24/07 23:00,Ames,IA,USA,Diamond,3-4 minutes,Two silent objects over public backup water supply.,11/11/13,
791,7/23/07 04:15,Cascade,IA,USA,Light,2-3 sec,"This is my second sighting in July. This early morning I was traveling south out of Dubuque, Ia on highway 151 near Cascade,Ia. I as al",8/14/07,
792,7/21/07 12:30,Cedar Falls,IA,USA,Light,1.5 hours,"Four crafts, flashing red, green and brilliant white lights, hovering overhead, one making zigzag movements.",8/7/07,
793,7/14/07 22:03,"Lake Poderosa, near Montezuma",IA,USA,Other,1 minute,"straight above, was stationery, appeared to be Jupiter in size and brighteness",3/6/23,
794,7/7/07 00:45,Ames,IA,USA,Triangle,5 Minutes +,Orange Triangular Craft in Pursuit,8/7/07,
795,6/26/07 21:00,Rockwell City,IA,USA,Fireball,21:09,Fire Ball,3/4/08,
796,6/21/07 23:00,Correctionville,IA,USA,Triangle,3 min,triangular shape with 2 lights streaming off. ((NUFORC Note: ISS?? PD)),8/7/07,
797,6/20/07 21:56,Albia,IA,USA,Light,8 seconds,2 points of lights resembling planets disappearing. ((NUFORC Note: Space Shuttle w/ ISS?? PD)),8/7/07,
798,6/19/07 23:05,Spencer,IA,USA,Formation,apprx 6 Minutes,Twin glowing white lights silently traverse the sky in Spencer Iowa then fade out. ((NUFORC Note: Space Shuttle w/ ISS?? PD)),8/7/07,
799,6/19/07 23:00,Sioux City,IA,USA,Light,30 minutes,Outside on breezeless night with neighbors talking when several lights appeared across the sky.,8/7/07,
800,6/15/07 13:00,Cedar Rapids,IA,USA,Unknown,5 minutes,"Sun shining off of geometric shape, hovering still, over Cedar River in C.R.",8/30/13,
801,5/22/07 20:10,Des Moines,IA,USA,Changing,20-30 sec.,Shape Changing Tube or Rod with Pursuing Military Jets?,6/12/07,
802,5/15/07 23:40,Davenport,IA,USA,Triangle,5-8 minutes,Pyramid constilation UFO slowly move across night sky,4/18/12,
803,5/2/07 03:10,Bettendorf,IA,USA,Unknown,3 - 5 minutes,"Fats moving, pulsating lights",6/12/07,
804,4/23/07 11:12,Des Moines,IA,USA,Circle,10min,Hazed lights traveling dew north in a clockwise position.,6/12/08,
805,4/23/07 00:00,Marion,IA,USA,Unknown,2 Minutes,A strange short sirun noise with two massive jet streams of smoke in the sky in rainbow formation.,4/27/07,
806,3/15/07 23:18,Ames,IA,USA,Other,5 minutes,Two white spheroids merged together while remaining distinct and hovered at a distance before disappearing after five minutes.,4/27/07,
807,3/12/07 23:00,Monticello,IA,USA,Other,3to4 min,Blinking lights moving several different directions.,4/27/07,
808,3/10/07 18:20,DeWitt,IA,USA,Triangle,10 minutes,object was traveling from South to North directly over town at a constant speed.,4/27/07,
809,3/8/07 20:00,Keystone (rural),IA,USA,Oval,30 minutes,3/08/07 to 3/13/07 Rural Keystone Iowa Oblong Lighted object/ small star like fast moving objects multiple sighting 20:00 to 21:30,4/27/07,
810,2/22/07 02:27,Des Moines,IA,USA,Light,5 sec,"To fast to be any thing Ive seen as a point of light, two objects parallel in a turn.",2/24/07,
811,2/19/07 20:00,West Point,IA,USA,Circle,2 min.,Large thin orange crescent with outline lights low in sky; changed size; possible mirage.,2/24/07,
812,2/16/07 19:00,Cedar Rapids,IA,USA,Formation,10 seconds,Six to eight round neon green objects flying north to south in a v shaped formation at low speed and slightly higher than tree height,2/24/07,
813,2/6/07 23:45,Cedar Rapids,IA,USA,Cigar,30 minutes,"Power outage, flash of light and two soundless hovering craft",2/24/07,
814,2/4/07 20:00,Bettendorf,IA,USA,Unknown,10 seconds,"Fireball, illuminating as dropping to ground 30 degrees inclination from horizontal",2/24/07,
815,1/31/07 01:45,Burlington,IA,USA,Triangle,12 minutes,Three bright lights in the form of a triangle with pin point lights emitted at corners.,2/1/07,
816,1/15/07 15:00,Marshalltown,IA,USA,Oval,hour,They seemed to react to each other the way that mercury does in its liquid form.,2/1/07,
817,1/10/07 23:05,Council Bluffs,IA,USA,Chevron,2 hours,I was driving near the industrial estate when a bright light appeared on the horizon. It began to climb into the sky and grow larger. T,2/1/07,
818,1/10/07 23:00,Council Bluffs,IA,USA,Chevron,57 minutes,the object darted around until it went over the horizon,2/1/07,
819,1/8/07 15:56,Otley,IA,USA,Sphere,About 30 secs,Observed unusual aircraft between Pella and Otley westbound on highway 163 around mile marker 36 viewed at a 45 degree from vehicle. Ai,2/1/07,
820,1/5/07 22:08,Atlantic and Audubon,IA,USA,Unknown,2 seconds,A streaking light falling to the ground seen from east bound I-80 mile marker 69.,2/1/07,
821,1/2/07 21:00,Adair,IA,USA,Circle,45 seconds,3 orange donut shaped objects,2/1/07,
822,1/1/07 00:11,Cedar Falls,IA,USA,Light,3-5 minutes,Strange light bobs up and down three times before circling around the east side of the city and disappearing.,2/1/07,
823,12/25/06 20:47,Rockford,IA,USA,Circle,watched about 10 -15 min,"Dec. 25, 2006 8:45 P.M. Rockford, Iowa A round with blue and red lights slowly moved across the sky.",2/1/07,
824,12/12/06 20:00,Iowa City,IA,USA,Light,3-4 seconds,extremely bright green lights that moved quickly across the sky and down to the horizon,2/1/07,
825,12/9/06 21:45,Bettendorf,IA,USA,Triangle,over one hour,9:45 PM 12/09/06 huge triangle defined by white light pattern motionless about 7 miles south of Bettendorf IA,12/14/06,
826,11/19/06 22:00,Waterloo,IA,USA,Other,30 seconds,silent objest with rippling effect,12/7/06,
827,11/19/06 20:02,Hartley,IA,USA,Unknown,1 min,5 liights in southern sky,3/8/07,
828,11/7/06 20:30,Stratford,IA,USA,Unknown,10 minutes,Huge spinning yellow orange lights in the Central Iowa sky.,12/7/06,
829,10/24/06 22:00,Fort Dodge,IA,USA,Triangle,Three hours,Iowa UFO invasion!,10/30/06,
830,10/1/06 17:00,Algona,IA,USA,Unknown,over an hour,6 people saw 2 objects in the sky that had lights and were flying in zig-zag patterns in the sky while staying in the same area.,10/30/06,
831,9/29/06,Spirit Lake,IA,USA,Light,5 sec,High altitude orange light moving from zenith west to 30 degrees at incredible speed and rapidly fading.,10/30/06,
832,9/20/06 23:04,La Motte,IA,USA,Flash,A few seconds,Wierd flash of light,10/30/06,
833,8/27/06 00:30,Winterset,IA,USA,Disk,15 min,The Closest thing anyone will ever come to a actual real life encounter.,10/30/06,
834,8/12/06 22:00,Fort Dodge,IA,USA,Oval,10 seconds,Solid orb of light moving rapidly increasing in size and brightness then suddenly vanishes.,10/30/06,
835,8/5/06 17:47,Waterloo,IA,USA,Cigar,5-10mins,Bright White/Sliver Cigar Shaped Craft sighted Iowa,10/30/06,
836,8/5/06 17:40,Waterloo,IA,USA,Cigar,4.5 minutes,"White Cigar Shaped Craft seen over Waterloo, Iowa",10/30/06,
837,7/25/06 04:31,Urbandale,IA,USA,Light,6 seconds,Bright light,10/30/06,
838,7/22/06 03:00,Des Moines,IA,USA,Orb,30-45 seconds,Flash of white light turns into orb then dims to likeness of dimm star.,10/30/06,
839,7/15/06 11:00,Ottumwa,IA,USA,Light,20 min,Unexplained object floating across the night sky,6/12/07,
840,7/14/06 23:30,Harpers Ferry,IA,USA,Light,2 nights,Bluish-white basketball-sized light over Mississippi River and land close to Effigy Mounds natioal monument,3/31/08,
841,6/14/06 23:15,Davenport,IA,USA,Oval,15,"UFO Sighting in Davenport, by the Sharewood apartments, and the Mississippi Valey Fair.",7/16/06,
842,5/25/06 00:30,Muscatine,IA,USA,Rectangle,2 mins.,Strange object passing through Muscatine,7/16/06,
843,5/22/06 21:35,Coralville,IA,USA,Oval,1 sec,a light and movement that I have never seen before,7/16/06,
844,5/14/06 01:45,Newton,IA,USA,Light,10 minutes,Red dots in the sky,5/15/06,
845,5/14/06 01:32,Newton,IA,USA,Light,about 10 mins,Red dots in mid air,5/15/06,
846,5/7/06 21:30,Davenport,IA,USA,Light,less than 1 minute,I was sitting on steps leading to my house. I was facing west when I noticed a light moving from a westardly direction that was very hi,5/15/06,
847,2/14/06 08:30,Urbandale,IA,USA,Teardrop,1 min,Object re-entering atmosphere...slowly,3/11/06,
848,2/8/06 20:15,Manilla,IA,USA,Light,15 Seconds,I believe we are being watched here.,2/14/06,
849,2/7/06 20:00,Manilla,IA,USA,Light,15 Seconds,Strange lights in Iowa skies,2/14/06,
850,12/22/05 21:40,Osceola,IA,USA,Triangle,15 MINUTES,WHILE I STEPPED OUT OF MY MOTEL ROOM I SAW A LARGE TRIANGLER OBJECT THAT DRIFTED IN THE SKY.,10/31/08,
851,12/22/05 20:40,Osceloa,IA,USA,Triangle,15 MINUTES,WHILE I WAS DRIVING AROUND AFTER DINNER I SAW SOME TRIANGLER UFOS OFF THE INTERSTATE AND AT THE MOTEL I WAS AT.,10/31/08,
852,12/18/05 18:45,Council Bluffs,IA,USA,Triangle,3:00 Mins,Traveling from Omaha to Des moines I witnessed a triangle object near interstate,2/14/06,
853,11/22/05 19:40,Norwalk,IA,USA,Cigar,15 MINUTES,While I was at my barn in my pasture I saw white lights and a cigar object,3/11/06,
854,11/7/05 17:00,Urbandale,IA,USA,Fireball,2 minutes,Witnessed Large Fireball at dusk was the size of a 50 cent piece held at arms length in the west.,11/8/05,
855,10/28/05 08:00,Eldridge,IA,USA,Disk,30 seconds,MISSOURI INVESTIGATORS GROUP Report: I saw a bright circular metal object in the sky which seemed to hover.,12/12/09,
856,10/27/05 00:00,Glidden,IA,USA,Triangle,5 hrs,((NUFORC Note: PSmall blinking color changing moving lights.,11/3/05,
857,10/11/05 21:00,Wall Lake,IA,USA,Light,10 seconds,strange shit in the sky in sac county iowa.,10/20/05,
858,10/6/05 18:00,Cedar Falls,IA,USA,Light,10min,RED LIGHT,10/11/05,
859,10/6/05 06:00,Mason City,IA,USA,Light,5 minutes,strange flying object,10/20/05,
860,10/5/05 23:00,West Des Moines,IA,USA,Cigar,5 Minutes,"Object Hovering between 2-5,000 feet in the air. 4-5 Strobe lights in a row flashing in sequence. Object hovered without making a sou",10/11/05,
861,10/4/05 20:15,Granger,IA,USA,Formation,15 seconds,"six orange lights in formation over Granger, IA",10/11/05,
862,9/24/05 05:30,Fort Madison,IA,USA,Orb,20 minutes,"Recently my friends and I were on a mission trip just outside of Fort Madison, Iowa. We had just finished doing some work on a house wh",7/16/06,
863,9/14/05 06:00,Muscatine,IA,USA,Fireball,5 Seconds,Fire ball in the western sky from Muscatine,10/11/05,
864,9/14/05 05:50,Various counties,IA,USA,Fireball,5-7 Seconds,IOWA MUFON REPORT: Fireball/greenish light seen from various Iowa locations by many witnesses & reported to radio show.,10/20/05,
865,9/11/05 21:03,West Des Moines,IA,USA,Light,3 seconds,Blue light that look about as bright as Venus streaked across the sky from the south to the north. I am in apartments sw of the I-235,10/11/05,
866,9/10/05 21:00,Pocahontas,IA,USA,Light,45 secionds,bright white- blue light in northern Iowa skies,10/11/05,
867,9/1/05 21:50,Boone,IA,USA,Chevron,2-3 min.,Slow moving boomerang moves across a Central Iowa town.,9/15/05,
868,8/1/05 03:15,Ottumwa,IA,USA,Light,15 minutes,"Star or planet - when seen in binoculars, five lights in a circle, one in the middle - flashing a rainbow of colours - moved miles East",9/2/05,
869,7/27/05 23:15,Ottumwa,IA,USA,Rectangle,<1 minute,Rectangle-shaped craft - silhouette,9/2/05,
870,7/24/05 22:10,Sheldon,IA,USA,Triangle,4 sec,Triangle shaped UFO observing thunderstorms,9/2/05,
871,7/24/05 22:10,Sheldon,IA,USA,Triangle,4 seconds,"IOWA MUFONREPORT: Director, Beverly Trout, interviewed witness by phone re a sighting witness had reported to NUFORC.",10/20/05,
872,7/24/05 04:45,Fort Dodge,IA,USA,Triangle,1 min,Dark Triangle with 2 lights seen traveling towards thunderstorms,12/16/05,
873,7/15/05 08:15,"Iowa City (near, on I-380)",IA,USA,Sphere,10 minutes,"Silent, slow moving black sphere flying near Iowa highway",3/11/06,
874,7/2/05 03:30,Oskaloosa,IA,USA,Fireball,90 min,"While sitting in the backyard with a friend. What appeared to be a star, slowly started decending toward the Southeast horizon.It slowl",7/5/05,
875,6/30/05 04:30,Sioux city,IA,USA,Other,45 minutes,I saw a barrel shaped object two hundred feet above morningside Lutheran church. It was n Not shiny. It resembled a 55 gallon oil drum,6/2/13,
876,6/25/05 21:30,Iowa (unspecified town),IA,USA,Disk,3minutes,"First object observed jumped from location to location instantly. Until it disappeared.  The second object was moving fast, the obje",9/2/05,
877,6/22/05 22:48,De Soto,IA,USA,Triangle,5 mins,3 lights defining a triangle shape moving slowly in a night sky. ((NUFORC Note: Possible sighting of U. S. Navy NOSS satellites. PD),7/5/05,
878,6/14/05 21:00,Council Bluffs,IA,USA,Triangle,30 seconds,Traingle UFO sighting clear veiw three witnesses and one stubborn person who wouldn't look,10/31/08,
879,6/2/05 22:15,Cedar Rapids,IA,USA,Other,10 seconds,"Object heading direct west moving about 3 times the speed of a plane, with one light flashing, jumping from position to position.",6/20/05,
880,5/25/05 03:30,Mason City,IA,USA,Unknown,5 Minutes,"didnt notice untill my friend asked me if i saw what he saw the object was in the sky very far away, may have been in space but couldn",6/20/05,
881,5/10/05 15:00,Holstein,IA,USA,Unknown,unknown,Time manipulation after possible abduction.  500 Lights On Object0: Yes,7/17/11,
882,4/26/05 23:00,Ottumwa,IA,USA,Triangle,<5 minutes,"Note: I don't remember the exact time, but it was sometime between 10 PM and 12 AM I believe.  I used to keep my window open before",9/2/05,
883,4/14/05 11:56,Iowa City,IA,USA,Fireball,10 sec.,11.56 AM 4/14/05 LOCATION: SE of Iowa City - Iowa City Airport. Altitude perhaps 1000-1500 feet. Thin white object rapidly appears,4/16/05,
884,4/9/05 01:43,Marshalltown,IA,USA,Circle,3-4 seconds,Large round glowing object falling to the South East.,4/16/05,
885,4/7/05 01:30,Waukee/Clive,IA,USA,Circle,1 hour,Strange Light Circles Waukee/Clive Iowa,9/2/05,
886,3/28/05 21:15,Cedar Rapids,IA,USA,Disk,1.5 minutes,Half-circle mooon shaped object with 5 brownish-oragneish colored lights on the bottom.,5/11/05,
887,3/27/05 23:05,Cedar Falls,IA,USA,Light,10min,lights cedar falls,4/16/05,
888,3/11/05 21:30,Des Moines,IA,USA,Disk,3 minutes (maybe),"Two objects leading a third, or was the two objects being followed ?",5/11/05,
889,3/7/05 15:35,Mason City,IA,USA,Circle,5MIN,SAW A CIRCLE,5/11/05,
890,3/1/05 17:50,DeWitt,IA,USA,Orb,at lease 30 minutes,"March 1, 2005 outside of Dewitt IA on I30, there were 6 lights grouped into 2 triangular configurations near the eastern horizon",4/16/05,
891,2/16/05 23:00,Brighton,IA,USA,Triangle,one minute,"dark triangle UFO, with three white lights and circle of red lights.",2/22/05,
892,2/10/05 20:20,Coalville,IA,USA,Changing,3 seconds,"Never saw a shape ,just three bright large lights .",2/22/05,
893,2/2/05 13:23,Cedar Falls,IA,USA,Fireball,10MIN 3SEC,FIREBALL TYPE CRAFT SAW FOR 10 MIN 3 SEC,2/8/05,
894,12/23/04 04:20,Malvern,IA,USA,Light,5 seconds,shooting star which stopped and suddenly shot upward,1/11/05,
895,12/4/04 23:30,Sutherland,IA,USA,Light,30 min,A quiet light apeared to observe us as we were coon hunting near the river.,2/24/05,
