,Date / Time,City,State,Country,Shape,Duration,Summary,Posted,Images
530,9/25/12 06:24,Fonda,IA,USA,Unknown,4 minutes,White light object rises from tree line and elevates (4 minutes) and disappears. ((NUFORC Note: Bright planet in the E sky? PD)),10/30/12,
531,9/18/12 07:30,Cedar Rapids,IA,USA,Oval,10 minutes,Shiny oval objects no wings and no sound,9/24/12,
532,9/8/12 22:00,Des Moines,IA,USA,Orb,3 minutes,2 Bright Orbs in the Eastern Sky moving fast and irregular.,9/24/12,
533,8/27/12 04:36,Storm Lake,IA,USA,Formation,12:00 am,Huge formation with many smaller formations. Some brighter than others.,9/24/12,
534,8/26/12 23:00,Bondurant,IA,USA,Light,9:30ish,I was laying in bed. I saw 3 lights in the sky. They seemed to be moving into a shape. One kept cycling around. As I went to take a pic,9/24/12,
535,8/23/12 22:05,Waterloo,IA,USA,Fireball,30 seconds,One Fireball like object with an oscillating halo preceding it appeared at 9;05pm moving from South to North and another following the,9/24/12,
536,8/18/12 20:00,LeClaire,IA,USA,Rectangle,5 minutes,"Flickering red light that lasted for about five minutes, then the craft disappeared.",8/19/12,
537,8/15/12,Council Bluffs,IA,USA,Chevron,2 minutes,"No sound, no trail, fast to appear slow to leave.",1/7/15,
538,8/13/12 21:00,Cedar Falls,IA,USA,Formation,5 minutes,"We were outside in a swing viewing the south sky, 4 lights appeared in a zig zag pattern hovering for 5 minutes or so. The lights of a",8/19/12,
539,8/11/12 20:46,Altoona,IA,USA,Triangle,13 minutes,Triangular shaped hovering craft with multi-colored flashing lights - seen for over 12 minutes.,8/19/12,
540,8/11/12 20:30,Altoona,IA,USA,,30 minutes,Lights spinning in circles and flashing morse code like signals.,8/19/12,
541,8/7/12 22:35,Iowa City,IA,USA,Changing,1 hour,Ufo spotted by IC Eastern airport. Round sphered shaped with 3 three lights view looked triangle. Slowly gliding came at car,8/19/12,
542,8/6/12 22:30,Bloomfield,IA,USA,Fireball,seconds,Large ball of light sighted above rooftops.,8/19/12,
543,8/5/12 05:55,Decorah,IA,USA,Triangle,1-2 minutes,Super large boomerang solid lighted object moving very fast.,8/5/12,
544,8/5/12 05:00,Des Moines,IA,USA,Light,hour or so,"Several moving lights over des moines, IA, blended in sky as if they were stars til they started moving.((NUFORC Note: Planets?? PD))",8/5/12,
545,8/2/12 23:18,Van Horne,IA,USA,Disk,2 minutes,Disk-shaped object seen above treeline,8/5/12,
546,7/29/12 11:00,Winterset,IA,USA,Fireball,5 minutes,Sighting was seen by several witnesess. Appeared to be just dots in the sky bit as I drove closer to themthey appeared to be like balls,8/5/12,
547,7/28/12 23:45,Cummings,IA,USA,Light,30 minutes,4 white lights circling CCW coming together as 1 light separating and repeating pattern. ((NUFORC Note: Advertising lights? PD)),8/5/12,
548,7/27/12 04:07,Des Moines,IA,USA,Fireball,5 seconds,Green and yellow fall in an arc shape across the sky. very bright,8/5/12,
549,7/23/12 23:55,Adel,IA,USA,Flash,1 minute,Pulsating light in the northern sky that flew in a non aircraft way.,8/5/12,
550,7/19/12 00:07,Council Bluffs,IA,USA,Triangle,3 minutes,"Triangle Ufo, with 3 lights on edges and 2 in center over council bluffs. Near the community college.",8/5/12,
551,7/16/12 23:40,Mt. Pleasant,IA,USA,Fireball,3 minutes,Large orange/red fireball appears and travels in sky above and quickly disappears.,8/5/12,
552,7/16/12 04:32,Ottumwa,IA,USA,Light,,I have seen three lights in northeast sky one really bright one bright and one that looks like a star going out you can see it every ni,8/5/12,
553,7/13/12 02:26,Marshalltown,IA,USA,Changing,2 minutes,Unexplained reddish orange light over Marshalltown IA,8/5/12,
554,7/13/12 01:24,Des Moines,IA,USA,Unknown,10 minutes,Floating white light with dim blinking light still in the sky with no sound.,8/5/12,
555,7/10/12 22:00,Bevington,IA,USA,Triangle,1 minute,"Triangular object with yellow lights hovering in air, along the road",8/5/12,
556,6/27/12 23:30,Iowa City,IA,USA,Fireball,~5 min,Hovering fireball north of Iowa City,7/4/12,
557,6/26/12 23:45,Eldridge (towards; going North on Utica Ridge Road),IA,USA,Triangle,5 minutes,"Triangle UFO over farmhouse and trees on Utica Ridge Road, towards Eldridge, Iowa",9/24/12,
558,6/26/12 10:00,West Des Moines,IA,USA,Light,2 minutes,orange glowing object in clear black sky amazing speed,7/4/12,
559,6/24/12 12:45,Bondurant,IA,USA,Cigar,4 minutes,Large cigar shaped object with lights in sequence from left to right then right to left traveling at high speed in a straight line,7/4/12,
560,6/21/12 23:05,Davenport,IA,USA,Fireball,90 seconds,Two witness one amber fireball track south over the Quad Cities,7/4/12,
561,6/19/12 22:45,Bettendorf,IA,USA,Light,45 seconds,"Distant white ""stars"" moving across the sky typically S of the big dipper. ((NUFORC Note: Overflight of satellites, we wonder? PD) )",6/20/12,
562,6/16/12 23:27,Des Moines,IA,USA,Circle,35 seconds,"3 circular orange reddish lights in the shape of a triangle seen in Des Moines, IA near the State Capitol building.",6/20/12,
563,6/15/12 02:00,Evansdale,IA,USA,Triangle,~2 minutes,Triangle shaped object called by military helicopters.,4/29/16,
564,6/8/12 20:55,Perry,IA,USA,Light,2-3 minutes,"Large sphere of light seen going over Perry, Iowa.",6/14/12,
565,6/6/12 06:00,Lemars,IA,USA,Circle,10 seconds,Bright aircraft caught my eye at dawn in the west and flew east. Seemed to be closer than planes usually fly but crossed the horizon at,6/8/12,
566,6/5/12 23:10,Muscatine,IA,USA,Light,3 to 4 minutes,"Wandering white light flying north, while three red/white constant lights remained stationary",6/8/12,
567,6/3/12 03:00,Cedar Rapids,IA,USA,Orb,5-6 minutes,Dancing BRIGHT BRIGHT white orbs in the night sky.,6/5/12,
568,6/2/12 23:00,Hazelton,IA,USA,Light,15-20 seconds,2 Bright Lights Traveling at the Same Speed and Flight Pattern,6/5/12,
569,6/2/12 21:00,Cedar Rapids,IA,USA,Circle,4-5 minutes,"Strange Lights Across Cedar Rapids, Iowa Sky on June 2, 2012 @ around 9:15 pm CST",6/5/12,
570,5/26/12 00:00,Mason City,IA,USA,Other,2 to 4 min.,acorn shaped with flames and a ring of white lights on bottom,6/5/12,
571,5/25/12 01:00,Corning,IA,USA,Cigar,15 seconds,"I was outside having a beer, and no I was not drunk. I was looking at the stars and saw three what I would describe as pen shaped objec",5/29/12,
572,5/24/12 04:00,Burlington,IA,USA,Light,About a Min.,Two lights seen flying overhead.,5/29/12,
573,5/23/12 03:00,Des Moines,IA,USA,Fireball,60 seconds,While driving east on 80/35 near the Merle hay exit A large cherry red to orange fireball. It moved as though it may land in front of m,5/29/12,
574,5/13/12 21:50,Des Moines,IA,USA,Orb,1min,Came out on my deck and before me in the sky were approximately 8-10 orange orbs moving in a SW to NE arc. This grouping was followed b,5/29/12,
575,5/13/12 21:45,Waukee,IA,USA,Unknown,unknown. It is still out,"star-like object, high in the night sky, blinking rapidly between red, white, green and possibly blue. ((NUFORC Note: Vega?? PD))",5/29/12,
576,5/8/12 22:30,Clear Lake,IA,USA,Cone,10 minutes,BLUE/GREEN/WHITE Flashing Lights - cone shaped in the Northwestern Sky in Northern Iowa.,5/13/12,
577,5/6/12 15:30,Vinton,IA,USA,Triangle,1-2 minutes,Transparent triangular shaped object,6/14/12,
578,5/4/12 22:35,Cedar Falls,IA,USA,Sphere,30-45 sec.,"2 yellow red glowing spheres moved against the wind in irregular motion and changing speeds, one dissappeared and the other flew away,",5/13/12,
579,4/26/12 07:35,Pella,IA,USA,Disk,12 seconds,Ultra-sonic disk,5/13/12,
580,4/24/12 21:45,Cedar Rapids,IA,USA,Light,7 minutes,"My girlfriend and I just happened to be outside at approximately 9:45pm. We witnessed a bright white light move slowly from the NW sky,",5/13/12,
581,4/20/12 20:45,Mason City,IA,USA,Light,2 min,Observed two steady red lights for about one minute that moved slowly and faded out,5/13/12,
582,4/11/12 21:40,Reinbeck,IA,USA,Light,1 min,Bright lighjt manuevers over Iowa sky.,5/13/12,
583,4/11/12 20:00,Ames,IA,USA,Fireball,30 seconds,A single fireball or ball of light with a slight tail or trail passed in an arc toward the ground.,5/13/12,
584,4/9/12 21:45,Dysart,IA,USA,Light,1 to 2 min.,"Lights in the sky over Dysart, Iowa.",4/18/12,
585,4/9/12 21:45,Dysart,IA,USA,Light,1 to 2 minutes,Bright lights in the sky over dysart ia.,4/18/12,
586,4/2/12 21:30,Ames,IA,USA,Light,4 mins,One white with blue light then two more same flight plan over Ames IA.,4/18/12,
587,3/30/12 21:15,Story City,IA,USA,Formation,<10 minutes,"Group of 4 red/orange lights, becoming 3 lights then disappearing into darkness of space",5/13/12,
588,3/25/12 00:00,Davenport,IA,USA,Changing,4 hours,Me and my friends just left a restraunt and we were at a stop light about 7:30 pm on march 24th 2012 and every single light shut off fo,4/18/12,
589,3/24/12 08:45,Waterloo,IA,USA,Circle,30-40 seconds,Red ball of fire descending out of the sky and landing,5/13/12,
590,3/18/12 21:30,Iowa City,IA,USA,Fireball,4-5 seconds,"3/18/12 9:30 pm, very fast moving orange small ball, zipped from south to north - driving west on I80 just before Iowa City",7/4/12,
591,3/5/12 11:30,Davenport,IA,USA,Oval,5 minutes,"Oval, hanging vertically above busy intersection in Davenport, IA at mid day.",3/13/12,
592,3/1/12 20:00,Pleasanton,IA,USA,Other,5-10 minutes,Three of us in our home heard a deep humming sound; two of us went outside to investigate and saw red/orange strobe lights.,3/13/12,
593,2/19/12 19:30,Clinton,IA,USA,Circle,5 mins,"Two strange orange lights in the sky, unattached from each other, no sound",3/13/12,
594,2/12/12 21:40,Ankeny,IA,USA,Triangle,30 seconds,"Flying triangle really low to ground not making any noise, not an airplane or a helicopter",3/13/12,
595,1/10/12 22:30,Ames (north of),IA,USA,Flash,3 seconds,"Bright blue/white flash north/northwest of Huxley, IA",1/12/12,
596,1/6/12 20:45,Gilmore City,IA,USA,Disk,8:00=8:45,Red/blue flashing disc in se sky. about 65 degrees just sitting there. ((NUFORC Note: Possible sighting of Sirius?? PD)),1/12/12,
597,1/3/12 21:00,Council Bluffs,IA,USA,Orb,2 hours,Lights moving in a circular motion,1/12/12,
598,12/29/11 20:00,Cedar Falls,IA,USA,Light,10-15 minutes,Bright golden light seen twice on the same road to home.,1/12/12,
599,12/25/11 21:00,Cedar Rapids,IA,USA,Fireball,40-50 seconds,"I saw a large fireball pass over my house at about 1000 feet --no noise, traveling about 15mph.",1/24/12,
600,12/19/11 01:30,Pella,IA,USA,,2-4 sec,"While in hot tub,looking east saw object,bar or cigar shaped, traveling north to south it veered off to south east speed like falling",1/12/12,
601,12/17/11 18:00,,IA,USA,Other,2 min,Strange ball of light moving slowly across central Iowa.,1/12/12,
602,12/14/11 12:30,Spencer,IA,USA,Sphere,30seconds,Green light ufo,6/20/12,
603,11/14/11 18:05,Lafayette,IA,USA,Light,15 seconds approx.,Stationary High-Magnitude Light Dimming Out,12/12/11,
604,11/5/11 19:00,Muscatine,IA,USA,Light,>15 minutes,Bright orange lights moving slow across the sky.,12/12/11,
605,10/29/11 21:30,Mingo,IA,USA,Circle,2 min,Saw a UFO landing on 10/29/2011,12/12/11,
606,10/20/11 21:15,Muscatine,IA,USA,Light,3 min.,five bright yellow lights leading huge craft,10/25/11,
607,10/15/11 20:05,Muscatine,IA,USA,Triangle,a few minutes,Three bright lights in the sky in the shape of a triangle,10/19/11,
608,10/11/11 19:40,Des Moines,IA,USA,Light,90 seconds,"An unexplained, unidentified flying object.",12/12/11,
609,9/30/11 11:36,Ames,IA,USA,Orb,"Continued after viewing,","White bright orb, (circular) craft in eastern sky, slow moving, at times still. Much brighter than any star, or planet, silent.",10/10/11,
610,9/10/11 23:20,Sioux City,IA,USA,Light,2-3 minutes,Bright orange lights taking an unusual flight pattern and then disappearing in the same area in the sky.,10/10/11,
611,9/4/11 23:25,West Des Moines,IA,USA,Formation,Unknown,Ten lights in a strange formation moving east over I235,10/10/11,
612,9/4/11 21:32,Waterloo,IA,USA,Orb,50s,4 large orange orbs moving across sky,10/10/11,
613,9/4/11 20:45,Tama,IA,USA,Fireball,1 minute,A fiery Red Orb like ball floated through the sky.,10/10/11,
614,9/2/11 20:45,Des Moines,IA,USA,Unknown,1 minute,"Sometime after 8:30, I went home with my mother and after parking in the driveway, I looked up (facing north) as always. Everything se",10/10/11,
615,8/28/11 20:30,Waukee,IA,USA,Other,3 minutes,Bright organge light- goes off and looks atom-shaped.,10/10/11,
616,8/25/11 00:31,Des Moines,IA,USA,Egg,7 sec,Siting looking at the stars was moving fast and steady rusty dark look no lights but had a glow and was heading west it came out of sig,10/10/11,
617,8/23/11 21:25,West Des Moines,IA,USA,Triangle,15 sec,"One multi-lighted triangle-shaped UFO sighted over West Des Moines, Iowa at 9:25 PM on 08/23/2011 by two people driving home.",10/10/11,
618,8/17/11 23:20,Waterloo,IA,USA,Circle,30s,"5 witnesses observed a very bright light, then the object travel outward, then changed direction for a period of 10 seconds .. then sto",8/21/11,
619,8/3/11 00:14,Ankeny,IA,USA,Formation,20 minutes,Triangle UFOs in formation around the New Highschool,8/7/11,
620,7/30/11 21:10,Dubuque,IA,USA,Light,about 10 mins?,"Single bright, moving winking light and ((NUFORC Note: Possible tumbling rocket/booster?? PD))",8/7/11,
621,7/23/11 22:10,Clive,IA,USA,Oval,1:00,Orange glowing ball moving slow powerd by jet like flame,8/7/11,
622,7/23/11 15:30,Council Bluffs,IA,USA,Triangle,2min,Object over council bluffs ia,8/7/11,
623,7/21/11 11:00,Fairfield,IA,USA,Light,01:00,"I am a night sky watcher and I have seen a lot of military maneuvers and a few strange things in this area, but what I saw this evening",4/18/14,
624,7/14/11 02:00,Ankeny,IA,USA,Triangle,3 minutes,"TRIANGLE FORMATION LIGHTS OVER CHURCH ANKENY, IOWA",3/18/14,
625,7/10/11 10:06,Bettendorf,IA,USA,Fireball,4 minutes,"Saw 8 fireballs floating over Bettendorf high school in a group. After a couple minutes they dispersed. The appeared to fly or ""drive""",7/17/11,
626,7/4/11 20:30,West Des Moines,IA,USA,Circle,3 minutes,2 red/orange spheres moving slowly appeared in des moines iowa.,7/17/11,
627,7/3/11 23:40,Waterloo,IA,USA,Light,1 minute,"Red light in the sky over Waterloo, IA",7/4/11,
628,6/28/11 20:00,Ames,IA,USA,Light,10 Minutes,"While taking my dogs out, I noticed a very bright light in the NW area of the sky, it was moving very slowly and at first I thought it",7/4/11,
629,6/12/11 22:30,Waukee,IA,USA,Circle,10 minutes,Circular ball of light moved very slowly through the sky in a straight line with no flashing lights on it.,6/20/11,
630,6/6/11 22:00,Dubuque,IA,USA,Light,2 minutes,Bright BRIGHT BIG white light w/ 2 smaller lights blinking red and orange,6/12/11,
631,5/29/11 22:00,Davenport,IA,USA,Triangle,2.5 hours,Triangle observed hovering over davenport near regional airport,6/3/11,
632,5/20/11 23:00,Sherrill,IA,USA,Triangle,6 minutes,Couldn't take one this craft shut power off to our and neighbors house all electrical devices also we malfunction i have a fuzzy video,10/14/13,
633,5/17/11 01:30,Sioux City,IA,USA,Triangle,15 seconds (approx.),Was outside late at night in a slightly drizziling rain when i caught sight of a triangulare object in the sky.,5/29/11,
634,5/16/11 22:15,Davenport,IA,USA,Circle,1 min,"Silent moving, dark, circular object with reflective bottom moving over houses in Davenport, IA.",5/29/11,
635,5/5/11 07:00,Mount Vernon,IA,USA,Unknown,unknown,I have a picture.,5/12/11,
636,5/3/11 21:30,Davenport,IA,USA,Egg,10min,"Bright Light over Davenport, Iowa.",5/12/11,
637,3/30/11 00:00,Floyd,IA,USA,Disk,30 min,Unusual movement of unusually lit craft over Iowa farm field.,4/3/11,
638,3/21/11 00:55,Des Moines,IA,USA,Light,5 seconds,lights (round shaped) in a v-shaped formation (5-7 in the v formation and one on the left side and another on the right side in front o,3/23/11,
639,3/15/11 13:10,Ruthven,IA,USA,Circle,3 minuets,round shaped object with wing at top,3/23/11,
640,3/14/11 21:00,Des Moines,IA,USA,Other,30 secs,A v shaped formation maybe 20 illuminated dots seen for about 30 seconds and then dissapeared,3/23/11,
641,1/6/11 19:00,Iowa City,IA,USA,Triangle,10 seconds,Triangular aircraft with white and red lights.,1/31/11,
642,1/4/11 17:15,Woodward,IA,USA,Fireball,5 min,"Orange/gold lights that seemed to ""leap frog"" across the north western Iowa sky.",1/31/11,
643,11/22/10 19:40,West Des Moines,IA,USA,Light,a few minutes,2 Bright Lights in Des Moines Iowa,1/5/11,
644,11/10/10 09:00,Belle Plaine,IA,USA,Cigar,1 minute,"I was in a field,looked up to the sky and noticed what looked like two all white subway cars hooked together. The object was heading No",1/16/15,
645,11/4/10 07:00,Sioux City,IA,USA,Light,30-45 seconds,3 white lights turn to 1 and wobble in the sky,11/21/10,
646,10/30/10 02:00,Cedar Falls,IA,USA,Light,about 5 minutes,Diagonal line of bending light seen above university from the moon on Hallow's Eve.,1/12/12,
647,10/15/10 22:30,Waterloo,IA,USA,Orb,8-10min,Bright orange orb quickly passing close by without sound.,11/21/10,
648,10/12/10 22:30,Waterloo,IA,USA,Orb,2-3 minutes,Orange orb came close.,12/23/13,
649,10/5/10 19:00,De Soto,IA,USA,Light,1 hour,5 amazingly bright light objects in bright redish/orange October sunset. in IOWA.,11/21/10,
650,10/3/10 23:00,Dubuque,IA,USA,Unknown,1 hr,ok i didnt see it but i heard about it and was hoping you could find out more a friend told me that lastnight her friend seen a craft a,11/21/10,
651,10/3/10 21:00,Dubuque,IA,USA,Other,2 hours,northeast sky colors flickering,11/21/10,
652,10/2/10 02:12,Des Moines,IA,USA,Diamond,25 minutes,Single light multiplied then came together as a diamond then became one and disappeared.,11/21/10,
653,9/30/10 13:05,Cedar Rapids,IA,USA,Triangle,about half a second,Flying object in the background of our video in video class flies 100 yards in less than 1/2 a second,11/21/10,
654,9/29/10 23:00,Sioux City,IA,USA,Other,8 seconds,9-12 white lights glide from north to south across morningside sky,11/21/10,
655,9/26/10 19:00,Audubon,IA,USA,Oval,3 hours,"Three different bright lights that did not move, yet when seen with binoculars had red blinking lights. ((NUFORC Note: Stars?? PD))",11/21/10,
656,9/25/10 03:00,Cedar Rapids,IA,USA,Circle,2-3 minutes,UFO over Cedar Rapids,11/21/10,
657,9/7/10 02:30,Mt. Pleasant,IA,USA,Triangle,120,Triangular craft moving very fast in odd directions.,11/21/10,
658,8/28/10 11:45,Des Moines,IA,USA,Light,Aprox. 10 minutes,"Solid and silent red light flying over Des Moines, Iowa.",11/21/10,
659,8/27/10 21:30,Hiawatha,IA,USA,Circle,,we saw a circle aircraft moving west at 20 mph fly only 200 yards off the ground.,8/30/10,
660,8/10/10 00:00,Washington (west of),IA,USA,Diamond,30-45 mins didnt get to w,"Hovering lights in western sky, Washington, Iowa",8/24/10,
661,8/8/10 21:00,Dubuque,IA,USA,Light,felt like 10 mins but tim,"Two Orange Spheres moments apart, followed by smaller moving star like object, which became two lights moving together from another dir",8/24/10,
662,7/31/10 22:00,Waukon (15 miles SE of),IA,USA,Unknown,5 mins,Triangular/V-shape UFO spotted over North East Iowa.,8/24/10,
663,7/19/10 22:20,Merrill,IA,USA,Diamond,2 minitues,Red/Bluish colored lights over Merrill Rural Areas.,7/28/10,
664,7/17/10 23:00,Boone,IA,USA,Disk,30 min,Flying obects in ia sky,7/19/10,
665,7/16/10 22:12,Carter Lake,IA,USA,Sphere,5 minutes,"One brilliantly illuminating ball of light that float over our heads and shorty afterwards, vanished before our eyes.",8/24/10,
666,7/7/10 22:10,Davenport,IA,USA,Changing,10 seconds,A green heat light traveling east to west.,7/10/10,
667,7/4/10 22:15,Polk City,IA,USA,Disk,10 Minutes,Unusual light in sky 7/4/10 from Saylorville campground.,7/19/10,
668,7/4/10 21:55,Polk City,IA,USA,Other,5 mins total,"I was walking my dog before the 10:00 news, looked up at the sky and saw an orange glowing object.",7/10/10,
669,7/3/10 22:00,Bonaparte,IA,USA,Fireball,5 to 15 min.,On july 3 2010 around 22:00 just before the fireworks show a orange and red orb just appeared over the des moines river and floated sou,7/10/10,
670,7/2/10 18:00,Audubon,IA,USA,Oval,4 Hours,"White bright light changing into an orange red light that flew back and forth, and then was gone.",7/6/10,
671,6/30/10 23:45,Sioux City,IA,USA,Light,15 seconds,Strange disappearing/re-appearing object over Sioux city,7/6/10,
672,6/24/10 22:15,Waukee,IA,USA,Light,120seconds,"Bright Zig-Zagging Light over Des Moines, 6/24/10",7/6/10,
673,6/17/10 20:00,Perry,IA,USA,Cylinder,15 - 20 min,36 bright objects flying across the sky in a short amount of time,6/23/10,
674,6/11/10 22:15,Bettendorf,IA,USA,Triangle,1:30,"three points of white light (triangle shape), no sound and very low directly above my house moving at maybe 70-80 knots",6/23/10,
675,5/31/10 15:00,Campo,IA,USA,Disk,unknown,Campo Colorado tornado photo,7/6/10,
676,5/29/10 22:44,Iowa City,IA,USA,Changing,:30,Iowa city group of lights,6/3/10,
677,5/29/10 22:30,Fonda,IA,USA,Sphere,Every Night,The object changes colors and moves. ((NUFORC Note: Probably a celestial body. PD)),6/3/10,
678,5/13/10 22:30,Burlington,IA,USA,Light,2:00,An object flew over my house it looked like a regular star but it was moving very fast no flashing lights,6/3/10,
679,5/12/10 21:00,Keokuk,IA,USA,Light,10 sec,We were just sitting there at my brothers right after dark. When we saw what look like a light larger then any star in the sky. It appe,5/12/11,
680,5/7/10 22:20,Woodward,IA,USA,Triangle,25 mins,Triangle shaped object hovering for extended period of time and then finally vanished.,5/12/10,
681,4/14/10 22:15,Hiawatha,IA,USA,Fireball,10 seconds,Bright turqouise fireball rapidly descending at 15-20 degrees erupts into bright light and dissapears.,5/12/10,
682,4/14/10 22:12,Iowa (unspecified location),IA,USA,Unknown,30 seconds,Bright green light faded then turned to orange before disappearing. ((NUFORC Note: Location of witness not specified. PD)),5/12/10,
683,4/14/10 22:05,Lamoni,IA,USA,Fireball,10 seconds,"Large green/red fireball over Lamoni, IA viewed from Graceland University. ((NUFORC Note: Probably a bright meteor. PD))",5/12/10,
684,4/14/10 22:03,Coralville,IA,USA,Fireball,30 secs,large greenish ball with trailing sparks moving level to ground altitude approx 500 feet.,5/12/10,
685,4/14/10 22:00,Cedar Rapids,IA,USA,Circle,,"Seen circle hovering and flashing red, blue, and green in southwestern sky. ((NUFORC Note: Probable sighting of a star. PD))",5/12/10,
686,3/18/10 20:50,Fort Madison,IA,USA,Flash,5 seconds,UFO Crashland in Fort Madison Iowa high school football field,4/13/10,
687,3/3/10 07:10,Fairfield,IA,USA,Fireball,,"Crash down of a red green firebal at 7:10 pm Wed. March 3rd north of Fairfield, Iowa being observed by 4 jets.",4/13/10,
688,2/28/10 06:00,Batavia,IA,USA,Sphere,15 minutes,A UFO was seen to the north of our house.,4/13/10,
689,2/13/10 03:05,Davenport,IA,USA,Light,Two at 10 sec. each,"Bright concentrated lights in two bursts, electrical disturbances, magnetic signs.",4/13/10,
690,1/21/10 05:30,Saint Charles,IA,USA,Other,15 minutes,Witness soundless flickering lights moving NE in the clouds above.,2/14/10,
691,1/20/10 07:45,Walnut,IA,USA,Flash,1 minute,"HUGE Flash of Pale Blue Light & Loud Cracking Sound in Walnut, IA.",2/14/10,
692,1/4/10 19:10,Cedar Rapids,IA,USA,Light,15 min,Two very bright white lights come close together in the northwest sky and one dissapears...,2/14/10,
693,11/26/09 18:00,Shenandoah,IA,USA,Light,2 minutes,"Two lights separated quite a distance apart, traveling in unison in a straight line from N.W. to S.E.",12/12/09,
694,11/12/09 21:00,Sioux City,IA,USA,Flash,1,Lights in the sky south of downtown sioux city,12/12/09,
695,11/1/09 16:15,Ottumwa,IA,USA,Sphere,30 mins,round reflective object,12/12/09,
696,10/20/09 23:00,Ottumwa,IA,USA,Light,5 mins,flashing light,12/12/09,
697,10/8/09 23:00,Cedar Rapids,IA,USA,Fireball,4 seconds,Fireball or (meteor?) Might be something stranger. ((anonymous report)),12/1/19,
698,10/4/09 20:45,Eldridge,IA,USA,Light,5 Minutes,Bright orange object seen flying E/SE out of atmosphere.,12/12/09,
699,9/25/09 21:15,Spencer,IA,USA,Changing,60 mins,"Unexplained pattern of mult-colored lights that moved, diappeared, reappeared and has 7 Iowans believing that there are definately UFOs",12/12/09,
700,9/20/09 02:00,Osceola to Kansas City,IA,USA,Light,until sunrise,Bright fflashing ufo.,12/12/09,
701,9/9/09 20:45,Ames,IA,USA,Light,4-5 min.,"Lights moving at same speed as aircraft, but no running lights. ((NUFORC Note: ISS and Space Shuttle in formation? PD))",12/12/09,
702,9/8/09 20:00,Muscatine,IA,USA,Light,3 min,i was looking southwest i saw 1 bright light and 1 dim light seem that they were teathered together moving very fast across the sky fro,12/12/09,
703,9/6/09 02:00,Newton,IA,USA,Oval,3 minutes,"3 bright orange oval shaped craft moving slowley over interstate 80 in Newton, Iowa",12/12/09,
704,9/5/09 21:00,Riverside,IA,USA,Teardrop,2 minutes times 2,Two Slow Flying Fireballs Within Seven Minutes,12/12/09,
705,9/2/09 21:41,Keokuk,IA,USA,Light,3-4 seconds,A extremly bright ball of light shot across the night sky a couple of thousand feet in the air then diappeared.,12/12/09,
706,9/2/09 01:00,Cedar Rapids,IA,USA,Flash,45 min,"flashing blue and red lights, didnt move for an hour then vanishd",12/12/09,
707,8/28/09 21:15,Ventura,IA,USA,Unknown,1 minute,"Craft with flashing white, red and blue lights hovering low over town making no noise.",12/12/09,
708,8/23/09 03:17,Fairfield,IA,USA,Oval,3 minutes,5 lights in shape of oval traveled from southwest to northeast sky which looked to outline one object at 3:16 AM.,8/27/09,
709,8/15/09 10:00,Eldora,IA,USA,Rectangle,6 sec,"Large, horizontal, whitish rectangle seen during the day.",2/23/11,
