,Date / Time,City,State,Country,Shape,Duration,Summary,Posted,Images
4303,9/24/03 02:40,New York City (Brooklyn),NY,USA,Sphere,less than 2 seconds,9/24/03 BklynN.Y. sphere less than 2 seconds. object moved at speed of meteor. stopped and made a left turn an dissappeared,10/7/03,
4304,9/24/03 02:30,New York City (Brooklyn),NY,USA,Sphere,less then 2 seconds,9/24/03 Bklyn N.Y. sphere less then 2 sec. Object moved at speed of meteor. Stopped and made left turn. then dissappeared.,9/28/03,
4305,9/22/03 03:00,Lake George,NY,USA,Flash,5 minutes,Bright lights that changed color seen on ground with corresponding area power surge.,9/24/03,
4306,9/17/03 21:45,Saratoga Springs,NY,USA,Unknown,5 minutes,"small 3 light triangle with 2 blinking on sides seen hovering, then moving about 100-200 feet up over road",9/24/03,
4307,9/16/03 22:00,Parishville,NY,USA,Unknown,30 minutes,Fighters trying to shoot down UFO over Ft. Drum NY?,9/17/03,
4308,9/14/03 22:30,New York City (Bronx),NY,USA,Light,1 minute,Two orange lights in the dark Bronx sky,10/27/04,
4309,9/12/03 23:50,Troy,NY,USA,Triangle,2 minutes,Triangle object stationary then moves fast and turns around......,9/17/03,
4310,9/12/03 20:40,Fort Plain,NY,USA,Triangle,2 minutes,"Unknown object viewed through 8"" telescope containing 3 bright lights arranged in triangular shape",9/17/03,
4311,9/11/03 21:00,Tupper Lake,NY,USA,Light,20- 30 mins,1 strange light in the Sky then 3 big orange lights. Both were gone Within 30 minutes,10/31/03,
4312,9/10/03 22:30,Patchogue,NY,USA,Light,one minute,10:30pm i was taking my garbage to the dumpster outside when i looked at the stars. They were bright and beautiful. Then i saw a bright,9/12/03,
4313,9/10/03 20:00,Glenfield,NY,USA,Circle,seconds,"A bright light almost a peach color, faded completely then reappeared again after several minutes",9/12/03,
4314,9/10/03 16:20,New York City (Manhattan),NY,USA,Disk,15 minutes,Disk shaped object over lower Manhattan,11/8/03,
4315,9/9/03 21:00,Norfolk,NY,USA,Light,10 MINUTES,three crafts viewed appearing and reappearing at a rapid pace,9/12/03,
4316,9/8/03 22:35,New York City (Brooklyn),NY,USA,Disk,1 min approx,I saw a very large disk shaped object in the sky over N.Y.C.,9/9/03,
4317,9/8/03 22:00,New York City (Brooklyn),NY,USA,Disk,current,"I just wanted to comment on your response to my report of a sighting on 9/8/03 around 22:00, and the event was current. It was in Broo",9/24/03,
4318,9/8/03 20:00,New York City (Brooklyn),NY,USA,Changing,current,"It is now 22:30 hours, and the object is still there. In the west end of Brooklyn, possible near JFK Airport. Planes were all over the",9/9/03,
4319,9/6/03 23:30,New York City,NY,USA,Cigar,1 hour,Lights over New York City,9/9/03,
4320,9/6/03 00:50,New York City,NY,USA,Other,3 seconds,A single green light going very fast and disapearing,9/9/03,
4321,8/31/03 22:35,Dansville,NY,USA,Fireball,2 MINUTES,"We saw a large fireball in the sky below a ceiling of clouds. We watched it move at a steady speed in a straight path across the sky,",12/19/03,
4322,8/31/03 20:11,West Sayville,NY,USA,Light,5 seconds,bright star-like object ascending out into space.,9/4/03,
4323,8/31/03 05:20,Centereach,NY,USA,Other,,"Silent,red and green arc shaped object going over trees from left to right,twice.Small round light in center",9/12/03,
4324,8/30/03 00:15,Merrick,NY,USA,Other,45 minutes,"4 elliptical lit objects surrounded by a haze/halo, proceeding to individually dive, climb, zigzag. Lasted about 45 minutes.",9/4/03,
4325,8/28/03 23:00,New York City (Brooklyn),NY,USA,Teardrop,1-2 minutes,teardrop shaped craft with 3 steady lights underneath,9/4/03,
4326,8/24/03 10:15,Oswego,NY,USA,Circle,aprox 45 secs.,On Sunday August 24th at aprox. 10:15 AM eastern time mysely and 2 others observed a sequence of 9 bright white / silver circle shapes,8/28/03,
4327,8/24/03 01:00,New York City (Staten Island),NY,USA,Flash,10-12 minutes,"bronze sphere, flashed silver, looked like a black horizontal line when flash turned off. moved in straight line across sky.",8/28/03,
4328,8/22/03 23:30,Ballston Lake,NY,USA,Triangle,2 minutes,VERY close up look at a boomerang/trianglor shaped craft with lights on the bottom,9/28/03,
4329,8/20/03 22:00,Manlius,NY,USA,Circle,5 sec,Round glowing object observed in Manlius N.Y.,8/28/03,
4330,8/19/03 02:00,New York City,NY,USA,Circle,30 seconds,Blue disc with fire trails moving toward the earth and vanishing.,8/28/03,
4331,8/14/03 21:00,Binghamton,NY,USA,Light,15 seconds,"""STAR"" makes a u-turn",8/28/03,
4332,8/14/03 21:00,New York City,NY,USA,Sphere,4 hours,Manhattan skyline UFO on night of the blackout ((NUFORC Note: Sighting of Mars?? PD)),8/28/03,
4333,8/14/03 18:30,Roosevelt,NY,USA,Formation,3-5 min.,"UFO sighting on Long Island, the night of the blackout.",9/4/03,
4334,8/13/03 23:59,Chemung,NY,USA,Light,5 seconds,lights seen night before blackout,8/28/03,
4335,8/9/03 03:30,Rochester,NY,USA,Unknown,1 minute,extraterrestrial walking around city,7/25/19,
4336,8/7/03 21:20,Endicott,NY,USA,Unknown,30 Seconds,There were two (2) Hot Air Balloons and one (1) Unknown Object.,8/28/03,
4337,8/4/03 22:00,Bloomfield,NY,USA,Other,a few hours,a trained mind can tell a ufo from other things in the sky,8/28/03,
4338,7/29/03 23:30,New York City (Brooklyn),NY,USA,Changing,2 hours,My wife looked out the window at around 11:30 PM. and saw a light in the distance to the west over Manhattan. At first we thought it w,8/1/03,
4339,7/28/03 18:00,Pinebush,NY,USA,Disk,30 min,"saucer shape ufo's taken with new digital camera, showing 4 ufo's getting out of way of plane",11/26/03,
4340,7/25/03 23:00,Schenectady,NY,USA,Formation,3-4 seconds,"Line of equally spaced ornage lights moving at an incredible speed, over Schenectady, New York",8/1/03,
4341,7/25/03 21:00,Port Washington,NY,USA,Diamond,35 minutes,"Object hovered for 35 minutes, glowed whitish yellow, changed shape., appeared to be approximately 5 to 10 miles away - 1,000 feet high",11/26/03,
4342,7/24/03 22:00,Wellsville,NY,USA,Triangle,2 minutes,Unknown slow mvoing silent triangular object spotted in non-military area.,6/12/08,
4343,7/19/03 22:00,Bellerose,NY,USA,Light,2-5 min,2 ufos 1 nite,7/23/03,
4344,7/19/03 21:30,New York City (Queens),NY,USA,Light,5-15 min,2 bright lights moving across Queens's sky,7/23/03,
4345,7/18/03 21:00,Brightwaters,NY,USA,Disk,2 secs,Disk with lights around the outside,7/23/03,
4346,7/17/03 21:19,New York City,NY,USA,Formation,2 1/2 minutes,Formation of moving lights over Manhattan,7/23/03,
4347,7/15/03 23:30,Pound Ridge,NY,USA,Disk,3 minutes,"One flying saucer flying in a zigzag motion, then a light in the sky resembling a slow-moving star which then sped up and vanished.",7/23/03,
4348,7/13/03 19:30,New York City (Staten Island),NY,USA,Sphere,1 hour,7 dots in the sky moving in unfamiliar fashion,7/16/03,
4349,7/13/03 18:15,New York City (Brooklyn),NY,USA,Sphere,15 Minutes,Watch Spherical object for 15 Minutes over Brooklyn,7/23/03,
4350,7/13/03 18:00,Buffalo,NY,USA,Light,5.00,i was sitting in front of my house smoking a cigertte and when i looked up over a larg empty feild right across from me i saw somthing,12/19/03,
4351,7/13/03 18:00,Belle Harbor,NY,USA,Changing,5 minutes,The thing I found most odd was the object appeared to remain motionless.,7/16/03,
4352,7/11/03 22:00,Bay Shore,NY,USA,Light,5-10 minutes,Strange red lights over Bay Shore,7/16/03,
4353,7/11/03 01:00,New York City (Bronx),NY,USA,Light,2.5 hours,Craft was near the moon and appeared to have landed on it.,7/23/03,
4354,7/9/03 20:30,Endicott,NY,USA,Triangle,2 minutes,Craft re-enters the atmosphere,7/16/03,
4355,7/6/03 23:11,Rochester,NY,USA,Circle,5 minutes,"Very bright, star like object moving across the sky--backing up and making very sharp turns and circles.",7/16/03,
4356,7/5/03 00:34,Ithaca,NY,USA,Light,10 minutes,"Light seen in night sky at a camp fire in itaca, ny",3/9/04,
4357,7/3/03 20:40,Manlius,NY,USA,Oval,30 seconds,"One large oval object observed traveling east to west at a fairly high rate of speed, metallic silver/gold color. appeared to reflect t",7/16/03,
4358,7/3/03 20:40,Manlius,NY,USA,Cylinder,10 seconds,7-3-03 A Soundless Vaporless Silver Cylinder Object Flyies East To West In The Suburbs Of Syracuse New York.,7/16/03,
4359,6/30/03 17:00,Syracuse,NY,USA,Fireball,30 minutes,((HOAX??)) basicly thats what happened but i recorded them on VIDEO,8/7/07,
4360,6/28/03 23:30,New York City (Queens),NY,USA,Disk,15 min,6/28/03 23:30 4 witnesses. This sighting happened at the Howard Beach Subway Station at JFK Airport. JFK is located in the southeastern,7/16/03,
4361,6/28/03 23:30,New York City (Manhattan),NY,USA,Disk,8-10min?,Light blue diskshape with a blinking red light on bottom above east river.,7/23/03,
4362,6/28/03 23:12,New York City (Brooklyn),NY,USA,Disk,6 minutes,A friend and I saw a round domed object metallic in appearance and rather large with lights located around the bottom edges and top.,7/16/03,
4363,6/19/03 22:06,Camden,NY,USA,Light,2 minutes,I was sitting on the couch looking out the screen door and i happened to see what looked like airplane lights but closer right over the,7/16/03,
4364,6/6/03 21:00,Jamesport,NY,USA,Light,3 minutes,the object was a very bright oval light with no sound,6/10/03,
4365,6/5/03 13:55,New York City (Brooklyn),NY,USA,Cigar,10 minutes,Was traveling on kent ave in brooklyn in my work truck when i saw something in the sky.I snapped a pic of it and i would like to send i,6/10/03,
4366,6/1/03 22:30,Bayside,NY,USA,Oval,20 minutes,Glowing object hovering over Shea Stadium,6/3/03,
4367,6/1/03 22:00,Fort Edward,NY,USA,Disk,2-3 minutes,Large black disk with flashing lights all around flying slowly above tree level,9/19/19,
4368,5/29/03 08:36,New York City (Manhattan),NY,USA,Sphere,2 minutes,Silverly helium balloon-like object,6/18/03,
4369,5/20/03 04:43,New York City,NY,USA,Triangle,20 Seconds,Triangular Bright White Object Over NYC Moving West to East 4:42 am.,5/27/03,
4370,4/25/03 20:10,East Meadow,NY,USA,Disk,10 seconds,Saw 1 greyish disk shaped object for about 10 seconds than it dissapered,4/27/03,
4371,4/24/03 22:01,Hammond,NY,USA,Unknown,20 Minutes,"UFO that appeared out of the corner of my eye, hovering up and down while going vertically southeast.",5/2/03,
4372,4/16/03 21:00,Plattsburgh,NY,USA,Circle,1 min,It6 moved at a high rate of speed from northwest to southeast leaving no trail and showing no indication of being a manmade aircraft.,4/22/03,
4373,4/16/03 11:00,New York City (Brooklyn),NY,USA,Disk,15 secs.,Invading Laguardia's Air Space.,3/19/09,
4374,4/13/03 22:00,New York City,NY,USA,Light,2 minutes,brownish lights forming triangle shape,4/22/03,
4375,4/10/03 12:10,Yaphank,NY,USA,Other,10 seconds,White Blob Hovering over Minumum Security Facility,4/22/03,
4376,3/24/03 16:00,Mt. Morris,NY,USA,Oval,16:20,"it was an oval shaped ship in the sky, with red lights all around it. there was a oval dome on the top of it. it stayed in the sky for",4/22/03,
4377,3/23/03 11:59,Windsor,NY,USA,Changing,aprox 7 minutes,Kept changing shape. Started as 2 after circuling a military jet. I have pictures of the jet as well as the 2 round then cigar shaped t,4/22/03,
4378,3/19/03 21:00,New York City (Bronx),NY,USA,Other,20 min,"Hi , I am (name deleted) and i am so happy that I finaly found your website so that I can report a very interesting object",3/21/03,
4379,3/15/03 01:00,Greenwich,NY,USA,Unknown,unknown; instantaneous?,An indescribable feeling/light felt/seen in a short instant.,10/7/03,
4380,3/11/03 13:00,Utica,NY,USA,Sphere,7 minutes,a medium sized sphere with no windows or visible doors it was making sharp turns and angular movements.,3/21/03,
4381,3/4/03 21:30,Clifton Park,NY,USA,Unknown,2 minutes,Red lights in the sky over Clifton Park,3/21/03,
4382,3/1/03 22:00,Bellmore,NY,USA,Circle,5 seconds,"Yellowish light flying in a straight line across the sky at high speed, there was no sound. Another one followed about 2 minuets later.",4/27/04,
4383,2/26/03 21:30,North Chili,NY,USA,Triangle,15-30? Minutes,"Black Triangle passed over our car, we got out as it did.",3/6/23,
4384,2/23/03 23:00,Sodus,NY,USA,Light,30 seconds,Mars observers witness light moving in roller coaster pattern from east to west.,8/28/03,
4385,2/23/03 20:30,New York City (Astoria; Queens),NY,USA,Circle,About 1 Hr,I was out side smoking when I looked up and saw what I thought was a Large star. Then it started moving vast then very slow then not at,3/21/03,
4386,2/20/03 21:32,Hauppauge,NY,USA,Light,1:20,"Three lights in triangular formation traveling in a North-East Direction in sufflok, LI, from brentwood direction towards hauppauge.",3/21/03,
4387,2/15/03 16:00,Buffalo,NY,USA,Other,10 seconds,Half a Yellow Blimp,4/22/03,
4388,2/13/03 23:59,Smithtown,NY,USA,Light,13 mins,Light Hovers in the NY sky... and it's not the first time...,3/21/03,
4389,2/11/03 05:35,New York City (Brooklyn),NY,USA,Egg,0630,"I saw something to the affect of a fireball yellowish orrange, its light got real bright .. soon after real dim and moving round",3/21/03,
4390,2/6/03 06:10,Arkport,NY,USA,Changing,20 Minutes,"Object in sky brighter than all others, clear morning; moved from right to left and then in a circular pattern.",3/21/03,
4391,1/31/03 19:00,Albany,NY,USA,Sphere,long time,many Balls of light over donwtown Albany,3/21/03,
4392,1/24/03 12:00,New York City,NY,USA,,,Possible explanation for beams of light....,3/21/03,
4393,1/16/03 09:40,Hudson Falls,NY,USA,Disk,5 minutes,5 Disks spotted over Upper NY State,3/21/03,
4394,1/16/03 01:34,Portchester,NY,USA,Cylinder,2-5mins,Large dark object with water like reflection looked like a cylinder.,3/21/03,
4395,1/10/03 04:45,Lockport,NY,USA,Flash,7 Minutes,"Lockport, NY Sighting. Hovering object pulsating and emitting different colors.",3/21/03,
4396,1/9/03 21:00,St. James,NY,USA,Cylinder,2min,it was a circle with power fill lights and let out 2 other objects,3/21/03,
4397,1/8/03 22:00,Albany,NY,USA,Triangle,5,3 Triangular objects,3/21/03,
4398,1/4/03 21:41,Bayport,NY,USA,Cone,4.3 min.,"Two glowing objects chasing, swirling, dancing in the nite sky.",3/21/03,
4399,12/21/02 06:10,Canastota,NY,USA,Unknown,5 mins,bright light,12/23/02,
4400,12/17/02 10:30,New York City (Manhattan),NY,USA,Orb,20 seconds,"Small silver orbs moving among Manhattan skyscrapers, morning and evening events",12/23/02,
4401,12/3/02 18:40,Farmingdale,NY,USA,Triangle,10 seconds,"A large triangle or boomerang shaped craft, making no sound glided over my house.",5/24/05,
4402,12/1/02 17:15,New York City (Manhattan),NY,USA,Formation,1 minute,Formation of moving lights over Manhattan,12/23/02,
4403,11/28/02 21:30,Amsterdam (west of),NY,USA,Flash,split-second,"Bright orange streak speeds toward Albany, NY",12/23/02,
4404,11/21/02 20:00,Tonawanda,NY,USA,Chevron,2 minutes,"three large white lights on craft, chevron shaped",12/23/02,
4405,11/19/02 23:30,Hamburg,NY,USA,Other,25 minutes,"took a picture of a flashing ""v"" shaped light.",11/20/02,
4406,11/19/02 00:45,New York City,NY,USA,Changing,5 min.,strange morphing cloud scans city at night,11/20/02,
4407,11/10/02 00:00,Briarcliff Manor,NY,USA,Disk,1 minute,A saucer hovering about 30 feet off of the ground with bright blue and red lights.,6/2/17,
4408,11/2/02 17:30,New York City (Manhattan),NY,USA,Oval,,Item floationg over statuette in NY,11/4/02,
4409,10/26/02 21:30,Garrison,NY,USA,Light,10 minutes,Possible UFO sighting in Garrison New York,10/28/02,
4410,10/23/02 20:15,Albany,NY,USA,Triangle,15 minutes,"Aircraft made no noise, it was black with, 2 red, 1 blue, and 1 white light, it flew a speed faster then anything have seen before.",3/21/03,
4411,10/21/02 18:00,Malone,NY,USA,Light,15 Min,"An erratic light being ""chased"" by a jet, then two floating objects quite some distance away,",10/28/02,
4412,10/21/02 12:30,Albany,NY,USA,Other,8 seconds,I saw the object reported by FOX-23 from my place of employment,11/4/02,
4413,10/21/02 10:00,Albany,NY,USA,Cigar,?,Strange Sighting over albany international airport,10/28/02,
4414,10/20/02 16:00,Albany,NY,USA,,1/3 second (est.),Airline pilot calls to inquire about FOX 23 video; complains that U. S. government apparently is doing nothing.,10/28/02,
4415,10/20/02 16:00,Albany,NY,USA,,,"Hey Guys, What about the UFO reported on Headline News on 10/23 or 10/22? This thing had extreme speed (by any distance)and DETAIL!!!",10/28/02,
4416,10/20/02 16:00,Albany,NY,USA,Cigar,5 seconds,Cigar shaped object caught on tape over albany international airport moving at an incredible rate of speed local news fox23,10/28/02,
4417,10/20/02 16:00,Albany,NY,USA,,,"Is it possible the object filmed at Albany, NY was the International Space Station? The outline looks like the solar arrays and body of",11/4/02,
4418,10/20/02 12:00,Latham,NY,USA,Cylinder,,Local news cameraman catches UFO on film. FBI investigating.,10/28/02,
4419,10/20/02,Albany,NY,USA,,,"I don't know if anyone has reported this to you or not. But on October 23, FOX NEWS was reporting on the sniper shootings, and a camer",10/28/02,
4420,10/20/02,Albany,NY,USA,Cylinder,???,UFO over Albany NY Airport,10/28/02,
4421,10/20/02,Albany (maybe New York),NY,USA,Cigar,seconds,"I am passing this on from my friend, as I did not see the news report. He said that on the local news, a CBS station here in Jacksonvi",10/28/02,
4422,10/7/02 18:45,Rome,NY,USA,Light,10+ Min's,Bright lights - erratic movement over Rome NY,10/15/02,
4423,10/6/02 07:15,Thousand Island Bridge (Near),NY,USA,Disk,aprox 20 min,Bright large saucer shaped object in sky 0715 in east sky on 10-06-02.,10/15/02,
4424,10/6/02 05:50,Inwood,NY,USA,Orb,0:5,BIG DIPPER HAS LOOSE STAR,10/15/02,
4425,10/6/02 03:00,Farmingdale,NY,USA,Light,30 min. plus,Long Island bright hovering white light eye level on a clear night sky.,10/15/02,
4426,10/2/02 19:20,Watertown,NY,USA,Rectangle,,The object picked up speed and followed us.,10/15/02,
4427,10/1/02 23:20,New York City,NY,USA,Changing,3 minutes,3 flying objects that changed shapes show up in midtown manhattan,10/15/02,
4428,10/1/02 19:50,New York City (Staten Island),NY,USA,Light,15 min's,Patrolling fighter jet followed by bright green light !,10/15/02,
4429,10/1/02 19:20,New York City (Staten Island),NY,USA,Egg,5 minutes,Egg Shaped Object Circling,10/15/02,
4430,10/1/02 16:00,Staten Island,NY,USA,Egg,5 seconds,Egg-shaped object parallels plane.,4/7/17,
4431,10/1/02 07:30,Kingston,NY,USA,Cigar,10 mins,"nys thruway heading nrth between exit 19 and 20 cigar shaped ,reflective or silver in color , incredable fast no sound .",3/4/08,
4432,9/28/02 21:00,New York City (Staten Island),NY,USA,Light,5 minutes,"Last evening at exactly 8pm, myself and my landlord witnessed a bright white light moving from a southeastern to northeastern direction",9/29/02,
4433,9/28/02 20:15,Center Moriches,NY,USA,Orb,1 minute,2 white objects traveling closely behind a plane,9/29/02,
4434,9/28/02 20:15,Glen Cove,NY,USA,Light,3 min approx,"bright slow moving object that started to dim then disappear as another faint ""star"" slowly fell to where it disappeared in the nw sky.",9/29/02,
4435,9/15/02 02:00,Mahopac,NY,USA,Cone,15-20 seconds,Brightly lit craft comes very close to us and then disappears in the woods,11/14/14,
4436,9/12/02 16:00,Oneida,NY,USA,Triangle,5 min.,yellow triangle with yellow pulsing lights,9/19/02,
4437,9/11/02 21:00,New York City,NY,USA,Sphere,25 minutes,4 light appeard behind the president during address to the nation on 9-11-02,9/13/02,
4438,9/11/02,Elmont,NY,USA,Triangle,about a minute,I was watching tv and i heard a really loud noise. at first i thought it might have been a plane. but it kept getting louder so i thoug,10/28/02,
4439,9/9/02 19:05,Moriches Bay (Long Island),NY,USA,,,Fishing boat skipper reports hearing dramatic UFO report to U. S. Coast Guard over radio.,10/15/02,
4440,9/9/02 19:02,Moriches Bay (Long Island/Atlantic Ocean),NY,USA,,30 sec.,"Two men report witnessing a peculiar object descends from the sky, levels out, streaks east over water.",9/13/02,
4441,9/9/02 19:02,Moriches Bay (Long Island),NY,USA,,"1 minute, or less.",U. S. Coast Guard (Boston) forwards report of sighting off Long Island by two witnesses on sailboat.,9/13/02,
4442,9/8/02 22:30,Glenfield,NY,USA,Circle,1:00a.m.,"I live upstate NY, and not only on the night mentioned but a couple of previous nights have seen very clearly, as well as husband and f",9/13/02,
4443,9/8/02 22:00,Hamburg,NY,USA,Circle,A few minutes,"It was too large to be Venus or a Star, and there was multiple witnesses.",3/21/03,
4444,9/8/02 21:30,Central Square,NY,USA,Disk,2 HOURS,"SAUCER SHAPED OBJECT W/GREEN,BLUE,RED&WHITE LIGHTS IN UPSTATE NY",9/13/02,
4445,9/8/02 20:00,Jamaica,NY,USA,Disk,15 minutes,"spoting in Queens, New York",9/13/02,
4446,9/8/02 16:00,New York City (Manhattan),NY,USA,Sphere,1-2hr,Eleven objects over Manhatten for nearly 2 hours.,9/13/02,
4447,9/8/02 03:20,Accord,NY,USA,Orb,2 minutes,3 bright UFO over ulster county-Aliens at the Art Farm,9/13/02,
4448,9/8/02 00:20,New York City (Staten Island),NY,USA,Orb,10 seconds,light splits into two objects then rejoins.,9/13/02,
4449,9/7/02 22:00,Rochester,NY,USA,Oval,1 hour,Ufo's seen hovering around the Rochester area,9/13/02,
4450,9/7/02 15:00,Astoria,NY,USA,Circle,about 30 min,UFO over Manhattan,9/13/02,
4451,9/3/02 00:35,Oneonta,NY,USA,Diamond,3 Minutes,Diamond-shaped object with 4 blinking lights very high,9/6/02,
4452,8/30/02 22:15,Holland,NY,USA,Circle,30 minutes,"Flashing red,blue,green and yellow light's appeared",9/6/02,
4453,8/29/02 03:20,Rochester,NY,USA,Triangle,,on aug.29th i woke up in the morning to go get something to drink after doing so i open my kitchen door which faces east to see how nic,9/6/02,
4454,8/22/02 23:40,Monroe,NY,USA,Egg,5 minutes,"Orb- brilliant white on Rt 17, NY",3/21/03,
4455,8/22/02 17:00,Bohemia,NY,USA,Diamond,30 seconds,ufo in diamond shape and the bottom was spinning and had hummingbird type winds on the outside.,5/27/03,
4456,8/21/02 18:30,White Plains,NY,USA,Disk,10 seconds or less,Small disk near Westchester Airport,8/28/02,
4457,8/15/02 21:00,New York City (Bronx),NY,USA,Circle,15 minutes,one of the kids said look a ufo,3/21/03,
4458,8/14/02 21:00,Syracuse,NY,USA,Triangle,one minute,three bright lights sighting,9/6/02,
4459,8/13/02 22:54,Rochester,NY,USA,Light,6 seconds,Bright light seen in the northeastern sky over New York tonight.,8/16/02,
4460,8/13/02 22:00,Rochester,NY,USA,Light,10 minutes,Bright Light,8/28/02,
4461,8/12/02 22:00,I-90 (along),NY,USA,Triangle,10 mins or more,Triangular shaped craft seen in upstate New York along I-90,9/6/02,
4462,8/11/02 02:00,Rochester (west of),NY,USA,Changing,slowed down,color blue red 1 too 3 lights 2 slow moveing satilites or ufo moved by it. it would jump around it loo,8/16/02,
4463,8/11/02 00:30,Rochester,NY,USA,Light,30 minutes,Colored Lighs,8/16/02,
4464,8/10/02 22:40,West Sand Lake,NY,USA,Fireball,15,Bright orange plasma like ship,8/16/02,
4465,8/10/02 22:30,Chazy,NY,USA,Light,5 minutes,2 lights in the sky,8/16/02,
4466,8/10/02 13:00,New York City,NY,USA,Disk,3 minutes,I saw and video recorded 3 metalic sacuer shape objects flying by the empire state building.,3/21/03,
4467,8/10/02 01:45,New York City,NY,USA,Disk,3 minutes,Recorded UFO siteing by the empire state building,8/16/02,
4468,8/6/02 19:00,New York City,NY,USA,Circle,,Unknown circular objects moving over manhattan,8/16/02,
4469,7/31/02 22:30,Cazenovia,NY,USA,Flash,30 seconds,2 bright lights that faded and had the same pattern of flight,8/16/02,
4470,7/29/02 22:15,New York Mills,NY,USA,Flash,10 minutes,"A dome-shaped object with green and red flashing lights was observed by 3 family members in suburban Utica,NY",7/30/02,
4471,7/28/02 20:10,New York City,NY,USA,Changing,2 mins,"Single black flying object, alternating between circular and disclike shape, constant velocity seen over NYC.",7/30/02,
4472,7/28/02 01:00,Cheektowaga,NY,USA,Triangle,one minute,A triangular shaped object with flames and green lights floats through the sky in my neighborhood.,7/30/02,
4473,7/27/02 22:30,Mohawk,NY,USA,Light,1 minute,"A stationary bright light appeared and started getting closer, than reversed and quickly moved away.",8/16/02,
4474,7/25/02 21:30,Shirley,NY,USA,Formation,3 Minutes,I sighted 6 fiery lights in formation of the southern coast of Long Island while I was flying an airplane in the vicinity.,7/26/02,
4475,7/25/02 21:30,Shirley,NY,USA,Light,3 minutes or more,"6 lights seen over ocean @ smith point park, shirley, NY @ 930PM on 7/25/2002",8/16/02,
4476,7/24/02 00:30,Albany,NY,USA,Fireball,5-10 seconds,An incredible bright white orb sped past at an anormous rate heading east.,8/16/02,
4477,7/24/02 00:30,Albany,NY,USA,Fireball,5-10 seconds,An extremely bright white light zoomed past my window at 12:30AM July 24th.,7/30/02,
4478,7/20/02 22:30,Maybrook,NY,USA,Fireball,5 seconds,I have seen the same fireball object as recently reported by someone else.,6/18/04,
4479,7/20/02 22:15,Chittenango,NY,USA,Unknown,Approx 20 secs.,Single bright white light observed in eastern sky of northern hemisphere moving from south to north approx. 40-45 degrees off horizon.,7/30/02,
4480,7/16/02 22:00,Riverhead,NY,USA,Light,50 minutes,Phoenix Lights on Long Island,7/26/02,
4481,7/16/02 10:00,New York City (Manhattan),NY,USA,Unknown,,crazy,7/26/02,
4482,7/15/02 22:30,Cold Spring,NY,USA,Circle,6-10,"A very large circle flying just above ground with flashing blue, red, and yellow lights",10/30/06,
4483,7/15/02 15:00,New York City (Brooklyn),NY,USA,Fireball,,7 bright lights in the sky.,7/25/04,
4484,7/14/02 13:00,LaGrangeville,NY,USA,Oval,10-20 sec,we saw a grayish (oval) object hover over a spot that stuck there for about 10 seconds.,3/21/03,
4485,7/13/02 23:59,Northport,NY,USA,Light,3 minutes,blue light changing shape and brightness,7/16/03,
