,Date / Time,City,State,Country,Shape,Duration,Summary,Posted,Images
2858,8/15/11 17:00,Hamburg,NY,USA,Other,20 seconds,This was a large craft all black. Mt daughter and I sat down at Applebees in Hamburg when we both seen looking outside the window over,12/12/11,
2859,8/15/11 15:00,New York City (Brooklyn),NY,USA,Egg,3 minutes,"UFO over Brooklyn, NYC, Flatbush Avenue.",6/20/14,
2860,8/15/11 00:00,Hunt,NY,USA,Triangle,25-30 minutes,"Triangle lights blinking, then slowly rotating, then blinking again. Then it took off at an unimaginable speed.",12/12/13,
2861,8/13/11 22:40,Buffalo,NY,USA,Fireball,4 minutes,"three UFOs seen over Buffalo, NY",8/21/11,
2862,8/13/11 21:50,Grand Island,NY,USA,Light,40-60 seconds,A noiseless and oscillating bright light in the eastern sky was moving from the south to the north.,10/10/11,
2863,8/13/11 21:20,Tonawanda,NY,USA,Fireball,1-2 min.,"Fireball travelling steadily over Tonawanda, NY",8/21/11,
2864,8/13/11 00:45,Watertown,NY,USA,Unknown,4 Minutes,"I seen multiple objects with flashing lights, one flew over my house and over me and my girlfriend.",8/21/11,
2865,8/12/11 23:15,Yonkers,NY,USA,Light,1 hour,Blinking lights in the sky not moving then disappearing and re-appearing.,8/21/11,
2866,8/12/11 22:40,Cheektowaga (Buffalo),NY,USA,Light,minutes,Three bright orange/red distinct lights of UFO's spotted in skies in western New York on 8/12/2011,8/21/11,
2867,8/12/11 21:00,Long Island,NY,USA,,20 mins,THE LIGHTS WE ALL SAW OVER LONG ISLAND TONIGHT WERE ONLY CHINESE LANTERNS THAT WERE LET GO FOR A CEREMONY HELD IN CONNECTIQUOT STATE PA,8/21/11,
2868,8/12/11 03:05,Staten Island,NY,USA,Other,2 seconds,It was a quick beam of silvery light tjatshot across the sky.,8/21/11,
2869,8/11/11 22:36,Binghamton,NY,USA,Rectangle,Lasted until I had to go,3 objects one slowly moving to the left and back with white and red lights 2 other moving objects flashing 5 dim red lights with white,8/21/11,
2870,8/11/11 20:48,North Massapequa,NY,USA,Fireball,2 minutes,My son and I were travelling north heading home at approximately 9:00 pm. We were about to turn west onto our street when we saw what,8/21/11,
2871,8/10/11 21:50,Inlet,NY,USA,Circle,3 minutes,At 9:50 PM a larger red circle surounded by smaller red cirlces moving slow and steady eastward.,8/21/11,
2872,8/9/11 01:00,Commack/Kings Park,NY,USA,Unknown,4 seconds,"I don't know what I saw, but I know what I saw.",8/21/11,
2873,8/6/11 21:30,Oakdale,NY,USA,Fireball,15 minutes,6 slow moving fireballs seen in western sky on Long Island,8/7/11,
2874,8/2/11 21:25,Owego,NY,USA,Triangle,3 minutes,"Triangular craft spotted with 3 white lights on corners, hovered without sound.",8/7/11,
2875,7/31/11 01:25,Goodyear Lake,NY,USA,Cigar,10 min,Four red craft.,8/21/11,
2876,7/31/11 00:00,Fulton,NY,USA,Fireball,20,three triangle shaped objects on fire in the sky,8/7/11,
2877,7/30/11 22:05,Port Jeff Station,NY,USA,Fireball,5 min,Appeared floating than was speeding through the sky suddenly went up at 90 degrees and disappeared.,8/7/11,
2878,7/30/11 22:00,Cassadaga,NY,USA,Fireball,5-7 minutes,Yellowish/orange sphere witnessed by 6-8 people in Western NY,12/12/11,
2879,7/30/11 21:00,New York City (Staten Island),NY,USA,Fireball,1 minute,Orange glowing object seen by 8 people,10/10/11,
2880,7/29/11 22:15,Utica,NY,USA,Circle,5 minutes,"8 orange glowing lights in the sky over Utica, NY",8/7/11,
2881,7/27/11 04:54,Coram,NY,USA,Orb,3 minutes,Object as bright as Venus moves through sky long island,8/7/11,
2882,7/27/11 01:00,East Setauket,NY,USA,Circle,2 minutes,Port Jefferson,8/7/11,
2883,7/24/11 20:57,East Islip,NY,USA,Circle,10 minutes,"8 red dots moving in a line slower than a plane, then they all disappeared and one started flashing on long island.",8/7/11,
2884,7/24/11 09:15,Colonie,NY,USA,Oval,2-3 minutes,2 crafts over albany ny . very close together moving in sharp turns and fast speed,8/7/11,
2885,7/23/11 22:15,Monticello,NY,USA,Light,One second,"Me and a friend saw a giant blue/white light up in the sky that made no sound. ((NUFORC Note: Flare from ""Iridium"" satellite? PD))",8/7/11,
2886,7/21/11 21:50,Middle Island,NY,USA,Fireball,4-5 minutes,Fireball moving silently across the sky.,8/7/11,
2887,7/21/11 20:45,Rochester,NY,USA,Changing,1 min,Noticed an orb floating in the sky. It seemed to be reflecting the sunlight. After 45 seconds it started changing shape and just vanish,8/7/11,
2888,7/19/11 23:00,Lindenhurst,NY,USA,Light,2 min,Red pulsating light over bay south of Lindenhurst traveled from south to north....,8/7/11,
2889,7/19/11 22:00,Poughkeepsie,NY,USA,Fireball,5 mins,Fireball hovering in the night sky,8/7/11,
2890,7/19/11 22:00,Evans Mills,NY,USA,Unknown,5 minutes,Tight groups of range horizontal lights in the sky.,8/7/11,
2891,7/17/11 04:06,Averill Park,NY,USA,Fireball,few seconds,Green fireball shooting across sky northbound. ((NUFORC Note: Possible meteor?? PD)),7/17/11,
2892,7/16/11 21:30,Penfield,NY,USA,Circle,15 minutes,12 balls of fire orange light flying from East to West,7/17/11,
2893,7/15/11 23:20,Poughquag,NY,USA,Triangle,10 s15 seconds,"Large triangular shaped object with steady red,green and white lights glides over my home",7/17/11,
2894,7/13/11 22:30,Watkins Glen,NY,USA,Orb,10 minutes,"Strange, Non-Aircraft Moving, Pulsing Lights Observed in Rural Upstate New York",7/17/11,
2895,7/13/11 22:29,Watkins Glen,NY,USA,Light,10 min,Three lights in the night sky over upstate NY moving erratically and very quickly,7/17/11,
2896,7/13/11 21:40,Watkins Glen,NY,USA,Fireball,20 minutes,Adult female witnesses 8 bizarre objects in the night sky. ((NUFORC Note: See other reports from siblings of witness. PD)),7/17/11,
2897,7/13/11 08:53,Lancaster,NY,USA,Fireball,15 seconds,"I was in the backyard watching from a portable dvd and turned my head toward the sky ,not sure why .And I saw seven to eight objects in",7/17/11,
2898,7/11/11 01:45,Wingdale,NY,USA,Sphere,1 hour,There were 6 spheres (1 larger orange and 5 smaller red flashing) circled around my home.,7/17/11,
2899,7/10/11 23:15,Ocean Beach (Fire Island),NY,USA,Light,30 seconds,"4 orange lights low in the sky observed from Fire Island, NY. ((NUFORC Note: Witness include former Air Traffic Controller. PD))",7/17/11,
2900,7/10/11 22:45,New York City (Brooklyn),NY,USA,Oval,1:39,Brooklyn UFO / VIDEO AND PHOTO / 7.10.11,5/13/12,
2901,7/10/11 21:30,Canisteo,NY,USA,Fireball,1 minute,"At around 9:30 PM July tenth 2011 in Canisteo N.Y., I observed a yellow red bright light for about one to two minutes.",8/7/11,
2902,7/10/11 20:45,Menands,NY,USA,Unknown,5 minutes,"Round flame colored object traveling east to west at great speed, then slowed to a stop, sped up and then traveled slowly west",7/17/11,
2903,7/10/11 14:00,New York City (Brooklyn),NY,USA,Sphere,5 minutes,Spheres over Brooklyn,7/17/11,
2904,7/9/11 20:00,Medford,NY,USA,Circle,03:00,"At 8:00 pm in Medford, NY at my grandfathers (Matthew Accardi)house right before sunset we saw a circular red ufo that look like a red",7/17/11,
2905,7/7/11 19:00,Horseheads,NY,USA,Changing,3 minutes,Weird craft,7/17/11,
2906,7/7/11 16:58,Liverpool,NY,USA,Sphere,north,A light in the sky blink red and green.,7/17/11,
2907,7/4/11 23:45,Verona,NY,USA,Light,10+ minutes,3 light ufos over central ny,7/6/11,
2908,7/4/11 22:45,Rochester,NY,USA,Circle,20-30 minutes,"Orange Balls Swiftly Gliding Through The Sky In Rochester, N.Y.",7/6/11,
2909,7/4/11 22:45,Levittown,NY,USA,Formation,5 Min,20-25 Orange Lights move from West to East and then disappear.,7/6/11,
2910,7/4/11 22:00,Bellport,NY,USA,Light,5 minutes,9 Red Lights that appeared in the night sky......,5/13/12,
2911,7/4/11 21:00,Greenport,NY,USA,Circle,Several hours,Multiple bright circles oscillating across the sky for hours at a time,3/4/22,
2912,7/4/11 21:00,Franklin Square,NY,USA,Fireball,few minutes,Round object that appeared to have fire inside it,7/6/11,
2913,7/4/11 18:30,New York,NY,USA,Light,3 hours,Bright lights over New York!,7/4/12,
2914,7/3/11 21:00,Esperance,NY,USA,Formation,2-3 min,"Group of UFO's witnessed over Esperance, NY, on 3 July 2011",7/4/11,
2915,7/2/11 17:00,Washington,NY,USA,Disk,15 minutes,I saw 7 metallic disk type hovering above the Washington monument. There were 7 total at one point. Two were on the left side hovering,7/17/11,
2916,7/1/11 23:45,Albany,NY,USA,Fireball,20 minutes,"Glowing amber fireball hovering over Albany, NY, 7-1-2011",7/4/11,
2917,7/1/11 21:45,Ontario,NY,USA,Oval,3 mins,"ORANGE GLOWING OBJECT, HOVERING FIRST, THEN RAPIDLY ACCELERATING IN ONTARIO, NY",7/6/11,
2918,7/1/11 01:00,Dansville,NY,USA,Sphere,2 minutes,Witnessed an object in the night sky while camping that was orange like the sun fly overhead two times in a span of twenty minutes,7/4/11,
2919,6/30/11 23:30,Modena,NY,USA,Light,up to 5 minutes,Lights over the Shawangunk Mountain Range.,7/4/12,
2920,6/29/11 22:15,New York City (Staten Island),NY,USA,Orb,30 sec to a min,I saw a brilliant white light moving. ((NUFORC Note: We suspect that the object was the International Space Station. PD)),7/4/11,
2921,6/26/11 23:30,North Babylon,NY,USA,Light,15 minutes,2 sperate sighting I will never forget!,3/13/12,
2922,6/24/11 21:00,Canandaigua,NY,USA,Light,6 minutes,A small fleet of UAP flying over a residential street.,7/4/11,
2923,6/22/11 21:00,Pomona,NY,USA,Fireball,less than 10 seconds,Green fireball seen while driving home after work streaked across sky appeared to have sparks coming off. ((NUFORC Note: Meteor? PD)),8/7/11,
2924,6/22/11 14:36,Hudson Falls,NY,USA,Fireball,2 minutes,strange green/blue fireballs,6/27/11,
2925,6/19/11 23:00,Albany,NY,USA,Fireball,1 minute,((HOAX??)) fatersday night we were outside lookin at the sky my daughter says whats that we all look in the sky and see a light,6/27/11,
2926,6/19/11 21:30,New York City (Brooklyn),NY,USA,Fireball,4 mins,2 fireballs that went dim over brooklyn ny,6/20/11,
2927,6/18/11 23:00,Bethpage,NY,USA,Oval,5-6 min,five lights seen over bethpage ny,6/20/11,
2928,6/18/11 23:00,Bethpage,NY,USA,Oval,5-6 min,"My son, his girlfriend,and another friend were sitting in the front of the house. They saw a red glowing object coming from the west g",6/20/11,
2929,6/17/11 21:30,Cicero,NY,USA,Fireball,almost two mintes,We live across the road from a lake. We were both standing on our back deck and it is 9:30 at night so it is dark and all of a sudden w,6/20/11,
2930,6/15/11 22:30,Bohemia,NY,USA,Other,Unkown,"7-9 ufos captured on video, 5 mins away from airport.",6/20/11,
2931,6/15/11 03:00,Pennellville,NY,USA,Light,3 minutes,At stated time I noticed a white bright solid light heading from W to E. ((NUFORC Note: Possible sighting of ISS. PD)),6/20/11,
2932,6/14/11 23:30,New York City (Manhattan),NY,USA,Sphere,5-7 minutes,2 objects flying SUPER FAST speeds in Manhattan,6/20/11,
2933,6/14/11 22:25,Astoria,NY,USA,Cigar,15 seconds,Wingless airplane torso in the night sky close to LaGuardia airport.,6/20/11,
2934,6/12/11 22:56,Hudson Falls,NY,USA,Other,10 minutes,Spiral ufo seen in hudson falls.,6/20/11,
2935,6/10/11 23:00,Pawling,NY,USA,Fireball,10 seconds,It was my birthday party and me and my friends were hanging out on the trampoline outside my house. I am reporting this now because i j,3/13/12,
2936,6/10/11 09:00,New Rochelle,NY,USA,Unknown,few seconds,"fast, bright light overhead in lower westchester NY",1/24/12,
2937,6/7/11 22:30,Palermo,NY,USA,Light,3 minuites,Looking out my living room window at 10:30 pm I noticed a big orange ball of light hovering over the treeline across the street,6/12/11,
2938,6/7/11 21:29,Huntington,NY,USA,Flash,4 seconds,"Flashing light, not an aircraft or shooting star. Rapid directional change.",6/12/11,
2939,6/5/11 14:38,Buffalo,NY,USA,Diamond,10 seconds,Unidentified flying object or anomaly caught on HD video appears to be diamond shaped with light.,6/14/12,
2940,6/4/11 22:10,Beacon,NY,USA,Triangle,1 Minute,Hovering Triangle in Beacon New York,6/12/11,
2941,6/4/11 21:30,Rochester,NY,USA,Fireball,Ten minutes,Fireball in Rochester ny,6/12/11,
2942,6/3/11 22:00,Cuba,NY,USA,Sphere,five minites,((HOAX??)) 8-10 red objects in nighttime sky at 22:00 hrs..,6/12/11,
2943,6/3/11 09:01,Montgomery,NY,USA,,,the rainbow light ship seen in hudson valley is my invention ((NUFORC Note: We have no idea what this anonymous statement means. PD)),6/3/11,
2944,6/1/11 00:00,Bergen,NY,USA,Triangle,2 minutes,"Two triangle UFO's sighted in the small Bergen village in Rochester, N.Y.",6/20/11,
2945,5/29/11 23:25,Ithaca,NY,USA,Formation,5 minutes,Three yellow-red 'orbs' changing formation in night sky,6/3/11,
2946,5/28/11 22:00,New York City (Queens/Whitestone),NY,USA,Unknown,15 secs,"I was sitting in my yard looking in an easterly direction, when I noticed an unidentified object moving in a northeasterly direction at",6/3/11,
2947,5/28/11 22:00,New York City (Queens),NY,USA,Disk,10-15 Minutes,"UFO in New York. We have photos and Details, the object was no doubt a UFO.",6/20/11,
2948,5/28/11 21:55,Buffalo,NY,USA,Unknown,4 minutes,"Unknown silent, lighted craft hovered overhead, Buffalo NY",5/29/11,
2949,5/23/11 10:30,South Kortright,NY,USA,Oval,1 HR.,Crippled an at the bottom of our lake,6/3/11,
2950,5/22/11 19:31,New York City (Manhattan),NY,USA,Triangle,Ongoing,Lights over Manhattan,5/29/11,
2951,5/14/11 02:50,New York City (Brooklyn),NY,USA,Changing,20 minutes,Brooklyn lights / VIDEO / 5.14.11,6/27/11,
2952,5/13/11 21:00,Olivebridge,NY,USA,Light,5 seconds,Bright light shooting in what appeared to be an upwards trajectory,5/29/11,
2953,5/7/11 21:30,Cambria,NY,USA,Unknown,6 seconds,"In Cambria, NY (Niagara County) on May 7, 2011 at about 9:30 pm a huge rectanglar light, approximately 40 feet by 60 feet, appeared in",5/12/11,
2954,5/7/11 12:44,Douglaston,NY,USA,Triangle,1 Minute,Black Triangle object with a Round top or head photographed in the Little Neck area of New York.,5/12/11,
2955,5/5/11 01:03,Rochester,NY,USA,Triangle,5 minutes,three large triangle shaped aircraft,5/29/11,
2956,5/1/11 21:30,Sound Beach,NY,USA,Light,4 minutes,White Light changed to orange ball.,1/10/14,
2957,4/30/11 09:00,Pennellville,NY,USA,Light,1 minute,A small orange yellow light was spotted over the fast track store on 264 wile we were heading southbound seen for 1 minute while headi,5/12/11,
2958,4/29/11 22:30,Corning,NY,USA,Light,3 hours,From around 10:30 pm to 1:00 am seen four lights in the sky at seperate times. They were not planes because they made 90 degrees turns,7/17/11,
2959,4/26/11 21:00,Rockland,NY,USA,Light,10 sec,odd,5/2/11,
2960,4/19/11 03:00,Sea Cliff,NY,USA,Light,30 secs,Sleeping when the bright light woke us up.,5/2/11,
2961,4/18/11 22:05,New York City (Queens),NY,USA,Triangle,7 seconds,Triangular craft hovering over Southeastern Queens,5/2/11,
2962,4/15/11 23:50,New York City,NY,USA,Circle,15 min,"Light was traveling and huvering fast , slow, steady. fast one direction, stopping for about 5 secs, then speeding in another direction",5/2/11,
2963,4/15/11 19:00,Campville,NY,USA,Light,10-15 minutes,"Two large bright white lights flying in tandem low in the night sky, absolutely no sound, nor any other lights nor color.",10/10/11,
2964,4/9/11 20:30,Grand Island,NY,USA,Light,about 30 seconds,Spotted a stationary pinkish light then it disappeared,5/2/11,
2965,4/9/11 01:30,Buffalo,NY,USA,Orb,15 seconds,"Green Orbs, Western NY, 1-2AM 4/9/11",5/2/11,
2966,4/8/11 01:00,Auburn,NY,USA,Triangle,10 minutes,Low flying-------triangle---- with at least 3 very bright white lights----------- Makes NO noise.--- Comes out on clear nights---,5/2/11,
2967,4/7/11 19:00,Valatie,NY,USA,Light,five minutes?,"04/07 - saw three white dashes/ lights in sky ,, approx central NY, Adirondack Mtns. but they could have been further away",5/2/11,
2968,4/7/11 09:00,New York,NY,USA,Cylinder,6 seconds,Hovering UFO over Central Park,5/2/11,
2969,4/2/11 21:00,Franklin Square/Valley Stream Border,NY,USA,Triangle,5 seconds,Lights flashed to reveal a Large Triangle Object,4/3/11,
2970,4/2/11 00:36,Springville,NY,USA,Unknown,4 sec,two orange lights moving very fast and turning,4/3/11,
2971,3/29/11 20:00,Oakdale,NY,USA,Circle,5 minutes,Light like star moving across sky decently slow.,4/3/11,
2972,3/17/11 17:30,Middletown,NY,USA,Sphere,7 minustes,footage of ufo strobe,4/3/11,
2973,3/13/11 22:00,Plattekill,NY,USA,Triangle,1 hour or more,OBJECTS VERIFIED BY LOCAL POLICE,3/23/11,
2974,3/4/11 11:20,New York City (Times Square),NY,USA,Circle,30 min,Time Square 03 04 11,3/10/11,
2975,3/4/11 11:15,New York City (Queens),NY,USA,Unknown,20 mins,"To the nake eye it was a bright light in the midday blue sky,took a picture from my cell and emailed it to computer",3/10/11,
2976,3/1/11 17:15,New York City (Manhattan),NY,USA,Other,perhaps 5 minutes,formation of lights seen overhead,3/10/11,
2977,3/1/11 13:00,Cohoes,NY,USA,Triangle,ongoing,2 Ufo's on Google Moon (incredible detail),3/10/11,
2978,2/23/11 19:50,Holley,NY,USA,Triangle,2:00 min,5 brights shaped like an upsidedown V or triangle over Holley Ny.,3/10/11,
2979,2/23/11 07:15,Central Valley,NY,USA,Diamond,1 Minute,Saw several diamond orange lights flashing in sky.,3/13/12,
2980,2/20/11 20:10,Hannacroix,NY,USA,Light,3-4 seconds,Southern Albany County light in sky waaay to fast for normal jet.,2/23/11,
2981,2/19/11 06:30,Endicott,NY,USA,,8 min,"I saw a white elongated light, it didn't move, it's size and length seemed odd.",2/23/11,
2982,2/18/11 19:10,Sag Harbor,NY,USA,Diamond,30 minutes,Large boomerang craft escorted by two smaller craft,2/23/11,
2983,2/14/11 19:30,Millbrook,NY,USA,Teardrop,3 Minutes,I saw a triangular hovering object in the night sky.,2/18/11,
2984,2/14/11 12:35,Tuckahoe,NY,USA,Teardrop,3 SECONDS,"About 50 degree weather with sunny skies, driving along Tuckahoe road, all of a sudden up in the sky infront of us we saw 1 (one) brigh",2/18/11,
2985,2/12/11 05:30,Niagara Falls,NY,USA,Sphere,1 minute,"It was a stationary, hovering globe of light that illuminated the night sky.",12/12/11,
2986,2/5/11 18:00,Latham,NY,USA,Oval,4 seconds,oval fast moving object seen two nights in a row at the same time and location.,3/10/11,
2987,2/4/11 19:00,Marathon,NY,USA,Chevron,20 Seconds,4 lights as bright as stars zoomed past orions belt,2/18/11,
2988,2/3/11 08:00,Rochester,NY,USA,Unknown,pending!,Contact me or Scott/Sandy/MOOSE from morning show on WPXY fm 97.9,2/8/11,
2989,1/26/11 03:00,New York City (Brooklyn),NY,USA,Fireball,3 minutes,randomly looking outside of my window and noticing something strange,1/31/11,
2990,1/16/11 22:12,New York,NY,USA,Light,5 minutes,Strangely moving orange lights appeared briefly over the East Side of Manhattan.,1/31/11,
2991,1/16/11 22:10,New York,NY,USA,Triangle,manhattan,4 bright orange blur lights moving in the sky like 4 flars with no smoke try to take pictures but any they disapeared,1/31/11,
2992,1/11/11 18:45,Buffalo area (In-flight observation),NY,USA,Unknown,5 min.,Bright lghts apppeared at our 12 o'clock and moved to our 9 o'clock position slowly. ((NUFORC Note: Pilot report. PD)),1/31/11,
2993,1/11/11 18:30,Buffalo area (In-flight observation),NY,USA,Unknown,5 mins,A well lit craft was viewed for 5 mins at a relatively low speed and with no apparent radar contact.,1/31/11,
2994,1/6/11 03:30,Penn Yan,NY,USA,Flash,3 minutes,"erratic bright white flashes, silent, lighting up the sky near south shore of Lake Ontario",1/31/11,
2995,1/3/11 05:30,Selden,NY,USA,Light,45 sec,"at 5:30 on 1/3/11 , i was walking my dog faceing north when i saw a flash in the sky.I saw a star moving from north to south .as it mov",1/5/11,
2996,12/25/10 22:00,Southampton,NY,USA,Light,2 minutes,"Spotted 3 red lights (UFOs) over Southampton, NY",1/5/11,
2997,12/24/10 20:33,Colonie,NY,USA,Unknown,still there,Flickering red and blue light to the Northwest of Albany. ((NUFORC Note: Possible sighting of Sirius?? PD)),1/5/11,
2998,12/19/10 04:27,New York City (Queens),NY,USA,Light,45 minutes +,"Round ball of light hovers over Queens, 30min+ ((NUFORC Note: Sighting of Venus?? PD))",1/5/11,
2999,12/16/10 19:40,Airmont,NY,USA,Light,10 minutes,3 lights zooming through the sky making loud buzzing sounds then vanishing.,1/5/11,
3000,12/15/10 06:30,New York City (Staten Island),NY,USA,Circle,35 min,"Bright circular object slowly changing shape covered with small lights over Staten Island, New York City",1/5/11,
3001,12/8/10 21:20,Newburgh,NY,USA,Changing,3-5 min.,"15-20 tiny points of light moving over Newburgh, NY.",1/5/11,
3002,12/8/10 20:35,Pine Bush,NY,USA,Light,2 minutes,2 lights hovering over Pine Bush,1/5/11,
3003,12/2/10 23:22,Medford,NY,USA,Other,3-5 seconds,4 Star like objects moving east to west in the southern sky on Dec. 2nd @ 11:22PM,1/5/11,
3004,11/24/10 07:04,Gloversville,NY,USA,Formation,15 min.,bright object with jet sound engine stops in sky and engine sound ceases,1/5/11,
3005,11/23/10 16:55,Albany (3 hrs W of; on I-90 near Exit 44),NY,USA,Other,30-45 seconds,Gun metal black crescent with 6 window-glowing lights.,4/4/14,
3006,11/23/10 05:49,North Babylon,NY,USA,Other,continuing,"I could see 5 lights around the bottom, closest shape would be a rectangle but it isn't. Cannot photograph it, did not come out on dig",1/5/11,
3007,11/20/10 17:00,Averill Park,NY,USA,Disk,10 seconds,Low to the ground... all black around the UFO in a saucer shape going slow then it sped up and it was gone. Had about 8 lights around,11/21/10,
3008,11/14/10 21:00,Washingtonville,NY,USA,Unknown,2 minutes,"The lights, that type of illumination on a plane or jet I have never seen before, and ONLY 2 of them, no others.",11/21/10,
3009,11/12/10 21:00,North Sanford,NY,USA,Circle,5 seconds,Round orange fast moving object in straight line with glowing tail.,11/21/10,
3010,11/12/10 00:00,Ithaca,NY,USA,Other,Roughly 1 hour,"One big V shaped object blinking white, red and blue at a stand still with random movements - multiple objects as well.",11/21/10,
3011,11/11/10 17:00,Wallkill,NY,USA,Other,4 minutes,"Low flying, standing still above tthe trees bowtie unidentified flying object seen driving home from work",11/21/10,
3012,11/10/10 17:45,Verona,NY,USA,Diamond,1 minute,"UFO sighting Verona NY November 10, 2010",11/21/10,
3013,11/10/10 00:00,Boston,NY,USA,Flash,1 hr,"seeing flashing ,red,white and green round object. that moves in a cicular motion very fast. ((NUFORC Note: Twinkling star?? PD))",11/21/10,
3014,11/7/10 00:30,Canajoharie,NY,USA,Flash,1 hour +,"UFO object with flashing red, blue and green lights. ((NUFORC Note: We suspect a possible ""twinkling"" star. PD))",11/21/10,
3015,11/6/10 16:00,Arkport,NY,USA,Orb,1 min,seen large bright orb in western sky,11/21/10,
3016,11/3/10 23:00,Albany,NY,USA,Light,3 hours,"((HOAX)) I was hanging out with my friends. Suddenly, we saw something don't seems to be the stars.",1/5/11,
3017,11/1/10 18:00,Forest Hills,NY,USA,Cylinder,1 minute,Cylindrical air craft firing red lights.,5/15/13,
3018,11/1/10 00:00,Rushville/Canandaguia,NY,USA,Light,5 minutes,"bright stationary white light, dimmed to nothing and began blinking red sparaticly, turned right and decended",11/21/10,
3019,10/29/10 05:15,Herkimer,NY,USA,Fireball,20 seconds,orange fireball passed stars,11/21/10,
3020,10/27/10 21:00,Brockport,NY,USA,Triangle,30min,triangular ufo with 30 or more lights disappering and reappering in differant spots,11/21/10,
3021,10/25/10 23:00,New York City (Brooklyn),NY,USA,Orb,~40 minutes,3 lights form hovering triangle and disappear behind NYC skyline,11/21/10,
3022,10/23/10 07:00,Highland,NY,USA,Other,10 seconds,quick long flashing hovering object,11/21/10,
3023,10/19/10 13:00,Yonkers,NY,USA,Sphere,15 minutes,silvery circular object suspended high in the sky,11/21/10,
3024,10/18/10 07:30,Honeoye Falls,NY,USA,,10 seconds,"A possible disk shaped object is seen over Honeoye Falls, NY.",11/21/10,
3025,10/18/10 04:00,Highland,NY,USA,Triangle,1 minute,low flying triangle slow moving blueish white light in front smaller white lights under no sound no strobes,11/21/10,
3026,10/18/10 01:00,New York City (Manhattan),NY,USA,Circle,clear skies,((HOAX??)) The scariest unknown thing in the night sky.,5/2/11,
3027,10/15/10 21:27,Buffalo,NY,USA,Fireball,several mins,"Balls of fire floating (not dropping) across the sky in Buffalo, NY 10-15-10.",7/4/12,
3028,10/15/10 17:00,New York City,NY,USA,Disk,nightly,I have been witnessing craft almost every night since the middle of october 2010. These craft are seen on a New York webcam. (wirednewy,2/8/11,
3029,10/15/10 03:30,Buffalo,NY,USA,Sphere,1.5 hrs,"Bright white object with blue, red, green and white lights close to Buffalo International airport... 1.5 hrs",11/21/10,
3030,10/13/10 19:20,New York City,NY,USA,Orb,on going,Multiple UFO sighting in NYC. ((NUFORC Note: We suspect that the objects may have been twinkling stars. PD)),11/21/10,
3031,10/13/10 04:45,Rochester,NY,USA,Light,60 minutes,Orange light seen hovering and moving over Rochester,11/21/10,
3032,10/11/10 04:50,Albany,NY,USA,Oval,2 min,Oval metallic object,11/21/10,
3033,10/10/10 21:30,Albany,NY,USA,Circle,10 seconds,Circle of light SUNY Albany.,8/30/13,
3034,10/10/10 01:00,Orchard Park,NY,USA,Light,a few hours,Xmas colored rotating lights. ((NUFORC Note: Twinkling stars?? PD)),1/5/11,
3035,10/8/10 07:25,Canandaigua,NY,USA,Flash,3 minutes,Intense bright obj moving at an extremely high rate of speed and disappearing out of atmosphere. ((NUFORC Note: Satellite? PD)),11/21/10,
3036,10/5/10 19:34,Buffalo,NY,USA,Changing,3-4 minutes,"Kite shaped object bright white, above deleware park",11/21/10,
3037,10/3/10 22:00,New York City (Manhattan),NY,USA,Light,5 mins,About 7 flying objects above New York Sky.,11/21/10,
3038,10/3/10 05:20,New York City (Staten Island),NY,USA,Oval,15 minutes,POSSIBLE UFO STATEN ISLAND NY,11/21/10,
3039,9/26/10 04:30,Sayville,NY,USA,Other,20 seconds,Looking to the sky on a very clear night we saw a glowing object that was reasonably close maybe 1-2 miles in the sky east of us. The a,11/21/10,
