,Date / Time,City,State,Country,Shape,Duration,Summary,Posted,Images
1440,2/10/16 22:00,Batavia,NY,USA,Cone,10 minutes,Upside down pyramid with four rows of lights with glowing green humanoid (also orb).,2/11/16,
1441,2/5/16 21:30,Selkirk,NY,USA,Cross,hovering until we past it,My family went out for dinner on our way back home we traveled the nys thurway we past a trooper who had someone pulled over and shortl,2/11/16,
1442,2/5/16 20:20,Staten Island,NY,USA,Light,10 minutes,2-3 lights following eachother in the sky for 20 minutes where they moved from east to west.,2/11/16,
1443,2/5/16 20:10,Cheektowaga,NY,USA,Rectangle,15-20 seconds,Large retangular craft with five circular lights on the bottom. Craft made no sound and seemed to be floating through the air rather,2/11/16,
1444,2/1/16 21:42,Rochester,NY,USA,Light,15-30 seconds,"Yellow/orange bright light over Rochester, NY.",2/4/16,
1445,1/31/16 13:00,Hampton Bays,NY,USA,Disk,4 seconds,It appears the he caught a UFO shooting out of the water possible doing a barrel roll. ((NUFORC Note: Bird in flight. PD)),2/11/16,
1446,1/30/16 20:00,Dansville,NY,USA,Light,20 minutes,Bright light western sky watched for 20 min then bam it was gone light was stationary. ((NUFORC Note: Venus. PD)),2/3/17,
1447,1/28/16 23:00,Amsterdam,NY,USA,Unknown,Several minutes,My mother saw a weird craft flying in an abnormal pattern. She said it had suddenly stopped behind the tree.,1/29/16,
1448,1/27/16 08:00,East Aurora,NY,USA,Other,10 seconds,"Branch type stick hovered erratically, moved sideways in lateral position then disappeared into clouds.",1/29/16,
1449,1/24/16 23:45,Whitestone,NY,USA,Light,3 minutes,Bright light.,1/29/16,
1450,1/24/16 16:49,Bolton,NY,USA,Changing,05-07 minutes,"Object over Lake George, NY observed by commercial aircraft",2/4/16,
1451,1/22/16 05:48,Middle Village,NY,USA,Other,2 minutes,Bright object arched path across dark sky.,1/23/16,
1452,1/17/16 20:30,New York City (Manhattan),NY,USA,Other,2 minutes,Bright white circular cloud with rotating orbs and metallic light,1/20/16,
1453,1/17/16 04:15,Accord,NY,USA,Triangle,2 minutes,Three gold/white lights - either an individual craft of three separate in tight formation - silentlymoving at slow speed - traveling S-,1/20/16,
1454,1/16/16 19:54,Woodside,NY,USA,Oval,10 minutes,"We saw a large, oval bright blue light in the sky that stayed for about 10 minutes. ((NUFORC Note: Advertising lights. PD))",1/20/16,
1455,1/16/16 19:54,Woodside,NY,USA,Oval,10 minutes,An enormous purple/indigo oval shaped light seen peering through the clouds. ((NUFORC Note: Advertising lights. PD)),1/20/16,
1456,1/15/16 19:15,Liverpool,NY,USA,Light,15-20 minutes,"Red/orange light moving very slowly above treeline, with no sound.",1/20/16,
1457,1/11/16 22:00,Rifton,NY,USA,Rectangle,3-5 minutes,Saw a rectangular object fireball orange/reddish/yellow approximately 300 feet up moving in a straight path east northeast direction.,1/14/16,
1458,1/10/16 16:00,Cooperstown,NY,USA,Rectangle,5-8 minutes,Slow moving white rectangle with bright amber lights on bottom. Clear blue sky at the time of sighting. Post stormy day.,1/14/16,
1459,1/7/16 12:25,New York City (Brooklyn),NY,USA,Oval,1 minute,Object shows up in photo but not to the naked eye.,1/14/16,
1460,1/2/16 17:00,Pound Ridge,NY,USA,Triangle,30 seconds,"Dark gray triangular object spotted very close, saw it clear as day.",1/5/16,
1461,1/1/16 17:00,Syracuse,NY,USA,Orb,Less than 5 seconds,"Orb of white light bolted up from ground to cloud level, stopped, then continued beyond the clouds, silently at ~mach 5.",3/6/23,Yes
1462,1/1/16 05:30,Medford,NY,USA,Circle,2 minutes,"Bright orange sphere in sky traveling N to E. Moving slowly, hovering, then again moving slowly and disappeared into eastern sky.",1/5/16,
1463,12/26/15 00:30,Elmhurst,NY,USA,Circle,30 minutes,Blue light in the sky.,1/5/16,
1464,12/25/15 19:00,Greene,NY,USA,Fireball,3 minutes,Fireballs about 20 feet above the treetops-Traveling slowly in an easterly direction-3 fireballs made a triangular pattern.,1/5/16,
1465,12/24/15 21:00,Angola,NY,USA,Cigar,1 hour and counting,"15/20 blue, cigar-shaped, craft hover silently and strobed blue on the length of the crafts. Multiple witnesses.",1/5/16,
1466,12/24/15 20:45,Cicero,NY,USA,Light,5 minutes,3 orange/red lights gliding across sky.,1/5/16,
1467,12/23/15 19:30,Rochester,NY,USA,Diamond,13 minutes,"Square or diamond shaped object hovering and moving very fast over Rochester, NY. 12/23/15 7:30 p.m. (EST).",1/5/16,
1468,12/20/15 20:00,Angola,NY,USA,Cigar,>1 hour,"North sky, south east of moon, seeing 15 blue cigar shaped crafts, with blue pulsing lights in the sky, 10 times bigger th",12/21/15,
1469,12/16/15 23:54,Kenmore,NY,USA,Light,4-5 minutes,Red light with multiple small yellowish-white flashing lights on either side in a rectangle shape.,12/17/15,
1470,12/3/15 18:05,Clifton Park,NY,USA,Light,30 seconds,"Very bright light in sky, enveloped by blackness, then it and the blackness were gone.",12/4/15,
1471,11/26/15 22:00,Staten Island,NY,USA,Sphere,3 minutes,Orange spherical pulsating objects descending from sky.,12/3/15,
1472,11/26/15 00:00,New York City (Brooklyn),NY,USA,Light,20 minutes,"Saw three lights heading north up the Hudson river, all separated by about five minute intervals. At first I suspected they were Chine",12/3/15,
1473,11/22/15 16:27,Jamestown,NY,USA,Oval,5 minutes,"Silvery white oval objects seen northeast of Jamestown, NY, on 11/22/15, at 4:27 pm.",11/26/15,
1474,11/22/15 12:00,Tuscarora Indian Reservation,NY,USA,Other,5 minutes,Three X shaped silver stationary objects observed above Native American Reservation.,11/26/15,
1475,11/21/15 22:00,New York,NY,USA,Light,40 minutes,Morphing light craft changing shape on the west side of Manhattan NY.,12/3/15,
1476,11/17/15 20:00,Massapequa,NY,USA,Circle,1 minute,4+ white lights flew from north to south together. No sound,11/19/15,
1477,11/17/15 02:23,Circleville,NY,USA,Fireball,3 seconds,A large blue glowing light that intensified in size and brightness.,11/19/15,
1478,11/17/15 01:05,Middletown,NY,USA,Disk,5 minutes,Intense glowing white/blue light.,11/19/15,
1479,11/16/15 23:50,Canton,NY,USA,Circle,Several hours,"When viewed through binoculars it appears as a round object with constant flashing of red, blue, green and yellow light.",11/19/15,
1480,11/16/15 21:06,Canandaigua,NY,USA,,3 seconds,Fireball south of Canandaigua. ((NUFORC Note: Possible meteor?? PD)),11/19/15,
1481,11/16/15 20:08,Horseheads,NY,USA,Triangle,10 minutes,Three red lights hovering in triangular formation over Elmira Heights,11/19/15,
1482,11/16/15 14:22,Wilson,NY,USA,Chevron,20 minutes,"Shiny chevron shaped object traveling East over Lake Niagara, and then changed direction going South.",11/19/15,
1483,11/15/15 22:30,Baldwinsville,NY,USA,Circle,5 seconds,Fluorescent blue ball of light with a slight zig zag falling in the horizon sky,11/19/15,
1484,11/15/15 21:45,Wynanskill,NY,USA,Light,10 minutes,3 lights hovering slowly with a flash of lightning above,11/19/15,
1485,11/14/15 23:00,Massapequa,NY,USA,Circle,5 minutes,UFO sighting.,11/19/15,
1486,11/13/15 16:30,Albany,NY,USA,Orb,<1 minute,White orb for short duration.,11/19/15,
1487,11/12/15 04:10,Baldwinsville,NY,USA,Diamond,1 minute or less,"Loud diamond shaped craft seen over Baldwinsville, NY.",11/19/15,
1488,11/11/15 21:55,Hauppauge,NY,USA,Light,10 minutes,Vibrant blue light in the sky; stayed visable for about 10 minutes.,11/12/15,
1489,11/9/15 22:00,Rotterdam/Amsterdam,NY,USA,Circle,15 seconds,"Large size and very bright light in the sky about 20x the size of an avg. ""shooting star."" It was going across the sky, SLOW",11/19/15,
1490,11/9/15 00:00,Morrisville,NY,USA,Other,instant,Fine shooting light.,11/19/15,
1491,11/8/15 19:30,Buffalo,NY,USA,Formation,30 seconds,"The were 6 round objs. flying in triangular formation and the dist. between each one started to change, but the speed of the fligh",11/19/15,
1492,11/8/15 17:30,Swain,NY,USA,Triangle,10 minutes,Very Large black slow moving triangle slowly fades then helicopters show up.,11/19/15,
1493,11/7/15 23:50,East Irondequoit,NY,USA,Other,2 minutes,3 cylindrical ship with 3 propulsion holes on bottom. Believe it to be man made. hydrogen fuelled electromagnetic propulsion.,4/22/16,
1494,11/7/15 21:30,Batavia,NY,USA,Triangle,5 minutes,Low flying object with two rows of three to four lights the object was triangular in shape. ((NUFORC Note: Husband's report. PD)),11/19/15,
1495,11/7/15 21:30,Batavia,NY,USA,Triangle,5 minutes,"There was a triangular shape that had lights and was flying low, about tree level. ((NUFORC Note: Wife's report. PD))",11/19/15,
1496,11/7/15 21:30,East Northport,NY,USA,Light,5-6 minutes,Saw what appeared to be a strobe light that's used for events pointed at the sky. Moved in a large slightly erratic circular pattern.,11/19/15,
1497,11/7/15 20:17,East Northport,NY,USA,Circle,1:45 minutes,White blue tinge light circulating erratically in sky for over an hour. Above the clouds not coming from ground,11/12/15,
1498,11/7/15 08:17,East Northport,NY,USA,Circle,1:45 minutes,White blue tinge light circulating erratically in sky for over an hour. Above the clouds not coming from ground,11/19/15,
1499,11/4/15 19:30,Cicero,NY,USA,Rectangle,~6 minutes,Large rectangular object with 4 lights on it 2 red in front 2 yellow in back hovered 300 ft bove ground at 25-30 mph.,11/6/15,
1500,11/1/15 17:09,Ticonderoga,NY,USA,Fireball,3 seconds,At the above mentioned time and date I was driving my vehicle approximately 55mph northward bound on Rt 9N out of Ticonderoga when some,11/6/15,
1501,10/31/15 03:00,Rensselaer,NY,USA,Rectangle,2 minutes,Eight lights in a rectangular formation.,11/6/15,
1502,10/30/15 23:20,Wellsville,NY,USA,Fireball,8 seconds,"Behind our property, I witnessed a large white fireball that was wide. My dogs noticed it, too.",11/6/15,
1503,10/30/15 03:00,Saratoga Springs,NY,USA,Cone,,I saw a glittering object start to move across the sky from north to south in a linear motion.,11/6/15,
1504,10/27/15 05:00,New York City (Brooklyn),NY,USA,Diamond,4 hours,Two bright diamond shaped UFO very close to earth hovering over water near JFK airport/canarsie/marine park.,10/29/15,
1505,10/26/15 20:00,Buffalo,NY,USA,Triangle,1:43,"4 YELLOWISH/ORANGE TRIANGULAR SHAPE OBJECTS IN THE BUFFALO, NY, EAST SIDE SKIES.",10/29/15,
1506,10/25/15 18:20,Tonawanda,NY,USA,Disk,~1 minute,"While taking pictures of the beautiful colors in the sky from the setting sun, I snapped several pictures. A couple days later while",10/29/15,
1507,10/25/15 06:30,Ogdensburg,NY,USA,Circle,3 minutes,"While spotting deer saw 3 fast moving spheres size of softballs 50 ft from rd ""PLAYING"" lasted 3 min. Then just zipped off.",1/12/17,
1508,10/24/15 19:50,Rochester,NY,USA,Light,10 minutes,"Unexplained Lights Over Rochester, NY. ((NUFORC Note: Possible advertising lights?? PD))",10/29/15,
1509,10/24/15 19:00,Yonkers,NY,USA,Orb,30 seconds,"Blue orb in sky over Yonkers, NY.",10/29/15,
1510,10/24/15 18:30,Plattsburgh,NY,USA,Oval,2 minutes,Translucent white/gray oval hovering over Lake Champlain.,10/29/15,
1511,10/24/15 05:30,New York City (Bronx),NY,USA,,,UFO over Bronx.,10/29/15,
1512,10/23/15 20:30,Patchogue,NY,USA,Light,3 minutes,"A bright white light came over the treeline in a SW direction, then quickly changed direction going NE, looped around, then hovered.",10/29/15,
1513,10/23/15 11:20,Tarrytown,NY,USA,Rectangle,10 minutes,Slow moving dark craft near Tappan Zee Bridge in NYC.,10/29/15,
1514,10/21/15 17:00,Southold,NY,USA,Rectangle,10 minutes,Sightings at Peconic Dog Park on Long Island New York,1/11/19,
1515,10/18/15 21:00,Mountain Rd,NY,USA,Rectangle,2 minutes,Huge transparent rectangular object with red & orange lights,10/29/15,
1516,10/18/15 20:13,Buffalo,NY,USA,Disk,~4 seconds,"Disk shaped, four lights, humming noise.",10/29/15,
1517,10/17/15 21:20,East Aurora,NY,USA,Light,2 minutes,"Bright, hovering, purple/green light that turned red and slowly fell to the ground.",10/29/15,
1518,10/16/15 21:00,Schenectady,NY,USA,Sphere,30 seconds,Orange ball that grew in size from a star to a small marble rising from the horizon in the north till it faded away into space.,10/29/15,
1519,10/15/15 04:00,Ashville,NY,USA,Other,30 minutes,Orange round ball of light.,7/8/16,
1520,10/11/15 20:00,North Tonawanda,NY,USA,Light,present,Craft over Lake Erie flashing lights.,10/16/15,
1521,10/11/15 19:00,Poughkeepsie,NY,USA,Fireball,1 minute,3 bright orange orbs and 1 dark color one flying over Marist College New York,10/16/15,
1522,10/11/15 07:30,Binghamton,NY,USA,Diamond,10,Diamond shaped object with 5 fireballs on each point.,10/16/15,
1523,10/10/15 21:30,Mexico,NY,USA,Oval,30+ minutes,"6 craft, oval shaped, red, blue,.green and white lights, hovering between field and line of trees, fast moving up down or side to side.",10/16/15,
1524,10/9/15 04:35,North Tonawanda,NY,USA,Light,<2 hours,Bright white light in sky North Tonawanda near Gasport.,10/16/15,
1525,10/7/15 05:30,Eden,NY,USA,Unknown,~20 minutes,Slow moving black UFO diamond shaped light,10/9/15,
1526,10/6/15 21:00,Massapequa,NY,USA,Light,1 minute,"Six flying objects flew over Long Island together in formation very fast almost like 6 shooting stars in formation 8 pm. Oct 6, 2015.",10/9/15,
1527,10/6/15 19:15,New York City (Manhattan),NY,USA,Diamond,2 minutes,About 11 ufo Diamond shape except for the Mother ufo.,10/9/15,
1528,10/2/15 20:00,Rochester,NY,USA,Unknown,2 minutes,"Large strange light shapes in sky flying in loose formation in semi-circle, then off in a straight line.",10/9/15,
1529,10/2/15 19:00,Kendall,NY,USA,Light,10 minutes,A friend and I were driving when we both notices a large bright red and yellow light low of the tree line a few miles away.,11/6/15,
1530,10/2/15 17:41,Croghan,NY,USA,Disk,3 minutes,"My trail camera took 2 pictures of a UFO on October 2, 2015.",10/29/15,
1531,10/1/15 21:00,North Bangor,NY,USA,Light,1 hour,Very bright light to the west appeared spotlighting the ground followed by a fighter jet from the west that race and circled for 45 min,1/25/18,
1532,9/30/15 20:15,Buffalo,NY,USA,Diamond,5 minutes,Very bright reddish orange color diamond shaped object.,10/2/15,
1533,9/28/15 21:47,East Setauket,NY,USA,Orb,1-2 minutes,"6-7 orange flying orbs in unison in staggered arrangement, with simultaneous movements of up, down, left, right, at great speeds.",10/9/15,
1534,9/28/15 18:10,Syracuse (20-30 mins away from),NY,USA,Formation,5-10 seconds,"A mass, grey oddly circular shaped, came twisting out of the clouds for about 5-10 seconds and then receded.",9/29/15,
1535,9/28/15 18:00,New York City (Manhattan),NY,USA,Cigar,,"It was hovering over Manhattan, but going in a circle motion with bright white light, with flashing red and green light for an hour.",9/29/15,
1536,9/27/15 22:30,Batavia,NY,USA,Light,1 minute,Red light with green blinking light hovered in SW sky then moved quickly to the side and downwards. Disappeared in the SW sky.,9/29/15,
1537,9/27/15 22:00,Huntington,NY,USA,Orb,20 minutes,"Witnessed six bright orange orbs with bright white centers traveling from the SE to the NW about 30 seconds to one minute apart, eventu",10/9/15,
1538,9/27/15 21:30,Rexford,NY,USA,Orb,40 minutes,"Before the moon was shadowed by earth, my camera (only) picked up this green orb, moving erratically. I have many more photos and two",9/29/15,
1539,9/27/15 21:30,Bay Shore (Long Island),NY,USA,,,"Approx. 9:30pm, in Bay Shore, Long Island, NY, I witnessed bright orange flame like objects in the sky. They came in clusters of 4-7.",9/29/15,
1540,9/27/15 20:00,Webster,NY,USA,Orb,2 minutes,"Multiple orange orbs going in and out of the atmosphere in a synchronized formation, eventually disappearing one by one",6/20/19,
1541,9/27/15 20:00,Modena,NY,USA,,20:05,Orange/red sphere...hovering the treeline.,9/29/15,
1542,9/27/15 20:00,Webster,NY,USA,Orb,10 minutes,Multiple orange orbs levitating in formation,8/20/20,
1543,9/27/15 20:00,Rochester,NY,USA,Fireball,1 minute,Bright orange orbs hoovering and zipping through the atmosphere with ease.,10/2/15,
1544,9/23/15 05:34,New York City (Brooklyn),NY,USA,Oval,30-60 minutes,A craft is flying over Brooklyn. I am in Brooklyn north looking south. The craft has a circular motioned attachment could be a camera r,9/25/15,
1545,9/20/15 01:00,Astoria,NY,USA,Light,15 seconds,"Objected glowed bright white and flew in a rapid zigzag motion, stopped then glowed brightly and shot out dissapearing into the clouds",9/25/15,
1546,9/18/15 18:00,New York City (Brooklyn),NY,USA,Disk,5 minutes,"As I was looking out my window I noticed a bright white oval looking object flying over near bensonhurst, in Brooklyn at 650pm, it was",9/25/15,
1547,9/18/15 01:00,New York City (Brooklyn),NY,USA,Circle,30 minutes,As I stared into the night from attic apartment. I noticed a color changing from green to red to white which at first was bigger than a,9/25/15,
1548,9/17/15 14:00,New York City,NY,USA,Changing,10 minutes,Morphing light being in NY.,11/19/15,
1549,9/14/15 01:00,Brunswick,NY,USA,Light,30-60 minutes,I was looking outside at the beautiful stars when I saw one flashing. One by one 4 of them appeared. They we're moving.,9/17/15,
1550,9/13/15 21:00,Clifton Park,NY,USA,Fireball,2-3 minutes,2 bright orange objects (like a fireball) moving slowly across the sky in upstate NY at approx. 9pm. Witnessed for about 2 min,9/17/15,
1551,9/12/15 21:00,Staten Island,NY,USA,,~10 minutes,Many bright lights flying over Staten Island.,9/17/15,
1552,9/11/15 22:45,Peru,NY,USA,Other,1 minute,Pulsing orange orb.,9/17/15,
1553,9/11/15 22:41,Clarence,NY,USA,,2 seconds,Two bangs heard and one flash seen in northern sky outside Buffalo New York at 22:41 on 9/11/15,9/17/15,
1554,9/10/15 11:00,Buffalo,NY,USA,Other,15 seconds,Black cloud hovering close to ground disappears in front of my eyes,9/11/15,
1555,9/7/15 01:30,Staten Island,NY,USA,Circle,2 minutes,"Circular, buzzing, UFO, 2 green lights and 2 orange lights, speeds extremely high; non human.",9/11/15,
1556,9/6/15 20:30,Red Hook,NY,USA,Formation,3 minutes,Taconic State Pkwy north; saw three groups of three white orbs floating in the sky.,9/11/15,
1557,9/6/15 18:20,Valley Stream,NY,USA,Unknown,20 minutes,"Intermittently pulsing object at very high altitude possibly low orbital, extremely slow movement, often stationary - in daylight.",9/11/15,
1558,9/6/15 12:50,Bayville,NY,USA,Flash,40 min,Small and extremely bright intermitten white light. High altitude on clear and sunny Labor Day. Did not move for at least 40 minutes.,9/11/15,
1559,9/6/15 00:02,Chazy Lake,NY,USA,Light,5 minutes,Bright orangish-red light silently moving slowly over lake.,9/11/15,
1560,9/5/15 23:00,New York City (Manhattan),NY,USA,Triangle,5,Multiple Red light objects in sky shaped as triangle formation over Hudson River,9/11/15,
1561,9/5/15 21:00,Black Creek,NY,USA,Formation,60 seconds,"Driving down unlit country road, vertical tower w/ 4 large lights moving over us-no towers in area then horizontal & disappeared.",9/11/15,
1562,9/5/15 00:00,New York City,NY,USA,Changing,10 minutes,UFO'S OVER NEW YORK CITY !!!!!!,9/17/15,
1563,9/4/15 02:30,Queens,NY,USA,,About 5-8 mins,My friend & I were going on vacation so we took the jfk airport tram around 2:30am on Sept 4th 2014,6/22/22,
1564,9/3/15 20:00,Forestburgh,NY,USA,Light,2 hours,At 8:00 pm on 9/3/2015 in Forestburgh NY we saw flashing lights in a generalized area. 6 jets flew towards it. This event lasted 2 hrs,9/11/15,
1565,9/3/15 20:00,Forestburgh,NY,USA,Light,2 hours,Saw unidentified flashing lights in a general area that was constant in one spot. As the lights were flashing I witnessed 3-4 military,9/11/15,
1566,9/1/15 05:03,Bayville,NY,USA,,20 seconds,"High-alt., bright and slowly dissipating pulses. Pulses were infrequent and not predictable. I could only see the it when it pulsed.",9/2/15,
1567,8/31/15 20:25,Hicksville,NY,USA,Formation,3-5 minutes,Orange almost twinkling sphere shaped objects. Flying from west to east. Firstly appx 8-10 in a formation of singular and dual file.,9/2/15,
1568,8/30/15 21:00,Syracuse,NY,USA,Formation,1 minute,"I stepped out of my home at approxinately 21:00 to help a stranded motorist, when I spotted four red lights in a 'Z' pattern stationary",9/2/15,
1569,8/30/15 19:45,Selden,NY,USA,Other,3 minutes,"While I was at a stop sign waiting to make a right turn i noticed,a very bright glowing light ,coming from the south east.at first i th",9/2/15,
1570,8/30/15 00:00,Syracuse,NY,USA,Sphere,15 minutes,Large bright orange craft over Syracuse.,9/2/15,
1571,8/29/15 23:55,New City,NY,USA,Sphere,10-15 minutes,"A low flying sphere was spotted, originally thought to be a shooting star, but then made some very strange maneuvers for about 10 - 15",9/2/15,
1572,8/29/15 23:50,Staten Island,NY,USA,Triangle,30 seconds,Red/orange object moving rapidly north by northeast.,9/2/15,
1573,8/27/15 21:30,Oceanside,NY,USA,Light,5 minutes,Orange lights flying set distance from one another in an arc. Single craft later observed.,9/2/15,
1574,8/27/15 20:30,Port Chester,NY,USA,Formation,1 minute,Was sitting on my roof with my wife enjoying the night viewing the stars when suddenly looking towards the east we saw what looked like,9/2/15,
1575,8/25/15 03:30,Orangeburg,NY,USA,Diamond,5-8 seconds,Saw av object flying lower than normal aircraft. It had 4 flashing bright yellow lights on each end,8/27/15,
1576,8/23/15 00:15,Kenmore,NY,USA,Egg,3 minutes,Two orange objects over niagra frontier,8/27/15,
1577,8/23/15 00:00,Rochester,NY,USA,Cross,45 minutes,Seen 2 orange orbs passing NE to N each dropped 3 small bright objects then later I used a telescope because I seen 2 bright stars that,8/27/15,
1578,8/22/15 22:12,New York City,NY,USA,Orb,20 minutes,Orange orbs of light popping out of nowhere!,8/27/15,
1579,8/22/15 21:20,New York City (Brooklyn),NY,USA,Light,60 seconds,"UFO over Brooklyn, Dyker Heights -Bensonhurst 8/22/15, approx 9:20PM EST, reddish light, no strobe or flash and in 30 -45 seconds trave",8/27/15,
1580,8/22/15,New York City (Manhattan),NY,USA,Circle,15 minutes,"My daughter and I were watching TV and I notices from the window a bright orange light, I wondered what it could be so bright then I sa",9/2/15,
1581,8/21/15 20:50,North Babylon,NY,USA,,30 seconds,"3 orbs in a triangle shape, moving SW. They disappear, and then reappear 3 seconds later, traveling the same path at 850 pm.",8/27/15,
1582,8/18/15 00:28,Staten Island,NY,USA,Cigar,2-3 seconds,"Cylinder/cigar shaped bright white lighted front, 1/5 rear yellow light- shot/flew past extremely fast and disappeared in 2-3 seconds.",8/27/15,
1583,8/17/15 20:00,New York City (East Harlem),NY,USA,Disk,5 seconds,"((HOAX)) I saw a strange whiteness in the sky which I tried to photograph, but got other photos instead.",12/21/15,
1584,8/17/15 19:50,Rome,NY,USA,Formation,5 minutes,"My girlfriend and I saw stationary, soundless, red lights in a Z formation that burned out in five minutes.",8/27/15,
1585,8/16/15 22:00,Centereach,NY,USA,Egg,2 minutes,Light that looked like flame silently moved over our heads quickly.,8/27/15,
1586,8/16/15 21:30,Rochester,NY,USA,Unknown,5 seconds,"Fast moving light, going straight up.",8/27/15,
1587,8/15/15 23:40,Bel,NY,USA,Circle,2 minutes,It first looked like a red dot with orange flames at the botom left than the whole thing moved to the left and turned comlitly orange,8/27/15,
1588,8/15/15 22:48,Utica,NY,USA,Circle,15 minutes,"Glowing red/ green ball bouncing around the sky in non human speeds and maneuvers for 15 min , truly incredible never will forget",8/27/15,
1589,8/13/15 21:30,Liverpool,NY,USA,Triangle,,Triangle shaped craft outlined with bright white lights.,8/27/15,
1590,8/13/15 03:30,Delmar,NY,USA,Orb,1 hour,Multiple white orbs of light traveling across the night sky during Perseid meteor shower,8/27/15,
1591,8/12/15 22:30,Buffalo,NY,USA,Other,<1 minute,"UFO sighted in Buffalo, New York.",8/27/15,
1592,8/12/15 21:30,Brantingham,NY,USA,Rectangle,30 minutes,Several orange glowing rectangles moving along same flight path.,8/27/15,
1593,8/9/15 03:00,Fonda,NY,USA,Circle,10 seconds,"20 small, perfectly blue and white, glowing circles.",8/13/15,
1594,8/8/15 23:25,Old Bethpage (Long Island),NY,USA,Cylinder,4 minutes,Orange Fireball flying E to W in a straight line at constant altitude.,8/13/15,
1595,8/8/15 22:26,West Falls,NY,USA,Formation,5 minutes,"I saw a very strange object zip across the sky 3 times back and forth. On the third time it stopped in my view of sight,and split to 3",9/17/15,
1596,8/8/15 22:00,New York City (Brooklyn),NY,USA,Light,>10 minutes,30 or Yellowish/Orange spheres flying slowly overhead. At one point stopping and hovering.,8/13/15,
1597,8/8/15 21:00,Cortland,NY,USA,Fireball,15 minutes,"3 bright red objects flying in random patterns. Objects would separate from each other, then come closer together.",8/13/15,
1598,8/8/15 21:00,Sayville/Blue Point (general area),NY,USA,Light,10 minutes,Two red lights disappeared.,8/13/15,
1599,8/8/15 05:15,Olmsteadville,NY,USA,Orb,minutes,I was hiking with my sister and her dog at Minerva Lake in New York. I took a series of pictures of the sky with the lake.,11/6/15,
1600,8/7/15 21:00,Old Field,NY,USA,Light,30 minutes,"On the beach N of West Meadow Beach, we saw five incidences of an orange light being launched into the sky over Smithtown Bay.",8/13/15,
1601,8/5/15 21:15,Irondequoit,NY,USA,Circle,1-2 minutes,"Five bright red lights, flying in V-formation, over Lake Ontario at night without sound with additional two behind.",8/6/15,
1602,8/1/15 23:00,Hicksville,NY,USA,Formation,7 minutes,Invasion of numerous bright orange/yellow lights across sky.,8/6/15,
1603,8/1/15 23:00,Mastic Beach,NY,USA,Light,2 minutes,"1 Greenish changing to Red light moved slowly at first then swirled around once rapidly only to disappear after 2 min., reappears.",8/6/15,
