,Date / Time,City,State,Country,Shape,Duration,Summary,Posted,Images
1756,11/9/12 06:20,Grifton,NC,USA,Oval,8-10 minutes,"Bright light staying still for about 5-6 minutes then moves across the sky, no blinking lights and slowly fades away.",11/19/12,
1757,11/8/12 21:30,Whiteville,NC,USA,Fireball,5 seconds,"I was driving down a rural Highway 701S leaving Clinton, NC going towards Myrtle Beach, SC. While in Whiteville, NC on 701S I witnessed",11/19/12,
1758,11/8/12 21:00,High Point,NC,USA,Triangle,1 minute,Slow moving Triangle made no noise,11/19/12,
1759,11/8/12 12:03,Winston-Salem,NC,USA,Disk,1 minute,2 discs.,11/19/12,
1760,11/7/12 20:35,Wilmington,NC,USA,Light,10 minutes,"Two stationary orange lights in the sky flickering on and off, fading to a reddish color before dissapearing.",11/19/12,
1761,11/3/12 21:00,Carrboro,NC,USA,Triangle,3 seconds,Black Triangle jets silently over Carrboro NC,11/19/12,
1762,11/2/12 22:00,Burnsville,NC,USA,Circle,Up to 30 min,"Glowing silverish sphere type object, with bright swirling, varying illumination. Sphere appears quite often.",12/20/12,
1763,11/1/12 16:30,Franklin,NC,USA,Unknown,about 20-30 minutes,"Disk shaped cloud, strange looking cloud moved quickly across town",11/4/12,
1764,10/31/12 22:13,Statesville,NC,USA,Circle,4 seconds,"Bright, fast, silent",11/4/12,
1765,10/31/12 22:00,Greensboro,NC,USA,Egg,15 seconds,Blue egg shaped light shot across my apartment in greensboro then disappear.,11/4/12,
1766,10/24/12 20:30,Ocean Isle,NC,USA,Light,15 minutes,These lights are unexplanable and frightening.,10/30/12,
1767,10/24/12 20:00,Sunset Beach,NC,USA,Other,45 minutes,Strange noises,10/30/12,
1768,10/24/12 20:00,Ocean Isle Beach,NC,USA,Circle,1 hour,"Red/Orange lights over Ocean Isle Beach, NC.",10/30/12,
1769,10/22/12 22:00,Salisbury,NC,USA,Changing,1 hour,Up to 3 objects spotted now for 2 years. would love to have answers!!,10/30/12,
1770,10/21/12 03:00,New Bern,NC,USA,Triangle,3 hours,I realized that at about 3:00 am as I was going outback to see the Orionid meteor shower that there was a strange jumble of lights on t,10/30/12,
1771,10/20/12 19:30,Bunn,NC,USA,Fireball,5 minutes,2 fireballs traveling across the sky,10/30/12,
1772,10/19/12 23:59,Faison,NC,USA,Oval,~2 seconds,"Faison NC, a bright oval object flashed above 3 friends and I, lit he whole area up.",10/30/12,
1773,10/16/12 20:40,Wrightsville Beach,NC,USA,Triangle,15-20 seconds,"Triangular Shaped Craft over Wrightville Beach, North Carolina",10/30/12,
1774,10/14/12 15:30,Raleigh,NC,USA,Cylinder,1 minute,A black cylindrical object seen fairly close to an airplane during daytime,10/30/12,
1775,10/13/12 23:30,New Bern,NC,USA,Orb,2 minutes,"2 red, silent, flying orbs",10/30/12,
1776,10/13/12 01:38,Cary,NC,USA,Fireball,@4 seconds,"Prior to this event, there was about 25-60 seconds of a very low vibrating hum that was almost piercing because it hit so many decibels",10/30/12,
1777,10/7/12 21:15,Avon,NC,USA,Fireball,6 seconds,"Huge orange fireball over ocean in Avon, NC.",10/30/12,
1778,10/2/12 21:00,Conover,NC,USA,Circle,15 minutes,"Sighted 3 red and white crafts moving back and forth quickly in the sky without sound in Hickory, and friends in Salisbury saw too.",10/30/12,
1779,10/2/12 10:15,Sanford,NC,USA,Triangle,3:00 minutes,Light formation,10/30/12,
1780,10/1/12 18:02,Leland,NC,USA,Oval,Unknown,3 objects in the sky looking toward Wilmington NC from Leland NC.,10/30/12,
1781,9/27/12 09:00,Raleigh,NC,USA,Circle,20 seconds,Silver circle hovering in sky,10/30/12,
1782,9/27/12 00:00,Waves,NC,USA,Circle,4 minutes,I just wanted to let you know we saw several of the fireballs traveling all over and then fade out. We went to explore further while va,10/30/12,
1783,9/26/12 22:00,Salvo,NC,USA,Circle,,If you look through binoculars Northeast over the Atlantic Ocean you will see what looks like a red circle with about 10 green dots wit,10/30/12,
1784,9/25/12 22:00,Salvo,NC,USA,Formation,10 minutes,Several bright lights in the sky over the Outer Banks,10/30/12,
1785,9/25/12 21:30,Avon,NC,USA,Sphere,5 seconds x 3,"Two hovering crafts appeared in Avon, NC, and emitted a distinct pattern of 4 circular orangish lights each.",10/30/12,
1786,9/24/12 00:00,Jacksonville,NC,USA,Light,,Blob when you see it throw a telescope.,10/30/12,
1787,9/24/12 22:30,Cary,NC,USA,Light,3 seconds,"Bright illumination in Cary, NC.",10/30/12,
1788,9/24/12 01:05,Garner,NC,USA,Light,1:07,Orange star like light slowly moving changed direction then bolted off.,10/30/12,
1789,9/22/12 23:45,Carolina Beach,NC,USA,Orb,2 minutes,"Orange Orb like spear over ocean at Carolina Beach, NC.",10/30/12,
1790,9/21/12 21:00,Salvo,NC,USA,Formation,1 hour,"Salvo, N.C. looking North towards Waves, N.C. & Rodanthe, N.C. (beach side) approx. 9:30pm & lasting over an hour 4 events on & off (th",9/24/12,
1791,9/21/12 19:05,Salvo,NC,USA,Circle,2 hours,Flying craft with orange flames underneath,10/30/12,
1792,9/21/12 13:00,Salvo,NC,USA,Disk,3 minutes,"Over Salvo, N.C. - Disc shaped objsct moving in circles, forward & backward on the drop of a dime, Very high in sky. No sound.",9/24/12,
1793,9/20/12 21:45,Goldsboro,NC,USA,Other,still ongoing,Numerous strobe lights in sky,9/24/12,
1794,9/14/12 21:50,Corolla,NC,USA,Fireball,5 minutes,Fireball over Corolla NC,9/24/12,
1795,9/12/12 20:45,Oak Island,NC,USA,Formation,5 minutes,Bright Orbs near Oak Island Pier.,9/24/12,
1796,9/12/12 20:03,Ocean Isle Beach,NC,USA,Light,15 minutes,Yellow lights,9/24/12,
1797,9/11/12 23:45,Elizabeth City,NC,USA,Light,several minutes,Saw a cluster of red lights moving at a high rate of speed with no sound over my neighborhood. Followed the lights for several minutes,9/24/12,
1798,9/10/12 22:30,Holden Beach,NC,USA,Triangle,1 hour,Large triangle formation of 3 orange fireballs followed by 8-10 small craft with erratic blinking white lights.,9/24/12,
1799,9/10/12 05:00,Nashville,NC,USA,Unknown,6,"Bright Lights Over Nashville, NC",11/6/14,
1800,9/9/12 20:00,Wilson,NC,USA,Orb,3 hours,Bright orb being chased by a jet along with several other crafts after that. very bright like the sun.,9/24/12,
1801,9/9/12 20:00,Kannapolis,NC,USA,Fireball,5 minutes,Fireball traveling in the sky,9/24/12,
1802,9/1/12 23:00,Hickory,NC,USA,Unknown,40 minutes,"Mulitcolored flashing object seen near lake Hickory, NC.",9/24/12,
1803,9/1/12 22:30,Carolina Beach,NC,USA,Teardrop,5-6 minutes,One floating orangish ember type object seen over the ocean at Carolina Beach NC,9/24/12,
1804,9/1/12 17:10,Bessemer City,NC,USA,Formation,seconds,Triangle formation as storm approached,9/24/12,
1805,9/1/12 01:30,Wilmington,NC,USA,Triangle,20 minutes,"Three white-yellowish lights and one red light in flying in a stretched out triangular formation, No Solid craft seen--transparent.",8/22/14,
1806,8/31/12 00:20,Raleigh,NC,USA,Other,5 minutes,"Two lights, one red and one small green",9/24/12,
1807,8/29/12 21:51,Charlotte,NC,USA,Fireball,30 seconds,Green fireball with orange trail following.,9/24/12,
1808,8/27/12 23:00,Corolla,NC,USA,Orb,10 minutes,5 glowing orange/red orbs seen above Outer Banks,8/29/14,
1809,8/25/12 22:25,Waxhaw,NC,USA,Circle,5 minutes,"15-20 red lights in the sky were hovering low in a staggered formation south of Charlotte for 5 min, then each moved northwest",9/24/12,
1810,8/25/12 21:00,Winston-Salem,NC,USA,Orb,10 minutes,UFO sighting in Winston-Salem NC 8/25/12 at 21:00 (9pm eastern time),9/24/12,
1811,8/25/12 05:00,Greensboro,NC,USA,Circle,20 minutes,It looked exactly like the ufo's from the some of the NASA film,9/24/12,
1812,8/24/12 22:45,Asheville,NC,USA,Circle,2-3 minutes,"Round orange light, silent and slow moving, suddenly changes direction and shrinks to a pinpoint, disappears.",9/24/12,
1813,8/24/12 21:30,Holly Springs,NC,USA,Fireball,4 minutes each,"Two bright orange fireballs cross the sky from west to east moving slowly, below clouds, no sound. The first one stopped and could see",9/24/12,
1814,8/23/12 11:30,Charlotte,NC,USA,Fireball,10.minutes,"5 orange objects over Charlotte, two mins apart",9/24/12,
1815,8/20/12 21:00,Asheville,NC,USA,Light,2 hours,West Asheville UFO Sightings,9/24/12,
1816,8/18/12 21:45,Holly Springs,NC,USA,Fireball,1 hour,"12 bright orange orbs moving across sky below clouds 1 min apart same exact path, then reduce color brightness, slow down accross sky.",8/19/12,
1817,8/18/12 21:00,Asheboro,NC,USA,Sphere,10-15 minutes,25-30 giant orange balls in the sky over Asheboro that floated and moved around then took off out of sight in the blink of the eye.,8/19/12,
1818,8/17/12 00:49,Wilmington,NC,USA,Cigar,45 seconds,Cigar-shaped object red pulses seen over Wilmington NC,8/19/12,
1819,8/16/12 21:30,Ellenboro,NC,USA,Light,5-7 minutes,Ball of light moving across the sky in a zig-zag motion.,10/3/14,
1820,8/13/12 23:00,Wilson,NC,USA,Rectangle,4 hours,"Small red and white lights hovering arond area for hours,comeing together as a triangle, moveing west with night fall",8/19/12,
1821,8/12/12 22:45,Oak Island,NC,USA,Triangle,5 minutes,"Orange cresent craft traveling west to east at Oak Island,North Carolinat at 10:45 p.m. 8/12/12",8/19/12,
1822,8/9/12 21:00,Waves,NC,USA,Fireball,5 min,"Glowing red orbs in the skys over rodanthe, nc.",8/19/12,
1823,8/7/12 22:00,Hatteras,NC,USA,Light,10 minutes,Orange Lights seen up in the night sky. They moved across the sky quickly,8/19/12,
1824,8/7/12 21:15,Buxton,NC,USA,Light,15-20 seconds,"2-3 glowing yellowish orange lights, splitting from one light in parallel lines over ocean in Buxton NC.",8/19/12,
1825,8/5/12 01:00,Wilson,NC,USA,Other,2 hours,"Bright lights look like a star, moves fast and stops, circles a standard craft, they circle the area and return to larger craft several",8/5/12,
1826,8/4/12 22:10,Hickory,NC,USA,Formation,10-15 min,"V formation of lights over Hickory, NC. (Wife's report.)",8/19/12,
1827,8/4/12 22:10,Hickory,NC,USA,Orb,5-10 minutes,Orange/Red lights seen over Catawba/Burke County NC. ((Husband's report)),8/5/12,
1828,8/4/12 22:05,Hickory,NC,USA,Triangle,2 minutes,"Orange lights forming triangle, disappeared quickly.",8/19/12,
1829,8/3/12 22:30,New Bern,NC,USA,Circle,2 minutes,Large orange circle appearing and moving across the sky at high rate of speed,8/5/12,
1830,8/1/12 20:00,Wilson,NC,USA,Circle,20 minutes,"Plane chasing a bright star like craft, very fast. I have it on video.",9/24/12,
1831,7/31/12 22:00,Huntersville,NC,USA,Orb,30 seconds,4 teenagers have a close encounter with a blue sphere and experienced temporary memory loss.,8/23/19,
1832,7/29/12 23:00,Granite Falls,NC,USA,Teardrop,About 30 seconds,Figures inside the UFO short black eyes UFO metallic color called friend andhe said he was hunting and he said he saw,8/5/12,
1833,7/29/12 21:00,Asheville,NC,USA,Cigar,2 minutes,"Two cigar shaped objects spotted over downtown Asheville, NC.",8/5/12,
1834,7/29/12 03:00,Kill Devil Hills,NC,USA,Fireball,1-2 minutes,Four fireballs moving across the night sky.,8/5/12,
1835,7/27/12 21:00,Nags Head,NC,USA,Orb,5 minutes,Orbs of light near Jeanette's Pier that vanished,8/5/12,
1836,7/27/12 19:00,Clyde (near),NC,USA,Triangle,~2 minutes,Trangular object seen over interstate.. pictures to prove it!,9/24/12,
1837,7/26/12 23:30,Avon,NC,USA,Fireball,15-20 minutes,"Around 11:30 PM on 7/26/12 me and two of my cousins were looking out over our balcony at A beachfront house in Avon, NC in a southern d",8/5/12,
1838,7/26/12 21:00,Burlington,NC,USA,Orb,1:30 minutes,Glowing ufos follow over burlington nc,8/5/12,
1839,7/25/12 22:20,Ocean Isle,NC,USA,Sphere,5 minutes,5 witnesses saw glowing reddish orange sphere in night sky slowly move parallel to ground for 5 minutes,8/5/12,
1840,7/25/12 22:00,Kure Beach,NC,USA,Orb,25 minutes,"Round dull-orange lights, stationary in the sky, over Kure Beach, NC, coastline night sky",8/5/12,
1841,7/23/12 22:00,Duck,NC,USA,Light,5-7 minutes,Two distinct red lights observed NNE of Duck within 3 - 4 minutes of one another with dramatic speed and direction changes.,8/5/12,
1842,7/23/12 05:00,Surf City,NC,USA,Formation,3 minutes,Two lights conected moving and still with small light moving around them,8/5/12,
1843,7/20/12 19:00,South Nags Head,NC,USA,Light,10 minutes,"Bright orange lights in sky seen from S. Nags Head NC, shone brightly then dimmed, reappeared north then dimmed again.",8/5/12,
1844,7/19/12 21:50,Emerald Isle,NC,USA,Sphere,20 seconds,Multiple red lights in disc shape over ocean.,8/5/12,
1845,7/19/12 21:40,North Topsail,NC,USA,Orb,20 seconds,Orange Orbs off the NC coast!,8/5/12,
1846,7/19/12 21:00,Frisco,NC,USA,Circle,4 seconds X 3,Four of us saw a huge illuminated object in the sky that has no logical explanation.,8/5/12,
1847,7/18/12 22:00,Oak Island,NC,USA,Fireball,Several seconds reoccurri,Lit up (orange in color) for a few seconds and then seemed to almost jump a distance in an instant. Light would fade and return several,8/5/12,
1848,7/18/12 22:00,Emerald Isle,NC,USA,Light,10 minutes,"There were Seven of us sitting on a 3 story deck overlooking (only one hundred feet away from) the Atlantic Ocean in Emerald Isle, NC.",8/5/12,
1849,7/18/12 21:30,Oak Island,NC,USA,Other,20:00,Large fireballing flashes on and off. Smaller white flashes move across the sky at incredible rate.,8/5/12,
1850,7/18/12 21:30,Holden Beach,NC,USA,Formation,25 minutes,"Multiple amber orbs observed over the ocean night sky for 2 straight nights in Holden beach ,NC",8/5/12,
1851,7/18/12 21:00,Calabash,NC,USA,Unknown,15 minutes,Bright yellow/orange lights in sky.,8/5/12,
1852,7/18/12 21:00,Ocean Isle Beach,NC,USA,Light,seconds,Orange lights and lots of jets,8/5/12,
1853,7/18/12 21:00,Holden Beach,NC,USA,Orb,45 minutes,Bright and flashing orbs moving and changing colors in the sky off Holden Beach.,8/5/12,
1854,7/18/12 21:00,Holden Beach,NC,USA,Formation,30 minutes,Orange bright flash then a strange formation of lights seen on the beach,8/5/12,
1855,7/18/12 21:00,Southport,NC,USA,Oval,8 minutes,Orange oval bright light in the sky that kept moving into different spots in the southern sky then went into the cloud.,8/5/12,
1856,7/17/12 23:00,Topsail Island,NC,USA,Cigar,10 seconds,Dark cigar shaped object over canal at Topsail Beach,8/5/12,
1857,7/17/12 01:10,South Nags Head,NC,USA,Cigar,5 seconds,"Greenish light, in cylindrical shape, moving across night horizon, making erratic maneuvers.",8/5/12,
1858,7/13/12 15:00,Creedmor,NC,USA,Sphere,~1 minute,Round silver objects flying at a high rate of speed and making no noise.,12/23/13,
1859,7/13/12 03:27,Charlotte,NC,USA,Triangle,9-10 seconds,Black triangle 36 sighted in backyard early AM that leaped from ground to higher branch or line.,8/19/12,
1860,7/11/12 22:15,Archdale,NC,USA,Fireball,30 seconds,Fireball which looked like a large airplane engulfed in flames,8/5/12,
1861,7/11/12 21:30,Kill Devil Hills,NC,USA,Light,:30,Sets of parallel orange lights appearing and disappearing over ocean,8/5/12,
1862,7/8/12 22:10,North Topsail Beach,NC,USA,Light,5 seconds,Fast moving reddish light moved from ocean toward land and disappeared.,8/5/12,
1863,7/6/12 23:00,Newport,NC,USA,Orb,around a minute,Two separate sightings over a few hours of multiple red orbs over the eastern carolina coast.,8/5/12,
1864,7/6/12 21:40,Carthage,NC,USA,Sphere,2 minutes,Orange glowing object East of Moore County NC towards Fort Bragg. ((NUFORC Note: Report from law enforcement officer. PD)),8/5/12,
1865,7/6/12 21:00,Kernersville,NC,USA,Fireball,5 minutes,"Two flickering fireballs moved across the sky, changing speed and direction.",8/5/12,
1866,7/5/12 03:45,Wilmington (Wrightsville Beach),NC,USA,Changing,5:10,"Moving ""stars"" and shifting shapes at Wrightsville Beach.",8/5/12,
1867,7/4/12 23:30,Concord,NC,USA,Disk,30 minutes,There was a reflection on the window of a circular disk that seemed to be going in a circular motion.,5/6/17,
1868,7/4/12 23:00,Hendersonville,NC,USA,Other,5 minutes,"Amber-colored object,shaped like a kitchen match,still, no movement,faded away.",9/13/18,
1869,7/4/12 22:00,Fayetteville,NC,USA,Orb,1:30,"I saw a red orb/sphere traveling from north to south. The object was traveling towards me. The object was about 1-2 miles high, and tur",8/5/12,
1870,7/4/12 22:00,Elizabeth City,NC,USA,Disk,8 seconds,Light-colored disc-shaped object enveleloped by reddish glow hovers slowly over houses then disappears,8/5/12,
1871,7/4/12 21:30,Hubert,NC,USA,Light,1 minute,Unknown red light or object moving from Northwest to Northeast for 1 minute before disappearing.,8/5/12,
1872,7/3/12 21:00,Nags Head,NC,USA,Orb,5-10 minutes,Silent Orange Orbs Moving From South To North Near Jennette's Pier (MP 16.5) Over the Beach in Nags Head.,9/24/12,
1873,7/2/12 21:30,Oak Island,NC,USA,Fireball,1 minute,Red ball stop to a hover and slowly disappear,7/4/12,
1874,7/2/12 20:00,Atlantic Beach,NC,USA,Light,5 seconds,((NUFORC Note: No information provided by witness. PD)),7/4/12,
1875,7/1/12 00:00,Burgaw,NC,USA,Circle,2 minutes,Bright Orange Plasma Ball Photos.,7/3/13,
1876,6/27/12 21:00,Parkton,NC,USA,Light,2 hours,Orange ball of light,8/5/12,
1877,6/26/12 12:04,Charlotte,NC,USA,Light,4 minutes,Bright orange light a luminating northwest from my home,7/4/12,
1878,6/25/12 00:30,North Cove,NC,USA,Oval,10 seconds,Roundish silver object traveling high rate of speed in NC,8/5/12,
1879,6/24/12 01:30,Burlington,NC,USA,Unknown,5 minutes,Red orbs in night sky in formation no sound. ((NUFORC Note: Date is flawed. Hoax?? PD)),7/4/12,
1880,6/23/12 23:00,Wrightsville Beach,NC,USA,Changing,25-30 minutes,multiple objects blinking different colors over ocean and 3 bright white lights scanning beach at ground level,7/4/12,
1881,6/23/12 21:30,Holly Springs,NC,USA,Disk,10 seconds,"I saw a UFO over Holly Springs, NC at 9:30 pm on June 23, 2012",7/4/12,
1882,6/21/12 22:00,Apex,NC,USA,Flash,1 minute,"Satellite ""flaring"" in the same manner on two different nights two weeks apart.",7/4/12,
1883,6/21/12 03:45,Leland,NC,USA,Unknown,15 minutes,"We saw a very bright lights from same object not moving that flickered green, red and white at same time. Brighter than any star in sky",7/4/12,
1884,6/15/12 00:30,cary,NC,USA,Circle,8 minutes,A yellow round floating ball of light in the sky right above a house across the street from me.,10/30/12,
1885,6/12/12 23:00,Jacksonville,NC,USA,Circle,3 minutes,Bright circular light in the sky with glowing lights around the object.,6/14/12,
1886,6/10/12 00:30,Greensboro,NC,USA,Sphere,3 minutes,Orange sphere seen near PTI airport,6/14/12,
1887,6/9/12 21:20,Charlotte,NC,USA,Circle,2 minutes,"Two orange circles moved slowly, then proceeded faster separated and disappeared in cloud",6/14/12,
1888,6/7/12 07:30,Winston-Salem,NC,USA,Changing,2,Formation of odd shapes that changed,6/8/12,
1889,6/6/12 23:00,Asheville,NC,USA,Teardrop,5-7 minutes,Five orange silent hot air balloon shapes ascending the night sky.,6/8/12,
1890,6/6/12 06:00,Ft. Bragg,NC,USA,Light,not sure,Four lights seen above ft. bragg,7/4/12,
1891,6/5/12 23:10,Chocowinity,NC,USA,Light,20 seconds,Big slow moving light in Chocowinity NC,6/8/12,
1892,6/2/12 22:00,Salisbury,NC,USA,Circle,10 minutes,"10 to 15 red string of lights, then started moving and eventually moved individually and dissappeared behind a cloud.",6/5/12,
1893,5/31/12 22:00,Durham,NC,USA,Light,120-140 seconds,UFO Sighting at 10 pm on Shannon rd. facing North/NE toward 15/501 The Lights first appeared insanely bright spinning counter clock w,6/5/12,
1894,5/30/12 23:00,Madison,NC,USA,Circle,drive by,UFO During Lightening Storm,6/5/12,
1895,5/28/12 23:20,Raleigh,NC,USA,Light,1 sec,Low flying bright light with no sound,5/29/12,
1896,5/28/12 21:30,Greensboro,NC,USA,Oval,,"Bright white, red and green flashing object to the west of Greensboro, NC. ((NUFORC Note: Possibly Vega? PD))",5/29/12,
1897,5/26/12 15:00,Wilmington,NC,USA,Other,45 minutes,"""Moon Lander"" Shaped UFO Stormy day.",6/8/12,
1898,5/22/12 03:00,Knighdale,NC,USA,Light,4 mins,Bright white/blue light falling slowly and fading as it fell.,5/29/12,
1899,5/22/12 01:00,Cape Fear,NC,USA,Oval,10 minutes,"Bright light off Cape Fear, NC",6/5/12,
1900,5/21/12 04:00,Durham,NC,USA,Light,30 SECONDS,"Saw a light the size and color of the moon, but descending quickly.",5/29/12,
1901,5/20/12 10:42,Holden beach,NC,USA,Triangle,30 seconds,"It seemed like just a red light coming at us at 100mph, once over us it seemed to slow down A LOT, it was triangle and had 4 lights tha",5/29/12,
1902,5/20/12 03:15,Lenoir,NC,USA,Triangle,6-7 seconds,A friend and I witnessed a possible UFO take off about 250 feet away.,10/3/13,
1903,5/19/12 21:50,Wesley Chapel,NC,USA,Oval,10.,"Orange, ovel, bright lights that change color to white",5/29/12,
1904,5/18/12 20:00,Kernersville,NC,USA,Cigar,about 5 min,strange the objects made NO sound at all.,5/29/12,
1905,5/17/12 22:00,China Grove,NC,USA,Other,2 minutes,Saw something silver explode leaving a silver trail.,5/29/12,
1906,5/15/12 23:00,Avon,NC,USA,Orb,Hour and a half,Orange orbs hovering over the beaches of North Carolina along with erratically behaving white lights,5/29/12,
1907,5/14/12 18:30,Franklin,NC,USA,Flash,20 seconds,There was a bright light in the sky that quickly flew off at a very fast speed.,6/5/12,
1908,5/13/12 02:30,Pisgah Forest,NC,USA,,1 hour,Saw many white lights about the size of grapefruits in the tree line while camping in North Carolina,5/29/12,
1909,5/11/12 21:30,Oak City,NC,USA,Orb,15 minutes,"Two red spheres seen moving fast, low and silently then disappearing in to nothing. Martin County, NC.",5/13/12,
1910,5/11/12 05:10,Lumberton,NC,USA,Triangle,3 Min,Strange triangular shaped craft in the sky.,5/13/12,
1911,5/8/12 20:50,Carolina Beach,NC,USA,Fireball,4 minutes,"3 fireballs observed above the ocean at Carolina Beach, NC",7/4/12,
1912,5/7/12 21:00,Cary,NC,USA,Other,5 minutes,"White, star-like object at dusk over Cary",7/4/12,
1913,5/5/12 23:00,Marshall,NC,USA,Disk,10 minutes,UFO orbiting supermoon?,5/13/12,
1914,5/4/12 00:38,Jamestown,NC,USA,Oval,2 minutes,Fiery reddish oval made from strings of light hovering.,5/13/12,
1915,5/3/12 22:15,Kernersville/Colfax area,NC,USA,Light,between a hour or more,This is a small light that appears in one spot each night that changes diff. colors. ((NUFORC Note: Sighting of star or planet? PD)),5/13/12,
1916,5/2/12 23:35,Carrboro,NC,USA,Circle,Five Minutes,"We were walking at night, and saw a large object (about 1/3 the size of the moon) that appeared to be a ball of fire moving in the sky",6/8/12,
1917,5/1/12 23:20,Huntersville,NC,USA,Rectangle,2 min,bright red orange and yellow,5/13/12,
1918,4/29/12 20:15,Cary,NC,USA,Egg,3 minutes,"Round suv-sized object seen traveling, hovering, traveling, just after sunset; no lights, no sounds",5/13/12,
1919,4/28/12 21:00,Charlotte,NC,USA,Triangle,40 seconds,Red Lights Over East Meck High,5/13/12,
1920,4/27/12 21:40,Greensboro,NC,USA,Sphere,1 to 2 minutes,"UFO over Greensboro, NC 4-27-12 looked like Jupiter but moving very slow all the way across the sky. ((NUFORC Note: ISS? PD))",5/13/12,
1921,4/24/12 21:00,Marshville,NC,USA,Circle,20 minutes,Three strange crafts circling over head,5/13/12,
1922,4/24/12 14:00,Raleigh,NC,USA,Cylinder,Few seconds,Dark cylinder hanging motionless in the sky near a jet.,4/26/18,
1923,4/23/12 21:14,St. Helena,NC,USA,Triangle,2-3 seconds,Triangulum Gargantua UFO,5/15/13,
1924,4/21/12,Wilmington,NC,USA,Orb,,"I was on our patio, facing East-South East and they came in the same direction over the treeline. I was on the phone with my father at",5/13/12,
1925,4/20/12 23:21,New Bern,NC,USA,Unknown,3 seconds,Amateur Skywatcher Notes Unusual Object Dynamics,5/13/12,
1926,4/20/12 22:00,Concord,NC,USA,Light,>1 hour,Bright light in the sky. Disappears and reappears.,5/13/12,
1927,4/16/12 22:50,Charlotte,NC,USA,Light,10 minutes,"Red, blue, and green twinkling lights in western Charlotte, NC sky. ((NUFORC Note: Possible sighting of Venus or Sirius?? PD))",4/18/12,
1928,4/14/12 23:15,North Wilkesboro,NC,USA,Light,3-5 minutes,Glowing red light in night sky,5/13/12,
1929,4/11/12 21:00,Holden Beach,NC,USA,Light,5-6 minutes,Bright red light with a flashing center that followed my flash light beam for over five minutes.,5/13/12,
1930,4/11/12 21:00,Holden Beach,NC,USA,Light,5 minutes,The red ligt was follwiing my flashlight.,5/13/12,
1931,4/11/12 20:45,Kernersville,NC,USA,Light,1min -2min,Light moved across sky no sound made very hard turns and moved side to side way to fast to be a plane it moved like a balloon that was,5/13/12,
1932,4/9/12 21:30,Frisco,NC,USA,Orb,2 hours,"Reddish orbs over Frisco, NC",4/18/12,
1933,4/9/12 21:00,Carolina Beach,NC,USA,Fireball,About 15 minutes the firs,Orange-pink lights/fireballs. Appeared singly and in pairs/patterns over the ocean. Could've been weaponry.,4/18/12,
1934,4/9/12 20:45,Raleigh,NC,USA,Light,2 minutes,"A bright white light that was extremely fast with no sound, ejected 2 smaller objects in opposite directions.",4/18/12,
1935,4/9/12 20:45,Moravian Falls,NC,USA,Unknown,< 10min,Bright object seen over Moravian Falls NC,4/18/12,
1936,4/7/12 21:28,Asheville,NC,USA,Fireball,5:00,Three orange dots rising from horizon and dying out one by one,5/13/12,
1937,4/4/12 23:00,Concord,NC,USA,Light,30 minutes,I was driving to my house from my friends house which is about 15 minutes away from my house. As I was driving I looked up at the sky,4/18/12,
1938,4/2/12 22:30,Yadkinville,NC,USA,Unknown,30 mins,Bright slow moving light.,4/18/12,
1939,4/2/12 02:00,Graham,NC,USA,Triangle,15 seconds,Strange black triangle flew over my home!,12/20/12,
1940,3/31/12 00:15,Hiddenite,NC,USA,Unknown,5 hours,Green/white lights of several UFOs seen by two private citizens.,4/18/12,
1941,3/27/12 21:45,Lillington,NC,USA,Formation,5-10 minutes +,3 red and white blinking lights stationary in sky,5/13/12,
1942,3/27/12 21:20,Wrightsville Beach,NC,USA,Triangle,20 minutes,"2 triangle objects and 1 sphere object, dancing and hovering in sky, red, purple, green, pink, very bright white lights.",5/13/12,
