,Date / Time,City,State,Country,Shape,Duration,Summary,Posted,Images
2504,6/24/08 22:00,Greensboro,NC,USA,Chevron,5 seconds,"Chevron shaped UFO over skies of Greensboro, NC",7/5/08,
2505,6/24/08 13:30,Silver City,NC,USA,Other,photo,Triangle and Disc photos taken after electrical disturbance in home.,7/5/08,
2506,6/17/08 21:31,Clinton,NC,USA,Fireball,10 Seconds,"Clinton NC, around 21:31 hours an orange circular object was spotted west of U.S. Highway 421, it remained visible for only 10 seconds",7/5/08,
2507,6/13/08 17:00,Statesville,NC,USA,Triangle,,((HOAX??)) My friend and I saw a Triangular craft fly above her house.,8/12/08,
2508,6/6/08 23:00,Mebane,NC,USA,Unknown,approx 2 minutes,"strange moving light in the night sky above Mebane, North Carolina",6/12/08,
2509,6/5/08 02:08,Charlotte,NC,USA,Circle,3 hours,"Moving Craft Overlooking Charlotte, NC",6/12/08,
2510,6/2/08 21:00,Boomer,NC,USA,Triangle,five minutes,Triangular undentified flying object/aircraft traveled in a south western direction over boomer nc june 08.,2/14/10,
2511,6/2/08 12:00,Rodanthe,NC,USA,Triangle,unknown,Black unexplained trangle rodanth NC,7/5/08,
2512,5/25/08 16:00,Charlotte,NC,USA,Unknown,,"UFO seen over NASCAR race in Charlotte, NC - Memorial Day weekend - May 25, 2008",7/5/08,
2513,5/22/08 08:23,Durham,NC,USA,Cigar,,unbelievable ufo in sky,6/12/08,
2514,5/19/08 03:40,Pittsboro,NC,USA,Light,two seconds,"As a sixty-year old, i oftentimes wake up in the middle of the night-unable to sleep. Last week, (i wrote down somewhere the exact d",6/12/08,
2515,5/14/08 00:30,Charlotte,NC,USA,Cylinder,3 seconds,On 5-14-2008 at about 0030 hours I observed a very bright glowing green object(almost neon green) descending from the sky towards the g,6/12/08,
2516,5/10/08 03:30,Pittsboro,NC,USA,Light,three seconds,"One brillian pin-point of light appeared, without a trail or tail ,then dissappeared",7/5/08,
2517,5/3/08 12:00,Silver City,NC,USA,Sphere,5 minutes,Black Sphere observed flying low over town in broad daylight,6/12/08,
2518,4/30/08 23:08,New Bern,NC,USA,Flash,?,"Flashing, stationary type light",6/12/08,
2519,4/25/08 13:00,Durham,NC,USA,Oval,2 min,Object viewed over I-40 during daylight,6/12/08,
2520,4/21/08 23:30,Durham,NC,USA,Triangle,3 to 4 min.,"large triangular craft with 5 lights1 a red blinking light,hovering until i arrived right next to it and slowly dissappeared",6/12/08,
2521,4/19/08 23:00,Silk Hope (near),NC,USA,Disk,3-4 minutes,"Three people saw disc-shaped craft with chaser lights, flying slowly and smoothly at high altitude, 4/19 at 2300.",1/10/09,
2522,4/16/08 15:40,Durham,NC,USA,Disk,10 seconds,Shiney Blob of Metal Hovering in Broad Daylight Durham NC,4/17/08,
2523,4/15/08 21:30,Cary,NC,USA,Unknown,5 Minutes,"Stationary Light Flashing Erratically, and Low Flying Object. ((NUFORC Note: Possible sighting of Sirius?? PD))",4/17/08,
2524,4/15/08 10:45,Moravian Falls,NC,USA,Unknown,30 sec,"Seen while driving on Price road off Hy 16 inMoravian Falls. I TOOK it to be Sirius, as thats what it looked like. From my view point a",6/12/08,
2525,4/14/08 03:58,Chapel Hill,NC,USA,Fireball,1-2 Sec,Bright descending burst of light.,6/12/08,
2526,4/10/08 22:00,Franklinton,NC,USA,Other,10 days,Constantly viewing organisms or unidentified object with a telescope...much activity---,6/12/08,
2527,4/10/08 20:44,Greenville,NC,USA,Formation,12-15 seconds,"four large greenish hazy lights, in straight line formation, moving very fast, no sound",4/17/08,
2528,4/8/08 22:35,Statesville,NC,USA,Changing,approximately 7 minutes,"Brightly lit, triangular craft flying closely over my home.",6/12/08,
2529,4/2/08 00:20,Cramerton,NC,USA,Flash,3-4 minutes,Flashing light (multiple colors) in the skys over cramerton and ranlo nc just above the horizon. ((NUFORC Note: Sirius?? PD)),4/17/08,
2530,3/28/08 20:30,Shelby,NC,USA,Light,16 minutes,"March 28, 2008 I sighted two orange objects stationary near Sirius. One orange star like in appearance was at the three oclock positi",6/12/08,
2531,3/27/08 22:00,Pope AFB,NC,USA,Triangle,1-2hrs,Objects could be F-117s,6/12/08,
2532,3/27/08 21:35,Raleigh,NC,USA,Triangle,15 seconds,Large triangle shaped object with 2 lights flying low to the ground over a major highway,3/31/08,
2533,3/26/08 20:30,Hatteras Village,NC,USA,Light,45 seconds,"3 orange lights appeared in a line,one blinked out only to reappear above the next in line,it happened 3-4 times then lights disapeared",4/17/08,
2534,3/21/08 20:00,Charlotte,NC,USA,Light,2-3 seconds,Bright green light disappeared above Charlotte skyline.,3/31/08,
2535,3/21/08 12:55,Charlotte,NC,USA,Circle,2 minutes,white circular object falls in behind commercial liner-middle of day,3/31/08,
2536,3/21/08 12:55,Charlotte,NC,USA,Circle,30 seconds,My first true UFO sighting!,3/31/08,
2537,3/20/08 22:00,Rocky Mount,NC,USA,,,Strange events in suburbia.,3/31/08,
2538,3/15/08 21:30,Wadesboro,NC,USA,Formation,2 MINUTES,7 Red lights in a straight line they were there no noise no movement and were gone,7/5/08,
2539,3/15/08 14:00,Winston-Salem,NC,USA,Triangle,3 min,red white and blue lights rippling black on the bottom huge!!,3/19/09,
2540,3/8/08 22:30,Gastonia,NC,USA,Light,15-25 seconds,"Observed 5-6 reddish orange lights traveling acroos the sky in a formation, then they swirled around and disappeared.",3/31/08,
2541,3/8/08 21:00,Salisbury,NC,USA,Cylinder,2 minutes,STRANGE SILVERY OBJECT HANG'S IN THE SKY DISPITE HIGH MARCH WIND'S!!...,3/31/08,
2542,3/5/08 22:00,Southport,NC,USA,Fireball,10-14 seconds,We were fishing at night for trout when I looked up in the sky and saw a large fireball moving very rapidly across the sky. I asked my,3/31/08,
2543,3/4/08 00:00,Roper,NC,USA,Light,4 minutes,"A bright golf ball-sized light was centered on my rear view mirror, then jetted quickly to the left and disappeared.",3/19/09,
2544,3/1/08 23:00,Albemarle,NC,USA,Chevron,five seconds,"Faint chevron-shaped object over Albemarle, NC.",12/12/09,
2545,2/29/08 07:04,Elm City,NC,USA,Unknown,5 seconds,I saw a bright light that was intensly brilliant for a short moment than dimly traveled in a southerly direction.,3/4/08,
2546,2/28/08 12:00,Hickory,NC,USA,Unknown,30 min,The chrome dot never moved from its position.,3/4/08,
2547,2/27/08 19:44,Havelock,NC,USA,Triangle,4 minutes,"At 7:44 PM, on February 27th 2008, I was on my way home when I saw a massive object on the corner of my eye. I looked to see what it wa",3/4/08,
2548,2/25/08 20:20,Greenville,NC,USA,Light,5mins,"A light with no blinking lights at all. ((NUFORC Note: possible satellite, or tumbling booster, we wonder. PD))",3/4/08,
2549,2/20/08 22:40,Fayetteville,NC,USA,Orb,5 seconds,"UFO observed in front of the Moon during FULL Lunar Eclipse 20 February 2008 in Fayetteville, NC",6/9/09,
2550,2/17/08 20:00,Weddington,NC,USA,Circle,1-2 minutes,"A round object with 4 bright lights in the front hovered, flew away, and dissapeared",3/4/08,
2551,2/13/08 23:30,Ayden,NC,USA,Oval,3 seconds,Unexpected UFO Sighting,3/4/08,
2552,2/8/08 11:32,Wallace,NC,USA,Other,30 seconds,Boomerang type object hovvering silently right above the treetops.,3/19/09,
2553,1/31/08 06:47,Charlotte,NC,USA,Unknown,45 minutes,Two lights in the sky as the sun came up,2/14/08,
2554,1/30/08 21:00,Advance,NC,USA,Other,approx=3-4hrs,Organized movement of mulitple lights/objects....in a circular pattern. ((NUFORC Note:,2/14/08,
2555,1/28/08 16:20,Rocky Mount,NC,USA,Other,15 seconds,Witnessed a bright stationary object seen next to passing jet travelling at cruise altitude.,12/12/09,
2556,1/26/08 19:00,Charlotte,NC,USA,Formation,30 minutes,5 bright flashing lights hovering horizontally in Charlotte NC sky at night,2/14/08,
2557,1/25/08 22:00,Maiden,NC,USA,Circle,15 minutes,"Strange Object/Light over Maiden, NC Area",2/14/08,
2558,1/22/08 05:00,Fayetteville,NC,USA,Unknown,10 minutes,Brilliant amber light in sky near Fayetteville NC,2/14/08,
2559,1/18/08 21:00,Cherryville,NC,USA,Triangle,20 seconds,Triangle shaped object seen in NC sky,1/21/08,
2560,1/15/08 21:00,Warrenton,NC,USA,Circle,10 seconds,Craziest thing ive ever seen,9/24/12,
2561,1/15/08 19:00,Chapel Hill,NC,USA,Triangle,1-2 minutes,Flying Triangle,1/21/08,
2562,1/4/08 20:37,Indian Trail,NC,USA,Disk,Evening,"Two UFOs almost crash into each other, one is gone, the other sits and glides, then sits, then glides.",1/21/08,
2563,12/31/07 19:30,Lake Toxaway,NC,USA,Oval,8-10 seconds,White streak with firey tail traveled horizonally from western horizon to eastern horizon in 10 seconds,1/21/08,
2564,12/14/07 19:15,Cary,NC,USA,Sphere,10-15 seconds,"Large round bright object seen flying above tree line in Cary, NC",3/4/08,
2565,12/12/07 21:25,Raleigh,NC,USA,Light,3 minutes,suspicious flashing light white light at Kemp Rd and Highway 98,3/4/08,
2566,12/12/07 16:00,Charlotte,NC,USA,Changing,10 minutes,it felw constant changing shapes,3/4/08,
2567,12/10/07 19:20,Baton,NC,USA,Other,25 min,slow-moving comet like tail with single strobe over western north carolina. ((NUFORC Note: Missile venting fuel in space. PD)),1/21/08,
2568,12/10/07 19:00,High Point,NC,USA,Other,25 minutes,7:00 PM in the evening I noticed what looked immediately like a bright comet. ((NUFORC Note: Missile venting fuel in space. PD)),3/4/08,
2569,12/10/07 18:45,Pittsboro,NC,USA,Cone,45 minutes,"Unexplained object moving SW to NE over North Carolina skies, tracked via refractor telescope. ((NUFORC Note: Missile fuel. PD))",3/4/08,
2570,12/4/07 19:30,Sylva,NC,USA,Triangle,10 seconds,Triangle shaped object in WNC,3/4/08,
2571,12/3/07 21:45,Monroe,NC,USA,Other,ONGOING,Monroe NC Unexplained stationary hovering lights. ((NUFORC Note: Celestial bodies?? PD)),3/4/08,
2572,11/28/07 17:45,Kings Mountain,NC,USA,Diamond,15 minutes,Diamond shaped object over Kings Mountain,3/4/08,
2573,11/21/07 05:30,Gastonia,NC,USA,Diamond,15 minutes,"Object moved straight up, left, right then back to center",11/28/07,
2574,11/18/07 18:15,Pittsboro,NC,USA,Other,15 sec,"Bright Green light, square shape",11/28/07,
2575,11/9/07 18:30,Indian Trail,NC,USA,Light,about 2 seconds,"a bright red light seen to grow in size and intensity, then vanish. ((NUFORC Note: Sighting of Iridium satellite flare?? PD))",11/28/07,
2576,11/5/07 13:00,Lincolnton,NC,USA,Cigar,5 min,cigar shaped ufo silver in color then flashed a bright light then vanished,11/28/07,
2577,11/3/07 19:30,Benson,NC,USA,Triangle,1 second,"I saw a very brief sighting, of what I would describe as a stealth craft. It was dark gray colored, and the best that I could tell, was",11/28/07,
2578,11/1/07 23:45,Mars Hill,NC,USA,Circle,seconds,extremely bright green ball of light,11/28/07,
2579,11/1/07 19:30,Hertford,NC,USA,Light,8 seconds,bright star flashed then receded. ((NUFORC Note: Possibly the flare from an Iridium satellite. PD)),11/28/07,
2580,10/28/07 20:42,Leicester,NC,USA,Disk,digial photo,Digital pictures of alien ship in Leicester NC,11/28/07,
2581,10/21/07 02:00,Mooresville,NC,USA,Unknown,8 seconds,4 bright lights traveling at a very high rate of speed.,11/28/07,
2582,10/21/07 00:00,Zebulon,NC,USA,Disk,,It was a circle shape with a very bright Florissant lights glow to it,11/28/07,
2583,10/13/07 20:28,Mooresville,NC,USA,Light,5 minutes,"Three large, round, bright orange lights coming together in the form of a rotating triangle",11/28/07,
2584,10/9/07 21:33,Waynesville,NC,USA,Disk,Longer than a cigarette b,"Large glowing disk at Max Patch, NC...... abduction?",11/28/07,
2585,10/8/07 23:55,Newport,NC,USA,Changing,almost 1 hour,"Bright blinking rows of lights with a red light that changed position, hovering in the northern and northwest sky.",11/28/07,
2586,10/5/07 20:00,Clemmons,NC,USA,Diamond,30 min,"Sparkling light, looks like a star, but flashes rainbow colors. Stays stationary. In Northwest sky. ((NUFORC Note: Star?? PD))",10/8/07,
2587,10/5/07 19:30,Clemmons,NC,USA,Light,1.5 Hours,"A very slow moving cluster of bright, brilliant lights",10/8/07,
2588,10/3/07 00:00,High Point,NC,USA,Triangle,15 mins,bright lights spinning in the sky,10/8/07,
2589,10/1/07 20:00,Tryon,NC,USA,Light,10 seconds,Strange lights in NC sky.,10/8/07,
2590,10/1/07 19:00,Beulaville,NC,USA,Triangle,5 sec,Green Glowing Triangular Craft,10/31/08,
2591,10/1/07 09:50,Charlotte,NC,USA,Light,20MIN,4 DOTS OF LIGHT AROUND MOON MID MORNING TODAY,10/8/07,
2592,9/30/07 18:30,Clarkton,NC,USA,Other,5 Minutes,This was a reddish vertical streamer that drifted to the south and was in the western sky.,10/8/07,
2593,9/26/07 21:20,Kure Beach,NC,USA,Orb,30 seconds,"2 groupings of 3 and 4 bright orange round lights over the ocean horizon off the shore at Kure Beach, NC.",10/8/07,
2594,9/25/07 21:30,Shelby,NC,USA,Circle,10 sec,"Round, lighted object over Shelby, NC, hovered then zoomed away. ((NUFORC Note: Possible hoax?? PD))",8/5/09,
2595,9/25/07 21:05,Wilmington,NC,USA,Light,60 seconds,Multiple orange lights over ocean in eastern sky of North Carolina,10/8/07,
2596,9/18/07 20:40,Kannapolis,NC,USA,Triangle,7-10 seconds,triangular reddish reflective object flying South,11/28/07,
2597,9/16/07 22:00,Asheville,NC,USA,Chevron,12 seconds,"Boomerang shaped object, glowing pink, red and yellow flying south.",10/8/07,
2598,9/4/07 22:30,Emerald Isle,NC,USA,Rectangle,3 to 4 seconds,"Three vertical rows of huge bright red lights observed in Emerald Isle, NC over the ocean under Mars in the sky.",10/8/07,
2599,9/2/07 23:39,Charlotte,NC,USA,Unknown,5-7 seconds,Grayish object flying fast North to south over Independence Blvd,10/8/07,
2600,8/30/07 21:00,Sneads Ferry,NC,USA,Other,2 minutes,Two UFO's appear over a small neighbourhood in North Carolina.,10/8/07,
2601,8/24/07 23:00,Clayton,NC,USA,Circle,20 seconds,Steady bright white ball of light moving above tree line and then disappears in cloudless sky,10/8/07,
2602,8/22/07 21:00,North Wilkesboro,NC,USA,Diamond,25-30 seconds,Diamond-shaped light flying silently,10/8/07,
2603,8/21/07 20:45,Charlotte,NC,USA,Disk,10 minutes total,Disk-Shaped Objects w/ Red and White Lights Over Incoming Flight Path of Charlotte-Douglas International Airport,10/8/07,
2604,8/21/07 12:00,Topsail Island,NC,USA,Disk,1 hour,((HOAX??)) silver disk.,10/8/07,
2605,8/17/07 21:00,Kannapolis,NC,USA,Diamond,1 hour,Multiple sightings of star like object moving in rapid precise movements across the night sky. ((NUFORC Note: Sighting of Sirius? PD),10/8/07,
2606,8/15/07 21:00,Cary,NC,USA,Light,10 seconds,walked out on back deck at twilight time red -white lite just above tree line cruises by heading west very very fast no noise or trail,10/8/07,
2607,8/14/07 04:00,Charlotte (Matthews),NC,USA,Disk,3 minutes,"Saucer shaped object hovers then suddendly dissappears, only to reappear again",8/14/07,
2608,8/5/07 22:00,Oak Island,NC,USA,Other,30 Minutes,"3 green lights in horizontal formation converged into 1 bright orange light, 3 oranage lights reappeared in triangular formation",10/8/07,
2609,8/4/07 03:30,Wilmington,NC,USA,Fireball,5 seconds,"Fireball O'er Wilmington, NC. Unexplicable illuminations",8/7/07,
2610,8/2/07 21:30,Garner,NC,USA,Light,1 min,Bright white light moves across sky and stops suddenly and reverses,8/7/07,
2611,8/2/07 21:00,New Bern,NC,USA,Other,10 MIN.,SEVERAL SMALL CRAFT WITH VERY LARGE WING SHAPED CRAFT THAT MADE NO NOISE,8/7/07,
2612,7/27/07 22:40,Rowland,NC,USA,Teardrop,3-5 Seconds,Neon Green object appears from behind cloud and Shoots faster than lightning across Sky.,8/7/07,
2613,7/21/07 22:30,Cornelius,NC,USA,Oval,20 seconds,An orange glowing object that made no noise nor did it move. After twenty seconds the light just slowly went out and was gone.,8/7/07,
2614,7/16/07 23:30,Angier,NC,USA,Circle,my house,me and my uncle saw a bright red circle shape object,8/7/07,
2615,7/16/07 22:40,Wilmington,NC,USA,Triangle,Under ten sec.,Triangular object with lights rotated as it flew over me.,8/7/07,
2616,7/10/07 00:00,Oak Ridge,NC,USA,Rectangle,"twice, both times were ab","rectangle shaped, low flying object over Oakridge, NC",8/7/07,
2617,7/4/07 22:15,Norwood,NC,USA,Cylinder,five minutes,"Cylinder, Amber Colored, no blinking lights, moving from South-to-North, extremely clear night.",8/7/07,
2618,6/28/07 21:30,Robbinsville (near),NC,USA,Light,5 minutes,"Four orange lights seem in Graham county, North Caroline.",8/7/07,
2619,6/25/07 22:30,Fayetteville,NC,USA,Cigar,10 seconds,"I was driving up to Raleigh, NC on I-95 N from Fayetteville, NC to visit some friends. It was about 10:30 at night. I am pretty sure it",8/7/07,
2620,6/23/07 02:30,Salisbury,NC,USA,Disk,5 to 10 sec,Very Strange UFO Sighting!!!!,3/4/08,
2621,6/20/07 22:45,Hendersonville,NC,USA,Other,90seconds,2 stars slowly moving in unison and climbing the sky until that faintly and slowly disappeared. ((NUFORC Note: ISS w/ Shuttle. PD)),8/7/07,
2622,6/4/07 22:20,Kannapolis,NC,USA,Oval,30 Sec,Glowing oval object over North Carolina sky,6/12/07,
2623,5/30/07 21:00,Hubert,NC,USA,Sphere,1 minute,2 blinking lights observed from back porch for 1 minute duration. No sound. Dogs barking.,6/12/07,
2624,5/26/07 19:00,Wilmington,NC,USA,Oval,20 minutes,"Near ILM airport ,before dusk we saw a oval orange tinted object not moving at first and then slowly moved and disapeared.",6/12/07,
2625,5/12/07 22:00,Asheville,NC,USA,Disk,,blue red bright lights stood still for approx one hour,6/12/07,
2626,5/12/07 00:00,Lake Jocassee,NC,USA,Light,00:05 (~5 min),"Light size color and brightness of venus appears in sky and moves changing direction and hovering without noise, responded to a flare.",6/12/07,
2627,5/5/07 03:00,Hendersonville,NC,USA,Light,5 seconds,Do Stars shoot up?,6/12/07,
2628,5/1/07 23:45,Pinnacle,NC,USA,Rectangle,3-5 minutes,"Rectangular object in the direction of HighWay 52 south, no sound, not moving, 2 amber colored lights",6/12/07,
2629,4/30/07 23:00,Wilson,NC,USA,Cigar,10 minutes,2 dark cigar shaped objects in night sky,6/12/07,
2630,4/22/07 09:55,Charlotte,NC,USA,Fireball,split second,I thought it was a firework at first...then I realized it was too big and way too fast. We live about 15 miles from airport....this wa,4/27/07,
2631,4/18/07 23:30,Black Mountain,NC,USA,Rectangle,15 seconds,On our way home we saw a large object with several lights stationary in the sky.,4/27/07,
2632,4/16/07 08:45,Kannapolis,NC,USA,Disk,10 sec.,"Top &bottom of chrome disk in morning sky for 10-15 seconds,then it disapears!!",4/27/07,
2633,4/14/07 23:30,Raleigh,NC,USA,Triangle,4 seconds,"Glowing green triangle moving at a very fast pace, stopping, flew away even faster, no noise over RBC Center.",6/27/11,
2634,4/14/07 22:00,Raleigh,NC,USA,Triangle,7 seconds,Bright Green Triangle in sky zooms ahead and disappears in an instant.,4/27/07,
2635,4/9/07 21:17,Charlotte,NC,USA,Oval,6 min,"Weard light moving southeast of Charlotte, oval shape moving really slow",4/27/07,
2636,4/9/07 14:20,Spindale,NC,USA,Oval,2 minutes,"Oval object over Forest City, NC moving fast, then abrutly changing direction and altitude",4/27/07,
2637,4/1/07 21:00,Marion,NC,USA,Circle,5 Minutes,Lights with no aviation lights visable every night with large binoculars,4/27/07,
2638,4/1/07 03:00,Mooresville,NC,USA,Fireball,3+ Hours,Star appearance with rapid accelerations and instant major changes of velocity for over two hours witnessed by 5 people with some video,4/27/07,
2639,3/28/07 19:00,Cary,NC,USA,Teardrop,1-2 min,2 red UFOs shuts off electrical equipment and makes noise.,4/27/07,
2640,3/24/07 21:35,Monroe,NC,USA,Orb,2 Minutes,Blinking light being chased by a military (?) aircraft...,4/27/07,
2641,3/20/07 01:00,Charlotte,NC,USA,Orb,4 hours,((HOAX??)) I am actually a little freaked out that I am even in a position where I reporting something like this.,4/27/07,
2642,3/15/07,North Wilkesboro,NC,USA,Other,,"Images of unidentified ""object"" accidentally located while viewing on maps.google.com ""Streetview"" in North Wilkesb",12/30/16,
2643,3/14/07 22:19,Eden,NC,USA,Rectangle,two to three seconds,Extremely fast moving lights in North Carolina,4/27/07,
2644,3/13/07 21:30,Jacksonville,NC,USA,Other,1 hour,Large wing shaped mother ship with over 80 small craft formation,4/27/07,
2645,3/12/07 00:00,Hendersonville,NC,USA,Light,30 seconds,Local TV station reports green light in skies over NC.,8/7/07,
2646,3/1/07 00:30,Charlotte,NC,USA,Light,2-3 minutes,bizarre orange lights over south charlotte,3/8/07,
2647,2/28/07 12:30,Charlotte,NC,USA,Circle,1 min,"Very disturbing sight. Bright lights, tones of blue and white, and EXTREMELY loud rumbling noise.",3/8/07,
2648,2/25/07 22:20,Horseshoe,NC,USA,Fireball,5-8 seconds,A fireball burning a bright greenish-yellow streaked across the road I was driving on.,3/8/07,
2649,2/24/07 19:00,Oak Island,NC,USA,Fireball,20 minutes,"Huge light source, movement, flashing lights seen over Oak Island, North Carolina",3/8/07,
2650,2/22/07 21:00,Jefferson (7 miles east of),NC,USA,Light,15 -20 seconds,"I saw a bright, orangish light in the sky that turned off, leaving no trail or any evidence that it was a search/landing light.",2/24/07,
2651,2/21/07 21:17,Spruce Pine,NC,USA,Fireball,3-5 min.,large neon green ball with greenand white tail shooting across sky. ((NUFORC Note: Possible meteor. PD)),2/24/07,
2652,2/15/07 11:15,Kernersville,NC,USA,Cylinder,2.00 mins.,My wife and I were traveling on I-40 the day after valentines when we noticed what we thought was an airplane moving so slowly that it,4/27/07,
2653,2/14/07 05:15,Mount Airy,NC,USA,Light,coming home,starship UFO over Mount Airy NC,2/24/07,
2654,2/10/07 00:00,Lillington,NC,USA,Circle,2 min,wird light,8/14/07,
2655,2/4/07 21:45,King,NC,USA,Unknown,seconds,Was the brightest red to orange colored object I have ever seen in the sky.,2/24/07,
2656,2/1/07 23:30,Charlotte,NC,USA,Oval,3 seconds,"a very high, fast, orange UFO over Charlotte NC",4/27/07,
2657,1/26/07 04:10,Rocky Mount,NC,USA,Other,1 minute,"Huge combination of shapes, lit up with individual white, bright light",2/1/07,
2658,1/24/07 20:00,Franklin,NC,USA,Fireball,3 secs,Green ball of light over Western NC,2/1/07,
2659,1/24/07 20:00,Leicester,NC,USA,Circle,2minutes,Green ball of light falls from the sky,2/1/07,
2660,1/24/07 20:00,Charlotte,NC,USA,Other,About an hour,UFO spotted over NC & SC.,2/1/07,
2661,1/24/07 19:00,Asheville,NC,USA,Unknown,4 hours,"Large Sighting of Green Lights Seen In WNC During Night Of Jan 24th,",2/1/07,
2662,1/24/07 12:10,Bunn,NC,USA,Cigar,5 min,"large bright white, cigar shaped objected moving right to left while heading southeast on Old Halifax Road, near Bunn, NC",2/24/07,
2663,1/24/07,Lake Norman,NC,USA,,,AP article: just passing this on .. UFO sighting in N.C. made AP wire on 1/26/07 (sighting was 1/24 I think),2/1/07,
2664,1/20/07 08:31,Kannapolis,NC,USA,Rectangle,5min,UFOs that have humans coming out of them!!!!,2/1/07,
2665,1/17/07 00:15,Winston-Salem (S of; around Tyro?),NC,USA,Other,6 or 7 seconds/ a few min,In the early hours of 1-17-07 I saw two unidentified flying objects within minutes of each other on US150E.,2/1/07,
2666,1/16/07 21:00,High Point,NC,USA,Chevron,5 min,V-shaped craft hovering near High Point,2/24/07,
2667,1/16/07 18:30,High Point,NC,USA,Triangle,5 minutes,Driving under a strange hovering craft looking like a triangle plane.,2/1/07,
2668,1/15/07 19:00,Fayetteville,NC,USA,Light,7 min,Two bright star like objects swooping down then hugging tree line....,4/27/07,
2669,1/14/07 18:23,Carrboro,NC,USA,Circle,30 minutes,Flying object seen making darting and odd manuevers for 30 minutes.,2/1/07,
2670,1/10/07 22:00,Hayesville,NC,USA,Circle,15 minutes,Flashing differant colors and expanding and contracting of craft,6/12/08,
2671,1/9/07 06:00,Dunn,NC,USA,Other,30,The lights seemed to be moving as if on a solid object.,2/1/07,
2672,1/3/07 18:15,Burlington,NC,USA,Circle,1 minute,The object was bright and made a left turn then started to ascend and pick up speed and shot upward and disappeard from view.,2/1/07,
2673,1/3/07 17:00,Charlotte,NC,USA,Light,30min,Slow moving then became still light in the sky over Lake Wylie 01/03/07 5:30pm,2/1/07,
2674,12/27/06 02:00,Mocksville,NC,USA,Circle,2 min.,Bright white object seen with one bright white missile-like object shooting out from the bottom,2/1/07,
2675,12/26/06 15:14,Raleigh,NC,USA,Changing,10 seconds,Daylight sighting of a star-shaped object,2/1/07,
2676,12/18/06 23:30,Apex,NC,USA,Triangle,2 min,I was down at jordan lake playing guitar and it was a clear night and i could see all the stars. I saw one light off in the distance c,2/1/07,
2677,12/14/06 19:30,Dunn,NC,USA,Triangle,10 minutes,Triangle shaped craft seen,2/1/07,
2678,12/9/06 20:53,Greensboro,NC,USA,Light,About Three Minutes,Space Shuttle presumed sighted in NC after recent night launch,2/1/07,
2679,12/9/06 18:22,Southport,NC,USA,Light,4 minutes,"Star-like object, flying fast toward the Eastern Seaboard, slowed, then resumed fast flight due north.",12/14/06,
2680,12/9/06 18:00,Huntersville,NC,USA,Rectangle,>10mins,"Box shape(ie a book) flat black all around,2 large white lights no windows or exhaust slow & silent.",2/24/07,
2681,12/2/06 00:00,Mills River,NC,USA,Sphere,30-45 seconds,Glowing yellow sphere seen around midnight,4/27/07,
2682,11/28/06 19:00,Marshall,NC,USA,Light,about 7 seconds,Was looking toward the west out of marshall. Green light flying to fast for an aircraft went from south to north at arms lenth about5 i,12/7/06,
2683,11/28/06 18:50,Marble,NC,USA,Light,5 seconds,Bright green light passing in and out of the clouds as it moved northeast over Marble N.C.,12/14/06,
2684,11/28/06 18:40,Boone,NC,USA,Fireball,18-20 seconds,Glowing Green light in Boone NC,12/7/06,
2685,11/28/06 18:25,Franklin,NC,USA,Light,2-3sec,2 green lights moving very fast traveling downward then turning moving upward at an angle and disappearing. no noise,12/7/06,
2686,11/28/06,Franklin,NC,USA,,,i would like to edit my account of sighting and leave contact information. It doesn't matter if you contact me or not. My sighting was,11/21/10,
