,Date / Time,City,State,Country,Shape,Duration,Summary,Posted,Images
864,11/7/16 10:30,Portland,OR,USA,Other,30-60 seconds,Color shifting object moving east to west mid-morning.,11/11/16,
865,10/26/16 19:10,Oklahoma City,OR,USA,Other,3 minutes,"Flare-like object, like a fireball with no tail.",1/6/17,
866,10/14/16 17:48,Bend,OR,USA,Circle,4 minutes,Saw a small white object traveling through the clouds slow and fast while.,10/21/16,
867,10/10/16 20:00,Astoria,OR,USA,Circle,2 minutes,"My daughter and I saw a round light floating across the sky above the Columbia river through our living room window, I ran outside to g",10/13/16,
868,10/1/16 22:00,Bend,OR,USA,Light,40 minutes,"Saw a flickering light that changed colors (white, red, green, blue). It stayed in the same general area, but would zig zag and dart oc",10/11/16,
869,9/29/16 09:00,Canby,OR,USA,Rectangle,<1 second,"A rectangular object of light, very small and fast captured on video.",10/11/16,
870,9/28/16 19:50,Beaverton,OR,USA,Disk,2 minutes,"The object was flying South, about as high as an airplane but looked different enough from a plane that it caught our eye and we contin",9/30/16,
871,9/27/16 22:30,Redmond,OR,USA,Unknown,Seconds,"Dimly lit, gray, fast moving object.",9/30/16,
872,9/27/16 21:30,Keizer,OR,USA,Formation,20 minutes,Formation of 3 reddish/orange colored lights flew over my house in a triangular formation. ((anonymous report)),9/30/16,
873,9/27/16 19:50,Beaverton,OR,USA,Disk,2 minutes,"We were headed east on Sexton Mountain Drive and I see this unusual light/object flying in the sky. I tell my husband to pull over, gra",9/30/16,
874,9/25/16 20:15,Eugene,OR,USA,Triangle,~15 seconds,Saw triangle shaped craft with some kind of cloaking.,9/30/16,
875,9/24/16 20:45,Tigard,OR,USA,Light,10 seconds,"Two very bright, star-like objects side by side at an angle.",9/30/16,
876,9/22/16 20:45,Portland,OR,USA,Orb,15-18 minutes,Slow moving orb over Portland oregon,9/30/16,
877,9/21/16 18:00,Beaverton,OR,USA,Circle,5 seconds,Bright blue ball of light! ((anonymous report)),9/22/16,
878,9/19/16 22:00,Aumsville,OR,USA,Cross,7 minutes,Light Object.,9/22/16,
879,9/15/16 22:05,Canby,OR,USA,Light,2-3 minutes,"2 amber lights over field outside of Canby, Oregon.",9/22/16,
880,9/14/16 01:00,Salem,OR,USA,Other,3 minutes,"We witnessed a cluster of blue lights blinking randomly and moving around sporadically for 3 minutes, then disappeared.",12/5/16,
881,9/13/16 20:40,Eugene,OR,USA,Circle,2 minutes,"What at first appeared to be a satellite shoots straight towards me at high speed, then reverses direction back to where it had been.",9/15/16,
882,9/9/16 22:00,Salem,OR,USA,,3 minutes,"3 yellow-ish/orange orbs that looked like oblong chunks plucked out of the sun, were seen moving across the Salem, OR, sky.",9/15/16,
883,9/9/16 09:30,Sandy,OR,USA,Egg,10 seconds,Telephoned report: Adult male reports witnessing a silver disc in the morning sky.,9/9/16,
884,9/7/16 20:45,Adrian,OR,USA,Circle,5 minutes,Red blinking lights on the skyline at dusk.,9/15/16,
885,9/3/16 23:57,Forest Grove,OR,USA,Orb,7-8 seconds,"Just before midnight, my friend and I were walking home and the sky lit up behind us, we both turned to look by that time it was passin",9/9/16,
886,9/3/16 23:55,Portland,OR,USA,Fireball,3 seconds,"At approx 11:55 pm, I observed in the western sky a large green fireball, with a strange oblong shape to it, traveling northward, at a",9/9/16,
887,9/2/16 23:59,Salem,OR,USA,Fireball,1 minute,Quiet comet like fireball with a long trail across the skyline at a downward angle fast moving went behind the trees lost sight,9/9/16,
888,9/2/16 23:40,Eugene,OR,USA,Triangle,10 seconds,"Bright triangle shape with iridescent ""panel"" type tail.",9/9/16,
889,9/2/16 15:20,McMinnville,OR,USA,Unknown,~1 minute,"Loud buzzing/rumbling noise, nothing was seen in sky, wind was extreme during sound. ((anonymous report))",9/9/16,
890,9/2/16 00:01,Hillsboro,OR,USA,Light,5 seconds,I was out my back door smoking a cig before going to bed and I witnessed a light moving very fast frome east to west I think then what,9/9/16,
891,8/29/16 20:25,Portland,OR,USA,Sphere,5 minutes,These spheres are white like electic and appear about 8:25 pm for weeks now they stay stationary for up to 4 to 5 minutes than descend,9/2/16,
892,8/25/16 23:00,Astoria,OR,USA,Orb,3 seconds,Large yellow orb crossed the sky twice heading east.,8/29/16,
893,8/25/16 21:00,Aloha,OR,USA,Circle,,Red round light bouncing around the sky quickly,8/29/16,
894,8/21/16 23:00,Silverton,OR,USA,Light,1-2 minutes?,"Camping outside when a bright light in the sky flashed, moved to the right, then faded out.",8/25/16,
895,8/21/16 23:00,Silverton,OR,USA,Light,2 minutes?,"Bright white light in night sky flashed, moved to the right, then faded out.",8/25/16,
896,8/21/16 02:45,Milwaukie,OR,USA,Oval,1 minute,Cant explain two red fireballs over Portland.,8/25/16,
897,8/18/16 21:45,Albany,OR,USA,Circle,Ongoing,"Circle aircraft, with three non-blinking lights, passed over very slowly.",8/19/16,
898,8/17/16 15:00,Tygh Valley,OR,USA,Oval,5-10 seconds,Oval object fades away into blue sky.,8/25/16,
899,8/16/16 19:00,Beaverton,OR,USA,Light,2 minutes,Bright unidentifiable flying object that faded to blend in with the sky.,8/25/16,
900,8/13/16 22:00,Bend,OR,USA,Unknown,5 minutes,"White light crosses sky, turns, then appears to hover before fading out.",9/9/16,
901,8/13/16 00:47,Albany,OR,USA,Rectangle,20 seconds,Large reddish orange craft moving SW at fast rate of speed. Heard roaring almost like engine. Noisy neighborhood though.,8/16/16,
902,8/12/16 22:30,Portland,OR,USA,Orb,Ongoing,Satellite not what it appears to be.,8/16/16,
903,8/11/16 23:00,Eagle Point,OR,USA,Other,3 seconds,Streaking blue light appeared like a crashing object near Table Rock Plateau. ((NUFORC Note: Possible meteor. PD)),8/16/16,
904,8/9/16 23:00,Portland,OR,USA,Flash,15 seconds,"Orbiting object flares, separate flash appears, then object disappears.",8/16/16,
905,8/9/16 22:10,Bend,OR,USA,Orb,60 seconds,Bright white orb.,8/16/16,
906,8/2/16 11:15,Portland,OR,USA,Light,3 minutes,Sitting on my porch with my significant other and saw a light appear from the sky and come down stay for a second and then go back up t,8/4/16,
907,8/1/16 21:46,Milwaukie,OR,USA,Light,6 minutes,We were walking past an athletic field when we looked over and noticed 3 lights in the sky that we had never seen before. Two of us,8/4/16,
908,8/1/16 06:00,Albany,OR,USA,Other,3 minutes,My mom and dad approached me back in the summer of 2016 saying how they saw a orange ball approaching over the field behind their h,1/17/19,
909,7/31/16 23:00,Gold Hill,OR,USA,Other,2 minutes,I saw an orange orb and as it glided by it appeared to be a pillar with orange at each end. ((anonymous report)),8/2/16,
910,7/31/16 22:00,Springfield,OR,USA,Circle,5 minutes,Two blue circular glowing flying objects were flying near each other then went in to different directions. ((anonymous report)),8/2/16,
911,7/31/16 16:00,Sherwood,OR,USA,Disk,3 hours,Disc.,8/16/16,
912,7/31/16 14:30,Canby,OR,USA,Disk,120 minutes,We saw a round shape disk that looked like a parachute. Stayed in the same sky about 1-2 hours,8/2/16,
913,7/30/16 22:50,Roseburg,OR,USA,Fireball,.5 second,I went outside for a smoke and when i looked up to the east i saw what appeared to be either a meteor breaking thru the atmosphere but,8/2/16,
914,7/30/16 10:53,Eugene,OR,USA,Cone,5 seconds,Green light comes falling down.,8/2/16,
915,7/29/16 21:15,Roseburg,OR,USA,Light,15 minutes,Starting at 21:15 hours a light coming from the SW heading NE about 15 thousand feet high.There were no blinking lights or strobes like,8/2/16,
916,7/29/16 21:00,Grants Pass (Murphy Area),OR,USA,Unknown,Sec,Eye in Sky,10/8/22,Yes
917,7/29/16 02:30,Grants Pass,OR,USA,Triangle,1 hour,Hovering craft with lights at each end.,8/2/16,
918,7/28/16 02:50,Clackamas,OR,USA,Fireball,4-5 seconds,Huge green low flying fireball. ((anonymous report)) ((NUFORC Note: Possible meteor?? PD)),8/2/16,
919,7/28/16 01:00,Oakridge,OR,USA,Rectangle,1 minute,I seen a floating slab it was thinner than is was wider and longer. ((anonymous report)),8/2/16,
920,7/27/16 23:15,Hermiston,OR,USA,Light,5 minutes,Light flying north the suddenly changes direction in a second. ((anonymous report)),8/2/16,
921,7/27/16 04:00,Florence,OR,USA,Light,15 minutes,At first glance I didn't noticeanythingother than a starrynight. Until a distantlight slowly whith no sound made its way across the sky,8/2/16,
922,7/26/16 22:30,Diamond Lake,OR,USA,Triangle,2 hours,Two objects seen in central Oregon.,8/2/16,
923,7/24/16 15:00,Portland,OR,USA,Other,1 hour,Dark grey box floating in the air near PDX airport.,8/2/16,
924,7/23/16 23:00,Richland,OR,USA,Light,10 minutes,Flashing Light Hells Canyon. 4 witnesses. Airline Captain. ((NUFORC Note: Airline captain/ATP report. PD)),10/21/16,
925,7/23/16 14:00,Eugene,OR,USA,Cigar,3-4 minutes,"Translucent object observed flying in the clear, blue afternoon sky.",8/2/16,
926,7/21/16 15:00,The Dalles,OR,USA,Other,30 seconds,"Bright shimmering object, not too high above ground level. Looking and moving like flying saucer right out of science fiction.",8/2/16,
927,7/19/16 16:39,Lincoln City,OR,USA,Circle,,Unknown circular object caught on photo. Unknown what it is.,7/22/16,
928,7/16/16 20:00,Eugene,OR,USA,Fireball,3 seconds,Fireball seen soaring across the sky. Aircraft seen chasing it.,7/22/16,
929,7/15/16 22:30,Brooks,OR,USA,Triangle,3-5 minutes,"Bright orb shaped lighth in distaces got brighter, then moved over freeway. Light went off triangle shaped craft w 3 glowing ports.",5/6/17,
930,7/14/16 21:30,Portland,OR,USA,Teardrop,4 seconds,Fireball.,7/15/16,
931,7/12/16 22:45,Springfield,OR,USA,Formation,15 minutes,"A formation of 5 soundless star bright red objects moving across the sky, from NE to SE.",7/22/16,
932,7/10/16 23:25,Brightwood,OR,USA,Fireball,5 minutes,"Shimmering orange fireball seen near Brightwood, Oregon.",7/15/16,
933,7/4/16 23:00,Vancouver & Portland,OR,USA,Sphere,30 seconds,Red lights seen twice on same night.,7/8/16,
934,7/4/16 22:45,Yachats,OR,USA,Orb,2 minutes,Bright purple craft hovered above eastward mountains,7/8/16,
935,7/1/16 22:15,Northwest Medford,OR,USA,Rectangle,5 minutes,"Strange moving object in Nortwest Medford, Oregon sky",7/8/16,
936,6/29/16 11:40,Tigard,OR,USA,Fireball,20 minutes,Glowing Orange Fireball over Tigard Oregon,7/8/16,
937,6/27/16 00:05,Eugene,OR,USA,Fireball,5-10 seconds,((HOAX??)) Out of the corner of my eye I seen a massive fireball falling. ((anonymous report)),7/8/16,
938,6/25/16 01:15,Oakridge,OR,USA,Formation,<10 seconds,"Facing west, I looked out my windshield and saw a large, blue orb shaped object shoot across the sky.",7/8/16,
939,6/18/16 20:45,Eugene,OR,USA,Oval,10-15 minutes,Multiple Bright orange object above Santa Clara/Eugene,6/24/16,
940,6/18/16 13:00,Gold Beach,OR,USA,Circle,3 minutes,"Round craft, bright in center, no sound, slowly moving west to east, hovered twice.",6/24/16,
941,6/7/16 23:15,Fall Creek,OR,USA,Sphere,2+ hours,Mysterious lightning above woods up Fall Creek Oregon,6/10/16,
942,6/3/16 23:50,Portland,OR,USA,Circle,1 minute,((HOAX?? DATE IS FLAWED)) Faster then anything I've ever seen ((anonymous report)),6/10/16,
943,6/2/16 22:45,Portland,OR,USA,Triangle,1 minute,"3 bright dots and 3 bright lines nearly connecting them-outlining a perfect triangle floating still and bright, high in the S sky.",6/3/16,
944,5/20/16 00:05,McMinnville,OR,USA,Disk,10-15 minutes,"Was walking to my car approximately midnight and saw a bright red object near the vicinity of Jupiter (due West, approx. 15 degrees abo",5/20/16,
945,5/15/16 22:53,Portland,OR,USA,Oval,3 minutes,Huge oval object with flashing colored lights and buzzing noise appeared outside my house.,5/20/16,
946,5/14/16 00:00,Portland,OR,USA,Flash,30 minutes,"Large flashes of light in N.E, Portland.",5/20/16,
947,5/12/16 22:00,Gresham,OR,USA,Fireball,15 seconds,Bright orange fireball.,5/20/16,
948,5/11/16 05:14,Medford,OR,USA,Triangle,2:00,U-shaped craft over the Rogue Valley.,5/20/16,
949,5/10/16 22:00,Grants Pass,OR,USA,Orb,Maybe a minute or two,I saw a bright orb hovering above the river and then it zig zagged and disappeared into the sky,3/6/23,
950,5/7/16 10:00,Portland,OR,USA,Oval,15 minutes,"((HOAX??)) Crafts flying over Portland. Orange light from bottom. Seemed to be two, one higher than the other. ((anonymous report))",5/10/16,
951,4/17/16 21:30,Lincoln City,OR,USA,Triangle,45 seconds,3 orbs in triangle formation along Oregon coastline.,4/22/16,
952,4/17/16 21:20,Seaside,OR,USA,Light,10 minutes,"Two golden orange flashing lights hovering silently, moving slowly around. ((anonymous))",4/22/16,
953,4/17/16 14:00,Eagle Point,OR,USA,Disk,1 minute,"While running, I saw five craft fly east-to-west, constantly changing formation.",4/22/16,
954,4/16/16 21:43,Seaside,OR,USA,Fireball,3 minutes,"Fast moving flame balls, heading SxSW at a clip faster than helicopters.",4/22/16,
955,4/11/16 22:30,Summer Lake,OR,USA,Orb,45 minutes,"Southeast Oregon Orange Orbs with one lasting 45 minutes on the night of April 11th, 2016.",4/22/16,
956,4/9/16 22:30,Portland,OR,USA,Orb,6 minutes,"6-10 slow moving, orange orbs or spheres",4/29/16,
957,4/9/16 21:20,Salem,OR,USA,Flash,6 minutes,"While observing the moon tonight at about 9:20 pm PST my daughter said, ""Look, I saw a flash in the sky over there three times.""",4/15/16,
958,4/9/16 11:45,Grants Pass,OR,USA,Disk,1-2 minutes,"Round, black object, no sound moving very fast thru morning sky.",4/15/16,
959,4/8/16 21:45,Portland,OR,USA,Circle,10 minutes,Slow moving orange lights.,4/15/16,
960,4/7/16 22:30,Brookings,OR,USA,Flash,10-12 minutes,Two flashing lights in the night sky moving very slowly.,4/15/16,
961,4/5/16 02:30,Salem,OR,USA,Other,90 minutes,As me and my fianse were sitting outside smoking we saw multiple amber and white colored lights appear and then dim out w/n 2-5sec in t,4/15/16,
962,4/2/16 22:19,Portland,OR,USA,Unknown,1 minute,"Glowing orange object (like a burning plane) disappears/fades away, doesn't fall to earth.",4/15/16,
963,4/1/16 21:30,Troutdale,OR,USA,Sphere,now,"Two bright lights hover over East Vancover, Washington.",4/15/16,
964,4/1/16 20:55,Portland,OR,USA,Orb,30 minutes,Multiple sightings of bright white orbs that sometimes flashed brightly.,4/15/16,
965,4/1/16 19:58,Portland,OR,USA,Formation,00:02,I saw what look like 3 objects at a very high altitude flying in a southeasterly direction. There was no sound and no lights. They mov,4/15/16,
966,4/1/16 19:58,Portland,OR,USA,Formation,2 minutes,I was standing in my backyard when I saw 3 dark objects in a triangle shape heading in a southerly direction.,4/15/16,
967,3/31/16 23:30,St. Helens,OR,USA,Formation,2 hours,They looked like stars but 13 where in a row then they dispersed threw the sky. They had bright flashing lights like cop cars! could se,4/1/16,
968,3/31/16 02:00,Portland,OR,USA,Light,3-5 seconds,"Went on a bike ride with my headphones in, was almost home i looked left casually and looked in the sky. I saw a VERY WHITE bright ligh",4/1/16,
969,3/31/16 00:21,Redmond,OR,USA,Light,15 minutes,Hovering flashing light over Sister's Mountains.,4/15/16,
970,3/25/16 20:00,Milwaukie,OR,USA,Triangle,3 minutes,I saw one red and two orange flying object in the sky.,4/1/16,
971,3/23/16 21:00,Eugene,OR,USA,Triangle,2 minutes,"I went to smoke outside, when I noticed a triangle in sky. I would say it was three separate orbs but in a perfect triangle.",3/24/16,
972,3/19/16 20:13,Albany,OR,USA,Triangle,20 minutes,Oregon UFO spotted near I-5 North towards Salem.,3/24/16,
973,3/18/16 21:45,Sutherlin,OR,USA,Circle,3 minutes,Small red object hovering in sky then drops a glowing white object twice it's size and red light disappeared shortly after,3/24/16,
974,3/18/16 21:35,Grants Pass,OR,USA,Sphere,3-4 minutes,Slow moving flames that interacted with a green light.,3/24/16,
975,3/18/16 00:00,Glide,OR,USA,Light,>15 minutes,"Lights in sky appeared to be blinking/flashing; got binocs, noticed 1 light was red, green, blue,and gold. ((NUFORC Note: Star? PD))",3/18/16,
976,3/17/16 20:20,West Linn,OR,USA,Diamond,5 minutes,"Driving home from work through West Linn, OR and noticed a bright diamond shaped light in the south east. It was brighter then a plane",3/24/16,
977,3/14/16 22:20,Irrigon,OR,USA,Changing,5 minutes,"First I heard a vibration then a shaking feeling, I thought it was bass from music. I felt the sound more than heard it.",3/18/16,
978,3/14/16 02:30,Portland,OR,USA,Disk,60-90 seconds,While standing in my back yard I was watching the dark clouds coming in.,3/18/16,
979,2/29/16 10:32,Klamath Falls,OR,USA,Other,4+ years,The sky warped and something like energy.,3/4/22,
980,2/28/16 20:01,Bandon,OR,USA,Oval,2.5 hours,"Bright white hovering oval light with spires shooting out from it. Looks like a star, but doesn't twinkle. Isn't a planet.",3/4/16,
981,2/24/16 20:45,Sodaville,OR,USA,Disk,4-5 minutes,Disc shaped glowing lights tonight with pictures and video!,2/26/16,
982,2/22/16 21:40,Vancouver,OR,USA,Disk,30 seconds,"Blue object over Portland, Oregon.",2/26/16,
983,2/21/16 19:20,Sandy,OR,USA,Fireball,<20 seconds,Huge ball of light falls to earth after stalling.,2/26/16,
984,2/20/16 19:30,Gresham,OR,USA,Flash,2 seconds,Super bright flash of light a week after a wave of UFO sightings,3/11/16,
985,2/14/16 19:30,Eugene,OR,USA,Light,5 minutes,"((HOAX??)) Orange light in sky, moving fast until a parachute opened and object descended into Eugene area.",2/19/16,
986,2/12/16 17:00,Springfield,OR,USA,Other,1 minute,"Large ""T"" shaped craft hovered just above tree line over parking lot of McKenzie Willamette Hospital.",4/29/16,
987,2/10/16 07:15,Beaverton,OR,USA,Disk,~10 minutes,White to yellow disc object in NE sky that split into two pieces.,2/11/16,
988,2/10/16 05:15,Newport,OR,USA,Other,<2 minutes,T-shaped craft traveling offshore that was absolutely not a helicopter or airplane of any sort,2/11/16,
989,2/10/16 05:15,Lebanon,OR,USA,Orb,30 seconds,Large circular craft flew silently over man walking his dog.,2/11/16,
990,2/10/16 05:15,Gresham,OR,USA,Light,4 minutes,Two strange illuminated semi circle of Vapor expand and the bright star-like light appears and one half semi circle disappear and the o,2/11/16,
991,2/10/16 05:15,Ione,OR,USA,Triangle,continuous,Observed a triangular shaped filmy patch of light moving from east to west at 5:15 am north of Ione.,2/11/16,
992,2/10/16 05:10,Culver,OR,USA,,5 minutes,Appeared to be a large star with a sort of spot light shining from the side outward. At first i thought maybe it was the space station,2/11/16,
993,2/10/16 05:00,Oakridge,OR,USA,Other,12-15 minutes,Large object moves slowly across early morning sky with shooting stars and comet tails.,2/11/16,
994,2/10/16 05:00,Idanha,OR,USA,Other,5 minutes,Awe inspiring and a bit scary when it was right above me.,2/11/16,
995,2/10/16 05:00,Ashland,OR,USA,Triangle,10 minutes,Bright point of light resembling satellite but followed by triangular illuminated shape.,2/11/16,
996,2/9/16 07:10,Clackamas,OR,USA,Diamond,15 minutes,"Bright golden square object has a bright golden light move away from the ""parent"" object.",2/11/16,
997,2/4/16 18:46,Roseburg,OR,USA,Circle,10 seconds,"Very large, bright white light seen over hill.",2/11/16,
998,2/3/16 02:10,Roseburg,OR,USA,Fireball,2 minutes,Orange lights west of Roseburg.,2/4/16,
999,1/31/16 23:00,Emigrant Pass (near; foothills of),OR,USA,Other,,"Seen a object with a solid orange bar that lit up bright on the base and the top, it moved slow like a helicopter and was 40 feet off t",2/4/16,
1000,1/28/16 19:00,Portland,OR,USA,Circle,,Saw three orange circles near each other and then they spread apart but weren't definitely airplanes or stars. They were slowly moving.,1/29/16,
1001,1/25/16 11:00,Salem,OR,USA,Oval,~4 minutes,"White oval object, hovering very smooth.",1/29/16,
1002,1/16/16 21:12,Neskowin,OR,USA,Oval,10 seconds,"The misty, illuminated oval traveled from the East losing altitude until it disappeared into the ocean.",1/20/16,
1003,1/16/16 21:00,Bend,OR,USA,Chevron,5 minutes,We were driving East on Cooley Road and saw an extremely bright white light in the distance. This light flew parallel of us until we tu,1/20/16,
1004,1/16/16 01:00,Roseburg,OR,USA,Fireball,1 minute,"I was standing on my front deck which faces to the west ,looking south talking to a friend on the phone when 3 orange looking orbs,or s",1/20/16,
1005,1/2/16 19:00,Cornelius,OR,USA,Formation,8 seconds,Red lights (non-flashing) in line (no sound) high rate of speed 7-8 PM heading North bound Cornelius Oregon.,1/5/16,
1006,1/1/16 00:00,Sodaville,OR,USA,Sphere,3 minutes,Two balls of orange light seen above the trees; one split into two!,1/5/16,
1007,12/31/15 23:59,Eugene,OR,USA,Fireball,7 minutes,Viewed 4 slow moving orange-ish orbs on new years eve moving from E to W until they disappeared on the horizon.,1/5/16,
1008,12/31/15 15:00,Monmouth,OR,USA,Egg,10 seconds,A white balloon gives off a bright blue light and disappears along with the balloon.,1/5/16,
1009,12/30/15 22:00,Portland,OR,USA,Light,5 hours,Dozen red green blue lights in portland sky that spin with two bright white lights that move. ((NUFORC Note: Stars?? PD)),1/5/16,
1010,12/30/15 19:30,Springfield,OR,USA,Changing,5 hours,"Shape changing UFO's in Springfield, Oregon.",1/5/16,
1011,12/30/15 16:50,Orient,OR,USA,Cylinder,15-20 minutes,"While driving at sunset I saw a hovering, vertical, cylindrical object glowing in the sun, which then separated into two objects.",1/5/16,
1012,12/25/15 16:35,Beaverton,OR,USA,Circle,8-10 minutes,There were 8 med. height flying objects evenly spaced in formation with no sound and no flashing lights the orange lights were steady.,1/5/16,
1013,12/25/15 02:30,Salem,OR,USA,Changing,30 minutes,"Christmas was just over, I stepped out to smoke in the cold, I focused on a bright star that seemed to b flickering, I lost contact.",1/5/16,
1014,12/24/15 21:32,Bend,OR,USA,Circle,4-5 minutes,"5 orange glowing lights seen by 2 witnesses, heading south to north, over Bend, Oregon, on Christmas Eve 2015.",1/5/16,
1015,12/18/15 05:00,Beaverton,OR,USA,Light,15 minutes,Pulsating lights in SW sky over Beaveton/Farmington area.,12/21/15,
1016,12/17/15 23:00,Milwaukie,OR,USA,Oval,12 seconds,Saw bright white circle hovering then shot up straight fast fast then darted sideways unlike any craft or drone ive ever seen...,12/21/15,
1017,12/14/15 04:45,Hillsboro,OR,USA,Fireball,3 minutes,We live off of 201st and baseline we saw a point with a thin tail that looked like bright white sparklers fireworks flying through the,12/17/15,
1018,12/9/15 17:23,Beaverton,OR,USA,Light,5 minutes,I was driving north on SW 158th Ave from Walker Rd and saw to the west 5 lights (traveling too slow and too close to be airplanes) 3 of,12/10/15,
1019,12/4/15 23:30,Portland,OR,USA,Other,2 minutes,"Strange moving multicolored diamond shape over Gresham, Oregon.",12/10/15,
1020,12/4/15 18:30,Portland,OR,USA,Fireball,1 second,Small fireball streaked across sky looking North from SE Portland. ((NUFORC Note: Possible meteor? PD)),12/10/15,
1021,11/29/15 19:15,Brownsville (on I-5 highway),OR,USA,Light,10 minutes,Saw a bright unidentified object in the sky while driving.,12/3/15,
1022,11/27/15 05:00,Medford,OR,USA,Circle,3 minutes,"3 dim white lights flying, using maneuvers not capable by human air crafts, over Medford, OR, about 5am.",12/3/15,
1023,11/26/15 20:00,Springfield,OR,USA,Rectangle,10 seconds,"At WalMart parking lot flashing lites red, white, moving fast from the south; low.",12/3/15,
1024,11/25/15 22:30,Salem,OR,USA,Fireball,5 minutes,4 identical reddish orange orbs moving silently NE to SW across the sky before slowly disappearing.,11/26/15,
1025,11/25/15 19:11,Dunes City,OR,USA,Fireball,3 seconds,"Big bright GREEN FIREBALL seen burning slowly to the earth in Dunes City, Oregon",11/26/15,
1026,11/25/15 04:15,Corvallis,OR,USA,Orb,30 minutes,Bright light with spike like lights protruding from it. ((NUFORC Note: Probable sighting of Venus? PD)),11/26/15,
1027,11/22/15 22:15,Bend,OR,USA,Fireball,5 minutes,"Fireball flies over Bend, Oregon.",11/26/15,
1028,11/20/15 20:30,Tualatin,OR,USA,Triangle,20 seconds,"Triangle pattern of 7 or 9 round lights moving slowly from east to west - electronic, pulsing machine sound",11/26/15,
1029,11/17/15 05:27,Sutherlin,OR,USA,Flash,1 hour,White lights.,11/19/15,
1030,11/12/15 22:00,Bend/Burns (between; on Hwy. 20),OR,USA,,5 seconds,"Was driving east on hwy 20 around 22:30,when a bright flash of light appeared in the eastern sky,so bright it was thought it was day fo",11/19/15,
1031,11/7/15 19:00,West Salem,OR,USA,Circle,3 minutes,A white ball shaped light moving at a super high hate of speed 200 feet above ground. ((NUFORC Note: U. S. Navy missile launch. PD)),11/19/15,
1032,11/3/15 21:40,Portland,OR,USA,Triangle,30 seconds,I saw a triangular object with a light trail behind it move REALLY FAST through the sky.,11/6/15,
1033,11/3/15 00:49,Keizer,OR,USA,Light,5 seconds,"Keizer, OR, S to N, saw a ball of light fly through the sky for approximately 5 seconds before it disappeared. No sound.",11/6/15,
1034,10/31/15 03:22,Oregon City,OR,USA,Orb,5 minutes,There was a break in the rain and I saw several white orbs or dots crossing the sky headed in the Wilsonville direction.,11/6/15,
1035,10/30/15 20:30,Dayton,OR,USA,Diamond,5 minutes,Diamond shaped ufo.,1/5/16,
1036,10/29/15 21:00,Joseph,OR,USA,Light,5 seconds,Reverse shooting star turns to red ball of light and disappears.,11/6/15,
1037,10/29/15 20:13,Bend,OR,USA,Fireball,5 minutes,I walked outside tonight when my boyfriend called for me to come see a strange light from the perspective of our front driveway.,11/6/15,
