,Date / Time,City,State,Country,Shape,Duration,Summary,Posted,Images
2511,10/21/04 19:30,Portland,OR,USA,Light,1 minute,"Two objects, both red, one appeared to slowly fade, the other moved out of view behind trees in a quick stop/start motion.",10/27/04,
2512,10/15/04 08:35,Mckenzie Bridge,OR,USA,Flash,5 mintues,a bright flashing light changed colors and danced above us for 5 minutes,10/27/04,
2513,10/15/04 01:45,Grants Pass-Murphy area,OR,USA,Unknown,2.5 hours,Fighters give chase to UFO within President Bush restricted air space.,11/2/04,
2514,10/13/04 23:45,Dallas,OR,USA,Triangle,,"Object moved steady then up and down changing color from blue, red, green, then white was very bright",10/27/04,
2515,10/13/04 23:00,Oregon,OR,USA,Circle,15 minits,my father and i saw somthing that night we do not understand the object was like nothing weve ever seen.,5/15/06,
2516,10/13/04 19:00,Oceanside,OR,USA,Disk,2min.or less,It look's like many pictures I have seen of so called flying saucer's Like bright metal in the sun. the sun was below the horizon.,10/27/04,
2517,10/11/04 03:40,Dallas,OR,USA,Light,20 seconds,"Very intense light, shone through covered windows, absolutely no sound, felt presence before observing.",10/27/04,
2518,10/4/04 20:30,Manzanita,OR,USA,Triangle,2 minutes,"Wedge, 70' off the ground, Moving NE at approx. 15 MPH towards Washington state. Very large with Red flashing lights and no sound.",10/27/04,
2519,9/26/04 20:15,Portland,OR,USA,Light,15 seconds,"Spouse and I saw a silent, bright fast moving light cross the sky, change color to red, then fade completely away.",9/29/04,
2520,9/21/04 05:30,Portland,OR,USA,Circle,20 min,At approx 5:30 AM I looked out my window and saw a large yellowish light in a circular form. It almost looked like a bright city lamp,9/29/04,
2521,9/15/04,La Grande (Morgan Lake),OR,USA,Changing,seconds/3-5,"This sounds like i'ntl space station descriptions, this was not. I am standing outside my vehicle at morgan lake 5mi. outside la Grande",12/16/05,
2522,9/12/04 21:10,North Bend,OR,USA,Unknown,4 minutes,"A strange shape, maybe wedge shaped? I could see a large circular shape with spokes on the bottom of it.",9/29/04,
2523,9/11/04 20:00,Madras,OR,USA,Circle,5min,"light ,white blinking,rotating on a circle,like a flat horizontal ferris wheel.saw the same thing in thesame place 2 times this week ov",9/29/04,
2524,8/31/04 23:00,Cottage Grove,OR,USA,Other,30,"August 31, 2004 Cottage Grove, Oregon UFO",9/1/04,
2525,8/20/04 22:30,Newport,OR,USA,Fireball,30 minutes,"Two men observe large, red/orange, glowing object disappear into the night sky.",7/17/11,
2526,8/20/04 22:00,Grants Pass,OR,USA,Circle,30 seconds,Three bright red cylinders changing to very bright white lights before disappearing at high speeds,8/24/04,
2527,8/19/04 23:30,Albany,OR,USA,Triangle,1 minute,"The craft seemed 6-12,000 ft high but was hard to tell. It was aclear night and my nephew saw the lights first thinking they were satel",8/24/04,
2528,8/19/04 22:00,Mule Creek Canyon (on the Rogue River),OR,USA,Fireball,10 seconds,Three very large lights at different times in the sky above the tree line. Military jets flying in the area.,8/24/04,
2529,8/16/04 21:30,Maupin,OR,USA,Flash,45 seconds,2130 object flashed on for about 2 full seconds then off for 5 seconds each time at roughly 5 deg. track object in outer space,8/24/04,
2530,8/15/04 01:35,Eugene,OR,USA,Triangle,35min,"Witnessed triangle shaped object w/ lights at altitude 25deg and azimuth 320 hover, then move rapidly L-R, hover again, Yaw right",8/24/04,
2531,8/12/04 10:30,Eugene,OR,USA,Triangle,5 seconds,Triangular craft,8/24/04,
2532,8/11/04 02:30,Portland,OR,USA,Light,3 seconds,Circular shaped light travels quickly across sky in suburbs.,8/24/04,
2533,8/9/04 00:50,Portland,OR,USA,Triangle,5 SECONDS,7 very fast moving lights over Portland Oregon!,8/11/04,
2534,8/6/04 23:30,Tualatin,OR,USA,Light,15 mins,"1 boomerang shaped, bright lighted object...",8/11/04,
2535,8/5/04 22:00,Eugene,OR,USA,Chevron,4 seconds,Chevron shaped craft over Eugene dunno what it was,8/24/04,
2536,8/2/04 02:13,Portland,OR,USA,Unknown,3 minutes,"Small craft, rapid movement and flight path, no sound.",8/11/04,
2537,7/25/04 20:00,Eugene,OR,USA,Diamond,1 1/2 minuets,black diamond shped object zigzaging across the sky with glowing red tailflame.,8/11/04,
2538,7/23/04 21:00,Waldport,OR,USA,Cigar,2 minutes,bright craft traveling fast ((NUFORC Note: Possible satellite or ISS? PD)),5/24/05,
2539,7/22/04 23:10,Portland,OR,USA,Circle,8 seconds,"Around 11:10 p.m. on July 22,2004 my boyfriend and I were out watching satelites on our front lawn. As I looked to my right I exclaime",8/11/04,
2540,7/19/04 16:00,Portland,OR,USA,Orb,5 min.,Sphere Cluster Drops Orb Down to Ground,5/24/05,
2541,7/15/04 22:00,Monmouth,OR,USA,Circle,10 to 15 seconds,looked like a star. it made a 60 degree turn without stopping.,5/24/05,
2542,7/15/04 22:00,Troutdale,OR,USA,Unknown,3 MINUTES,BRIGHT LIGHT TRAVELLING FULL HORIZON,7/25/04,
2543,7/8/04 23:15,Otis,OR,USA,Other,4 minutes,"Two faint star-like objects moving in a straight line, exactly with one another, slowly across the sky.",7/25/04,
2544,7/8/04 21:07,Portland,OR,USA,Diamond,4.5 minutes,Four lobed blue-black object seen moving south at dusk,7/25/04,
2545,7/7/04 22:00,Salem,OR,USA,Light,2-3 minutes,"Strange lights -- moving and not moving -- seen in skys over Salem, OR",7/25/04,
2546,7/4/04 23:00,Eugene,OR,USA,Sphere,2 minutes,"Brilliant, erratically zig-zagging, fast-moving object in 4th of July sky at Eugene,Oregon",7/25/04,
2547,7/4/04 22:30,Eugene,OR,USA,Circle,1 minute,Move straight accross the sky like at sattelite but was too large to be one and then move like a bumble bee,7/8/04,
2548,7/4/04 22:00,Brookings,OR,USA,Circle,10 minutes,"during fireworks observed round bright, white light circling at high alltitude, no running lights",7/8/04,
2549,7/3/04 22:00,Salem,OR,USA,Light,5 minutes,Bright light seen in western sky below the planet Jupiter. Brighter than Jupiter.,7/25/04,
2550,6/27/04 04:10,Portland,OR,USA,Sphere,1 min 30 seconds,Object seen in sky traveling from southwest to northeast. Silver/white in color with no visible wings and approximately 1000-1500 feet,8/11/04,
2551,6/27/04 03:00,Sherwood,OR,USA,Circle,10 minutes,small craft grew enormous and blue as it came crashing down towards me.,7/8/04,
2552,6/25/04 22:45,Portland,OR,USA,Fireball,2 minutes,A bright red object flying in the sky above our heads just above the trees,7/8/04,
2553,6/24/04 14:00,Hillsboro,OR,USA,Oval,1 second,Daytime High speed orb caugt on video,2/14/06,
2554,6/20/04 23:00,Ashland,OR,USA,Light,1 hour,"strange distant lights moving in zig zag patterns from south to north, one after another aprox. 1 minute apart. ((Satellites??))",6/23/04,
2555,6/16/04 23:00,Gerber Reservoir,OR,USA,Changing,2 Hours,Approximately 11PM my friend and I were sitting around a campfire. I got up and walked towards the tree line. I saw 2 orange orbs (pu,6/23/04,
2556,6/16/04 13:18,Portland,OR,USA,Sphere,3 minutes,Object seen in sky over Downtown Portland Oregon moving very slowly coming from N.E. Direction to S.W. direction. Appeared silver in c,6/18/04,
2557,6/10/04 23:15,Portland,OR,USA,Unknown,25 minutes,Weird lights revoling around a center light in the sky ((NUFORC Note: Advertising lights?? PD)),6/18/04,
2558,6/7/04 23:00,Christmas Valley,OR,USA,Other,35-40 minutes,"Bright lights changing color and pattern above skyline, like I've never seen before.",6/18/04,
2559,6/4/04 20:40,Eugene,OR,USA,Cigar,2-3 minutes,"""blimp"" like shaped object moving across the sky at sunset. Absolutely silent. Let us have a good look, but got no pic. ((Contrail??)",6/18/04,
2560,5/27/04 15:10,Klamath Falls,OR,USA,Unknown,5 min,Solid radar return with no visual,6/18/04,
2561,5/15/04 14:30,Portland,OR,USA,Rectangle,10 minutes,"Dark Cylinder/ Rectangular flying object dips in and out of low clouds over Portland, Oregon",6/4/04,
2562,5/14/04 02:30,Scappoose,OR,USA,Triangle,5minutes,Massive triangle object moving from south to north covering the background stars,6/4/04,
2563,5/8/04 13:45,Sherwood,OR,USA,Sphere,20 min.,Sphere cluster release's smaller object's.,5/10/04,
2564,5/5/04 21:30,Portland,OR,USA,Sphere,3 sec,"It was a very large globe-shaped object, very low and very fast, traveling in a very straight line. Color was deep orange-yellow, and",6/4/04,
2565,5/3/04 15:09,Salem,OR,USA,Circle,six minutes,Object changed directions several times.,5/10/04,
2566,4/30/04 18:30,Portland,OR,USA,Circle,10 - 15 minutes,"Object Hovering Near Jet-Trails 4/30/04, Portland, Or.",5/4/04,
2567,4/28/04 21:30,Portland,OR,USA,Other,,Strobing Night Sky Object - Photo,5/10/04,
2568,4/28/04 20:00,Central Paint,OR,USA,Light,1 minute,The light turn sharply south and climbed at 10:00 direction and disappeared,5/8/14,
2569,4/25/04 21:35,Bend,OR,USA,Formation,10 minutes,"String of star-like lights drift through sky in straight line, with equal distance apart from one another.",4/30/04,
2570,4/10/04 23:50,Baker City,OR,USA,Chevron,25 seconds+/-,Transparent grayish chevron-shaped obect changes to 6 individual green lights that reconverge to form 1 green light,4/27/04,
2571,4/8/04 22:24,Albany,OR,USA,Egg,Bright Flashes,Bright flashes hovering and an egg shaped aircraft went from hovering it high speed instantly.,4/27/04,
2572,3/29/04 20:00,Jordan Valley,OR,USA,Circle,1-2 minutes,"I am a farmer from Idaho and was driving a semi-truck north bound on hwy 95 about two miles out of the small town of Jordan Valley, Ore",4/9/04,
2573,3/25/04 19:40,Wilsonville,OR,USA,Rectangle,5 min,"Hovering craft with green, then orange, then yellow-white lights seen in night sky over housing development.",3/28/04,
2574,3/18/04 01:00,Portland,OR,USA,Disk,20 seconds?,Fast moving round object at night.,3/23/04,
2575,3/17/04 14:00,Bend,OR,USA,Circle,A few seconds,A round metallic object seen momentarily in the blue sky.,3/28/04,
2576,3/12/04 21:30,Redmond,OR,USA,Disk,2 minutes,small disc shape object with dark orange glow underneath,3/23/04,
2577,3/5/04 09:00,Stanfield,OR,USA,Teardrop,15 minutes,"Big flash of light, small figures, wierd motions awfully creepy!",5/15/06,
2578,3/2/04 14:00,Portland,OR,USA,,10 seconds,across the sky faster than most anything,3/9/04,
2579,2/21/04 22:05,Portland,OR,USA,Unknown,unknown,HBCCUFO CANADIAN REPORT: The clouded parts of the sky on that day had some weird shaped circular or oval.,3/17/04,
2580,2/20/04 23:30,Roseburg,OR,USA,Cylinder,5min,Orange glowing cylindrical spinning object - Roseburg Oregon,3/2/04,
2581,2/9/04 19:00,Lincoln City,OR,USA,Disk,1 hour 10 min.,bright amber lights flashing in random sequence later came withing 30 ft. of our house and returned over the ocean,3/2/04,
2582,2/7/04 19:00,Redmond,OR,USA,Changing,1 1/2 hr.,We watched a bright light off our pourch till it vanished.,2/12/04,
2583,2/5/04 13:59,Bend,OR,USA,Unknown,not know,here is the story behind the picture..I live in Oregon and as always for the last few months it has been cold and overcast if not snowi,3/17/04,
2584,2/3/04 03:05,Medford,OR,USA,Unknown,3 minutes,Fast moving object disappears into night sky,2/12/04,
2585,2/2/04 19:30,Tillamook,OR,USA,Cylinder,10 Minutes,"Brightly lit cylindrical object rises slowly above Tillamook Bay, Oregon",2/12/04,
2586,2/2/04 07:00,Coquille,OR,USA,,01,I believe I was ALMOST abducted.,2/12/04,
2587,1/21/04 20:26,Clackamas,OR,USA,Cylinder,1-2 min.,"7-9 Amber colored, zig-zag patern. I CANNOT be the only one that saw these! I took pix too.",3/2/04,
2588,1/21/04 18:23,Aloha,OR,USA,Circle,3 minutes,This was no sattelite!,1/22/04,
2589,1/21/04 18:00,Coos Bay,OR,USA,Disk,11/2 hour,"Three lighted objects over ocean ,big object blinked and manuvered: Other 2 stationary.",1/22/04,
2590,1/20/04 20:00,Medford,OR,USA,Other,5 seconds,"At night, 2 close lights flying fast parrallel to the ground for 5 seconds with absolutely no sound.",1/22/04,
2591,1/17/04 22:40,Eugene,OR,USA,Changing,5-7 MINUTES,"large yellowish orange ball hovering in sky with lights bouncing around inside, slowly moving east then north",1/22/04,
2592,1/1/04 18:00,Beatty (near),OR,USA,,,Unusual object.,1/17/04,
2593,12/31/03 23:40,Albany,OR,USA,Formation,5 minutes,"Albany, OR Lights in the sky.",1/17/04,
2594,12/31/03 05:00,Selma,OR,USA,Flash,few seconds,green flashes,1/17/04,
2595,12/29/03 21:15,Salem,OR,USA,Circle,5 seconds,Fast Moving Bright Light,1/17/04,
2596,12/18/03 03:30,Dallas,OR,USA,Other,13 minutes.,"I heard a strange noise, suffered a physical and emotional response to it, military jets ""chased"" it away.",1/17/04,
2597,12/14/03 03:38,Eugene,OR,USA,Unknown,2 min,Extraordinary set of 2 long lasting flashes light up the entire sky.,1/17/04,
2598,11/26/03 18:31,Vernonia,OR,USA,Sphere,30 seconds,"Bright light seen near Mars, descended rapidly.",12/9/03,
2599,11/26/03 01:23,The Dalles,OR,USA,Light,10 seconds,"I saw weird, moving lights along the Columbia River heading Eastward.",12/9/03,
2600,11/25/03 16:10,Portland,OR,USA,Disk,2 to 3 minutes,Wobbling Disc Daylight Sighting,11/26/03,
2601,11/24/03 18:10,Coos Bay,OR,USA,Oval,5 to 6 mins,"very bright light, slowing and speeding up, white light w/red and yellow lights around main light",12/9/03,
2602,11/8/03 18:30,Madras,OR,USA,Circle,15 minutes,"At about 6:30 p.m. 11/08/03, our next door neighbor's litte girl came over, knocked on the door, and asked if we wanted to see a UFO.",11/26/03,
2603,11/8/03 15:00,Springfield,OR,USA,Cigar,10 minutes,Two dark objects flying low without any sounds.,11/11/03,
2604,11/7/03 20:00,Newport,OR,USA,Other,about 5 min,"This object was on the south beach area near the airport. I believe the object was partially behind a hill, so I wasn't able to get a",11/11/03,
2605,11/6/03 19:30,Portland/Gresham,OR,USA,Light,1 minute,Yellow/orange light in evening sky followed by military jet activity,11/11/03,
2606,11/6/03 11:30,Portland (I-5/Lombard Exit),OR,USA,Sphere,2-3 min.,Young woman reports witnessing F-15 fighter jets approach a peculiar sphere over Interstate 5.,11/8/03,
2607,11/5/03 11:00,Portland,OR,USA,Circle,5 minutes,"Dear PD, On 11/5/03, my wife described a sighting to me that sounds very similar to one reported by a witness in your database for Port",11/11/03,
2608,11/1/03 16:48,Portland,OR,USA,Sphere,1 minute,"Pink-Orange sphere photographed near downtown Portland, OR",11/26/03,
2609,10/30/03 23:00,Scappoose,OR,USA,Triangle,5 seconds (x2),"2 more fast, noiseless, triangular objects seen above Scappoose, OR within 1 week of first sighting",10/31/03,
2610,10/25/03 21:15,Scappoose,OR,USA,Triangle,5 seconds,"Swift hard-to-see triangular object moving in a straight line across night sky with 3 luminous tips, one at front, two at rear.",10/31/03,
2611,10/18/03 01:44,Salem,OR,USA,Other,bout 10 secs.,"saw red light appear move rapidly through the sky in salem, or and then dissapear.",10/31/03,
2612,10/9/03 23:00,Corvallis,OR,USA,Other,2 HOURS,"A LARGE UFO, LARGER THAN THE BRIDGE THAT DISAPPEARED IN FRONT OF ME.. ((NUFORC Note: Possibly not UFO related?? PD))",12/12/09,
2613,10/9/03 20:10,Brookings Harbor,OR,USA,Light,3 minutes,5 lights moving in different directions over ocean,10/15/03,
2614,9/28/03 21:30,Cornelius,OR,USA,Disk,5 secs.,"washer shape in early night sky at Cornelius, Oregon 9/28/03",6/23/04,
2615,9/28/03 19:29,Baker City,OR,USA,Rectangle,15-20 sec.,Panel of light surgically zig/zagged across sky. Here to gone in 2 seconds flat. Impressed the hell out of us. WE WANT 1,10/7/03,
2616,9/26/03 01:44,Junction City,OR,USA,Triangle,5-7 seconds,"Observed triangle shaped craft moving at high velocity from East to West, then make an almost 90 degree turn to the north.",9/28/03,
2617,9/24/03 23:13,Portland,OR,USA,Orb,3 minutes,Flickering Colored Orb,9/28/03,
2618,9/23/03 20:16,Portland,OR,USA,Sphere,10 seconds,Happened to see a very bright planet like white golf ball size light and I went outside to investigate further.,9/28/03,
2619,9/23/03 13:23,Lincoln City,OR,USA,Oval,See Below,No idea what this object is,1/27/05,
2620,9/23/03 04:27,Portland,OR,USA,Light,.5-1.5 hr,"single object non-moving, changing colors, red, blue-green, white",9/24/03,
2621,9/22/03 17:30,Portland,OR,USA,Light,Less than 1 minute,Bright shining object over Porland OR,9/24/03,
2622,9/21/03 10:05,Corvallis,OR,USA,,5 minutes,"Strange F-16 Operations In Corvallis, Oregon.",9/24/03,
2623,9/20/03 22:00,Blachly,OR,USA,Light,,"a girl sees a formation of 2 lights i the sky forming in to one ""saucer""",9/24/03,
2624,9/20/03 08:00,Idhna,OR,USA,Light,30 sec,It was as there was an exploding star or something of that nature.,9/24/03,
2625,9/17/03 02:00,Springfield,OR,USA,Flash,1 sec,brilliant flash of light,9/24/03,
2626,9/16/03 20:20,Lakeside,OR,USA,Triangle,10 min.,A six lighted wedge flying north to south in the western sky.,9/17/03,
2627,9/12/03 20:33,Scotts Mills,OR,USA,Unknown,2 minutes,floated at @ 100 feet then shot straight up into the sky lost in sun.,3/11/16,
2628,9/5/03 23:30,Hillsboro,OR,USA,Circle,3sec,"Green ball with a pink/red tail entering our atmosphere , then flying of over the horizon.",9/9/03,
2629,9/2/03 19:23,Hillsboro,OR,USA,Sphere,1 hour,Metalic sphere about twice the size of a commerial airliner.,10/27/04,
2630,9/1/03 23:00,Grants Pass,OR,USA,Other,3 min,"We saw a lobed orb over Grants Pass, Oregon, on 9/1/03.",6/18/04,
2631,9/1/03 11:00,Springfield,OR,USA,Oval,10 min,Craft seen in daylight over Oregon,9/4/03,
2632,9/1/03 01:30,Portland,OR,USA,Light,hour plus,"small compact formation of lights, no movement; but bursts of red and yellow lights - very faint.",9/4/03,
2633,8/31/03 23:30,Mulino,OR,USA,Triangle,1 minute,"Triangle of white lights heading north at high altitude over Portland. ((NUFORC Note: Possible sighting of ""NOSS"" satellites. PD))",9/28/03,
2634,8/31/03 20:32,Salem,OR,USA,Light,6 seconds,Very Bright Light,9/4/03,
2635,8/31/03 02:00,Salem,OR,USA,Unknown,30 MIN?,"Salem OR, slow moving lights at midnight and 2 hours later heard noise but nothing spotted",9/4/03,
2636,8/29/03 22:30,Portland,OR,USA,Triangle,7 minutes,"Silent Triangle over Gresham/Portland Oregon remains motionless, rapidly accelerates away. ((OREGON/MUFON REPORT INCL.))",9/4/03,
2637,8/28/03 18:30,Springfield (Camp Creek Road),OR,USA,Oval,15 minutes,Large oblong Bright & Colorfully Lite Up With No Sound Flew Right Above The Trees.,2/18/13,
2638,8/27/03 19:00,Springfield,OR,USA,Cigar,2 minutes,"Object seen the night Mars was closest to Earth August 27, 2003.",6/4/14,
2639,8/16/03 23:00,Seaside,OR,USA,Light,approximate: 5 seconds,Twin objects race across the sky in an unusal criss-cross pattern in an exciting sighting at the Oregon coast!,8/28/03,
2640,8/15/03 21:30,Salem,OR,USA,Light,2 minutes,Two red lights moving very quickly made two changes of direction in less than 20 seconds.,8/28/03,
2641,8/13/03 14:00,Portland,OR,USA,Sphere,15 minutes,Sphere over Portland with Military Jet,8/28/03,
2642,8/12/03 22:10,Jordan Valley,OR,USA,Disk,20-25 secs,Very large disk shaped structure with lights,12/19/03,
2643,8/9/03 22:30,Gresham,OR,USA,Light,7 minutes,"OR UFO Review Case: Investigative findings and conclusions to the triangle lights sighting case in Gresham Oregon, August 9th, 2003.",10/15/03,
2644,8/7/03 22:00,Newberry Crater National Monument,OR,USA,Light,1 minute,bright light pretending to be a star in big dipper,6/12/08,
2645,8/5/03 04:30,Ashland,OR,USA,Oval,5 sec,3 oval electric blue objects,6/4/04,
2646,7/27/03 19:00,Keizer,OR,USA,Other,5 min,translutant orb seen two different times.,8/1/03,
2647,7/26/03 23:17,Tillamook,OR,USA,Fireball,1-2 minutes,fireball into ocean,8/1/03,
2648,7/26/03 21:52,Portland,OR,USA,Fireball,2-1/2 min,This was the amber fireball...very smooth trajectory and very fast...just takin` its time it seemed....,8/1/03,
2649,7/25/03 01:30,Wallowa,OR,USA,Disk,20 seconds,Flying saucer type object not large and alone soft white light and incredibly fast.,6/1/16,
2650,7/23/03 22:00,Portland,OR,USA,Circle,nightly,"We see objects in the sky that look like tiny stars that move at lightning speeds, hover in one spot then takes off at lightning speeds",8/28/03,
2651,7/21/03 22:30,Portland,OR,USA,Light,3 mins,"Between 10 and 11 pm, very bright quiet object traveling S to N then abruptly turned toward the E..",8/1/03,
2652,7/20/03 11:00,Forest Grove,OR,USA,Light,>30 seconds,"Bright light moving erratically, then moving to one spot to disappear. Forest Grove, Oregon, July 20, 2003",8/28/03,
2653,7/20/03 07:00,Bend,OR,USA,Other,,A strange craft the best i can subscribe it was a thin rectangle with a pair of wings they went back from the front in a 60 degree angl,12/16/05,
2654,7/19/03 19:20,Eugene,OR,USA,Oval,2 minutes,"Oval object seen racing from west to east over Eugene, Oregon.",7/23/03,
2655,7/17/03 15:15,Portland,OR,USA,Sphere,1hr 15 min,"Clearly visible, stationary sphere, ""takes off"" after an hour or so of observation",7/23/03,
2656,7/14/03 15:33,Beaverton,OR,USA,Oval,21 min,White-pink oval object seen & photo'd while rising up thru high cloud.,10/31/03,
2657,7/6/03 19:15,Salem,OR,USA,Circle,15min,saw 11 circle object heading due south a a very slow pace in a group formation than disappeared,7/16/03,
2658,7/6/03 00:04,Salem,OR,USA,Other,45-65 seconds,"V shaped, Tilted and rotating pale white craft. No noise.",7/16/03,
2659,7/4/03 23:00,Clear Lake,OR,USA,Light,,"light in sky that bobed and had big spotlight threw trees,made no noise",10/31/03,
2660,6/21/03 03:02,Gates,OR,USA,Rectangle,Multiple times,Large octagon grid patterns late night sightings.,9/24/03,
2661,6/18/03 00:24,Portland,OR,USA,Light,12 seconds,"This object coud not have been a jet and it was not a ""shooting star"".",6/18/03,
2662,6/15/03 00:17,Creswell,OR,USA,Other,10-15 min,i could tell you this: IT WAS NOT AN AIRPLANE!,6/18/03,
2663,6/7/03 02:00,Lake Oswego,OR,USA,Oval,5 seconds,Oregon UFO Review Case: Football shaped UFO with purple glow and lights seen from inside tent during camping.,6/18/03,
2664,6/4/03 21:55,Aloha,OR,USA,Fireball,15 seconds,Fireball seen behind trees moving vertically then up into the sky,7/16/03,
2665,5/31/03 13:00,Ashland,OR,USA,Changing,30 minutes,"Ground-moving small black boomerang shaped unidentified object observed with witnesses in broad daylight near Ashland, Or.",8/30/13,
2666,5/25/03 01:45,Rural/Unknown,OR,USA,Light,"30 seconds, maybe more.",Oregon UFO Review Case: Bright lights illuminate daughters bedroom window.,5/27/03,
2667,4/13/03 16:16,Gresham/ Wood Village,OR,USA,Changing,8 - 10 min,"Multi-colored orb sighting report, low, slow-moving",11/8/03,
2668,4/8/03 01:00,Fort Klamath,OR,USA,Oval,25 minutes,White oval light with in touching distance .,5/15/13,
2669,4/4/03 18:35,Aloha,OR,USA,Sphere,2 seconds,Large sphere entering clouds at high rate of speed.,4/22/03,
2670,3/1/03 13:30,Eugene,OR,USA,Cigar,10 seconds,"sunny day, huge jet-shaped craft with tiny red/black wings very low to the ground rose noiselessly into a cloud. didn't emerge.",3/11/03,
2671,2/22/03 23:15,Portland,OR,USA,,60 sec.,"Two adults witness a peculiar ""light orange"" ball of light move horizontally across the eastern sky of Portland.",2/25/03,
2672,2/21/03 22:30,Valley Junction,OR,USA,Other,12 minutes,Missing time,2/25/03,
2673,2/16/03 20:25,Wingville,OR,USA,,5-10 min.,"Man witnesses dramatic fireball in southern sky, followed by sighting of 5-6 tiny lights moving slowly west in the southern sky.",2/25/03,
2674,2/11/03 21:40,Gresham,OR,USA,Triangle,,Triangle,2/25/03,
2675,2/10/03 10:00,Madras,OR,USA,Sphere,3 min.,"Spherical metallic object seen about 7 miles NE of Madras, OR",2/12/04,
2676,2/9/03 20:55,La Grande,OR,USA,Fireball,about 5 seconds,object looked like shooting star it turned green and glowing as it came closer to the ground increasing in size.,2/11/03,
2677,2/6/03 13:30,Portland,OR,USA,Sphere,10-15 minutes,Sphere moving very slowly NE to NW.,2/11/03,
2678,2/5/03 17:55,Clackamas,OR,USA,,,"Man reports witnessing four very bright white lights, appearing in a ""T"" formation, to the south.",2/11/03,
2679,2/1/03 02:00,Eugene,OR,USA,Light,20 seconds,A zipzag light in the night sky hovering and flying with supersonic speeds.,12/23/20,
2680,1/28/03 23:07,Beaverton,OR,USA,Sphere,2min,saw a couple of strange air craft,2/5/03,
2681,1/28/03 02:00,Bend,OR,USA,Disk,15 minutes,"A single, stationary fairly large saucer/disc with rotating lights that changed colors from red to green, blue and white that hovered f",2/5/03,
2682,1/27/03 19:00,Gresham,OR,USA,Flash,10 seconds,Three bright flashes appeared in the north sky within a 10 second period,2/5/03,
2683,1/25/03 19:00,Sutherlin,OR,USA,Changing,,LIGHT,2/5/03,
2684,1/22/03 17:05,Salem,OR,USA,Cylinder,1 1/2 min.,"""A U-F-O HAS BEEN SPOTTED OVER THE SKIES OF SALEM.""",2/5/03,
2685,1/17/03 20:20,Albany,OR,USA,Light,5 min,red light in sky changed direction twice before stopping and 5-6 other small red lights fell from the bottom; one veering suddenly east,2/5/03,
2686,1/5/03 18:15,Portland,OR,USA,Light,couple minutes,Red light above Portland,2/5/03,
2687,12/22/02 14:20,Portland,OR,USA,Disk,5 min.,Black saucer wobbled slowly as it gained altitude.,12/23/02,
2688,12/6/02 21:30,West Linn,OR,USA,Chevron,2 minutes,"Chevron shape with a center light followed by 5 round, intensely bright lights.",12/23/02,
2689,12/6/02 20:30,Chiloquin,OR,USA,Sphere,45minutes,"6 rotating,flashing spheres of colored light,in night sky above Chiloquin Ridge, Oregon",12/23/02,
2690,12/6/02 19:30,Wilsonville/Tualatin,OR,USA,Unknown,3-5 seconds,I was headed North on I-5 when I saw a glowing green object streaking across the night sky and descending towards Tualatin.,12/23/02,
2691,12/1/02 05:30,Warren,OR,USA,Sphere,15 minutes,"A bright glowing light changing from red, green, blue to white. Moved in different directions. Then was gone.",12/23/02,
