,Date / Time,City,State,Shape,Duration,Summary,Link to Event
260,2015-03-20 13:00:00,Chester,WV,Triangle,3 minutes,"Triangular UFOs spotted in Chester, West Virginia.",https://nuforc.org/webreports/reports/117/S117972.html
261,2015-03-04 19:00:00,East Lynn,WV,Rectangle,45 seconds,"Rectangle UFO seen Wayne County, WV.",https://nuforc.org/webreports/reports/117/S117569.html
262,2015-03-02 21:00:00,Mineral Wells,WV,Chevron,15 minutes,"Chevron of lights sighted along I-77, and again on RT. 14.",https://nuforc.org/webreports/reports/117/S117549.html
263,2015-02-16 02:45:00,Tomahawk,WV,Egg,10 seconds,"The UFO was egg like shaped. I saw 3 of them and each were different colors. The colors were red, blue and green. Hovered maybe about 5",https://nuforc.org/webreports/reports/117/S117356.html
264,2015-02-10 14:18:00,Huntington,WV,Other,20 seconds,Two military grade Chinooks flying overhead.,https://nuforc.org/webreports/reports/117/S117256.html
265,2015-02-05 20:00:00,Martinsburg,WV,Sphere,3 seconds,A glowing blue sphere streaking diagonally toward earth in the east.,https://nuforc.org/webreports/reports/117/S117204.html
266,2015-02-03 07:00:00,Inwood,WV,Triangle,35 minutes,"Big, black triangle flying object!",https://nuforc.org/webreports/reports/117/S117177.html
267,2015-01-31 20:50:00,Dunlow,WV,Light,15 minutes,I was on way back from Wayne picking up my grandson who's 4 yrs.' old. My mom was with me it was dark out.,https://nuforc.org/webreports/reports/121/S121118.html
268,2015-01-19 09:00:00,Clarksburg,WV,Disk,2:00,2 cigar or disk shaped objects with 3 bar shaped lights on each of them.,https://nuforc.org/webreports/reports/117/S117015.html
269,2015-01-17 21:00:00,High View,WV,Disk,1-2 hours,"Two ufos, one had a red light, the other blue, hovering over the mountains.",https://nuforc.org/webreports/reports/116/S116780.html
270,2015-01-16 20:45:00,South Charleston,WV,Light,2-3 seconds,While sitting in a friend's driveway we both spotted a green ball-shaped green light fall strait down out of the sky. Lasted 2-3 sec.,https://nuforc.org/webreports/reports/116/S116801.html
271,2015-01-08 23:00:00,Tomahawk,WV,Circle,5 minutes,"Spotted back in Tomahawk past Hedgesville. Hovers about 1,000' off the ground and has 2 bright large headlights. It is circle.",https://nuforc.org/webreports/reports/116/S116600.html
272,2014-12-25 23:45:00,Huntington,WV,Chevron,5 minutes,"UFO Sighted over Spring Valley in Huntington, WV, on Christmas night.",https://nuforc.org/webreports/reports/116/S116317.html
273,2014-12-09 02:30:00,Morgantown,WV,Other,15 seconds,"Entity showed itself next to black mass in Morgantown, WV.",https://nuforc.org/webreports/reports/115/S115894.html
274,2014-11-25 18:30:00,Oak Hill,WV,Triangle,2 hours,Giant levitating triangle followed our car with four people inside from Stone Cliff to Oak Hill.,https://nuforc.org/webreports/reports/115/S115633.html
275,2014-11-25 10:23:00,Marmet,WV,Cylinder,12-15 minutes,"11-25-14. Getting gas at Exxon gas station in Marmet, WV, as my truck was facing N at 10:23AM, I notice two identical small objs.",https://nuforc.org/webreports/reports/115/S115634.html
276,2014-11-20 19:30:00,Shinnston,WV,Other,2-4 minutes,"Low altitude craft flies over car, and possible physical evidence.",https://nuforc.org/webreports/reports/115/S115519.html
277,2014-11-12 20:55:00,Hedgesville,WV,Unknown,3 minutes,White ball moving up.,https://nuforc.org/webreports/reports/115/S115326.html
278,2014-11-03 01:30:00,Keyser,WV,Fireball,5 minutes,West Virginia man sees strange orange object in the night sky,https://nuforc.org/webreports/reports/115/S115103.html
279,2014-10-26 02:00:00,Teays Valley,WV,Disk,10+ minutes,Moving left to right for a few minutes,https://nuforc.org/webreports/reports/114/S114776.html
280,2014-10-24 01:00:00,Morgantown,WV,Triangle,30+ minutes,Watching a UFO bigger than a plane ziz zag and dance around without actually leaving its locaton.,https://nuforc.org/webreports/reports/114/S114844.html
281,2014-10-17 20:10:00,Morgantown,WV,Orb,2 minutes,"White, orb of light hovers, then darts into Western sky over downtown Morgantown",https://nuforc.org/webreports/reports/114/S114918.html
282,2014-10-13 22:00:00,Winifrede,WV,Triangle,15 minutes,"3 triangle shaped objects lined with lights, in formation, very close, very slow, no noises, and 1 with flashing red light at the end.",https://nuforc.org/webreports/reports/114/S114512.html
283,2014-09-27 20:30:00,Martinsburg,WV,Other,90 seconds,"Two red, slow-moving, circular lights suddenly become star-like and and blends into the night sky.",https://nuforc.org/webreports/reports/114/S114033.html
284,2014-09-25 18:40:00,Creston,WV,Cylinder,45 seconds,"Silver Cylinder,no wings,no sound,flying in straight line,full sun,no vapor Trail.4 witnesses.",https://nuforc.org/webreports/reports/113/S113882.html
285,2014-09-25 08:38:00,Martinsburg,WV,Diamond,2 minutes,Diamond shaped object with orange flashing lights,https://nuforc.org/webreports/reports/113/S113940.html
286,2014-09-24 11:55:00,Flatwoods,WV,Cylinder,30 seconds,Shiny silverish/white cylinder with no sound traveling above cloud level.,https://nuforc.org/webreports/reports/113/S113847.html
287,2014-09-22 02:00:00,Clear Creek,WV,Light,40 minutes,Bright white light. My mom says it has happened before. Light moves back in fourth the. Would just stop and dissappear. Would just reap,https://nuforc.org/webreports/reports/113/S113792.html
288,2014-09-20 22:10:00,Fairview (rural),WV,Circle,2 seconds,"Green circular object hovers briefly high in north sky, then speeds toward the ground in a laser like fashion.",https://nuforc.org/webreports/reports/113/S113725.html
289,2014-09-13 20:30:00,Clarksburg,WV,Circle,30 minutes,Numerous reddish orange spheres moving at high speed from north to south.,https://nuforc.org/webreports/reports/113/S113555.html
290,2014-09-13 05:00:00,South Hills,WV,Rectangle,10 minutes,4 Bright lights flashing in unison.,https://nuforc.org/webreports/reports/113/S113507.html
291,2014-08-27 00:00:00,Charleston,WV,Circle,30 minutes,Larger craft with changing lights with smaller crafts flying around the light.,https://nuforc.org/webreports/reports/121/S121667.html
292,2014-08-26 22:00:00,Charleston,WV,Circle,20 minutes,Just wanted to see if anyone noticed a pattern from 2014,https://nuforc.org/webreports/reports/144/S144559.html
293,2014-08-26 00:00:00,Charleston,WV,Circle,20 minutes,Circle craft over charleston wv mulitiple light patterns.,https://nuforc.org/webreports/reports/112/S112931.html
294,2014-08-23 21:43:00,Clarksburg,WV,Light,30 seconds,Read not flashing bright light in sky.,https://nuforc.org/webreports/reports/112/S112836.html
295,2014-08-13 21:45:00,Harpers Ferry,WV,Circle,30 seconds,Red to Orange silent flying object - mid ground level then flies out of sight.,https://nuforc.org/webreports/reports/112/S112447.html
296,2014-08-03 21:30:00,Martinsburg,WV,Fireball,15 seconds,Weird ball of light falling to the ground.,https://nuforc.org/webreports/reports/112/S112185.html
297,2014-07-30 00:45:00,Lewisburg,WV,Oval,3 seconds,"Bright green flashing object, fast as a meteor and big as the moon, seen from vehicle in southern sky.",https://nuforc.org/webreports/reports/120/S120742.html
298,2014-07-24 23:00:00,Circleville,WV,Other,5 minutes,"During an evening outdoor event at a retreat center in the mountains, one of 14 witnesss drew our attention to a couple of bright light",https://nuforc.org/webreports/reports/111/S111939.html
299,2014-07-21 23:00:00,Point Pleasant,WV,Circle,1 minute,"Bright light in the sky that reduces to a pin point, and quickly disappears.",https://nuforc.org/webreports/reports/111/S111790.html
300,2014-07-10 00:00:00,Ragland,WV,Disk,2 minutes,"Round object, hovering in sky, emanating a glowing light, came down in circular motion, disappearing back into the clouds.",https://nuforc.org/webreports/reports/111/S111409.html
301,2014-07-09 20:00:00,Elizabeth,WV,Light,1 minutes,Bright light shooting across the sky.,https://nuforc.org/webreports/reports/111/S111374.html
302,2014-07-08 22:04:00,Parkersburg,WV,Triangle,8 seconds,Triangular shadow moving slightly below the moon.,https://nuforc.org/webreports/reports/111/S111340.html
303,2014-07-04 21:15:00,Fayetteville,WV,Light,45,We were sitting on rt 19sb waiting for fireworks to begin. I first noticed the red light around 9:15 mixed in the tree line. Exactly,https://nuforc.org/webreports/reports/110/S110919.html
304,2014-06-28 23:30:00,Rainelle,WV,Light,4 minutes,"Saw 2 large yellow lights, with red light strip on bottom, traveling NE, stopping, hovering, separating and then suddenly disappearing.",https://nuforc.org/webreports/reports/110/S110826.html
305,2014-06-28 22:45:00,Weirton,WV,Fireball,5 minutes,Single bright orange light moving slowly east to north. Light seemed to be traveling away then abruptly disappeared.,https://nuforc.org/webreports/reports/110/S110837.html
306,2014-06-23 22:30:00,Summersville,WV,Cylinder,5 seconds,"Silver cylinder flying object with no wings, flying west, moving in a straight line, with no sound.",https://nuforc.org/webreports/reports/110/S110626.html
307,2014-06-07 21:55:00,Weirton,WV,Circle,~10 minutes,"Several bright light-orange circular lights moving in the E sky from S to N in a lined-up, organized fashion",https://nuforc.org/webreports/reports/110/S110194.html
308,2014-06-02 16:55:00,MacArthur,WV,Oval,,"Long brown oval body two antenna's two wings and a stinger. ((NUFORC Note: We believe either a grasshopper, or a praying mantiss. PD",https://nuforc.org/webreports/reports/110/S110161.html
309,2014-06-01 23:00:00,New Haven,WV,Triangle,5 minutes,I saw a triangle shaped silent craft with 3 non-pulsating non-flashing red lights.,https://nuforc.org/webreports/reports/113/S113660.html
310,2014-05-20 04:15:00,Rupert,WV,Circle,10 minutes,Large object with rotating blue-ish white lights hovering above mountain in middle of nowhere.,https://nuforc.org/webreports/reports/109/S109918.html
311,2014-05-16 07:30:00,Huntington,WV,Disk,2 minutes,White pulsing disc near moon over Huntington WV,https://nuforc.org/webreports/reports/109/S109556.html
312,2014-05-03 21:45:00,Parkersburg,WV,Light,3-5 minutes,"Several lights seen over Parkersburg, WV",https://nuforc.org/webreports/reports/109/S109171.html
313,2014-05-01 16:45:00,Charleston,WV,Formation,5 minutes,5 orange lights observed moving S to N before independently disappearing,https://nuforc.org/webreports/reports/109/S109090.html
314,2014-04-30 01:10:00,Charleston,WV,Unknown,7 seconds,I could not see the craft just Two pale yellow sets of triangle lights on the bottem not a air plane not a helicopter moved to slow and,https://nuforc.org/webreports/reports/109/S109065.html
315,2014-04-25 21:30:00,Morgantown,WV,Other,15 minutes,"Observed 12-18 flickering, yellowish-burning objects following a path NW to SE above Morgantown, WV.",https://nuforc.org/webreports/reports/108/S108929.html
316,2014-04-22 21:30:00,Twilight,WV,Sphere,1 minute,Bright objects moving in sky.,https://nuforc.org/webreports/reports/108/S108853.html
317,2014-04-20 22:00:00,Rainelle,WV,Unknown,30 minutes,"Witnessed floating, slow moving object with wierd circular light outside of Rainelle, WV.",https://nuforc.org/webreports/reports/108/S108814.html
318,2014-04-13 02:00:00,Fayetteville,WV,Fireball,3 hours,Baseball on fire.,https://nuforc.org/webreports/reports/108/S108611.html
319,2014-04-12 22:00:00,Milton (5 miles south of),WV,,4 hours,In West Virginia about 5 miles south of Milton on big 2 mile rd Saturday evening 4-12-14 between 8pm and midnight I saw 10-12 bright or,https://nuforc.org/webreports/reports/108/S108629.html
320,2014-04-12 20:00:00,Milton,WV,Light,1 minute (each light),"Bright orange lights came from south moving north in groups, 1 after another.",https://nuforc.org/webreports/reports/108/S108635.html
321,2014-02-28 05:20:00,Princeton,WV,Light,40 minutes,Brite white star light object positioned from the E followed me to my work site on Fri. a.m..,https://nuforc.org/webreports/reports/107/S107570.html
322,2014-02-27 03:05:00,Scott Depot,WV,Unknown,3 minutes,Secret aircraft comunicating with unknown,https://nuforc.org/webreports/reports/107/S107505.html
323,2014-02-22 22:10:00,Harpers Ferry,WV,Unknown,4 seconds,Object viewed with telescope moving a high rate of speed outside our solar system.,https://nuforc.org/webreports/reports/107/S107428.html
324,2014-02-22 19:15:00,Thurmond,WV,Formation,2 minutes,"Approximately 7:15 pm, we looked into the sky and seen a formation of 4 red lights in a triangular shape, but not a perfect triangle.",https://nuforc.org/webreports/reports/107/S107472.html
325,2014-02-18 01:40:00,Fairmont,WV,Light,~5 minutes,"Three smooth gliding amber lights;no blinkers,two kept same distance apart moving WSW to ESE as moon stayed still while one followed.",https://nuforc.org/webreports/reports/107/S107231.html
326,2014-02-05 00:40:00,Beckley,WV,Formation,30 seconds,There was a boom at about 4:06pm that was felt in 3 different counties and tonight well at 12:40am on 2/5/14 I went out to look at the,https://nuforc.org/webreports/reports/106/S106933.html
327,2014-02-04 21:58:00,Huntington,WV,Other,10 seconds,"Weird, maybe a meteor passing through atmosphere. But on and off blue then red, orange and back to blue strobing light. Illuminating th",https://nuforc.org/webreports/reports/106/S106936.html
328,2014-02-02 22:00:00,Princeton,WV,Light,1 minute,"Cobalt bue lightning like flashes near I-77 exit 9 at Princeton, WV.",https://nuforc.org/webreports/reports/106/S106886.html
329,2014-02-02 21:00:00,Bluefield/Bland Virginia,WV,Other,5-10 minutes,White light and flash?,https://nuforc.org/webreports/reports/106/S106931.html
330,2014-02-01 20:33:00,Huntington,WV,Fireball,20:36,Outside smoking a cigarette seen it goes straight up went over to the last for about 10 miles until we couldn't see it anymore then sta,https://nuforc.org/webreports/reports/106/S106846.html
331,2014-01-18 20:30:00,Huntington,WV,Fireball,3 minutes,Was driving home from store and looked up and saw an orange fire ball in the sky at first i thought it was a meteor but then it hover a,https://nuforc.org/webreports/reports/106/S106410.html
332,2014-01-07 20:00:00,Princeton,WV,Cylinder,1 hour,"UFO? over Princeton/Oakvale, WV.",https://nuforc.org/webreports/reports/106/S106111.html
333,2014-01-06 19:00:00,Lewisburg,WV,Triangle,20 minutes,((NUFORC Note: Witness provides no information. PD)),https://nuforc.org/webreports/reports/106/S106122.html
334,2014-01-01 00:10:00,Saint Albans,WV,Triangle,50 seconds,Orange lights in a triangular formation.,https://nuforc.org/webreports/reports/105/S105793.html
335,2013-12-27 00:00:00,Keyser,WV,Flash,1-2 minutes,red and white lights tjat telaported across the sky moving with strange angels.,https://nuforc.org/webreports/reports/105/S105627.html
336,2013-12-25 18:30:00,Belle,WV,Triangle,4-5 seconds,"Something in the sky in Belle, WV.",https://nuforc.org/webreports/reports/105/S105616.html
337,2013-12-13 03:30:00,Princeton,WV,Circle,3 minutes,"Light yellowish white circle of light looking like a full moon started moving, descending down behind trees of horizon.",https://nuforc.org/webreports/reports/105/S105359.html
338,2013-12-04 21:05:00,Valley Head,WV,Light,20 minutes,Fleet of 30 UFO's crossing E/W and N/S - very high blinking white red green in square.,https://nuforc.org/webreports/reports/105/S105097.html
339,2013-11-30 22:30:00,Kearneysville,WV,Fireball,5 minutes,5 or more orange lights.,https://nuforc.org/webreports/reports/105/S105012.html
340,2013-11-16 19:00:00,Boomer,WV,Circle,12 minutes,Lights in small town looks like that of the New Years Eve ball.,https://nuforc.org/webreports/reports/104/S104586.html
341,2013-11-16 00:00:00,Martinsburg,WV,Oval,2 minutes,Grey elongated egg like shape.,https://nuforc.org/webreports/reports/104/S104530.html
342,2013-11-14 15:00:00,Princeton,WV,Other,1 minute,"Flat precise platinum line viewed low in sky, descending at sharp angle, tilted to show shape, modified triangular, immediately masked.",https://nuforc.org/webreports/reports/105/S105416.html
343,2013-11-05 22:15:00,Charleston,WV,Oval,1 minute,Bright Amber light in the sky.,https://nuforc.org/webreports/reports/104/S104212.html
344,2013-11-03 20:00:00,Huntington,WV,Cross,5-10 minutes,"Red and white ""T"" shaped objects with small white lights falling from the white ones and all disappearing at the same point i",https://nuforc.org/webreports/reports/104/S104112.html
345,2013-10-15 23:30:00,Reedsville,WV,Triangle,1 minute,"Dark-colored, silent, hovering triangle with red and white lights.",https://nuforc.org/webreports/reports/104/S104643.html
346,2013-10-10 21:17:00,Lost Creek,WV,Triangle,45 seconds,Small triangle with 3 lights floating low over a field then slowly flying away.,https://nuforc.org/webreports/reports/103/S103127.html
347,2013-10-08 20:00:00,Ceredo,WV,Chevron,<1 minute,"My son, age six, and my self walked outside on my patio to view the sky because we was told there was going to be a meteor shower tonig",https://nuforc.org/webreports/reports/103/S103066.html
348,2013-10-02 20:05:00,Martinsburg,WV,Light,2 seconds,Very green light appeared and fell straight down.,https://nuforc.org/webreports/reports/102/S102917.html
349,2013-09-29 22:00:00,South Charleston,WV,Light,60-120,"Multiple orange lights seen hovering stationary over South Charleston. The slowly dimmed one by one, and eventually completely disappea",https://nuforc.org/webreports/reports/102/S102812.html
350,2013-09-25 22:25:00,Fayetteville,WV,Changing,35 minutes,"Upon letting my dogs out, I observed a bright flashingight i'n the NE sky. This light moved rapidly and randomly. It appeared to have r",https://nuforc.org/webreports/reports/102/S102667.html
351,2013-09-06 16:00:00,Augusta,WV,Cylinder,2 minutes,Rod or cylindrical object seen heading from NW to SE. Object was white on either end with a darker division in the center.,https://nuforc.org/webreports/reports/101/S101977.html
352,2013-09-03 01:00:00,Logan,WV,Triangle,2 minutes,"Long half a mile at least, white lights along the side.",https://nuforc.org/webreports/reports/103/S103492.html
353,2013-09-02 00:55:00,Milton,WV,Light,16 minutes,24 strange lights in sky for 16 minutes.,https://nuforc.org/webreports/reports/101/S101803.html
354,2013-09-01 00:55:00,Milton,WV,Oval,15 minutes,"24 ORANGE LIGHTS OF MILTION, WV.",https://nuforc.org/webreports/reports/101/S101805.html
355,2013-08-31 21:30:00,Fairmont,WV,Circle,1-3,Crazy lol,https://nuforc.org/webreports/reports/101/S101785.html
356,2013-08-31 11:30:00,Oakhill,WV,Circle,15 minutes,Aug. 31 13 lights over WV,https://nuforc.org/webreports/reports/101/S101787.html
357,2013-08-31 00:03:00,Charleston,WV,Triangle,2-3 minutes,Lights appeared in a triangular shape.,https://nuforc.org/webreports/reports/102/S102334.html
358,2013-08-26 22:00:00,Bridgeport,WV,Light,5 minutes,Bright planet size light hovering above hill before getting bighter then dim shooting high and out of sight.,https://nuforc.org/webreports/reports/101/S101624.html
359,2013-08-24 21:20:00,Belo,WV,Light,3 minutes,Red orange lights in the wv sky,https://nuforc.org/webreports/reports/101/S101533.html
360,2013-08-17 23:30:00,Ravenswood,WV,Sphere,2 minutes,I was heading to bed and went out to smoke a cigarette and looked up in the sky and noticed an orange ball in the sky that turned red.,https://nuforc.org/webreports/reports/101/S101592.html
361,2013-08-17 21:10:00,Shepherdstown,WV,Rectangle,5 minutes,"Four bright orange red lights in Shepherdstown, WV.",https://nuforc.org/webreports/reports/101/S101286.html
362,2013-08-16 00:00:00,West Union,WV,Circle,1 hour,A big ball was over our head and it did not seem from this world as i know?,https://nuforc.org/webreports/reports/103/S103329.html
363,2013-08-02 21:30:00,Huntington,WV,Light,1:30,"Numerous star-like objects observed in Huntington, WV",https://nuforc.org/webreports/reports/100/S100785.html
364,2013-07-25 02:43:00,Point Pleasant,WV,Unknown,10 minutes,Odd lights in the sky around Point Pleasant WV.,https://nuforc.org/webreports/reports/100/S100461.html
365,2013-07-19 17:00:00,Elkins,WV,Egg,5 seconds,"Dark gray ""egg"" spotted hovering in daytime sky, disappears suddenly",https://nuforc.org/webreports/reports/100/S100879.html
366,2013-07-07 21:50:00,Charleston,WV,Unknown,2 minutes,"2 bright lights seen flying over Charleston, WV.",https://nuforc.org/webreports/reports/103/S103041.html
367,2013-07-06 01:00:00,Barboursville,WV,Fireball,4-5 minutes,4 fireballs seen about 60 seconds a piece they were reddish orange and was about 4 or 5 mins apart .,https://nuforc.org/webreports/reports/099/S99782.html
368,2013-07-05 21:45:00,Wheeling,WV,Fireball,10 minutes,"Round red-orange lights rising in the distant sky, hovering briefly then fading away.",https://nuforc.org/webreports/reports/100/S100584.html
369,2013-07-04 21:30:00,Ravenswood,WV,Light,5 minutes,Bright red hovering circular light near Ravenswood.,https://nuforc.org/webreports/reports/099/S99660.html
370,2013-07-03 22:05:00,Moundsville,WV,Oval,3:00 minutes,"an oval twinkling light that turned orange and shot across the sky three times in a blue strek forming a triangular flight pattern,stop",https://nuforc.org/webreports/reports/099/S99665.html
371,2013-06-28 01:30:00,Parkersburg,WV,Circle,30 seconds,Large bright white light traveling quicky in the Northwest sky.,https://nuforc.org/webreports/reports/098/S98998.html
372,2013-06-26 22:17:00,Seneca Rocks,WV,Chevron,Only a few seconds,"Me and my dad were camping and we were outside, a large, long chevron shape blocked out the stars for a few seconds before it was gone.",https://nuforc.org/webreports/reports/118/S118410.html
373,2013-06-22 22:00:00,Fairmont,WV,Fireball,3-5 minutes,"Red, orange fiery, glowing sphere witnessed by five people.",https://nuforc.org/webreports/reports/114/S114141.html
374,2013-06-21 22:50:00,Parkersburg,WV,Light,30 seconds,Hovering red light over Parkersburg.,https://nuforc.org/webreports/reports/098/S98800.html
375,2013-06-19 23:00:00,Fairmont,WV,Unknown,5-6 minutes,Bright white object moving west to east. ((NUFORC Note: Probable sighting of the ISS?? PD)),https://nuforc.org/webreports/reports/098/S98895.html
376,2013-06-08 21:00:00,Rivesville,WV,Cross,3 minutes,Spherical object that turned into a cross pattern .,https://nuforc.org/webreports/reports/098/S98522.html
377,2013-06-04 12:35:00,Charles Town,WV,Circle,A few second,Like a falling star but not. It's fastest object I've ever seen.,https://nuforc.org/webreports/reports/098/S98457.html
378,2013-05-30 23:30:00,Charleston,WV,Triangle,10 seconds,Blue Triangle over WV.,https://nuforc.org/webreports/reports/098/S98474.html
379,2013-05-23 20:15:00,Cross Lanes,WV,Other,3 minutes,Orange polygon shaped aircraft.,https://nuforc.org/webreports/reports/097/S97943.html
380,2013-05-15 20:40:00,Scott Depot,WV,Orb,2 minutes,"Orange orb and slow moving meteorites in Putnam County, WV.",https://nuforc.org/webreports/reports/097/S97944.html
381,2013-05-14 20:45:00,Princeton,WV,Formation,20 minutes,"Sitting in wal-mart parking lot......noticed what appeared to be bright stars....after the sun went all the way down, the lights remain",https://nuforc.org/webreports/reports/098/S98152.html
382,2013-05-14 20:15:00,Parkersburg,WV,Cigar,1 minute,"I observed May 14 2013 at 20:15hrs, 1 white cigar shaped obj. 20ft or more in length flying at low altitude (no jet stream).",https://nuforc.org/webreports/reports/097/S97736.html
383,2013-04-21 23:45:00,Mineral Wells,WV,Light,30 minutes,"Two bright lights over treeline, no sound",https://nuforc.org/webreports/reports/097/S97305.html
384,2013-04-15 20:00:00,Mineral Wells,WV,Triangle,10 minutes,I saw a triangular shaped craft over Chesterville road in Mineral Wells WV. Am I the only one?,https://nuforc.org/webreports/reports/116/S116726.html
385,2013-03-23 20:00:00,Ridge Mountain Elkins,WV,Fireball,:10,A friend showed me a video of a picture that shows three objects in it. One of the object was emitting laser beams from it. He says tha,https://nuforc.org/webreports/reports/103/S103285.html
386,2013-03-15 19:45:00,Panther,WV,Light,2-5 minutes,"It was about dark I was cleaning out my truck ,I was listening to music with the windows rolled up, I can't remember the exact date, b",https://nuforc.org/webreports/reports/106/S106398.html
387,2013-03-09 20:30:00,Fayetteville,WV,Chevron,A few seconds,"Band of lights traveled north to south, silent,. Clear night.",https://nuforc.org/webreports/reports/096/S96609.html
388,2013-03-01 23:00:00,Charleston,WV,Triangle,2 minutes,Solid triangular lights or light on the underbody,https://nuforc.org/webreports/reports/097/S97160.html
389,2013-02-02 20:00:00,Clarksburg,WV,Circle,2 minutes,"Round, pulsating orange object in the sky -- no noise",https://nuforc.org/webreports/reports/096/S96209.html
390,2013-01-24 11:07:00,Scott Depot,WV,Changing,20 minutes,Small red/orange balls of light seemed to rise from behind the trees floating slowly up in the air and hovering changing shape several.,https://nuforc.org/webreports/reports/096/S96085.html
391,2013-01-19 17:00:00,Fairmont/Morgantown,WV,Disk,1 minute,"Red, yellow/white, and blue lights on saucer object floating over house. UFO WV.",https://nuforc.org/webreports/reports/096/S96529.html
392,2013-01-01 01:30:00,Canaan Valley,WV,Fireball,30 seconds,Two Orange bright lights moving across Canaan Valley WV sky,https://nuforc.org/webreports/reports/095/S95748.html
850,2071-07-15 12:00:00,Genoa,WV,Cigar,about 5 minutes,Me and my brother saw a cigar shaped object move quietly and very slowly above us for about 5 minutes.,https://nuforc.org/webreports/reports/053/S53803.html
851,2071-07-14 22:00:00,Danese,WV,Unknown,5 minutes,Traveling at a speed of 1500 MPH and stopping instantly displaying Super Bright Search Lights no Noise.,https://nuforc.org/webreports/reports/052/S52336.html
